,number,value,datetime_start,datetime_complete,duration,params_C,params_M,params_N,params_P,params_S,state
2653,2653,38.0,2023-12-07 16:23:08.969236,2023-12-07 16:23:09.188510,0 days 00:00:00.219274,0.95,0.0,6.0,200,random selection,COMPLETE
2654,2654,40.8,2023-12-07 16:23:09.188720,2023-12-07 16:23:09.665537,0 days 00:00:00.476817,0.6,0.0,8.0,200,weighted choice,COMPLETE
2655,2655,37.2,2023-12-07 16:23:09.665764,2023-12-07 16:23:09.929049,0 days 00:00:00.263285,0.8,0.0,8.0,100,random selection,COMPLETE
2656,2656,37.6,2023-12-07 16:23:09.929273,2023-12-07 16:23:10.316204,0 days 00:00:00.386931,0.8,0.1,8.0,250,random selection,COMPLETE
2657,2657,37.6,2023-12-07 16:23:10.316426,2023-12-07 16:23:10.682068,0 days 00:00:00.365642,0.8,0.1,6.0,20,roulette wheel,COMPLETE
2658,2658,37.6,2023-12-07 16:23:10.682277,2023-12-07 16:23:11.282245,0 days 00:00:00.599968,0.6,0.5,6.0,150,roulette wheel,COMPLETE
2659,2659,37.6,2023-12-07 16:23:11.282446,2023-12-07 16:23:11.927011,0 days 00:00:00.644565,0.8,0.5,8.0,100,weighted choice,COMPLETE
2660,2660,39.6,2023-12-07 16:23:11.927230,2023-12-07 16:23:12.339441,0 days 00:00:00.412211,0.6,0.1,6.0,20,weighted choice,COMPLETE
2661,2661,38.0,2023-12-07 16:23:12.339645,2023-12-07 16:23:12.723685,0 days 00:00:00.384040,0.6,0.1,8.0,50,random selection,COMPLETE
2662,2662,38.0,2023-12-07 16:23:12.723904,2023-12-07 16:23:13.247698,0 days 00:00:00.523794,0.8,0.33,6.0,10,weighted choice,COMPLETE
2663,2663,40.4,2023-12-07 16:23:13.247918,2023-12-07 16:23:13.611715,0 days 00:00:00.363797,0.95,0.01,8.0,100,roulette wheel,COMPLETE
2664,2664,44.0,2023-12-07 16:23:13.611929,2023-12-07 16:23:14.080937,0 days 00:00:00.469008,0.6,0.0,6.0,100,weighted choice,COMPLETE
2665,2665,40.4,2023-12-07 16:23:14.081158,2023-12-07 16:23:14.509151,0 days 00:00:00.427993,0.6,0.01,8.0,20,roulette wheel,COMPLETE
2666,2666,37.6,2023-12-07 16:23:14.509362,2023-12-07 16:23:15.133422,0 days 00:00:00.624060,0.5,0.5,6.0,20,random selection,COMPLETE
2667,2667,39.6,2023-12-07 16:23:15.133650,2023-12-07 16:23:15.394832,0 days 00:00:00.261182,0.8,0.0,8.0,200,roulette wheel,COMPLETE
2668,2668,42.4,2023-12-07 16:23:15.395043,2023-12-07 16:23:15.727237,0 days 00:00:00.332194,0.5,0.0,8.0,200,roulette wheel,COMPLETE
2669,2669,38.0,2023-12-07 16:23:15.727467,2023-12-07 16:23:16.115288,0 days 00:00:00.387821,0.95,0.1,8.0,50,roulette wheel,COMPLETE
2670,2670,38.0,2023-12-07 16:23:16.115499,2023-12-07 16:23:16.488402,0 days 00:00:00.372903,0.8,0.1,6.0,200,roulette wheel,COMPLETE
2671,2671,38.0,2023-12-07 16:23:16.488631,2023-12-07 16:23:17.059712,0 days 00:00:00.571081,0.95,0.5,6.0,150,random selection,COMPLETE
2672,2672,41.6,2023-12-07 16:23:17.059936,2023-12-07 16:23:17.537430,0 days 00:00:00.477494,0.8,0.0,8.0,20,roulette wheel,COMPLETE
2673,2673,37.2,2023-12-07 16:23:17.537653,2023-12-07 16:23:18.042405,0 days 00:00:00.504752,0.6,0.33,8.0,50,random selection,COMPLETE
2674,2674,37.2,2023-12-07 16:23:18.042649,2023-12-07 16:23:18.622219,0 days 00:00:00.579570,0.95,0.5,6.0,50,roulette wheel,COMPLETE
2675,2675,38.4,2023-12-07 16:23:18.622429,2023-12-07 16:23:19.109917,0 days 00:00:00.487488,0.8,0.33,8.0,100,roulette wheel,COMPLETE
2676,2676,37.2,2023-12-07 16:23:19.110139,2023-12-07 16:23:19.615425,0 days 00:00:00.505286,0.8,0.33,8.0,300,roulette wheel,COMPLETE
2677,2677,37.2,2023-12-07 16:23:19.615635,2023-12-07 16:23:20.343238,0 days 00:00:00.727603,0.6,0.5,8.0,250,weighted choice,COMPLETE
2678,2678,39.6,2023-12-07 16:23:20.343453,2023-12-07 16:23:20.578950,0 days 00:00:00.235497,0.8,0.0,6.0,200,roulette wheel,COMPLETE
2679,2679,37.6,2023-12-07 16:23:20.579170,2023-12-07 16:23:20.948434,0 days 00:00:00.369264,0.95,0.1,6.0,20,roulette wheel,COMPLETE
2680,2680,38.0,2023-12-07 16:23:20.948745,2023-12-07 16:23:21.551506,0 days 00:00:00.602761,0.6,0.5,8.0,200,roulette wheel,COMPLETE
2681,2681,37.6,2023-12-07 16:23:21.551719,2023-12-07 16:23:22.105924,0 days 00:00:00.554205,0.6,0.33,8.0,50,weighted choice,COMPLETE
2682,2682,37.2,2023-12-07 16:23:22.106139,2023-12-07 16:23:22.684643,0 days 00:00:00.578504,0.8,0.5,8.0,250,roulette wheel,COMPLETE
2683,2683,38.0,2023-12-07 16:23:22.684865,2023-12-07 16:23:23.238945,0 days 00:00:00.554080,0.6,0.1,8.0,300,weighted choice,COMPLETE
2684,2684,37.2,2023-12-07 16:23:23.239155,2023-12-07 16:23:23.816803,0 days 00:00:00.577648,0.8,0.5,8.0,50,roulette wheel,COMPLETE
2685,2685,37.2,2023-12-07 16:23:23.817028,2023-12-07 16:23:24.295919,0 days 00:00:00.478891,0.95,0.33,6.0,20,random selection,COMPLETE
2686,2686,38.0,2023-12-07 16:23:24.296134,2023-12-07 16:23:24.790163,0 days 00:00:00.494029,0.8,0.33,8.0,10,random selection,COMPLETE
2687,2687,39.6,2023-12-07 16:23:24.790393,2023-12-07 16:23:25.347099,0 days 00:00:00.556706,0.6,0.01,6.0,250,weighted choice,COMPLETE
2688,2688,38.0,2023-12-07 16:23:25.347329,2023-12-07 16:23:25.973165,0 days 00:00:00.625836,0.5,0.5,8.0,100,roulette wheel,COMPLETE
2689,2689,42.4,2023-12-07 16:23:25.973378,2023-12-07 16:23:26.416684,0 days 00:00:00.443306,0.6,0.0,8.0,150,weighted choice,COMPLETE
2690,2690,37.2,2023-12-07 16:23:26.416901,2023-12-07 16:23:26.790632,0 days 00:00:00.373731,0.6,0.1,6.0,10,random selection,COMPLETE
2691,2691,37.2,2023-12-07 16:23:26.790873,2023-12-07 16:23:27.163135,0 days 00:00:00.372262,0.6,0.1,6.0,50,random selection,COMPLETE
2692,2692,38.0,2023-12-07 16:23:27.163354,2023-12-07 16:23:27.671046,0 days 00:00:00.507692,0.5,0.33,6.0,250,roulette wheel,COMPLETE
2693,2693,37.6,2023-12-07 16:23:27.671284,2023-12-07 16:23:28.185619,0 days 00:00:00.514335,0.6,0.33,8.0,150,roulette wheel,COMPLETE
2694,2694,37.6,2023-12-07 16:23:28.185837,2023-12-07 16:23:28.586422,0 days 00:00:00.400585,0.5,0.1,8.0,20,roulette wheel,COMPLETE
2695,2695,38.4,2023-12-07 16:23:28.586640,2023-12-07 16:23:28.927938,0 days 00:00:00.341298,0.8,0.01,6.0,300,roulette wheel,COMPLETE
2696,2696,37.6,2023-12-07 16:23:28.928142,2023-12-07 16:23:29.457682,0 days 00:00:00.529540,0.5,0.33,8.0,100,roulette wheel,COMPLETE
2697,2697,36.8,2023-12-07 16:23:29.457910,2023-12-07 16:23:30.042407,0 days 00:00:00.584497,0.8,0.5,8.0,20,roulette wheel,COMPLETE
2698,2698,36.4,2023-12-07 16:23:30.042625,2023-12-07 16:23:30.531989,0 days 00:00:00.489364,0.6,0.33,6.0,50,random selection,COMPLETE
2699,2699,37.2,2023-12-07 16:23:30.532207,2023-12-07 16:23:31.021233,0 days 00:00:00.489026,0.95,0.33,6.0,150,roulette wheel,COMPLETE
2700,2700,37.6,2023-12-07 16:23:31.021462,2023-12-07 16:23:31.410103,0 days 00:00:00.388641,0.5,0.1,6.0,20,roulette wheel,COMPLETE
2701,2701,38.0,2023-12-07 16:23:31.410322,2023-12-07 16:23:31.983556,0 days 00:00:00.573234,0.95,0.5,6.0,150,roulette wheel,COMPLETE
2702,2702,40.4,2023-12-07 16:23:31.983769,2023-12-07 16:23:32.415591,0 days 00:00:00.431822,0.5,0.01,6.0,20,roulette wheel,COMPLETE
2703,2703,36.8,2023-12-07 16:23:32.415811,2023-12-07 16:23:33.025589,0 days 00:00:00.609778,0.6,0.5,8.0,200,roulette wheel,COMPLETE
2704,2704,42.0,2023-12-07 16:23:33.025830,2023-12-07 16:23:33.332465,0 days 00:00:00.306635,0.5,0.0,6.0,200,roulette wheel,COMPLETE
2705,2705,36.8,2023-12-07 16:23:33.332673,2023-12-07 16:23:33.626826,0 days 00:00:00.294153,0.6,0.0,8.0,300,random selection,COMPLETE
2706,2706,36.8,2023-12-07 16:23:33.627045,2023-12-07 16:23:34.241298,0 days 00:00:00.614253,0.5,0.5,6.0,100,roulette wheel,COMPLETE
2707,2707,36.0,2023-12-07 16:23:34.241514,2023-12-07 16:23:34.634283,0 days 00:00:00.392769,0.8,0.0,8.0,50,random selection,COMPLETE
2708,2708,39.2,2023-12-07 16:23:34.634521,2023-12-07 16:23:35.103751,0 days 00:00:00.469230,0.6,0.01,8.0,10,roulette wheel,COMPLETE
2709,2709,38.8,2023-12-07 16:23:35.103964,2023-12-07 16:23:35.615009,0 days 00:00:00.511045,0.95,0.33,8.0,250,roulette wheel,COMPLETE
2710,2710,37.6,2023-12-07 16:23:35.615230,2023-12-07 16:23:36.115080,0 days 00:00:00.499850,0.95,0.33,8.0,20,roulette wheel,COMPLETE
2711,2711,37.2,2023-12-07 16:23:36.115307,2023-12-07 16:23:36.610938,0 days 00:00:00.495631,0.95,0.33,8.0,50,roulette wheel,COMPLETE
2712,2712,37.2,2023-12-07 16:23:36.611155,2023-12-07 16:23:37.088392,0 days 00:00:00.477237,0.95,0.33,6.0,300,random selection,COMPLETE
2713,2713,38.0,2023-12-07 16:23:37.088617,2023-12-07 16:23:37.485312,0 days 00:00:00.396695,0.6,0.1,8.0,300,roulette wheel,COMPLETE
2714,2714,38.0,2023-12-07 16:23:37.485541,2023-12-07 16:23:37.894894,0 days 00:00:00.409353,0.8,0.1,8.0,20,weighted choice,COMPLETE
2715,2715,37.6,2023-12-07 16:23:37.895113,2023-12-07 16:23:38.422150,0 days 00:00:00.527037,0.5,0.33,8.0,200,random selection,COMPLETE
2716,2716,38.0,2023-12-07 16:23:38.422381,2023-12-07 16:23:38.813372,0 days 00:00:00.390991,0.5,0.1,6.0,10,roulette wheel,COMPLETE
2717,2717,38.4,2023-12-07 16:23:38.813589,2023-12-07 16:23:39.480552,0 days 00:00:00.666963,0.5,0.33,8.0,250,weighted choice,COMPLETE
2718,2718,37.2,2023-12-07 16:23:39.480784,2023-12-07 16:23:39.893178,0 days 00:00:00.412394,0.5,0.01,8.0,300,random selection,COMPLETE
2719,2719,38.8,2023-12-07 16:23:39.893386,2023-12-07 16:23:40.317261,0 days 00:00:00.423875,0.5,0.01,8.0,300,roulette wheel,COMPLETE
2720,2720,38.0,2023-12-07 16:23:40.317486,2023-12-07 16:23:40.813262,0 days 00:00:00.495776,0.8,0.1,8.0,200,weighted choice,COMPLETE
2721,2721,38.0,2023-12-07 16:23:40.813496,2023-12-07 16:23:41.425798,0 days 00:00:00.612302,0.8,0.33,6.0,250,weighted choice,COMPLETE
2722,2722,39.2,2023-12-07 16:23:41.426024,2023-12-07 16:23:41.673701,0 days 00:00:00.247677,0.95,0.0,8.0,250,roulette wheel,COMPLETE
2723,2723,37.6,2023-12-07 16:23:41.673926,2023-12-07 16:23:42.253626,0 days 00:00:00.579700,0.8,0.5,8.0,50,random selection,COMPLETE
2724,2724,38.0,2023-12-07 16:23:42.253844,2023-12-07 16:23:42.740880,0 days 00:00:00.487036,0.95,0.33,6.0,10,roulette wheel,COMPLETE
2725,2725,39.2,2023-12-07 16:23:42.741106,2023-12-07 16:23:43.221560,0 days 00:00:00.480454,0.8,0.33,6.0,150,random selection,COMPLETE
2726,2726,41.6,2023-12-07 16:23:43.221777,2023-12-07 16:23:43.655934,0 days 00:00:00.434157,0.95,0.0,6.0,20,roulette wheel,COMPLETE
2727,2727,42.8,2023-12-07 16:23:43.656173,2023-12-07 16:23:44.149069,0 days 00:00:00.492896,0.5,0.0,6.0,150,weighted choice,COMPLETE
2728,2728,38.4,2023-12-07 16:23:44.149292,2023-12-07 16:23:44.534479,0 days 00:00:00.385187,0.6,0.1,8.0,10,roulette wheel,COMPLETE
2729,2729,37.2,2023-12-07 16:23:44.534705,2023-12-07 16:23:45.128737,0 days 00:00:00.594032,0.6,0.5,6.0,100,roulette wheel,COMPLETE
2730,2730,36.8,2023-12-07 16:23:45.128955,2023-12-07 16:23:45.717776,0 days 00:00:00.588821,0.8,0.5,8.0,150,roulette wheel,COMPLETE
2731,2731,40.4,2023-12-07 16:23:45.718013,2023-12-07 16:23:46.141913,0 days 00:00:00.423900,0.5,0.01,6.0,50,roulette wheel,COMPLETE
2732,2732,38.0,2023-12-07 16:23:46.142152,2023-12-07 16:23:46.652754,0 days 00:00:00.510602,0.6,0.33,8.0,300,roulette wheel,COMPLETE
2733,2733,37.6,2023-12-07 16:23:46.652975,2023-12-07 16:23:47.147024,0 days 00:00:00.494049,0.8,0.33,8.0,200,roulette wheel,COMPLETE
2734,2734,37.6,2023-12-07 16:23:47.147251,2023-12-07 16:23:47.813265,0 days 00:00:00.666014,0.6,0.5,6.0,100,weighted choice,COMPLETE
2735,2735,37.6,2023-12-07 16:23:47.813502,2023-12-07 16:23:48.233480,0 days 00:00:00.419978,0.5,0.01,8.0,200,random selection,COMPLETE
2736,2736,40.4,2023-12-07 16:23:48.233712,2023-12-07 16:23:48.683104,0 days 00:00:00.449392,0.5,0.01,8.0,20,roulette wheel,COMPLETE
2737,2737,37.6,2023-12-07 16:23:48.683341,2023-12-07 16:23:49.302690,0 days 00:00:00.619349,0.5,0.5,8.0,300,roulette wheel,COMPLETE
2738,2738,36.4,2023-12-07 16:23:49.302927,2023-12-07 16:23:49.687431,0 days 00:00:00.384504,0.6,0.1,8.0,50,random selection,COMPLETE
2739,2739,38.0,2023-12-07 16:23:49.687659,2023-12-07 16:23:50.090688,0 days 00:00:00.403029,0.5,0.1,8.0,20,roulette wheel,COMPLETE
2740,2740,37.6,2023-12-07 16:23:50.090913,2023-12-07 16:23:50.476120,0 days 00:00:00.385207,0.6,0.1,8.0,10,random selection,COMPLETE
2741,2741,39.6,2023-12-07 16:23:50.476343,2023-12-07 16:23:50.923299,0 days 00:00:00.446956,0.6,0.01,6.0,10,roulette wheel,COMPLETE
2742,2742,37.2,2023-12-07 16:23:50.923522,2023-12-07 16:23:51.542010,0 days 00:00:00.618488,0.5,0.5,8.0,250,random selection,COMPLETE
2743,2743,40.0,2023-12-07 16:23:51.542246,2023-12-07 16:23:51.964669,0 days 00:00:00.422423,0.5,0.01,8.0,200,roulette wheel,COMPLETE
2744,2744,37.2,2023-12-07 16:23:51.964885,2023-12-07 16:23:52.312065,0 days 00:00:00.347180,0.8,0.01,6.0,200,random selection,COMPLETE
2745,2745,38.0,2023-12-07 16:23:52.312291,2023-12-07 16:23:52.904030,0 days 00:00:00.591739,0.6,0.5,6.0,50,roulette wheel,COMPLETE
2746,2746,44.0,2023-12-07 16:23:52.904263,2023-12-07 16:23:53.423023,0 days 00:00:00.518760,0.8,0.0,8.0,50,weighted choice,COMPLETE
2747,2747,42.0,2023-12-07 16:23:53.423239,2023-12-07 16:23:53.858256,0 days 00:00:00.435017,0.5,0.01,6.0,50,roulette wheel,COMPLETE
2748,2748,38.0,2023-12-07 16:23:53.858481,2023-12-07 16:23:54.383100,0 days 00:00:00.524619,0.5,0.33,8.0,150,random selection,COMPLETE
2749,2749,42.0,2023-12-07 16:23:54.383317,2023-12-07 16:23:54.889706,0 days 00:00:00.506389,0.8,0.0,8.0,20,roulette wheel,COMPLETE
2750,2750,38.0,2023-12-07 16:23:54.889929,2023-12-07 16:23:55.413293,0 days 00:00:00.523364,0.6,0.33,8.0,150,roulette wheel,COMPLETE
2751,2751,37.2,2023-12-07 16:23:55.413543,2023-12-07 16:23:56.043660,0 days 00:00:00.630117,0.5,0.5,6.0,150,roulette wheel,COMPLETE
2752,2752,37.2,2023-12-07 16:23:56.043891,2023-12-07 16:23:56.670592,0 days 00:00:00.626701,0.95,0.33,6.0,250,weighted choice,COMPLETE
2753,2753,38.0,2023-12-07 16:23:56.670816,2023-12-07 16:23:57.261853,0 days 00:00:00.591037,0.6,0.5,6.0,20,random selection,COMPLETE
2754,2754,37.6,2023-12-07 16:23:57.262087,2023-12-07 16:23:57.883973,0 days 00:00:00.621886,0.95,0.33,8.0,200,weighted choice,COMPLETE
2755,2755,37.6,2023-12-07 16:23:57.884207,2023-12-07 16:23:58.152711,0 days 00:00:00.268504,0.6,0.0,6.0,300,random selection,COMPLETE
2756,2756,37.6,2023-12-07 16:23:58.152940,2023-12-07 16:23:58.774700,0 days 00:00:00.621760,0.95,0.33,8.0,200,weighted choice,COMPLETE
2757,2757,37.6,2023-12-07 16:23:58.774946,2023-12-07 16:23:59.373181,0 days 00:00:00.598235,0.6,0.5,8.0,250,roulette wheel,COMPLETE
2758,2758,36.4,2023-12-07 16:23:59.373420,2023-12-07 16:23:59.791537,0 days 00:00:00.418117,0.95,0.1,8.0,20,weighted choice,COMPLETE
2759,2759,39.6,2023-12-07 16:23:59.791763,2023-12-07 16:24:00.314450,0 days 00:00:00.522687,0.8,0.01,8.0,250,weighted choice,COMPLETE
2760,2760,38.4,2023-12-07 16:24:00.314679,2023-12-07 16:24:00.899998,0 days 00:00:00.585319,0.8,0.5,8.0,10,roulette wheel,COMPLETE
2761,2761,38.4,2023-12-07 16:24:00.900229,2023-12-07 16:24:01.496839,0 days 00:00:00.596610,0.95,0.5,8.0,200,roulette wheel,COMPLETE
2762,2762,38.0,2023-12-07 16:24:01.497071,2023-12-07 16:24:02.012772,0 days 00:00:00.515701,0.6,0.1,6.0,250,weighted choice,COMPLETE
2763,2763,38.0,2023-12-07 16:24:02.013005,2023-12-07 16:24:02.605818,0 days 00:00:00.592813,0.6,0.5,6.0,250,roulette wheel,COMPLETE
2764,2764,38.0,2023-12-07 16:24:02.606038,2023-12-07 16:24:03.280301,0 days 00:00:00.674263,0.5,0.33,8.0,250,weighted choice,COMPLETE
2765,2765,37.2,2023-12-07 16:24:03.280566,2023-12-07 16:24:03.925225,0 days 00:00:00.644659,0.6,0.5,8.0,10,weighted choice,COMPLETE
2766,2766,37.2,2023-12-07 16:24:03.925458,2023-12-07 16:24:04.500697,0 days 00:00:00.575239,0.8,0.5,6.0,200,roulette wheel,COMPLETE
2767,2767,38.0,2023-12-07 16:24:04.500925,2023-12-07 16:24:04.917904,0 days 00:00:00.416979,0.6,0.01,8.0,20,random selection,COMPLETE
2768,2768,36.8,2023-12-07 16:24:04.918141,2023-12-07 16:24:05.321588,0 days 00:00:00.403447,0.5,0.1,6.0,20,random selection,COMPLETE
2769,2769,37.6,2023-12-07 16:24:05.321829,2023-12-07 16:24:05.837912,0 days 00:00:00.516083,0.8,0.33,8.0,200,random selection,COMPLETE
2770,2770,42.0,2023-12-07 16:24:05.838130,2023-12-07 16:24:06.274514,0 days 00:00:00.436384,0.6,0.0,6.0,150,weighted choice,COMPLETE
2771,2771,38.8,2023-12-07 16:24:06.274737,2023-12-07 16:24:06.524689,0 days 00:00:00.249952,0.95,0.0,8.0,250,roulette wheel,COMPLETE
2772,2772,36.4,2023-12-07 16:24:06.524904,2023-12-07 16:24:07.119257,0 days 00:00:00.594353,0.95,0.5,8.0,50,random selection,COMPLETE
2773,2773,37.6,2023-12-07 16:24:07.119489,2023-12-07 16:24:07.741952,0 days 00:00:00.622463,0.5,0.5,8.0,100,random selection,COMPLETE
2774,2774,37.2,2023-12-07 16:24:07.742191,2023-12-07 16:24:08.100282,0 days 00:00:00.358091,0.95,0.01,8.0,100,random selection,COMPLETE
2775,2775,38.0,2023-12-07 16:24:08.100525,2023-12-07 16:24:08.588510,0 days 00:00:00.487985,0.95,0.33,6.0,300,roulette wheel,COMPLETE
2776,2776,38.0,2023-12-07 16:24:08.588732,2023-12-07 16:24:09.236063,0 days 00:00:00.647331,0.6,0.5,8.0,50,weighted choice,COMPLETE
2777,2777,44.0,2023-12-07 16:24:09.236301,2023-12-07 16:24:09.905323,0 days 00:00:00.669022,0.5,0.0,8.0,100,weighted choice,COMPLETE
2778,2778,36.8,2023-12-07 16:24:09.905547,2023-12-07 16:24:10.512335,0 days 00:00:00.606788,0.6,0.5,8.0,20,roulette wheel,COMPLETE
2779,2779,39.2,2023-12-07 16:24:10.512596,2023-12-07 16:24:10.929139,0 days 00:00:00.416543,0.5,0.01,6.0,250,roulette wheel,COMPLETE
2780,2780,37.6,2023-12-07 16:24:10.929368,2023-12-07 16:24:11.348909,0 days 00:00:00.419541,0.5,0.01,8.0,200,random selection,COMPLETE
2781,2781,40.8,2023-12-07 16:24:11.349150,2023-12-07 16:24:11.785899,0 days 00:00:00.436749,0.8,0.01,6.0,100,weighted choice,COMPLETE
2782,2782,39.2,2023-12-07 16:24:11.786146,2023-12-07 16:24:12.177652,0 days 00:00:00.391506,0.95,0.01,6.0,10,roulette wheel,COMPLETE
2783,2783,40.4,2023-12-07 16:24:12.177975,2023-12-07 16:24:12.418226,0 days 00:00:00.240251,0.8,0.0,6.0,200,roulette wheel,COMPLETE
2784,2784,38.0,2023-12-07 16:24:12.418456,2023-12-07 16:24:13.002797,0 days 00:00:00.584341,0.8,0.33,6.0,150,weighted choice,COMPLETE
2785,2785,41.6,2023-12-07 16:24:13.003018,2023-12-07 16:24:13.564533,0 days 00:00:00.561515,0.6,0.0,6.0,20,roulette wheel,COMPLETE
2786,2786,42.0,2023-12-07 16:24:13.564759,2023-12-07 16:24:14.276047,0 days 00:00:00.711288,0.5,0.0,6.0,20,weighted choice,COMPLETE
2787,2787,38.0,2023-12-07 16:24:14.276276,2023-12-07 16:24:15.002027,0 days 00:00:00.725751,0.6,0.5,8.0,200,weighted choice,COMPLETE
2788,2788,37.2,2023-12-07 16:24:15.002274,2023-12-07 16:24:15.258638,0 days 00:00:00.256364,0.8,0.0,8.0,100,random selection,COMPLETE
2789,2789,38.0,2023-12-07 16:24:15.258879,2023-12-07 16:24:15.655602,0 days 00:00:00.396723,0.5,0.1,8.0,20,roulette wheel,COMPLETE
2790,2790,38.4,2023-12-07 16:24:15.655851,2023-12-07 16:24:15.998752,0 days 00:00:00.342901,0.95,0.01,6.0,300,roulette wheel,COMPLETE
2791,2791,39.2,2023-12-07 16:24:15.998978,2023-12-07 16:24:16.461688,0 days 00:00:00.462710,0.8,0.01,8.0,10,weighted choice,COMPLETE
2792,2792,37.6,2023-12-07 16:24:16.461928,2023-12-07 16:24:16.988701,0 days 00:00:00.526773,0.6,0.33,8.0,300,roulette wheel,COMPLETE
2793,2793,38.4,2023-12-07 16:24:16.988919,2023-12-07 16:24:17.393321,0 days 00:00:00.404402,0.5,0.1,8.0,100,roulette wheel,COMPLETE
2794,2794,37.6,2023-12-07 16:24:17.393558,2023-12-07 16:24:17.987520,0 days 00:00:00.593962,0.6,0.5,6.0,300,random selection,COMPLETE
2795,2795,39.6,2023-12-07 16:24:17.987761,2023-12-07 16:24:18.625312,0 days 00:00:00.637551,0.5,0.0,8.0,10,roulette wheel,COMPLETE
2796,2796,38.0,2023-12-07 16:24:18.625556,2023-12-07 16:24:19.213608,0 days 00:00:00.588052,0.8,0.5,8.0,10,roulette wheel,COMPLETE
2797,2797,37.6,2023-12-07 16:24:19.213832,2023-12-07 16:24:19.900155,0 days 00:00:00.686323,0.6,0.33,8.0,300,weighted choice,COMPLETE
2798,2798,40.0,2023-12-07 16:24:19.900402,2023-12-07 16:24:20.318466,0 days 00:00:00.418064,0.6,0.01,8.0,150,roulette wheel,COMPLETE
2799,2799,38.0,2023-12-07 16:24:20.318709,2023-12-07 16:24:20.809239,0 days 00:00:00.490530,0.8,0.33,6.0,200,roulette wheel,COMPLETE
2800,2800,38.8,2023-12-07 16:24:20.809473,2023-12-07 16:24:21.330684,0 days 00:00:00.521211,0.95,0.1,6.0,250,weighted choice,COMPLETE
2801,2801,40.0,2023-12-07 16:24:21.330916,2023-12-07 16:24:21.553760,0 days 00:00:00.222844,0.95,0.0,6.0,250,roulette wheel,COMPLETE
2802,2802,40.0,2023-12-07 16:24:21.553998,2023-12-07 16:24:22.101559,0 days 00:00:00.547561,0.95,0.0,6.0,10,weighted choice,COMPLETE
2803,2803,37.2,2023-12-07 16:24:22.101794,2023-12-07 16:24:22.691878,0 days 00:00:00.590084,0.6,0.5,6.0,150,roulette wheel,COMPLETE
2804,2804,40.0,2023-12-07 16:24:22.692105,2023-12-07 16:24:23.050743,0 days 00:00:00.358638,0.95,0.0,6.0,250,weighted choice,COMPLETE
2805,2805,38.0,2023-12-07 16:24:23.050973,2023-12-07 16:24:23.723783,0 days 00:00:00.672810,0.5,0.33,6.0,250,weighted choice,COMPLETE
2806,2806,37.6,2023-12-07 16:24:23.724020,2023-12-07 16:24:24.111212,0 days 00:00:00.387192,0.95,0.1,8.0,10,roulette wheel,COMPLETE
2807,2807,38.0,2023-12-07 16:24:24.111450,2023-12-07 16:24:24.606668,0 days 00:00:00.495218,0.8,0.1,6.0,200,weighted choice,COMPLETE
2808,2808,38.0,2023-12-07 16:24:24.606913,2023-12-07 16:24:25.183618,0 days 00:00:00.576705,0.8,0.5,8.0,300,roulette wheel,COMPLETE
2809,2809,38.0,2023-12-07 16:24:25.183862,2023-12-07 16:24:25.780488,0 days 00:00:00.596626,0.8,0.5,8.0,250,roulette wheel,COMPLETE
2810,2810,38.4,2023-12-07 16:24:25.780721,2023-12-07 16:24:26.260780,0 days 00:00:00.480059,0.5,0.1,8.0,100,weighted choice,COMPLETE
2811,2811,36.8,2023-12-07 16:24:26.261025,2023-12-07 16:24:26.781810,0 days 00:00:00.520785,0.6,0.33,8.0,10,roulette wheel,COMPLETE
2812,2812,38.0,2023-12-07 16:24:26.782040,2023-12-07 16:24:27.179348,0 days 00:00:00.397308,0.5,0.1,6.0,300,roulette wheel,COMPLETE
2813,2813,38.0,2023-12-07 16:24:27.179587,2023-12-07 16:24:27.552173,0 days 00:00:00.372586,0.8,0.1,6.0,100,roulette wheel,COMPLETE
2814,2814,37.6,2023-12-07 16:24:27.552410,2023-12-07 16:24:28.039591,0 days 00:00:00.487181,0.8,0.33,6.0,100,random selection,COMPLETE
2815,2815,39.6,2023-12-07 16:24:28.039840,2023-12-07 16:24:28.287173,0 days 00:00:00.247333,0.95,0.0,8.0,250,roulette wheel,COMPLETE
2816,2816,42.4,2023-12-07 16:24:28.287412,2023-12-07 16:24:28.673846,0 days 00:00:00.386434,0.95,0.0,6.0,50,roulette wheel,COMPLETE
