,number,value,datetime_start,datetime_complete,duration,params_C,params_M,params_N,params_P,params_S,state
2489,2489,41.6,2023-12-07 16:21:52.043754,2023-12-07 16:21:52.447388,0 days 00:00:00.403634,0.6,0.01,8.0,100,roulette wheel,COMPLETE
2490,2490,41.2,2023-12-07 16:21:52.447560,2023-12-07 16:21:52.842922,0 days 00:00:00.395362,0.6,0.01,6.0,100,roulette wheel,COMPLETE
2491,2491,38.0,2023-12-07 16:21:52.843109,2023-12-07 16:21:53.368761,0 days 00:00:00.525652,0.5,0.33,8.0,10,roulette wheel,COMPLETE
2492,2492,43.2,2023-12-07 16:21:53.368944,2023-12-07 16:21:53.875595,0 days 00:00:00.506651,0.95,0.0,8.0,50,weighted choice,COMPLETE
2493,2493,38.4,2023-12-07 16:21:53.875776,2023-12-07 16:21:54.258580,0 days 00:00:00.382804,0.95,0.1,6.0,150,roulette wheel,COMPLETE
2494,2494,37.6,2023-12-07 16:21:54.258756,2023-12-07 16:21:54.861869,0 days 00:00:00.603113,0.6,0.5,8.0,250,roulette wheel,COMPLETE
2495,2495,38.4,2023-12-07 16:21:54.862047,2023-12-07 16:21:55.256196,0 days 00:00:00.394149,0.6,0.1,6.0,300,roulette wheel,COMPLETE
2496,2496,38.4,2023-12-07 16:21:55.256391,2023-12-07 16:21:55.627855,0 days 00:00:00.371464,0.8,0.1,6.0,100,roulette wheel,COMPLETE
2497,2497,39.2,2023-12-07 16:21:55.628037,2023-12-07 16:21:55.980512,0 days 00:00:00.352475,0.95,0.01,8.0,250,roulette wheel,COMPLETE
2498,2498,38.0,2023-12-07 16:21:55.980688,2023-12-07 16:21:56.411686,0 days 00:00:00.430998,0.6,0.1,6.0,50,weighted choice,COMPLETE
2499,2499,38.0,2023-12-07 16:21:56.411879,2023-12-07 16:21:56.776142,0 days 00:00:00.364263,0.8,0.1,6.0,10,roulette wheel,COMPLETE
2500,2500,38.0,2023-12-07 16:21:56.776326,2023-12-07 16:21:57.172384,0 days 00:00:00.396058,0.95,0.1,8.0,300,roulette wheel,COMPLETE
2501,2501,38.0,2023-12-07 16:21:57.172565,2023-12-07 16:21:57.574508,0 days 00:00:00.401943,0.6,0.01,8.0,100,random selection,COMPLETE
2502,2502,38.0,2023-12-07 16:21:57.574692,2023-12-07 16:21:57.957946,0 days 00:00:00.383254,0.6,0.1,6.0,300,random selection,COMPLETE
2503,2503,38.0,2023-12-07 16:21:57.958141,2023-12-07 16:21:58.347778,0 days 00:00:00.389637,0.5,0.1,6.0,200,roulette wheel,COMPLETE
2504,2504,37.6,2023-12-07 16:21:58.347955,2023-12-07 16:21:58.860946,0 days 00:00:00.512991,0.5,0.33,6.0,50,roulette wheel,COMPLETE
2505,2505,37.2,2023-12-07 16:21:58.861126,2023-12-07 16:21:59.248174,0 days 00:00:00.387048,0.8,0.1,8.0,250,random selection,COMPLETE
2506,2506,38.0,2023-12-07 16:21:59.248363,2023-12-07 16:21:59.646381,0 days 00:00:00.398018,0.95,0.1,8.0,250,roulette wheel,COMPLETE
2507,2507,39.2,2023-12-07 16:21:59.646575,2023-12-07 16:22:00.324779,0 days 00:00:00.678204,0.6,0.0,8.0,10,weighted choice,COMPLETE
2508,2508,37.2,2023-12-07 16:22:00.324966,2023-12-07 16:22:00.836606,0 days 00:00:00.511640,0.5,0.33,8.0,300,random selection,COMPLETE
2509,2509,37.6,2023-12-07 16:22:00.836797,2023-12-07 16:22:01.236141,0 days 00:00:00.399344,0.5,0.1,8.0,50,roulette wheel,COMPLETE
2510,2510,38.4,2023-12-07 16:22:01.236323,2023-12-07 16:22:01.833113,0 days 00:00:00.596790,0.6,0.5,8.0,10,random selection,COMPLETE
2511,2511,41.2,2023-12-07 16:22:01.833296,2023-12-07 16:22:02.094808,0 days 00:00:00.261512,0.8,0.0,8.0,150,roulette wheel,COMPLETE
2512,2512,41.2,2023-12-07 16:22:02.094984,2023-12-07 16:22:02.507169,0 days 00:00:00.412185,0.8,0.01,6.0,20,weighted choice,COMPLETE
2513,2513,40.0,2023-12-07 16:22:02.507356,2023-12-07 16:22:02.890062,0 days 00:00:00.382706,0.6,0.01,6.0,200,roulette wheel,COMPLETE
2514,2514,40.4,2023-12-07 16:22:02.890258,2023-12-07 16:22:03.345528,0 days 00:00:00.455270,0.6,0.01,8.0,20,weighted choice,COMPLETE
2515,2515,40.4,2023-12-07 16:22:03.345740,2023-12-07 16:22:03.782343,0 days 00:00:00.436603,0.95,0.01,8.0,10,weighted choice,COMPLETE
2516,2516,39.2,2023-12-07 16:22:03.782542,2023-12-07 16:22:04.288624,0 days 00:00:00.506082,0.8,0.0,6.0,10,roulette wheel,COMPLETE
2517,2517,37.2,2023-12-07 16:22:04.288837,2023-12-07 16:22:04.542316,0 days 00:00:00.253479,0.8,0.0,8.0,300,random selection,COMPLETE
2518,2518,37.6,2023-12-07 16:22:04.542510,2023-12-07 16:22:05.039030,0 days 00:00:00.496520,0.6,0.33,6.0,50,roulette wheel,COMPLETE
2519,2519,38.8,2023-12-07 16:22:05.039224,2023-12-07 16:22:05.627005,0 days 00:00:00.587781,0.8,0.0,8.0,10,weighted choice,COMPLETE
2520,2520,38.0,2023-12-07 16:22:05.627185,2023-12-07 16:22:06.290270,0 days 00:00:00.663085,0.6,0.33,6.0,300,weighted choice,COMPLETE
2521,2521,37.6,2023-12-07 16:22:06.290472,2023-12-07 16:22:06.931768,0 days 00:00:00.641296,0.5,0.33,8.0,200,weighted choice,COMPLETE
2522,2522,38.4,2023-12-07 16:22:06.931978,2023-12-07 16:22:07.321321,0 days 00:00:00.389343,0.95,0.1,6.0,250,roulette wheel,COMPLETE
2523,2523,37.6,2023-12-07 16:22:07.321523,2023-12-07 16:22:07.804125,0 days 00:00:00.482602,0.5,0.1,6.0,150,weighted choice,COMPLETE
2524,2524,38.0,2023-12-07 16:22:07.804321,2023-12-07 16:22:08.276492,0 days 00:00:00.472171,0.8,0.33,6.0,300,roulette wheel,COMPLETE
2525,2525,40.0,2023-12-07 16:22:08.276701,2023-12-07 16:22:08.705037,0 days 00:00:00.428336,0.5,0.01,8.0,300,roulette wheel,COMPLETE
2526,2526,37.2,2023-12-07 16:22:08.705233,2023-12-07 16:22:09.065445,0 days 00:00:00.360212,0.8,0.1,6.0,20,random selection,COMPLETE
2527,2527,38.0,2023-12-07 16:22:09.065646,2023-12-07 16:22:09.647221,0 days 00:00:00.581575,0.6,0.5,6.0,250,random selection,COMPLETE
2528,2528,38.0,2023-12-07 16:22:09.647410,2023-12-07 16:22:10.214108,0 days 00:00:00.566698,0.95,0.5,6.0,100,roulette wheel,COMPLETE
2529,2529,37.2,2023-12-07 16:22:10.214323,2023-12-07 16:22:10.783711,0 days 00:00:00.569388,0.95,0.5,6.0,50,random selection,COMPLETE
2530,2530,37.6,2023-12-07 16:22:10.783898,2023-12-07 16:22:11.221636,0 days 00:00:00.437738,0.5,0.1,8.0,10,weighted choice,COMPLETE
2531,2531,42.4,2023-12-07 16:22:11.221828,2023-12-07 16:22:11.598821,0 days 00:00:00.376993,0.6,0.0,8.0,100,roulette wheel,COMPLETE
2532,2532,37.2,2023-12-07 16:22:11.599042,2023-12-07 16:22:11.983216,0 days 00:00:00.384174,0.8,0.1,8.0,300,random selection,COMPLETE
2533,2533,38.4,2023-12-07 16:22:11.983419,2023-12-07 16:22:12.354925,0 days 00:00:00.371506,0.95,0.1,6.0,100,random selection,COMPLETE
2534,2534,37.6,2023-12-07 16:22:12.355109,2023-12-07 16:22:12.951264,0 days 00:00:00.596155,0.6,0.33,6.0,150,weighted choice,COMPLETE
2535,2535,37.2,2023-12-07 16:22:12.951461,2023-12-07 16:22:13.466718,0 days 00:00:00.515257,0.5,0.33,8.0,250,random selection,COMPLETE
2536,2536,36.8,2023-12-07 16:22:13.466914,2023-12-07 16:22:13.778849,0 days 00:00:00.311935,0.5,0.0,8.0,250,random selection,COMPLETE
2537,2537,39.6,2023-12-07 16:22:13.779060,2023-12-07 16:22:14.143985,0 days 00:00:00.364925,0.8,0.01,8.0,250,roulette wheel,COMPLETE
2538,2538,37.6,2023-12-07 16:22:14.144182,2023-12-07 16:22:14.637939,0 days 00:00:00.493757,0.95,0.33,8.0,10,random selection,COMPLETE
2539,2539,37.2,2023-12-07 16:22:14.638144,2023-12-07 16:22:15.161744,0 days 00:00:00.523600,0.5,0.33,8.0,20,random selection,COMPLETE
2540,2540,38.0,2023-12-07 16:22:15.161951,2023-12-07 16:22:15.758919,0 days 00:00:00.596968,0.5,0.5,6.0,300,random selection,COMPLETE
2541,2541,38.4,2023-12-07 16:22:15.759114,2023-12-07 16:22:16.149401,0 days 00:00:00.390287,0.5,0.1,6.0,150,roulette wheel,COMPLETE
2542,2542,40.0,2023-12-07 16:22:16.149591,2023-12-07 16:22:16.371886,0 days 00:00:00.222295,0.95,0.0,6.0,250,roulette wheel,COMPLETE
2543,2543,37.6,2023-12-07 16:22:16.372097,2023-12-07 16:22:16.773443,0 days 00:00:00.401346,0.5,0.1,8.0,150,random selection,COMPLETE
2544,2544,41.6,2023-12-07 16:22:16.773671,2023-12-07 16:22:17.262986,0 days 00:00:00.489315,0.5,0.01,6.0,50,weighted choice,COMPLETE
2545,2545,38.4,2023-12-07 16:22:17.263192,2023-12-07 16:22:17.625663,0 days 00:00:00.362471,0.8,0.01,8.0,300,roulette wheel,COMPLETE
2546,2546,36.8,2023-12-07 16:22:17.625852,2023-12-07 16:22:18.215414,0 days 00:00:00.589562,0.8,0.5,8.0,10,random selection,COMPLETE
2547,2547,40.8,2023-12-07 16:22:18.215603,2023-12-07 16:22:18.555871,0 days 00:00:00.340268,0.5,0.0,8.0,250,roulette wheel,COMPLETE
2548,2548,38.0,2023-12-07 16:22:18.556053,2023-12-07 16:22:19.048445,0 days 00:00:00.492392,0.8,0.33,8.0,10,random selection,COMPLETE
2549,2549,38.0,2023-12-07 16:22:19.048642,2023-12-07 16:22:19.577982,0 days 00:00:00.529340,0.5,0.33,8.0,10,random selection,COMPLETE
2550,2550,38.0,2023-12-07 16:22:19.578179,2023-12-07 16:22:20.066842,0 days 00:00:00.488663,0.8,0.33,6.0,200,random selection,COMPLETE
2551,2551,36.8,2023-12-07 16:22:20.067026,2023-12-07 16:22:20.435158,0 days 00:00:00.368132,0.95,0.1,6.0,20,random selection,COMPLETE
2552,2552,37.2,2023-12-07 16:22:20.435355,2023-12-07 16:22:21.027811,0 days 00:00:00.592456,0.8,0.5,8.0,50,roulette wheel,COMPLETE
2553,2553,40.4,2023-12-07 16:22:21.028029,2023-12-07 16:22:21.371103,0 days 00:00:00.343074,0.5,0.0,8.0,300,roulette wheel,COMPLETE
2554,2554,38.8,2023-12-07 16:22:21.371289,2023-12-07 16:22:21.863156,0 days 00:00:00.491867,0.95,0.33,6.0,200,random selection,COMPLETE
2555,2555,37.2,2023-12-07 16:22:21.863385,2023-12-07 16:22:22.498093,0 days 00:00:00.634708,0.6,0.5,6.0,10,weighted choice,COMPLETE
2556,2556,36.4,2023-12-07 16:22:22.498289,2023-12-07 16:22:23.119439,0 days 00:00:00.621150,0.5,0.5,6.0,20,roulette wheel,COMPLETE
2557,2557,37.2,2023-12-07 16:22:23.119626,2023-12-07 16:22:23.698391,0 days 00:00:00.578765,0.8,0.5,8.0,250,random selection,COMPLETE
2558,2558,38.8,2023-12-07 16:22:23.698582,2023-12-07 16:22:24.077328,0 days 00:00:00.378746,0.8,0.1,8.0,50,roulette wheel,COMPLETE
2559,2559,40.8,2023-12-07 16:22:24.077512,2023-12-07 16:22:24.565235,0 days 00:00:00.487723,0.5,0.01,6.0,50,weighted choice,COMPLETE
2560,2560,37.2,2023-12-07 16:22:24.565435,2023-12-07 16:22:25.182896,0 days 00:00:00.617461,0.95,0.5,8.0,10,weighted choice,COMPLETE
2561,2561,37.2,2023-12-07 16:22:25.183098,2023-12-07 16:22:25.772960,0 days 00:00:00.589862,0.8,0.5,8.0,100,roulette wheel,COMPLETE
2562,2562,37.2,2023-12-07 16:22:25.773141,2023-12-07 16:22:26.487737,0 days 00:00:00.714596,0.6,0.5,8.0,150,weighted choice,COMPLETE
2563,2563,37.6,2023-12-07 16:22:26.487939,2023-12-07 16:22:27.057326,0 days 00:00:00.569387,0.95,0.33,6.0,150,weighted choice,COMPLETE
2564,2564,38.0,2023-12-07 16:22:27.057522,2023-12-07 16:22:27.685486,0 days 00:00:00.627964,0.5,0.5,6.0,50,random selection,COMPLETE
2565,2565,37.2,2023-12-07 16:22:27.685676,2023-12-07 16:22:27.947428,0 days 00:00:00.261752,0.8,0.0,8.0,200,random selection,COMPLETE
2566,2566,37.6,2023-12-07 16:22:27.947614,2023-12-07 16:22:28.447688,0 days 00:00:00.500074,0.8,0.33,8.0,20,random selection,COMPLETE
2567,2567,42.8,2023-12-07 16:22:28.447884,2023-12-07 16:22:28.898120,0 days 00:00:00.450236,0.8,0.0,6.0,50,roulette wheel,COMPLETE
2568,2568,37.6,2023-12-07 16:22:28.898316,2023-12-07 16:22:29.505607,0 days 00:00:00.607291,0.5,0.5,6.0,200,roulette wheel,COMPLETE
2569,2569,36.8,2023-12-07 16:22:29.505801,2023-12-07 16:22:29.900074,0 days 00:00:00.394273,0.5,0.1,6.0,20,random selection,COMPLETE
2570,2570,38.4,2023-12-07 16:22:29.900266,2023-12-07 16:22:30.397130,0 days 00:00:00.496864,0.6,0.33,6.0,200,random selection,COMPLETE
2571,2571,38.4,2023-12-07 16:22:30.397324,2023-12-07 16:22:30.777032,0 days 00:00:00.379708,0.6,0.1,6.0,100,roulette wheel,COMPLETE
2572,2572,38.0,2023-12-07 16:22:30.777218,2023-12-07 16:22:31.341519,0 days 00:00:00.564301,0.8,0.5,8.0,300,roulette wheel,COMPLETE
2573,2573,37.6,2023-12-07 16:22:31.341715,2023-12-07 16:22:31.712811,0 days 00:00:00.371096,0.6,0.1,6.0,50,roulette wheel,COMPLETE
2574,2574,37.6,2023-12-07 16:22:31.713004,2023-12-07 16:22:32.100570,0 days 00:00:00.387566,0.95,0.1,8.0,300,random selection,COMPLETE
2575,2575,38.4,2023-12-07 16:22:32.100762,2023-12-07 16:22:32.499332,0 days 00:00:00.398570,0.95,0.1,6.0,10,weighted choice,COMPLETE
2576,2576,39.6,2023-12-07 16:22:32.499540,2023-12-07 16:22:32.922199,0 days 00:00:00.422659,0.5,0.01,8.0,300,roulette wheel,COMPLETE
2577,2577,37.6,2023-12-07 16:22:32.922396,2023-12-07 16:22:33.508756,0 days 00:00:00.586360,0.6,0.5,8.0,300,random selection,COMPLETE
2578,2578,40.8,2023-12-07 16:22:33.508958,2023-12-07 16:22:33.998760,0 days 00:00:00.489802,0.5,0.01,8.0,20,weighted choice,COMPLETE
2579,2579,42.0,2023-12-07 16:22:33.998960,2023-12-07 16:22:34.554172,0 days 00:00:00.555212,0.6,0.0,8.0,20,roulette wheel,COMPLETE
2580,2580,38.4,2023-12-07 16:22:34.554364,2023-12-07 16:22:34.932114,0 days 00:00:00.377750,0.8,0.1,8.0,100,roulette wheel,COMPLETE
2581,2581,36.8,2023-12-07 16:22:34.932320,2023-12-07 16:22:35.342486,0 days 00:00:00.410166,0.6,0.0,6.0,50,random selection,COMPLETE
2582,2582,37.2,2023-12-07 16:22:35.342688,2023-12-07 16:22:35.590026,0 days 00:00:00.247338,0.95,0.0,8.0,200,random selection,COMPLETE
2583,2583,40.8,2023-12-07 16:22:35.590247,2023-12-07 16:22:36.039683,0 days 00:00:00.449436,0.6,0.0,6.0,200,weighted choice,COMPLETE
2584,2584,37.2,2023-12-07 16:22:36.039894,2023-12-07 16:22:36.739908,0 days 00:00:00.700014,0.8,0.5,6.0,250,weighted choice,COMPLETE
2585,2585,42.4,2023-12-07 16:22:36.740106,2023-12-07 16:22:37.206820,0 days 00:00:00.466714,0.6,0.0,8.0,50,roulette wheel,COMPLETE
2586,2586,40.8,2023-12-07 16:22:37.207016,2023-12-07 16:22:37.833222,0 days 00:00:00.626206,0.5,0.0,6.0,10,roulette wheel,COMPLETE
2587,2587,37.6,2023-12-07 16:22:37.833415,2023-12-07 16:22:38.345581,0 days 00:00:00.512166,0.8,0.1,8.0,250,weighted choice,COMPLETE
2588,2588,42.8,2023-12-07 16:22:38.345780,2023-12-07 16:22:38.607728,0 days 00:00:00.261948,0.8,0.0,8.0,100,roulette wheel,COMPLETE
2589,2589,38.4,2023-12-07 16:22:38.607931,2023-12-07 16:22:38.989755,0 days 00:00:00.381824,0.8,0.1,8.0,100,roulette wheel,COMPLETE
2590,2590,40.0,2023-12-07 16:22:38.989940,2023-12-07 16:22:39.489878,0 days 00:00:00.499938,0.6,0.01,6.0,150,weighted choice,COMPLETE
2591,2591,38.8,2023-12-07 16:22:39.490073,2023-12-07 16:22:39.997245,0 days 00:00:00.507172,0.95,0.33,8.0,200,random selection,COMPLETE
2592,2592,38.0,2023-12-07 16:22:39.997433,2023-12-07 16:22:40.612211,0 days 00:00:00.614778,0.5,0.5,6.0,100,roulette wheel,COMPLETE
2593,2593,38.0,2023-12-07 16:22:40.612402,2023-12-07 16:22:41.138537,0 days 00:00:00.526135,0.5,0.33,8.0,250,roulette wheel,COMPLETE
2594,2594,39.2,2023-12-07 16:22:41.138726,2023-12-07 16:22:41.554551,0 days 00:00:00.415825,0.5,0.01,8.0,250,roulette wheel,COMPLETE
2595,2595,40.0,2023-12-07 16:22:41.554751,2023-12-07 16:22:41.915279,0 days 00:00:00.360528,0.95,0.01,8.0,100,roulette wheel,COMPLETE
2596,2596,38.0,2023-12-07 16:22:41.915479,2023-12-07 16:22:42.488973,0 days 00:00:00.573494,0.8,0.5,6.0,10,roulette wheel,COMPLETE
2597,2597,36.8,2023-12-07 16:22:42.489174,2023-12-07 16:22:43.059356,0 days 00:00:00.570182,0.8,0.5,8.0,300,random selection,COMPLETE
2598,2598,37.2,2023-12-07 16:22:43.059562,2023-12-07 16:22:43.560937,0 days 00:00:00.501375,0.95,0.33,6.0,250,roulette wheel,COMPLETE
2599,2599,38.4,2023-12-07 16:22:43.561152,2023-12-07 16:22:43.923199,0 days 00:00:00.362047,0.8,0.1,6.0,20,roulette wheel,COMPLETE
2600,2600,37.2,2023-12-07 16:22:43.923399,2023-12-07 16:22:44.390136,0 days 00:00:00.466737,0.8,0.33,6.0,300,random selection,COMPLETE
2601,2601,44.0,2023-12-07 16:22:44.390336,2023-12-07 16:22:45.006617,0 days 00:00:00.616281,0.5,0.0,8.0,100,weighted choice,COMPLETE
2602,2602,37.6,2023-12-07 16:22:45.006810,2023-12-07 16:22:45.581561,0 days 00:00:00.574751,0.6,0.5,6.0,300,random selection,COMPLETE
2603,2603,38.4,2023-12-07 16:22:45.581777,2023-12-07 16:22:45.961764,0 days 00:00:00.379987,0.95,0.1,6.0,300,roulette wheel,COMPLETE
2604,2604,38.0,2023-12-07 16:22:45.961974,2023-12-07 16:22:46.342000,0 days 00:00:00.380026,0.6,0.1,8.0,10,random selection,COMPLETE
2605,2605,40.0,2023-12-07 16:22:46.342204,2023-12-07 16:22:46.808882,0 days 00:00:00.466678,0.8,0.01,6.0,200,weighted choice,COMPLETE
2606,2606,40.4,2023-12-07 16:22:46.809095,2023-12-07 16:22:47.204929,0 days 00:00:00.395834,0.6,0.01,6.0,150,roulette wheel,COMPLETE
2607,2607,37.6,2023-12-07 16:22:47.205138,2023-12-07 16:22:47.802148,0 days 00:00:00.597010,0.95,0.33,6.0,200,weighted choice,COMPLETE
2608,2608,38.0,2023-12-07 16:22:47.802374,2023-12-07 16:22:48.194385,0 days 00:00:00.392011,0.5,0.1,6.0,250,roulette wheel,COMPLETE
2609,2609,37.6,2023-12-07 16:22:48.194589,2023-12-07 16:22:48.752928,0 days 00:00:00.558339,0.95,0.5,6.0,20,random selection,COMPLETE
2610,2610,37.6,2023-12-07 16:22:48.753125,2023-12-07 16:22:49.069482,0 days 00:00:00.316357,0.5,0.0,8.0,250,random selection,COMPLETE
2611,2611,37.6,2023-12-07 16:22:49.069747,2023-12-07 16:22:49.682591,0 days 00:00:00.612844,0.5,0.5,8.0,150,roulette wheel,COMPLETE
2612,2612,38.8,2023-12-07 16:22:49.682790,2023-12-07 16:22:50.081916,0 days 00:00:00.399126,0.5,0.1,8.0,150,roulette wheel,COMPLETE
2613,2613,37.2,2023-12-07 16:22:50.082118,2023-12-07 16:22:50.658176,0 days 00:00:00.576058,0.8,0.5,8.0,50,roulette wheel,COMPLETE
2614,2614,37.6,2023-12-07 16:22:50.658416,2023-12-07 16:22:51.227492,0 days 00:00:00.569076,0.8,0.5,6.0,200,roulette wheel,COMPLETE
2615,2615,37.2,2023-12-07 16:22:51.227703,2023-12-07 16:22:51.719672,0 days 00:00:00.491969,0.95,0.33,8.0,300,roulette wheel,COMPLETE
2616,2616,43.2,2023-12-07 16:22:51.719880,2023-12-07 16:22:51.986163,0 days 00:00:00.266283,0.8,0.0,8.0,100,roulette wheel,COMPLETE
2617,2617,37.6,2023-12-07 16:22:51.986375,2023-12-07 16:22:52.471000,0 days 00:00:00.484625,0.8,0.33,6.0,20,roulette wheel,COMPLETE
2618,2618,40.0,2023-12-07 16:22:52.471201,2023-12-07 16:22:52.957653,0 days 00:00:00.486452,0.95,0.0,8.0,10,roulette wheel,COMPLETE
2619,2619,37.6,2023-12-07 16:22:52.957866,2023-12-07 16:22:53.649123,0 days 00:00:00.691257,0.6,0.5,8.0,150,weighted choice,COMPLETE
2620,2620,40.0,2023-12-07 16:22:53.649329,2023-12-07 16:22:54.240446,0 days 00:00:00.591117,0.6,0.0,8.0,10,roulette wheel,COMPLETE
2621,2621,38.0,2023-12-07 16:22:54.240666,2023-12-07 16:22:54.697396,0 days 00:00:00.456730,0.6,0.1,8.0,100,weighted choice,COMPLETE
2622,2622,38.4,2023-12-07 16:22:54.697609,2023-12-07 16:22:55.096411,0 days 00:00:00.398802,0.6,0.1,8.0,150,roulette wheel,COMPLETE
2623,2623,37.6,2023-12-07 16:22:55.096617,2023-12-07 16:22:55.575424,0 days 00:00:00.478807,0.8,0.33,6.0,200,roulette wheel,COMPLETE
2624,2624,38.0,2023-12-07 16:22:55.575648,2023-12-07 16:22:55.948384,0 days 00:00:00.372736,0.8,0.1,6.0,250,roulette wheel,COMPLETE
2625,2625,37.2,2023-12-07 16:22:55.948585,2023-12-07 16:22:56.349720,0 days 00:00:00.401135,0.6,0.01,8.0,300,random selection,COMPLETE
2626,2626,37.6,2023-12-07 16:22:56.349931,2023-12-07 16:22:57.058834,0 days 00:00:00.708903,0.6,0.5,6.0,150,weighted choice,COMPLETE
2627,2627,38.0,2023-12-07 16:22:57.059045,2023-12-07 16:22:57.430632,0 days 00:00:00.371587,0.95,0.1,6.0,50,roulette wheel,COMPLETE
2628,2628,38.4,2023-12-07 16:22:57.430845,2023-12-07 16:22:57.932354,0 days 00:00:00.501509,0.95,0.33,8.0,50,roulette wheel,COMPLETE
2629,2629,39.6,2023-12-07 16:22:57.932556,2023-12-07 16:22:58.274336,0 days 00:00:00.341780,0.8,0.01,6.0,300,roulette wheel,COMPLETE
2630,2630,41.6,2023-12-07 16:22:58.274542,2023-12-07 16:22:58.585935,0 days 00:00:00.311393,0.5,0.0,6.0,150,roulette wheel,COMPLETE
2631,2631,37.6,2023-12-07 16:22:58.586143,2023-12-07 16:22:59.179369,0 days 00:00:00.593226,0.6,0.33,6.0,150,weighted choice,COMPLETE
2632,2632,38.0,2023-12-07 16:22:59.179593,2023-12-07 16:22:59.698132,0 days 00:00:00.518539,0.8,0.0,8.0,10,random selection,COMPLETE
2633,2633,38.4,2023-12-07 16:22:59.698344,2023-12-07 16:23:00.083017,0 days 00:00:00.384673,0.6,0.1,6.0,200,roulette wheel,COMPLETE
2634,2634,37.2,2023-12-07 16:23:00.083291,2023-12-07 16:23:00.501344,0 days 00:00:00.418053,0.5,0.01,6.0,150,random selection,COMPLETE
2635,2635,39.6,2023-12-07 16:23:00.501557,2023-12-07 16:23:00.880527,0 days 00:00:00.378970,0.8,0.01,8.0,200,roulette wheel,COMPLETE
2636,2636,37.2,2023-12-07 16:23:00.880747,2023-12-07 16:23:01.509402,0 days 00:00:00.628655,0.5,0.5,6.0,100,roulette wheel,COMPLETE
2637,2637,42.8,2023-12-07 16:23:01.509612,2023-12-07 16:23:02.024718,0 days 00:00:00.515106,0.5,0.0,8.0,150,weighted choice,COMPLETE
2638,2638,36.8,2023-12-07 16:23:02.024929,2023-12-07 16:23:02.635836,0 days 00:00:00.610907,0.5,0.5,6.0,200,random selection,COMPLETE
2639,2639,38.0,2023-12-07 16:23:02.636049,2023-12-07 16:23:03.002598,0 days 00:00:00.366549,0.95,0.1,6.0,50,roulette wheel,COMPLETE
2640,2640,42.0,2023-12-07 16:23:03.002791,2023-12-07 16:23:03.518036,0 days 00:00:00.515245,0.5,0.0,8.0,150,weighted choice,COMPLETE
2641,2641,38.0,2023-12-07 16:23:03.518244,2023-12-07 16:23:04.041398,0 days 00:00:00.523154,0.5,0.33,8.0,50,random selection,COMPLETE
2642,2642,38.8,2023-12-07 16:23:04.041614,2023-12-07 16:23:04.617332,0 days 00:00:00.575718,0.95,0.5,8.0,300,random selection,COMPLETE
2643,2643,38.8,2023-12-07 16:23:04.617541,2023-12-07 16:23:04.986805,0 days 00:00:00.369264,0.8,0.1,6.0,10,roulette wheel,COMPLETE
2644,2644,40.4,2023-12-07 16:23:04.987027,2023-12-07 16:23:05.366637,0 days 00:00:00.379610,0.8,0.01,8.0,20,roulette wheel,COMPLETE
2645,2645,37.2,2023-12-07 16:23:05.366840,2023-12-07 16:23:05.999219,0 days 00:00:00.632379,0.8,0.5,8.0,50,weighted choice,COMPLETE
2646,2646,38.0,2023-12-07 16:23:05.999438,2023-12-07 16:23:06.489917,0 days 00:00:00.490479,0.95,0.33,8.0,300,random selection,COMPLETE
2647,2647,36.8,2023-12-07 16:23:06.490128,2023-12-07 16:23:06.853253,0 days 00:00:00.363125,0.8,0.1,6.0,200,random selection,COMPLETE
2648,2648,38.4,2023-12-07 16:23:06.853473,2023-12-07 16:23:07.286046,0 days 00:00:00.432573,0.6,0.1,8.0,50,weighted choice,COMPLETE
2649,2649,37.6,2023-12-07 16:23:07.286265,2023-12-07 16:23:07.584882,0 days 00:00:00.298617,0.6,0.0,8.0,200,random selection,COMPLETE
2650,2650,38.0,2023-12-07 16:23:07.585121,2023-12-07 16:23:08.239791,0 days 00:00:00.654670,0.5,0.33,6.0,250,weighted choice,COMPLETE
2651,2651,40.0,2023-12-07 16:23:08.240011,2023-12-07 16:23:08.655664,0 days 00:00:00.415653,0.5,0.01,6.0,250,roulette wheel,COMPLETE
2652,2652,43.2,2023-12-07 16:23:08.655879,2023-12-07 16:23:08.969027,0 days 00:00:00.313148,0.5,0.0,6.0,150,roulette wheel,COMPLETE
