,number,value,datetime_start,datetime_complete,duration,params_C,params_M,params_N,params_P,params_S,state
841,841,38.8,2023-12-06 14:08:09.111007,2023-12-06 14:08:09.666048,0 days 00:00:00.555041,0.5,0.33,1.0,50,weighted choice,COMPLETE
842,842,38.0,2023-12-06 14:08:09.666303,2023-12-06 14:08:10.289925,0 days 00:00:00.623622,0.6,0.5,4.0,10,weighted choice,COMPLETE
843,843,37.6,2023-12-06 14:08:10.290189,2023-12-06 14:08:29.628482,0 days 00:00:19.338293,0.6,0.33,0.0,50,random selection,COMPLETE
844,844,38.0,2023-12-06 14:08:29.628743,2023-12-06 14:08:30.233483,0 days 00:00:00.604740,0.5,0.5,4.0,100,random selection,COMPLETE
845,845,38.0,2023-12-06 14:08:30.233736,2023-12-06 14:08:30.629726,0 days 00:00:00.395990,0.6,0.1,2.0,20,weighted choice,COMPLETE
846,846,38.0,2023-12-06 14:08:30.629990,2023-12-06 14:09:51.544006,0 days 00:01:20.914016,0.6,0.0,0.0,100,weighted choice,COMPLETE
847,847,37.2,2023-12-06 14:09:51.544290,2023-12-06 14:09:57.503870,0 days 00:00:05.959580,0.0,0.0,,10,roulette wheel,COMPLETE
848,848,39.2,2023-12-06 14:09:57.504133,2023-12-06 14:09:58.008678,0 days 00:00:00.504545,0.8,0.0,4.0,10,roulette wheel,COMPLETE
849,849,38.0,2023-12-06 14:09:58.008942,2023-12-06 14:09:58.373652,0 days 00:00:00.364710,0.95,0.1,2.0,20,weighted choice,COMPLETE
850,850,38.0,2023-12-06 14:09:58.373925,2023-12-06 14:09:58.832794,0 days 00:00:00.458869,0.95,0.33,2.0,100,roulette wheel,COMPLETE
851,851,41.2,2023-12-06 14:09:58.833055,2023-12-06 14:09:59.443535,0 days 00:00:00.610480,0.5,0.0,4.0,20,roulette wheel,COMPLETE
852,852,36.4,2023-12-06 14:09:59.443793,2023-12-06 14:09:59.786623,0 days 00:00:00.342830,0.95,0.01,2.0,20,random selection,COMPLETE
853,853,37.2,2023-12-06 14:09:59.786903,2023-12-06 14:10:00.378078,0 days 00:00:00.591175,0.6,0.5,1.0,20,roulette wheel,COMPLETE
854,854,41.6,2023-12-06 14:10:00.378351,2023-12-06 14:10:00.880456,0 days 00:00:00.502105,0.5,0.01,2.0,100,weighted choice,COMPLETE
855,855,38.0,2023-12-06 14:10:00.880724,2023-12-06 14:10:01.485503,0 days 00:00:00.604779,0.5,0.5,1.0,20,random selection,COMPLETE
856,856,37.6,2023-12-06 14:10:01.485766,2023-12-06 14:11:21.978015,0 days 00:01:20.492249,0.0,0.0,,100,weighted choice,COMPLETE
857,857,36.8,2023-12-06 14:11:21.978268,2023-12-06 14:12:26.229904,0 days 00:01:04.251636,0.95,0.0,0.0,100,random selection,COMPLETE
858,858,44.0,2023-12-06 14:12:26.230188,2023-12-06 14:12:26.824286,0 days 00:00:00.594098,0.5,0.0,2.0,50,roulette wheel,COMPLETE
859,859,36.4,2023-12-06 14:12:26.824546,2023-12-06 14:12:31.067039,0 days 00:00:04.242493,0.6,0.33,0.0,10,roulette wheel,COMPLETE
860,860,38.0,2023-12-06 14:12:31.067319,2023-12-06 14:12:45.155015,0 days 00:00:14.087696,0.6,0.1,0.0,50,roulette wheel,COMPLETE
861,861,37.6,2023-12-06 14:12:45.155266,2023-12-06 14:13:13.863568,0 days 00:00:28.708302,0.0,0.1,,100,weighted choice,COMPLETE
862,862,36.8,2023-12-06 14:13:13.863837,2023-12-06 14:13:19.858950,0 days 00:00:05.995113,0.0,0.0,,10,roulette wheel,COMPLETE
863,863,41.2,2023-12-06 14:13:19.859213,2023-12-06 14:13:20.193328,0 days 00:00:00.334115,0.95,0.01,4.0,100,roulette wheel,COMPLETE
864,864,37.2,2023-12-06 14:13:20.193675,2023-12-06 14:14:01.819554,0 days 00:00:41.625879,0.5,0.0,0.0,50,weighted choice,COMPLETE
865,865,37.6,2023-12-06 14:14:01.819826,2023-12-06 14:14:07.191530,0 days 00:00:05.371704,0.8,0.01,0.0,20,roulette wheel,COMPLETE
866,866,37.6,2023-12-06 14:14:07.191801,2023-12-06 14:14:07.810879,0 days 00:00:00.619078,0.5,0.5,2.0,50,roulette wheel,COMPLETE
867,867,37.6,2023-12-06 14:14:07.811150,2023-12-06 14:14:19.837084,0 days 00:00:12.025934,0.6,0.01,0.0,50,roulette wheel,COMPLETE
868,868,36.4,2023-12-06 14:14:19.837347,2023-12-06 14:14:47.909106,0 days 00:00:28.071759,0.0,0.0,,50,random selection,COMPLETE
869,869,42.8,2023-12-06 14:14:47.909362,2023-12-06 14:14:48.476457,0 days 00:00:00.567095,0.8,0.0,4.0,20,weighted choice,COMPLETE
870,870,37.2,2023-12-06 14:14:48.476720,2023-12-06 14:15:06.025915,0 days 00:00:17.549195,0.0,0.33,,50,random selection,COMPLETE
871,871,38.0,2023-12-06 14:15:06.026179,2023-12-06 14:15:06.646236,0 days 00:00:00.620057,0.5,0.5,4.0,10,roulette wheel,COMPLETE
872,872,37.2,2023-12-06 14:15:06.646497,2023-12-06 14:15:06.979812,0 days 00:00:00.333315,0.8,0.01,1.0,50,random selection,COMPLETE
873,873,37.2,2023-12-06 14:15:06.980084,2023-12-06 14:15:15.275500,0 days 00:00:08.295416,0.6,0.33,0.0,20,roulette wheel,COMPLETE
874,874,38.0,2023-12-06 14:15:15.275764,2023-12-06 14:15:15.845426,0 days 00:00:00.569662,0.95,0.5,1.0,20,weighted choice,COMPLETE
875,875,36.8,2023-12-06 14:15:15.845686,2023-12-06 14:15:23.245015,0 days 00:00:07.399329,0.5,0.0,0.0,10,roulette wheel,COMPLETE
876,876,38.8,2023-12-06 14:15:23.245303,2023-12-06 14:15:25.965123,0 days 00:00:02.719820,0.0,0.1,,10,roulette wheel,COMPLETE
877,877,40.8,2023-12-06 14:15:25.965371,2023-12-06 14:15:26.352608,0 days 00:00:00.387237,0.6,0.01,4.0,100,roulette wheel,COMPLETE
878,878,37.2,2023-12-06 14:15:26.352890,2023-12-06 14:15:31.623652,0 days 00:00:05.270762,0.0,0.1,,20,roulette wheel,COMPLETE
879,879,36.8,2023-12-06 14:15:31.623916,2023-12-06 14:15:51.026711,0 days 00:00:19.402795,0.0,0.01,,100,roulette wheel,COMPLETE
880,880,38.4,2023-12-06 14:15:51.027082,2023-12-06 14:15:51.402940,0 days 00:00:00.375858,0.6,0.1,4.0,10,roulette wheel,COMPLETE
881,881,36.4,2023-12-06 14:15:51.403217,2023-12-06 14:15:55.223986,0 days 00:00:03.820769,0.0,0.33,,10,random selection,COMPLETE
882,882,43.6,2023-12-06 14:15:55.224253,2023-12-06 14:15:55.840653,0 days 00:00:00.616400,0.6,0.0,1.0,50,roulette wheel,COMPLETE
883,883,40.4,2023-12-06 14:15:55.840936,2023-12-06 14:15:56.373451,0 days 00:00:00.532515,0.6,0.0,4.0,20,roulette wheel,COMPLETE
884,884,40.4,2023-12-06 14:15:56.373714,2023-12-06 14:15:56.776978,0 days 00:00:00.403264,0.5,0.01,1.0,50,roulette wheel,COMPLETE
885,885,38.0,2023-12-06 14:15:56.777237,2023-12-06 14:15:59.461847,0 days 00:00:02.684610,0.0,0.1,,10,random selection,COMPLETE
886,886,37.6,2023-12-06 14:15:59.462106,2023-12-06 14:15:59.840516,0 days 00:00:00.378410,0.6,0.1,4.0,100,roulette wheel,COMPLETE
887,887,37.2,2023-12-06 14:15:59.840798,2023-12-06 14:16:00.219131,0 days 00:00:00.378333,0.5,0.1,2.0,20,random selection,COMPLETE
888,888,36.0,2023-12-06 14:16:00.219410,2023-12-06 14:16:00.650915,0 days 00:00:00.431505,0.5,0.01,4.0,20,random selection,COMPLETE
889,889,37.6,2023-12-06 14:16:00.651188,2023-12-06 14:16:01.233520,0 days 00:00:00.582332,0.6,0.5,1.0,100,random selection,COMPLETE
890,890,38.0,2023-12-06 14:16:01.233791,2023-12-06 14:16:20.511358,0 days 00:00:19.277567,0.0,0.01,,100,roulette wheel,COMPLETE
891,891,38.0,2023-12-06 14:16:20.511624,2023-12-06 14:16:20.880976,0 days 00:00:00.369352,0.6,0.1,4.0,100,roulette wheel,COMPLETE
892,892,38.8,2023-12-06 14:16:20.881242,2023-12-06 14:16:21.305377,0 days 00:00:00.424135,0.95,0.1,4.0,100,weighted choice,COMPLETE
893,893,37.2,2023-12-06 14:16:21.305656,2023-12-06 14:16:58.607253,0 days 00:00:37.301597,0.0,0.0,,50,weighted choice,COMPLETE
894,894,37.6,2023-12-06 14:16:58.607529,2023-12-06 14:17:42.263992,0 days 00:00:43.656463,0.0,0.5,,100,weighted choice,COMPLETE
895,895,38.4,2023-12-06 14:17:42.264365,2023-12-06 14:17:45.160820,0 days 00:00:02.896455,0.5,0.01,0.0,10,weighted choice,COMPLETE
896,896,38.0,2023-12-06 14:17:45.161094,2023-12-06 14:17:45.716084,0 days 00:00:00.554990,0.8,0.5,2.0,100,random selection,COMPLETE
897,897,40.0,2023-12-06 14:17:45.716352,2023-12-06 14:17:46.417592,0 days 00:00:00.701240,0.5,0.0,1.0,10,roulette wheel,COMPLETE
898,898,39.6,2023-12-06 14:17:46.417866,2023-12-06 14:17:46.909745,0 days 00:00:00.491879,0.95,0.0,2.0,10,roulette wheel,COMPLETE
899,899,37.2,2023-12-06 14:17:46.910077,2023-12-06 14:17:47.526673,0 days 00:00:00.616596,0.6,0.0,1.0,10,random selection,COMPLETE
900,900,43.6,2023-12-06 14:17:47.526943,2023-12-06 14:17:48.258841,0 days 00:00:00.731898,0.6,0.0,1.0,100,weighted choice,COMPLETE
901,901,37.2,2023-12-06 14:17:48.259194,2023-12-06 14:18:02.230069,0 days 00:00:13.970875,0.5,0.1,0.0,50,roulette wheel,COMPLETE
902,902,36.8,2023-12-06 14:18:02.230344,2023-12-06 14:18:07.413655,0 days 00:00:05.183311,0.8,0.5,0.0,10,random selection,COMPLETE
903,903,37.6,2023-12-06 14:18:07.413910,2023-12-06 14:18:11.825176,0 days 00:00:04.411266,0.0,0.01,,20,roulette wheel,COMPLETE
904,904,37.6,2023-12-06 14:18:11.825429,2023-12-06 14:18:12.418176,0 days 00:00:00.592747,0.6,0.5,4.0,20,roulette wheel,COMPLETE
905,905,38.0,2023-12-06 14:18:12.418467,2023-12-06 14:18:12.812381,0 days 00:00:00.393914,0.6,0.1,2.0,20,weighted choice,COMPLETE
906,906,41.2,2023-12-06 14:18:12.812665,2023-12-06 14:18:13.400330,0 days 00:00:00.587665,0.95,0.0,2.0,10,weighted choice,COMPLETE
907,907,37.2,2023-12-06 14:18:13.400598,2023-12-06 14:18:13.969528,0 days 00:00:00.568930,0.8,0.5,4.0,50,roulette wheel,COMPLETE
908,908,38.0,2023-12-06 14:18:13.969803,2023-12-06 14:18:14.513612,0 days 00:00:00.543809,0.5,0.33,1.0,20,weighted choice,COMPLETE
909,909,39.2,2023-12-06 14:18:14.513898,2023-12-06 14:18:14.911227,0 days 00:00:00.397329,0.6,0.1,4.0,20,weighted choice,COMPLETE
910,910,40.0,2023-12-06 14:18:14.911507,2023-12-06 14:18:15.351876,0 days 00:00:00.440369,0.6,0.01,1.0,50,weighted choice,COMPLETE
911,911,37.2,2023-12-06 14:18:15.352151,2023-12-06 14:18:21.226006,0 days 00:00:05.873855,0.0,0.1,,20,weighted choice,COMPLETE
912,912,38.0,2023-12-06 14:18:21.226279,2023-12-06 14:18:21.638625,0 days 00:00:00.412346,0.5,0.01,2.0,50,random selection,COMPLETE
913,913,41.2,2023-12-06 14:18:21.638957,2023-12-06 14:18:22.021235,0 days 00:00:00.382278,0.95,0.01,4.0,50,weighted choice,COMPLETE
914,914,37.2,2023-12-06 14:18:22.021529,2023-12-06 14:18:22.233163,0 days 00:00:00.211634,0.8,0.0,4.0,100,random selection,COMPLETE
915,915,36.8,2023-12-06 14:18:22.233448,2023-12-06 14:18:22.827606,0 days 00:00:00.594158,0.8,0.5,4.0,20,weighted choice,COMPLETE
916,916,37.6,2023-12-06 14:18:22.827894,2023-12-06 14:18:27.224377,0 days 00:00:04.396483,0.8,0.33,0.0,10,roulette wheel,COMPLETE
917,917,36.0,2023-12-06 14:18:27.224660,2023-12-06 14:18:27.813830,0 days 00:00:00.589170,0.6,0.0,2.0,20,random selection,COMPLETE
918,918,37.6,2023-12-06 14:18:27.814122,2023-12-06 14:18:31.671178,0 days 00:00:03.857056,0.0,0.33,,10,roulette wheel,COMPLETE
919,919,38.8,2023-12-06 14:18:31.671434,2023-12-06 14:18:32.178741,0 days 00:00:00.507307,0.8,0.33,2.0,10,weighted choice,COMPLETE
920,920,38.0,2023-12-06 14:18:32.179024,2023-12-06 14:18:32.737750,0 days 00:00:00.558726,0.8,0.5,4.0,20,random selection,COMPLETE
921,921,38.0,2023-12-06 14:18:32.738025,2023-12-06 14:18:33.053040,0 days 00:00:00.315015,0.8,0.01,1.0,100,random selection,COMPLETE
922,922,43.6,2023-12-06 14:18:33.053317,2023-12-06 14:18:33.647562,0 days 00:00:00.594245,0.6,0.0,1.0,50,roulette wheel,COMPLETE
923,923,37.6,2023-12-06 14:18:33.647838,2023-12-06 14:18:33.983721,0 days 00:00:00.335883,0.95,0.1,1.0,100,random selection,COMPLETE
924,924,36.8,2023-12-06 14:18:33.983998,2023-12-06 14:18:41.966792,0 days 00:00:07.982794,0.8,0.0,0.0,10,random selection,COMPLETE
925,925,41.2,2023-12-06 14:18:41.967050,2023-12-06 14:18:42.316705,0 days 00:00:00.349655,0.8,0.01,2.0,50,roulette wheel,COMPLETE
926,926,37.6,2023-12-06 14:18:42.316978,2023-12-06 14:18:42.763728,0 days 00:00:00.446750,0.95,0.33,1.0,10,random selection,COMPLETE
927,927,40.0,2023-12-06 14:18:42.764026,2023-12-06 14:18:43.208490,0 days 00:00:00.444464,0.5,0.01,2.0,20,roulette wheel,COMPLETE
928,928,37.6,2023-12-06 14:18:43.208760,2023-12-06 14:18:48.829978,0 days 00:00:05.621218,0.95,0.01,0.0,20,roulette wheel,COMPLETE
929,929,37.6,2023-12-06 14:18:48.830261,2023-12-06 14:18:49.250301,0 days 00:00:00.420040,0.8,0.1,1.0,100,weighted choice,COMPLETE
930,930,38.0,2023-12-06 14:18:49.250569,2023-12-06 14:19:01.354679,0 days 00:00:12.104110,0.0,0.1,,50,random selection,COMPLETE
931,931,38.4,2023-12-06 14:19:01.354950,2023-12-06 14:19:01.698041,0 days 00:00:00.343091,0.95,0.1,1.0,10,roulette wheel,COMPLETE
932,932,38.0,2023-12-06 14:19:01.698308,2023-12-06 14:19:02.097724,0 days 00:00:00.399416,0.6,0.1,1.0,10,weighted choice,COMPLETE
933,933,38.0,2023-12-06 14:19:02.098010,2023-12-06 14:19:28.728458,0 days 00:00:26.630448,0.8,0.1,0.0,100,roulette wheel,COMPLETE
934,934,42.8,2023-12-06 14:19:28.728845,2023-12-06 14:19:28.928508,0 days 00:00:00.199663,0.95,0.0,1.0,100,roulette wheel,COMPLETE
935,935,38.4,2023-12-06 14:19:28.928785,2023-12-06 14:19:50.998041,0 days 00:00:22.069256,0.0,0.1,,100,roulette wheel,COMPLETE
936,936,36.8,2023-12-06 14:19:50.998316,2023-12-06 14:19:51.503658,0 days 00:00:00.505342,0.5,0.33,4.0,100,roulette wheel,COMPLETE
937,937,36.8,2023-12-06 14:19:51.503931,2023-12-06 14:19:51.854548,0 days 00:00:00.350617,0.8,0.1,4.0,10,random selection,COMPLETE
938,938,38.0,2023-12-06 14:19:51.854820,2023-12-06 14:19:52.315121,0 days 00:00:00.460301,0.8,0.33,2.0,100,roulette wheel,COMPLETE
939,939,36.8,2023-12-06 14:19:52.315409,2023-12-06 14:20:19.964843,0 days 00:00:27.649434,0.95,0.1,0.0,100,roulette wheel,COMPLETE
940,940,36.4,2023-12-06 14:20:19.965236,2023-12-06 14:20:20.530241,0 days 00:00:00.565005,0.8,0.5,4.0,10,roulette wheel,COMPLETE
941,941,38.0,2023-12-06 14:20:20.530543,2023-12-06 14:20:57.995132,0 days 00:00:37.464589,0.95,0.0,0.0,50,roulette wheel,COMPLETE
942,942,38.8,2023-12-06 14:20:57.995604,2023-12-06 14:20:58.372955,0 days 00:00:00.377351,0.95,0.1,2.0,20,weighted choice,COMPLETE
943,943,38.4,2023-12-06 14:20:58.373228,2023-12-06 14:21:03.583800,0 days 00:00:05.210572,0.0,0.1,,20,roulette wheel,COMPLETE
944,944,37.6,2023-12-06 14:21:03.584074,2023-12-06 14:21:04.188932,0 days 00:00:00.604858,0.5,0.5,1.0,20,roulette wheel,COMPLETE
945,945,37.6,2023-12-06 14:21:04.189211,2023-12-06 14:21:04.653611,0 days 00:00:00.464400,0.95,0.33,4.0,20,random selection,COMPLETE
946,946,37.2,2023-12-06 14:21:04.653884,2023-12-06 14:21:04.994555,0 days 00:00:00.340671,0.8,0.01,4.0,50,random selection,COMPLETE
947,947,37.6,2023-12-06 14:21:04.994843,2023-12-06 14:21:05.553824,0 days 00:00:00.558981,0.8,0.5,4.0,10,roulette wheel,COMPLETE
948,948,38.8,2023-12-06 14:21:05.554095,2023-12-06 14:21:06.094104,0 days 00:00:00.540009,0.8,0.5,1.0,50,random selection,COMPLETE
949,949,38.0,2023-12-06 14:21:06.094385,2023-12-06 14:21:29.264523,0 days 00:00:23.170138,0.6,0.5,0.0,50,roulette wheel,COMPLETE
950,950,37.6,2023-12-06 14:21:29.264818,2023-12-06 14:22:11.211838,0 days 00:00:41.947020,0.5,0.5,0.0,100,roulette wheel,COMPLETE
951,951,37.6,2023-12-06 14:22:11.212440,2023-12-06 14:22:16.459768,0 days 00:00:05.247328,0.0,0.1,,20,roulette wheel,COMPLETE
952,952,40.8,2023-12-06 14:22:16.460032,2023-12-06 14:22:16.787779,0 days 00:00:00.327747,0.8,0.01,2.0,100,roulette wheel,COMPLETE
953,953,37.6,2023-12-06 14:22:16.788054,2023-12-06 14:23:23.558431,0 days 00:01:06.770377,0.95,0.0,0.0,100,roulette wheel,COMPLETE
954,954,37.2,2023-12-06 14:23:23.558713,2023-12-06 14:23:55.438340,0 days 00:00:31.879627,0.8,0.1,0.0,100,weighted choice,COMPLETE
955,955,40.8,2023-12-06 14:23:55.438892,2023-12-06 14:23:55.883535,0 days 00:00:00.444643,0.5,0.01,2.0,20,roulette wheel,COMPLETE
956,956,37.2,2023-12-06 14:23:55.883810,2023-12-06 14:23:56.444972,0 days 00:00:00.561162,0.6,0.5,1.0,50,roulette wheel,COMPLETE
957,957,36.8,2023-12-06 14:23:56.445280,2023-12-06 14:24:24.403365,0 days 00:00:27.958085,0.0,0.1,,100,weighted choice,COMPLETE
958,958,34.8,2023-12-06 14:24:24.403874,2023-12-06 14:24:24.701317,0 days 00:00:00.297443,0.95,0.0,4.0,50,random selection,COMPLETE
959,959,41.2,2023-12-06 14:24:24.701593,2023-12-06 14:24:25.341730,0 days 00:00:00.640137,0.5,0.0,2.0,20,roulette wheel,COMPLETE
960,960,41.2,2023-12-06 14:24:25.342008,2023-12-06 14:24:25.968768,0 days 00:00:00.626760,0.6,0.0,1.0,20,roulette wheel,COMPLETE
961,961,37.6,2023-12-06 14:24:25.969047,2023-12-06 14:24:54.034045,0 days 00:00:28.064998,0.0,0.0,,50,roulette wheel,COMPLETE
962,962,39.6,2023-12-06 14:24:54.034318,2023-12-06 14:24:54.664939,0 days 00:00:00.630621,0.6,0.0,1.0,10,roulette wheel,COMPLETE
963,963,36.4,2023-12-06 14:24:54.665219,2023-12-06 14:25:06.121475,0 days 00:00:11.456256,0.0,0.0,,20,random selection,COMPLETE
964,964,36.8,2023-12-06 14:25:06.121760,2023-12-06 14:25:47.994030,0 days 00:00:41.872270,0.6,0.5,0.0,100,roulette wheel,COMPLETE
965,965,37.2,2023-12-06 14:25:47.994593,2023-12-06 14:25:48.502469,0 days 00:00:00.507876,0.5,0.33,2.0,100,roulette wheel,COMPLETE
966,966,38.0,2023-12-06 14:25:48.502760,2023-12-06 14:26:06.602693,0 days 00:00:18.099933,0.8,0.0,0.0,20,weighted choice,COMPLETE
967,967,43.6,2023-12-06 14:26:06.602980,2023-12-06 14:26:07.116263,0 days 00:00:00.513283,0.5,0.0,2.0,100,roulette wheel,COMPLETE
968,968,36.8,2023-12-06 14:26:07.116549,2023-12-06 14:26:07.691872,0 days 00:00:00.575323,0.6,0.5,4.0,50,random selection,COMPLETE
969,969,37.2,2023-12-06 14:26:07.692153,2023-12-06 14:26:08.276527,0 days 00:00:00.584374,0.5,0.33,2.0,100,weighted choice,COMPLETE
970,970,38.0,2023-12-06 14:26:08.276798,2023-12-06 14:26:08.684138,0 days 00:00:00.407340,0.6,0.1,4.0,10,weighted choice,COMPLETE
971,971,40.8,2023-12-06 14:26:08.684416,2023-12-06 14:26:09.027537,0 days 00:00:00.343121,0.95,0.01,1.0,20,roulette wheel,COMPLETE
972,972,36.8,2023-12-06 14:26:09.027823,2023-12-06 14:26:57.483577,0 days 00:00:48.455754,0.6,0.5,0.0,100,weighted choice,COMPLETE
973,973,37.2,2023-12-06 14:26:57.483892,2023-12-06 14:26:57.810993,0 days 00:00:00.327101,0.8,0.01,2.0,100,random selection,COMPLETE
974,974,36.0,2023-12-06 14:26:57.811298,2023-12-06 14:26:58.148892,0 days 00:00:00.337594,0.95,0.1,1.0,10,random selection,COMPLETE
975,975,39.2,2023-12-06 14:26:58.149183,2023-12-06 14:26:58.779733,0 days 00:00:00.630550,0.5,0.0,4.0,10,roulette wheel,COMPLETE
976,976,37.6,2023-12-06 14:26:58.780005,2023-12-06 14:26:59.279250,0 days 00:00:00.499245,0.5,0.33,1.0,50,random selection,COMPLETE
977,977,37.2,2023-12-06 14:26:59.279545,2023-12-06 14:27:21.009885,0 days 00:00:21.730340,0.0,0.1,,100,random selection,COMPLETE
978,978,35.6,2023-12-06 14:27:21.010212,2023-12-06 14:27:21.389236,0 days 00:00:00.379024,0.95,0.01,4.0,10,random selection,COMPLETE
979,979,38.0,2023-12-06 14:27:21.389525,2023-12-06 14:27:36.017609,0 days 00:00:14.628084,0.8,0.1,0.0,50,random selection,COMPLETE
980,980,38.0,2023-12-06 14:27:36.017898,2023-12-06 14:27:45.028212,0 days 00:00:09.010314,0.0,0.5,,20,random selection,COMPLETE
981,981,38.0,2023-12-06 14:27:45.028503,2023-12-06 14:28:11.121986,0 days 00:00:26.093483,0.8,0.1,0.0,100,random selection,COMPLETE
982,982,38.0,2023-12-06 14:28:11.122606,2023-12-06 14:28:17.011016,0 days 00:00:05.888410,0.0,0.0,,10,random selection,COMPLETE
983,983,39.6,2023-12-06 14:28:17.011273,2023-12-06 14:28:17.409295,0 days 00:00:00.398022,0.95,0.01,1.0,10,roulette wheel,COMPLETE
984,984,36.8,2023-12-06 14:28:17.409593,2023-12-06 14:29:11.061737,0 days 00:00:53.652144,0.0,0.0,,100,random selection,COMPLETE
985,985,36.0,2023-12-06 14:29:11.062000,2023-12-06 14:29:11.584150,0 days 00:00:00.522150,0.5,0.33,2.0,20,roulette wheel,COMPLETE
986,986,36.0,2023-12-06 14:29:11.584535,2023-12-06 14:29:34.507419,0 days 00:00:22.922884,0.0,0.1,,100,roulette wheel,COMPLETE
987,987,38.0,2023-12-06 14:29:34.507725,2023-12-06 14:29:34.871748,0 days 00:00:00.364023,0.6,0.1,2.0,10,roulette wheel,COMPLETE
988,988,38.4,2023-12-06 14:29:34.872019,2023-12-06 14:29:49.005400,0 days 00:00:14.133381,0.5,0.0,0.0,20,random selection,COMPLETE
989,989,38.0,2023-12-06 14:29:49.005689,2023-12-06 14:29:49.378800,0 days 00:00:00.373111,0.6,0.1,4.0,100,roulette wheel,COMPLETE
990,990,37.2,2023-12-06 14:29:49.379114,2023-12-06 14:30:01.174805,0 days 00:00:11.795691,0.0,0.0,,20,roulette wheel,COMPLETE
991,991,36.4,2023-12-06 14:30:01.175069,2023-12-06 14:30:01.621754,0 days 00:00:00.446685,0.5,0.01,2.0,20,random selection,COMPLETE
992,992,38.0,2023-12-06 14:30:01.622019,2023-12-06 14:30:01.996573,0 days 00:00:00.374554,0.5,0.1,1.0,20,random selection,COMPLETE
993,993,43.6,2023-12-06 14:30:01.996872,2023-12-06 14:30:02.434015,0 days 00:00:00.437143,0.6,0.0,1.0,100,roulette wheel,COMPLETE
994,994,43.2,2023-12-06 14:30:02.434310,2023-12-06 14:30:03.055618,0 days 00:00:00.621308,0.8,0.0,1.0,50,weighted choice,COMPLETE
995,995,39.6,2023-12-06 14:30:03.055892,2023-12-06 14:30:03.532704,0 days 00:00:00.476812,0.5,0.01,4.0,10,roulette wheel,COMPLETE
996,996,38.0,2023-12-06 14:30:03.532994,2023-12-06 14:30:38.053001,0 days 00:00:34.520007,0.6,0.0,0.0,50,roulette wheel,COMPLETE
997,997,44.8,2023-12-06 14:30:38.053307,2023-12-06 14:30:38.753853,0 days 00:00:00.700546,0.5,0.0,1.0,50,roulette wheel,COMPLETE
998,998,38.0,2023-12-06 14:30:38.754135,2023-12-06 14:30:44.577977,0 days 00:00:05.823842,0.0,0.1,,20,weighted choice,COMPLETE
999,999,38.0,2023-12-06 14:30:44.578269,2023-12-06 14:30:45.080055,0 days 00:00:00.501786,0.6,0.33,4.0,50,random selection,COMPLETE
1000,1000,38.0,2023-12-06 14:30:45.080346,2023-12-06 14:30:45.509048,0 days 00:00:00.428702,0.8,0.1,4.0,100,weighted choice,COMPLETE
1001,1001,43.6,2023-12-06 14:30:45.509337,2023-12-06 14:30:45.740567,0 days 00:00:00.231230,0.8,0.0,2.0,100,roulette wheel,COMPLETE
1002,1002,36.4,2023-12-06 14:30:45.740840,2023-12-06 14:31:13.676119,0 days 00:00:27.935279,0.0,0.1,,100,weighted choice,COMPLETE
1003,1003,37.2,2023-12-06 14:31:13.676466,2023-12-06 14:31:36.877215,0 days 00:00:23.200749,0.6,0.5,0.0,50,roulette wheel,COMPLETE
1004,1004,37.6,2023-12-06 14:31:36.877514,2023-12-06 14:31:37.427447,0 days 00:00:00.549933,0.8,0.5,1.0,10,roulette wheel,COMPLETE
1005,1005,38.4,2023-12-06 14:31:37.427720,2023-12-06 14:32:14.689056,0 days 00:00:37.261336,0.0,0.5,,100,random selection,COMPLETE
1006,1006,37.6,2023-12-06 14:32:14.689446,2023-12-06 14:32:15.147954,0 days 00:00:00.458508,0.95,0.33,2.0,50,random selection,COMPLETE
1007,1007,37.6,2023-12-06 14:32:15.148259,2023-12-06 14:32:15.698306,0 days 00:00:00.550047,0.6,0.33,1.0,100,weighted choice,COMPLETE
1008,1008,36.8,2023-12-06 14:32:15.698595,2023-12-06 14:32:16.060442,0 days 00:00:00.361847,0.6,0.1,2.0,10,random selection,COMPLETE
