,number,value,datetime_start,datetime_complete,duration,params_C,params_M,params_N,params_P,params_S,state
2325,2325,37.6,2023-12-07 15:37:05.977366,2023-12-07 15:38:41.687293,0 days 00:01:35.709927,0.8,0.0,0.0,250,roulette wheel,COMPLETE
2326,2326,38.4,2023-12-07 15:38:41.687519,2023-12-07 15:38:42.035720,0 days 00:00:00.348201,0.8,0.1,2.0,300,roulette wheel,COMPLETE
2327,2327,36.4,2023-12-07 15:38:42.035961,2023-12-07 15:38:42.401793,0 days 00:00:00.365832,0.6,0.01,4.0,300,random selection,COMPLETE
2328,2328,37.6,2023-12-07 15:38:42.402020,2023-12-07 15:41:46.094064,0 days 00:03:03.692044,0.6,0.0,0.0,300,weighted choice,COMPLETE
2329,2329,41.2,2023-12-07 15:41:46.094461,2023-12-07 15:41:46.406698,0 days 00:00:00.312237,0.8,0.01,2.0,250,roulette wheel,COMPLETE
2330,2330,39.6,2023-12-07 15:41:46.406968,2023-12-07 15:41:46.713204,0 days 00:00:00.306236,0.95,0.01,4.0,250,roulette wheel,COMPLETE
2331,2331,37.2,2023-12-07 15:41:46.713449,2023-12-07 15:42:27.866698,0 days 00:00:41.153249,0.0,0.01,,300,roulette wheel,COMPLETE
2332,2332,38.8,2023-12-07 15:42:27.866946,2023-12-07 15:42:28.354806,0 days 00:00:00.487860,0.8,0.01,4.0,300,weighted choice,COMPLETE
2333,2333,39.2,2023-12-07 15:42:28.355041,2023-12-07 15:42:28.691638,0 days 00:00:00.336597,0.6,0.01,1.0,250,roulette wheel,COMPLETE
2334,2334,37.2,2023-12-07 15:42:28.691876,2023-12-07 15:43:24.009883,0 days 00:00:55.318007,0.95,0.5,0.0,300,random selection,COMPLETE
2335,2335,37.6,2023-12-07 15:43:24.010161,2023-12-07 15:43:24.580282,0 days 00:00:00.570121,0.8,0.5,4.0,250,roulette wheel,COMPLETE
2336,2336,38.0,2023-12-07 15:43:24.580526,2023-12-07 15:43:24.930746,0 days 00:00:00.350220,0.8,0.1,2.0,300,roulette wheel,COMPLETE
2337,2337,38.0,2023-12-07 15:43:24.930975,2023-12-07 15:43:25.401750,0 days 00:00:00.470775,0.95,0.1,1.0,300,weighted choice,COMPLETE
2338,2338,36.8,2023-12-07 15:43:25.401986,2023-12-07 15:43:25.990676,0 days 00:00:00.588690,0.6,0.5,2.0,300,random selection,COMPLETE
2339,2339,38.0,2023-12-07 15:43:25.990934,2023-12-07 15:43:26.492223,0 days 00:00:00.501289,0.95,0.1,2.0,300,weighted choice,COMPLETE
2340,2340,36.8,2023-12-07 15:43:26.492457,2023-12-07 15:43:50.598345,0 days 00:00:24.105888,0.0,0.1,,300,random selection,COMPLETE
2341,2341,38.4,2023-12-07 15:43:50.598574,2023-12-07 15:47:01.313105,0 days 00:03:10.714531,0.95,0.0,0.0,300,weighted choice,COMPLETE
2342,2342,37.6,2023-12-07 15:47:01.313573,2023-12-07 15:47:52.688785,0 days 00:00:51.375212,0.0,0.33,,300,roulette wheel,COMPLETE
2343,2343,38.0,2023-12-07 15:47:52.689023,2023-12-07 15:48:36.847128,0 days 00:00:44.158105,0.6,0.1,0.0,250,roulette wheel,COMPLETE
2344,2344,38.0,2023-12-07 15:48:36.847367,2023-12-07 15:48:37.308218,0 days 00:00:00.460851,0.8,0.33,1.0,300,roulette wheel,COMPLETE
2345,2345,36.8,2023-12-07 15:48:37.308457,2023-12-07 15:49:04.714721,0 days 00:00:27.406264,0.0,0.01,,300,random selection,COMPLETE
2346,2346,38.4,2023-12-07 15:49:04.715145,2023-12-07 15:49:05.196966,0 days 00:00:00.481821,0.95,0.1,2.0,300,weighted choice,COMPLETE
2347,2347,36.8,2023-12-07 15:49:05.197206,2023-12-07 15:50:02.182442,0 days 00:00:56.985236,0.95,0.5,0.0,250,random selection,COMPLETE
2348,2348,37.6,2023-12-07 15:50:02.182877,2023-12-07 15:50:02.564782,0 days 00:00:00.381905,0.5,0.1,4.0,300,random selection,COMPLETE
2349,2349,36.8,2023-12-07 15:50:02.565019,2023-12-07 15:50:35.787327,0 days 00:00:33.222308,0.0,0.1,,300,random selection,COMPLETE
2350,2350,37.6,2023-12-07 15:50:35.787571,2023-12-07 15:50:36.420895,0 days 00:00:00.633324,0.5,0.5,4.0,250,roulette wheel,COMPLETE
2351,2351,37.6,2023-12-07 15:50:36.421128,2023-12-07 15:50:36.984702,0 days 00:00:00.563574,0.8,0.5,2.0,250,roulette wheel,COMPLETE
2352,2352,36.4,2023-12-07 15:50:36.984946,2023-12-07 15:51:00.064808,0 days 00:00:23.079862,0.0,0.01,,300,random selection,COMPLETE
2353,2353,38.4,2023-12-07 15:51:00.065128,2023-12-07 15:51:00.661654,0 days 00:00:00.596526,0.8,0.33,2.0,250,weighted choice,COMPLETE
2354,2354,37.6,2023-12-07 15:51:00.661915,2023-12-07 15:51:40.008300,0 days 00:00:39.346385,0.0,0.1,,250,roulette wheel,COMPLETE
2355,2355,37.6,2023-12-07 15:51:40.008542,2023-12-07 15:52:45.751051,0 days 00:01:05.742509,0.0,0.01,,300,weighted choice,COMPLETE
2356,2356,36.8,2023-12-07 15:52:45.751279,2023-12-07 15:53:29.265931,0 days 00:00:43.514652,0.0,0.5,,300,random selection,COMPLETE
2357,2357,38.0,2023-12-07 15:53:29.266187,2023-12-07 15:53:29.773386,0 days 00:00:00.507199,0.6,0.1,4.0,250,weighted choice,COMPLETE
2358,2358,38.4,2023-12-07 15:53:29.773619,2023-12-07 15:53:30.153533,0 days 00:00:00.379914,0.5,0.1,2.0,300,roulette wheel,COMPLETE
2359,2359,38.0,2023-12-07 15:53:30.153773,2023-12-07 15:53:30.653480,0 days 00:00:00.499707,0.5,0.33,1.0,300,roulette wheel,COMPLETE
2360,2360,38.0,2023-12-07 15:53:30.653724,2023-12-07 15:54:26.501768,0 days 00:00:55.848044,0.0,0.33,,250,roulette wheel,COMPLETE
2361,2361,37.6,2023-12-07 15:54:26.502011,2023-12-07 15:55:27.112540,0 days 00:01:00.610529,0.0,0.01,,250,weighted choice,COMPLETE
2362,2362,37.6,2023-12-07 15:55:27.112784,2023-12-07 15:56:06.308194,0 days 00:00:39.195410,0.8,0.01,0.0,300,roulette wheel,COMPLETE
2363,2363,37.2,2023-12-07 15:56:06.308529,2023-12-07 15:56:06.757941,0 days 00:00:00.449412,0.95,0.33,1.0,300,roulette wheel,COMPLETE
2364,2364,38.0,2023-12-07 15:56:06.758180,2023-12-07 15:57:18.705131,0 days 00:01:11.946951,0.6,0.5,0.0,250,roulette wheel,COMPLETE
2365,2365,38.0,2023-12-07 15:57:18.705387,2023-12-07 15:58:59.907801,0 days 00:01:41.202414,0.95,0.0,0.0,250,roulette wheel,COMPLETE
2366,2366,38.0,2023-12-07 15:58:59.908056,2023-12-07 15:59:00.277771,0 days 00:00:00.369715,0.6,0.1,4.0,250,roulette wheel,COMPLETE
2367,2367,40.8,2023-12-07 15:59:00.278020,2023-12-07 15:59:00.851164,0 days 00:00:00.573144,0.5,0.01,1.0,250,weighted choice,COMPLETE
2368,2368,38.0,2023-12-07 15:59:00.851398,2023-12-07 16:00:14.909313,0 days 00:01:14.057915,0.5,0.5,0.0,250,roulette wheel,COMPLETE
2369,2369,36.8,2023-12-07 16:00:14.909703,2023-12-07 16:00:15.530762,0 days 00:00:00.621059,0.6,0.33,2.0,250,weighted choice,COMPLETE
2370,2370,38.0,2023-12-07 16:00:15.531007,2023-12-07 16:00:57.143581,0 days 00:00:41.612574,0.5,0.1,0.0,300,roulette wheel,COMPLETE
2371,2371,37.2,2023-12-07 16:00:57.143829,2023-12-07 16:00:57.501836,0 days 00:00:00.358007,0.6,0.1,2.0,250,random selection,COMPLETE
2372,2372,39.6,2023-12-07 16:00:57.502082,2023-12-07 16:00:57.808654,0 days 00:00:00.306572,0.8,0.01,1.0,300,roulette wheel,COMPLETE
2373,2373,38.0,2023-12-07 16:00:57.808896,2023-12-07 16:00:58.399255,0 days 00:00:00.590359,0.6,0.5,1.0,300,roulette wheel,COMPLETE
2374,2374,36.4,2023-12-07 16:00:58.399500,2023-12-07 16:00:59.001680,0 days 00:00:00.602180,0.8,0.33,1.0,300,weighted choice,COMPLETE
2375,2375,36.8,2023-12-07 16:00:59.001927,2023-12-07 16:01:58.102061,0 days 00:00:59.100134,0.0,0.01,,250,weighted choice,COMPLETE
2376,2376,36.8,2023-12-07 16:01:58.102308,2023-12-07 16:01:58.492197,0 days 00:00:00.389889,0.5,0.1,2.0,300,roulette wheel,COMPLETE
2377,2377,43.2,2023-12-07 16:01:58.492560,2023-12-07 16:01:58.768611,0 days 00:00:00.276051,0.5,0.0,4.0,250,roulette wheel,COMPLETE
2378,2378,37.2,2023-12-07 16:01:58.768856,2023-12-07 16:03:44.958502,0 days 00:01:46.189646,0.8,0.0,0.0,300,roulette wheel,COMPLETE
2379,2379,37.6,2023-12-07 16:03:44.958739,2023-12-07 16:03:45.659132,0 days 00:00:00.700393,0.8,0.5,1.0,250,weighted choice,COMPLETE
2380,2380,37.2,2023-12-07 16:03:45.659385,2023-12-07 16:04:24.972963,0 days 00:00:39.313578,0.0,0.01,,300,roulette wheel,COMPLETE
2381,2381,37.6,2023-12-07 16:04:24.973578,2023-12-07 16:04:48.939841,0 days 00:00:23.966263,0.0,0.01,,300,random selection,COMPLETE
2382,2382,41.2,2023-12-07 16:04:48.940174,2023-12-07 16:04:49.389930,0 days 00:00:00.449756,0.8,0.01,1.0,250,weighted choice,COMPLETE
2383,2383,38.8,2023-12-07 16:04:49.390173,2023-12-07 16:04:49.720368,0 days 00:00:00.330195,0.95,0.1,1.0,300,roulette wheel,COMPLETE
2384,2384,40.4,2023-12-07 16:04:49.720612,2023-12-07 16:04:50.283439,0 days 00:00:00.562827,0.5,0.01,2.0,250,weighted choice,COMPLETE
2385,2385,37.6,2023-12-07 16:04:50.283693,2023-12-07 16:04:50.621339,0 days 00:00:00.337646,0.8,0.1,1.0,250,random selection,COMPLETE
2386,2386,38.0,2023-12-07 16:04:50.621582,2023-12-07 16:05:33.259752,0 days 00:00:42.638170,0.5,0.1,0.0,250,roulette wheel,COMPLETE
2387,2387,36.8,2023-12-07 16:05:33.260013,2023-12-07 16:06:19.832882,0 days 00:00:46.572869,0.8,0.1,0.0,250,roulette wheel,COMPLETE
2388,2388,37.6,2023-12-07 16:06:19.833150,2023-12-07 16:06:59.057529,0 days 00:00:39.224379,0.0,0.1,,250,roulette wheel,COMPLETE
2389,2389,38.0,2023-12-07 16:06:59.057777,2023-12-07 16:07:44.845888,0 days 00:00:45.788111,0.0,0.33,,300,roulette wheel,COMPLETE
2390,2390,37.6,2023-12-07 16:07:44.846124,2023-12-07 16:07:45.227301,0 days 00:00:00.381177,0.95,0.1,4.0,250,roulette wheel,COMPLETE
2391,2391,37.6,2023-12-07 16:07:45.227531,2023-12-07 16:07:45.813523,0 days 00:00:00.585992,0.6,0.5,1.0,250,roulette wheel,COMPLETE
2392,2392,42.0,2023-12-07 16:07:45.813760,2023-12-07 16:07:46.311316,0 days 00:00:00.497556,0.6,0.0,2.0,300,weighted choice,COMPLETE
2393,2393,37.2,2023-12-07 16:07:46.311566,2023-12-07 16:08:46.057112,0 days 00:00:59.745546,0.5,0.33,0.0,250,roulette wheel,COMPLETE
2394,2394,37.2,2023-12-07 16:08:46.057338,2023-12-07 16:08:46.647575,0 days 00:00:00.590237,0.6,0.5,4.0,250,roulette wheel,COMPLETE
2395,2395,41.6,2023-12-07 16:08:46.647825,2023-12-07 16:08:47.021285,0 days 00:00:00.373460,0.8,0.0,4.0,250,weighted choice,COMPLETE
2396,2396,37.6,2023-12-07 16:08:47.021516,2023-12-07 16:09:52.256155,0 days 00:01:05.234639,0.95,0.33,0.0,250,roulette wheel,COMPLETE
2397,2397,37.6,2023-12-07 16:09:52.256413,2023-12-07 16:12:01.068789,0 days 00:02:08.812376,0.0,0.0,,250,roulette wheel,COMPLETE
2398,2398,37.2,2023-12-07 16:12:01.069090,2023-12-07 16:13:41.548158,0 days 00:01:40.479068,0.8,0.5,0.0,300,weighted choice,COMPLETE
2399,2399,37.6,2023-12-07 16:13:41.548393,2023-12-07 16:15:16.048960,0 days 00:01:34.500567,0.0,0.5,,300,weighted choice,COMPLETE
2400,2400,39.6,2023-12-07 16:21:10.671597,2023-12-07 16:21:11.011692,0 days 00:00:00.340095,0.95,0.01,6.0,250,roulette wheel,COMPLETE
2401,2401,37.2,2023-12-07 16:21:11.012138,2023-12-07 16:21:11.623954,0 days 00:00:00.611816,0.6,0.5,8.0,10,roulette wheel,COMPLETE
2402,2402,38.4,2023-12-07 16:21:11.624140,2023-12-07 16:21:12.018430,0 days 00:00:00.394290,0.5,0.1,8.0,50,roulette wheel,COMPLETE
2403,2403,38.4,2023-12-07 16:21:12.018624,2023-12-07 16:21:12.407465,0 days 00:00:00.388841,0.6,0.1,8.0,150,roulette wheel,COMPLETE
2404,2404,38.0,2023-12-07 16:21:12.407659,2023-12-07 16:21:12.798145,0 days 00:00:00.390486,0.5,0.1,8.0,20,roulette wheel,COMPLETE
2405,2405,41.6,2023-12-07 16:21:12.798342,2023-12-07 16:21:13.157763,0 days 00:00:00.359421,0.8,0.01,6.0,50,roulette wheel,COMPLETE
2406,2406,36.8,2023-12-07 16:21:13.157949,2023-12-07 16:21:13.668827,0 days 00:00:00.510878,0.5,0.33,6.0,150,random selection,COMPLETE
2407,2407,37.2,2023-12-07 16:21:13.669044,2023-12-07 16:21:14.365119,0 days 00:00:00.696075,0.95,0.5,6.0,300,weighted choice,COMPLETE
2408,2408,38.0,2023-12-07 16:21:14.365303,2023-12-07 16:21:14.891133,0 days 00:00:00.525830,0.8,0.33,8.0,20,weighted choice,COMPLETE
2409,2409,37.6,2023-12-07 16:21:14.891304,2023-12-07 16:21:15.281998,0 days 00:00:00.390694,0.6,0.1,6.0,300,roulette wheel,COMPLETE
2410,2410,39.2,2023-12-07 16:21:15.282169,2023-12-07 16:21:15.539455,0 days 00:00:00.257286,0.8,0.0,8.0,250,roulette wheel,COMPLETE
2411,2411,38.8,2023-12-07 16:21:15.539620,2023-12-07 16:21:16.155036,0 days 00:00:00.615416,0.6,0.5,8.0,10,roulette wheel,COMPLETE
2412,2412,38.8,2023-12-07 16:21:16.155259,2023-12-07 16:21:16.523041,0 days 00:00:00.367782,0.8,0.1,6.0,200,random selection,COMPLETE
2413,2413,38.0,2023-12-07 16:21:16.523217,2023-12-07 16:21:17.052963,0 days 00:00:00.529746,0.8,0.01,8.0,300,weighted choice,COMPLETE
2414,2414,39.6,2023-12-07 16:21:17.053147,2023-12-07 16:21:17.453435,0 days 00:00:00.400288,0.95,0.01,8.0,10,roulette wheel,COMPLETE
2415,2415,37.2,2023-12-07 16:21:17.453612,2023-12-07 16:21:17.865445,0 days 00:00:00.411833,0.5,0.01,6.0,100,random selection,COMPLETE
2416,2416,36.8,2023-12-07 16:21:17.865651,2023-12-07 16:21:18.253400,0 days 00:00:00.387749,0.6,0.1,8.0,200,random selection,COMPLETE
2417,2417,36.8,2023-12-07 16:21:18.253574,2023-12-07 16:21:18.645533,0 days 00:00:00.391959,0.95,0.01,8.0,10,random selection,COMPLETE
2418,2418,37.6,2023-12-07 16:21:18.645717,2023-12-07 16:21:19.261052,0 days 00:00:00.615335,0.5,0.5,8.0,20,random selection,COMPLETE
2419,2419,39.6,2023-12-07 16:21:19.261230,2023-12-07 16:21:19.665120,0 days 00:00:00.403890,0.6,0.01,8.0,250,roulette wheel,COMPLETE
2420,2420,40.4,2023-12-07 16:21:19.665291,2023-12-07 16:21:20.077335,0 days 00:00:00.412044,0.6,0.01,8.0,50,roulette wheel,COMPLETE
2421,2421,35.2,2023-12-07 16:21:20.077511,2023-12-07 16:21:20.560456,0 days 00:00:00.482945,0.5,0.0,6.0,50,random selection,COMPLETE
2422,2422,38.4,2023-12-07 16:21:20.560638,2023-12-07 16:21:20.947198,0 days 00:00:00.386560,0.5,0.1,6.0,100,roulette wheel,COMPLETE
2423,2423,42.0,2023-12-07 16:21:20.947366,2023-12-07 16:21:21.306122,0 days 00:00:00.358756,0.8,0.01,6.0,50,roulette wheel,COMPLETE
2424,2424,37.2,2023-12-07 16:21:21.306302,2023-12-07 16:21:21.815681,0 days 00:00:00.509379,0.5,0.33,6.0,250,roulette wheel,COMPLETE
2425,2425,37.2,2023-12-07 16:21:21.815856,2023-12-07 16:21:22.340700,0 days 00:00:00.524844,0.6,0.0,8.0,20,random selection,COMPLETE
2426,2426,37.2,2023-12-07 16:21:22.340893,2023-12-07 16:21:22.903409,0 days 00:00:00.562516,0.8,0.5,6.0,150,random selection,COMPLETE
2427,2427,38.4,2023-12-07 16:21:22.903589,2023-12-07 16:21:23.411231,0 days 00:00:00.507642,0.6,0.33,8.0,300,roulette wheel,COMPLETE
2428,2428,36.8,2023-12-07 16:21:23.411401,2023-12-07 16:21:24.032012,0 days 00:00:00.620611,0.8,0.5,8.0,50,weighted choice,COMPLETE
2429,2429,38.0,2023-12-07 16:21:24.032182,2023-12-07 16:21:24.551932,0 days 00:00:00.519750,0.5,0.33,6.0,300,random selection,COMPLETE
2430,2430,37.2,2023-12-07 16:21:24.552102,2023-12-07 16:21:24.868194,0 days 00:00:00.316092,0.5,0.0,8.0,300,random selection,COMPLETE
2431,2431,36.4,2023-12-07 16:21:24.868381,2023-12-07 16:21:25.449871,0 days 00:00:00.581490,0.95,0.33,8.0,150,weighted choice,COMPLETE
2432,2432,42.0,2023-12-07 16:21:25.450048,2023-12-07 16:21:25.770465,0 days 00:00:00.320417,0.95,0.0,8.0,100,weighted choice,COMPLETE
2433,2433,37.6,2023-12-07 16:21:25.770641,2023-12-07 16:21:26.346708,0 days 00:00:00.576067,0.8,0.5,8.0,50,roulette wheel,COMPLETE
2434,2434,37.6,2023-12-07 16:21:26.346886,2023-12-07 16:21:26.962403,0 days 00:00:00.615517,0.95,0.5,8.0,10,weighted choice,COMPLETE
2435,2435,36.8,2023-12-07 16:21:26.962572,2023-12-07 16:21:27.461962,0 days 00:00:00.499390,0.6,0.33,8.0,250,roulette wheel,COMPLETE
2436,2436,37.6,2023-12-07 16:21:27.462137,2023-12-07 16:21:27.822722,0 days 00:00:00.360585,0.8,0.1,6.0,50,roulette wheel,COMPLETE
2437,2437,36.8,2023-12-07 16:21:27.822907,2023-12-07 16:21:28.059124,0 days 00:00:00.236217,0.8,0.0,6.0,150,random selection,COMPLETE
2438,2438,38.0,2023-12-07 16:21:28.059307,2023-12-07 16:21:28.555712,0 days 00:00:00.496405,0.6,0.33,6.0,10,random selection,COMPLETE
2439,2439,38.8,2023-12-07 16:21:28.555899,2023-12-07 16:21:29.204000,0 days 00:00:00.648101,0.5,0.33,8.0,200,weighted choice,COMPLETE
2440,2440,40.0,2023-12-07 16:21:29.204175,2023-12-07 16:21:29.620204,0 days 00:00:00.416029,0.6,0.01,8.0,20,roulette wheel,COMPLETE
2441,2441,42.0,2023-12-07 16:21:29.620399,2023-12-07 16:21:30.359806,0 days 00:00:00.739407,0.5,0.0,8.0,20,weighted choice,COMPLETE
2442,2442,37.2,2023-12-07 16:21:30.359988,2023-12-07 16:21:30.903730,0 days 00:00:00.543742,0.6,0.33,8.0,20,weighted choice,COMPLETE
2443,2443,41.2,2023-12-07 16:21:30.903932,2023-12-07 16:21:31.202223,0 days 00:00:00.298291,0.6,0.0,8.0,250,roulette wheel,COMPLETE
2444,2444,37.2,2023-12-07 16:21:31.202388,2023-12-07 16:21:31.784293,0 days 00:00:00.581905,0.95,0.5,8.0,100,roulette wheel,COMPLETE
2445,2445,38.0,2023-12-07 16:21:31.784541,2023-12-07 16:21:32.373057,0 days 00:00:00.588516,0.95,0.33,8.0,150,weighted choice,COMPLETE
2446,2446,37.2,2023-12-07 16:21:32.373238,2023-12-07 16:21:32.941059,0 days 00:00:00.567821,0.95,0.33,8.0,100,weighted choice,COMPLETE
2447,2447,39.2,2023-12-07 16:21:32.941236,2023-12-07 16:21:33.565241,0 days 00:00:00.624005,0.5,0.5,6.0,10,roulette wheel,COMPLETE
2448,2448,42.8,2023-12-07 16:21:33.565409,2023-12-07 16:21:33.867452,0 days 00:00:00.302043,0.6,0.0,8.0,150,roulette wheel,COMPLETE
2449,2449,40.8,2023-12-07 16:21:33.867639,2023-12-07 16:21:34.313261,0 days 00:00:00.445622,0.6,0.01,8.0,10,roulette wheel,COMPLETE
2450,2450,36.4,2023-12-07 16:21:34.313434,2023-12-07 16:21:34.895517,0 days 00:00:00.582083,0.95,0.33,8.0,100,weighted choice,COMPLETE
2451,2451,43.6,2023-12-07 16:21:34.895704,2023-12-07 16:21:35.206111,0 days 00:00:00.310407,0.5,0.0,6.0,150,roulette wheel,COMPLETE
2452,2452,36.8,2023-12-07 16:21:35.206282,2023-12-07 16:21:35.803099,0 days 00:00:00.596817,0.6,0.5,8.0,100,roulette wheel,COMPLETE
2453,2453,37.2,2023-12-07 16:21:35.803263,2023-12-07 16:21:36.303354,0 days 00:00:00.500091,0.6,0.33,6.0,150,roulette wheel,COMPLETE
2454,2454,36.8,2023-12-07 16:21:36.303532,2023-12-07 16:21:36.683657,0 days 00:00:00.380125,0.8,0.1,8.0,300,random selection,COMPLETE
2455,2455,40.0,2023-12-07 16:21:36.683842,2023-12-07 16:21:37.076545,0 days 00:00:00.392703,0.6,0.01,6.0,300,roulette wheel,COMPLETE
2456,2456,38.4,2023-12-07 16:21:37.076717,2023-12-07 16:21:37.589749,0 days 00:00:00.513032,0.6,0.33,6.0,10,roulette wheel,COMPLETE
2457,2457,40.8,2023-12-07 16:21:37.589931,2023-12-07 16:21:37.954429,0 days 00:00:00.364498,0.95,0.01,8.0,50,roulette wheel,COMPLETE
2458,2458,42.4,2023-12-07 16:21:37.954609,2023-12-07 16:21:38.301490,0 days 00:00:00.346881,0.95,0.01,6.0,50,roulette wheel,COMPLETE
2459,2459,37.6,2023-12-07 16:21:38.301670,2023-12-07 16:21:38.875225,0 days 00:00:00.573555,0.8,0.33,6.0,100,weighted choice,COMPLETE
2460,2460,37.6,2023-12-07 16:21:38.875420,2023-12-07 16:21:39.252864,0 days 00:00:00.377444,0.95,0.1,8.0,50,random selection,COMPLETE
2461,2461,37.6,2023-12-07 16:21:39.253057,2023-12-07 16:21:40.014808,0 days 00:00:00.761751,0.5,0.5,6.0,250,weighted choice,COMPLETE
2462,2462,38.0,2023-12-07 16:21:40.015122,2023-12-07 16:21:40.684058,0 days 00:00:00.668936,0.6,0.33,6.0,300,weighted choice,COMPLETE
2463,2463,38.8,2023-12-07 16:21:40.684243,2023-12-07 16:21:41.282401,0 days 00:00:00.598158,0.6,0.5,8.0,250,roulette wheel,COMPLETE
2464,2464,38.0,2023-12-07 16:21:41.282587,2023-12-07 16:21:41.663279,0 days 00:00:00.380692,0.8,0.1,8.0,100,random selection,COMPLETE
2465,2465,37.2,2023-12-07 16:21:41.663462,2023-12-07 16:21:42.052100,0 days 00:00:00.388638,0.8,0.1,8.0,200,roulette wheel,COMPLETE
2466,2466,37.6,2023-12-07 16:21:42.052291,2023-12-07 16:21:42.653356,0 days 00:00:00.601065,0.6,0.5,6.0,300,roulette wheel,COMPLETE
2467,2467,37.2,2023-12-07 16:21:42.653532,2023-12-07 16:21:43.023804,0 days 00:00:00.370272,0.6,0.1,6.0,200,random selection,COMPLETE
2468,2468,42.8,2023-12-07 16:21:43.023989,2023-12-07 16:21:43.375363,0 days 00:00:00.351374,0.8,0.0,8.0,100,weighted choice,COMPLETE
2469,2469,42.4,2023-12-07 16:21:43.375548,2023-12-07 16:21:43.685258,0 days 00:00:00.309710,0.6,0.0,8.0,100,roulette wheel,COMPLETE
2470,2470,38.0,2023-12-07 16:21:43.685433,2023-12-07 16:21:44.190531,0 days 00:00:00.505098,0.8,0.33,8.0,200,roulette wheel,COMPLETE
2471,2471,37.6,2023-12-07 16:21:44.190715,2023-12-07 16:21:44.571409,0 days 00:00:00.380694,0.5,0.1,6.0,100,roulette wheel,COMPLETE
2472,2472,39.2,2023-12-07 16:21:44.571598,2023-12-07 16:21:44.969587,0 days 00:00:00.397989,0.8,0.0,8.0,200,weighted choice,COMPLETE
2473,2473,42.0,2023-12-07 16:21:44.969769,2023-12-07 16:21:45.297914,0 days 00:00:00.328145,0.5,0.0,8.0,250,roulette wheel,COMPLETE
2474,2474,40.8,2023-12-07 16:21:45.298093,2023-12-07 16:21:45.707362,0 days 00:00:00.409269,0.5,0.01,6.0,150,roulette wheel,COMPLETE
2475,2475,42.0,2023-12-07 16:21:45.707542,2023-12-07 16:21:46.408439,0 days 00:00:00.700897,0.5,0.0,6.0,50,weighted choice,COMPLETE
2476,2476,38.4,2023-12-07 16:21:46.408616,2023-12-07 16:21:46.792949,0 days 00:00:00.384333,0.8,0.1,8.0,50,roulette wheel,COMPLETE
2477,2477,38.4,2023-12-07 16:21:46.793153,2023-12-07 16:21:47.322248,0 days 00:00:00.529095,0.5,0.33,6.0,300,roulette wheel,COMPLETE
2478,2478,40.8,2023-12-07 16:21:47.322422,2023-12-07 16:21:47.579846,0 days 00:00:00.257424,0.8,0.0,8.0,200,roulette wheel,COMPLETE
2479,2479,37.6,2023-12-07 16:21:47.580031,2023-12-07 16:21:48.102992,0 days 00:00:00.522961,0.5,0.33,6.0,200,random selection,COMPLETE
2480,2480,36.8,2023-12-07 16:21:48.103178,2023-12-07 16:21:48.651116,0 days 00:00:00.547938,0.6,0.33,8.0,20,weighted choice,COMPLETE
2481,2481,38.0,2023-12-07 16:21:48.651310,2023-12-07 16:21:49.328219,0 days 00:00:00.676909,0.95,0.5,8.0,100,weighted choice,COMPLETE
2482,2482,38.4,2023-12-07 16:21:49.328468,2023-12-07 16:21:49.601815,0 days 00:00:00.273347,0.6,0.0,6.0,150,random selection,COMPLETE
2483,2483,38.0,2023-12-07 16:21:49.602009,2023-12-07 16:21:50.035547,0 days 00:00:00.433538,0.5,0.1,8.0,20,weighted choice,COMPLETE
2484,2484,38.8,2023-12-07 16:21:50.035726,2023-12-07 16:21:50.604843,0 days 00:00:00.569117,0.8,0.5,6.0,20,random selection,COMPLETE
2485,2485,36.8,2023-12-07 16:21:50.605019,2023-12-07 16:21:50.980922,0 days 00:00:00.375903,0.6,0.1,6.0,250,random selection,COMPLETE
2486,2486,38.0,2023-12-07 16:21:50.981111,2023-12-07 16:21:51.373814,0 days 00:00:00.392703,0.6,0.1,8.0,150,roulette wheel,COMPLETE
2487,2487,38.0,2023-12-07 16:21:51.373991,2023-12-07 16:21:51.749696,0 days 00:00:00.375705,0.8,0.1,8.0,150,roulette wheel,COMPLETE
2488,2488,37.6,2023-12-07 16:21:51.749880,2023-12-07 16:21:52.043563,0 days 00:00:00.293683,0.6,0.0,8.0,150,random selection,COMPLETE
