,number,value,datetime_start,datetime_complete,duration,params_C,params_M,params_N,params_P,params_S,state
2817,2817,37.2,2023-12-07 16:24:28.674091,2023-12-07 16:24:29.074190,0 days 00:00:00.400099,0.95,0.1,8.0,300,random selection,COMPLETE
2818,2818,38.8,2023-12-07 16:24:29.074437,2023-12-07 16:24:29.427592,0 days 00:00:00.353155,0.8,0.01,6.0,200,roulette wheel,COMPLETE
2819,2819,37.2,2023-12-07 16:24:29.427825,2023-12-07 16:24:29.940917,0 days 00:00:00.513092,0.5,0.33,6.0,300,roulette wheel,COMPLETE
2820,2820,38.4,2023-12-07 16:24:29.941143,2023-12-07 16:24:30.499561,0 days 00:00:00.558418,0.6,0.33,8.0,20,weighted choice,COMPLETE
2821,2821,37.6,2023-12-07 16:24:30.499799,2023-12-07 16:24:31.046529,0 days 00:00:00.546730,0.6,0.33,6.0,20,weighted choice,COMPLETE
2822,2822,37.6,2023-12-07 16:24:31.046765,2023-12-07 16:24:31.836181,0 days 00:00:00.789416,0.5,0.5,8.0,300,weighted choice,COMPLETE
2823,2823,37.6,2023-12-07 16:24:31.836418,2023-12-07 16:24:32.541345,0 days 00:00:00.704927,0.95,0.5,6.0,200,weighted choice,COMPLETE
2824,2824,37.2,2023-12-07 16:24:32.541581,2023-12-07 16:24:33.072721,0 days 00:00:00.531140,0.5,0.33,8.0,250,random selection,COMPLETE
2825,2825,37.6,2023-12-07 16:24:33.072960,2023-12-07 16:24:33.666977,0 days 00:00:00.594017,0.6,0.5,6.0,20,random selection,COMPLETE
2826,2826,40.4,2023-12-07 16:24:33.667232,2023-12-07 16:24:34.145586,0 days 00:00:00.478354,0.95,0.0,6.0,10,roulette wheel,COMPLETE
2827,2827,40.0,2023-12-07 16:24:34.145876,2023-12-07 16:24:34.595935,0 days 00:00:00.450059,0.5,0.01,8.0,20,roulette wheel,COMPLETE
2828,2828,36.8,2023-12-07 16:24:34.596166,2023-12-07 16:24:34.992218,0 days 00:00:00.396052,0.6,0.01,6.0,50,random selection,COMPLETE
2829,2829,39.2,2023-12-07 16:24:34.992460,2023-12-07 16:24:35.420509,0 days 00:00:00.428049,0.5,0.01,8.0,250,roulette wheel,COMPLETE
2830,2830,38.0,2023-12-07 16:24:35.420745,2023-12-07 16:24:35.835983,0 days 00:00:00.415238,0.8,0.1,8.0,20,weighted choice,COMPLETE
2831,2831,40.8,2023-12-07 16:24:35.836211,2023-12-07 16:24:36.078594,0 days 00:00:00.242383,0.8,0.0,6.0,300,roulette wheel,COMPLETE
2832,2832,40.4,2023-12-07 16:24:36.078891,2023-12-07 16:24:36.408939,0 days 00:00:00.330048,0.95,0.01,6.0,200,roulette wheel,COMPLETE
2833,2833,38.0,2023-12-07 16:24:36.409217,2023-12-07 16:24:37.028060,0 days 00:00:00.618843,0.5,0.5,8.0,200,random selection,COMPLETE
2834,2834,38.8,2023-12-07 16:24:37.028306,2023-12-07 16:24:37.524819,0 days 00:00:00.496513,0.8,0.1,8.0,200,weighted choice,COMPLETE
2835,2835,37.6,2023-12-07 16:24:37.525063,2023-12-07 16:24:38.068041,0 days 00:00:00.542978,0.6,0.33,6.0,20,weighted choice,COMPLETE
2836,2836,38.8,2023-12-07 16:24:38.068273,2023-12-07 16:24:38.453469,0 days 00:00:00.385196,0.8,0.1,8.0,200,roulette wheel,COMPLETE
2837,2837,40.0,2023-12-07 16:24:38.453712,2023-12-07 16:24:38.678959,0 days 00:00:00.225247,0.95,0.0,6.0,150,roulette wheel,COMPLETE
2838,2838,37.2,2023-12-07 16:24:38.679202,2023-12-07 16:24:39.313949,0 days 00:00:00.634747,0.5,0.5,8.0,10,random selection,COMPLETE
2839,2839,36.0,2023-12-07 16:24:39.314192,2023-12-07 16:24:39.588082,0 days 00:00:00.273890,0.6,0.0,6.0,100,random selection,COMPLETE
2840,2840,40.4,2023-12-07 16:24:39.588326,2023-12-07 16:24:39.888513,0 days 00:00:00.300187,0.6,0.0,8.0,300,roulette wheel,COMPLETE
2841,2841,37.2,2023-12-07 16:24:39.888762,2023-12-07 16:24:40.246102,0 days 00:00:00.357340,0.8,0.01,6.0,50,random selection,COMPLETE
2842,2842,38.0,2023-12-07 16:24:40.246342,2023-12-07 16:24:40.602515,0 days 00:00:00.356173,0.8,0.01,6.0,150,random selection,COMPLETE
2843,2843,37.6,2023-12-07 16:24:40.602756,2023-12-07 16:24:40.844896,0 days 00:00:00.242140,0.95,0.0,8.0,200,random selection,COMPLETE
2844,2844,42.0,2023-12-07 16:24:40.845130,2023-12-07 16:24:41.572322,0 days 00:00:00.727192,0.5,0.0,6.0,20,weighted choice,COMPLETE
2845,2845,39.6,2023-12-07 16:24:41.572586,2023-12-07 16:24:41.958834,0 days 00:00:00.386248,0.8,0.1,8.0,10,roulette wheel,COMPLETE
2846,2846,38.8,2023-12-07 16:24:41.959066,2023-12-07 16:24:42.332592,0 days 00:00:00.373526,0.8,0.1,6.0,10,roulette wheel,COMPLETE
2847,2847,41.2,2023-12-07 16:24:42.332832,2023-12-07 16:24:42.761293,0 days 00:00:00.428461,0.5,0.01,6.0,50,roulette wheel,COMPLETE
2848,2848,39.2,2023-12-07 16:24:42.761540,2023-12-07 16:24:43.139639,0 days 00:00:00.378099,0.8,0.1,6.0,250,roulette wheel,COMPLETE
2849,2849,37.2,2023-12-07 16:24:43.139880,2023-12-07 16:24:43.839999,0 days 00:00:00.700119,0.8,0.5,6.0,250,weighted choice,COMPLETE
2850,2850,36.4,2023-12-07 16:24:43.840244,2023-12-07 16:24:44.404520,0 days 00:00:00.564276,0.95,0.5,6.0,300,random selection,COMPLETE
2851,2851,36.4,2023-12-07 16:24:44.404765,2023-12-07 16:24:44.879175,0 days 00:00:00.474410,0.95,0.0,8.0,10,random selection,COMPLETE
2852,2852,36.8,2023-12-07 16:24:44.879422,2023-12-07 16:24:45.234024,0 days 00:00:00.354602,0.95,0.01,8.0,100,random selection,COMPLETE
2853,2853,41.2,2023-12-07 16:24:45.234262,2023-12-07 16:24:45.666206,0 days 00:00:00.431944,0.8,0.01,8.0,20,weighted choice,COMPLETE
2854,2854,37.2,2023-12-07 16:24:45.666447,2023-12-07 16:24:46.157781,0 days 00:00:00.491334,0.95,0.33,8.0,300,random selection,COMPLETE
2855,2855,37.6,2023-12-07 16:24:46.158018,2023-12-07 16:24:46.726155,0 days 00:00:00.568137,0.95,0.5,6.0,50,roulette wheel,COMPLETE
2856,2856,40.4,2023-12-07 16:24:46.726400,2023-12-07 16:24:47.031375,0 days 00:00:00.304975,0.6,0.0,8.0,300,roulette wheel,COMPLETE
2857,2857,37.6,2023-12-07 16:24:47.031628,2023-12-07 16:24:47.657606,0 days 00:00:00.625978,0.5,0.5,6.0,10,roulette wheel,COMPLETE
2858,2858,36.8,2023-12-07 16:24:47.657858,2023-12-07 16:24:48.278619,0 days 00:00:00.620761,0.5,0.5,8.0,100,random selection,COMPLETE
2859,2859,38.0,2023-12-07 16:24:48.278866,2023-12-07 16:24:48.869443,0 days 00:00:00.590577,0.95,0.5,8.0,150,roulette wheel,COMPLETE
2860,2860,39.6,2023-12-07 16:24:48.869668,2023-12-07 16:24:49.463330,0 days 00:00:00.593662,0.6,0.0,8.0,10,roulette wheel,COMPLETE
2861,2861,38.0,2023-12-07 16:24:49.463576,2023-12-07 16:24:50.164147,0 days 00:00:00.700571,0.95,0.5,6.0,300,weighted choice,COMPLETE
2862,2862,39.2,2023-12-07 16:24:50.164389,2023-12-07 16:24:50.493149,0 days 00:00:00.328760,0.95,0.01,6.0,250,roulette wheel,COMPLETE
2863,2863,37.6,2023-12-07 16:24:50.493384,2023-12-07 16:24:50.994104,0 days 00:00:00.500720,0.95,0.33,6.0,250,random selection,COMPLETE
2864,2864,38.0,2023-12-07 16:24:50.994360,2023-12-07 16:24:51.380751,0 days 00:00:00.386391,0.6,0.1,8.0,250,roulette wheel,COMPLETE
2865,2865,42.4,2023-12-07 16:24:51.380990,2023-12-07 16:24:51.821136,0 days 00:00:00.440146,0.6,0.0,8.0,150,weighted choice,COMPLETE
2866,2866,38.0,2023-12-07 16:24:51.821387,2023-12-07 16:24:52.415987,0 days 00:00:00.594600,0.95,0.5,8.0,250,roulette wheel,COMPLETE
2867,2867,39.6,2023-12-07 16:24:52.416238,2023-12-07 16:24:53.016042,0 days 00:00:00.599804,0.6,0.0,8.0,10,roulette wheel,COMPLETE
2868,2868,40.0,2023-12-07 16:24:53.016292,2023-12-07 16:24:53.380501,0 days 00:00:00.364209,0.95,0.01,8.0,100,roulette wheel,COMPLETE
2869,2869,37.6,2023-12-07 16:24:53.380759,2023-12-07 16:24:53.867775,0 days 00:00:00.487016,0.8,0.33,6.0,20,roulette wheel,COMPLETE
2870,2870,36.8,2023-12-07 16:24:53.868025,2023-12-07 16:24:54.241463,0 days 00:00:00.373438,0.95,0.1,6.0,150,random selection,COMPLETE
2871,2871,40.8,2023-12-07 16:24:54.241706,2023-12-07 16:24:54.677953,0 days 00:00:00.436247,0.5,0.01,8.0,100,roulette wheel,COMPLETE
2872,2872,37.6,2023-12-07 16:24:54.678190,2023-12-07 16:24:55.192883,0 days 00:00:00.514693,0.6,0.33,8.0,20,random selection,COMPLETE
2873,2873,40.4,2023-12-07 16:24:55.193128,2023-12-07 16:24:55.589903,0 days 00:00:00.396775,0.6,0.01,6.0,250,roulette wheel,COMPLETE
2874,2874,38.0,2023-12-07 16:24:55.590130,2023-12-07 16:24:56.188186,0 days 00:00:00.598056,0.6,0.5,8.0,100,random selection,COMPLETE
2875,2875,42.8,2023-12-07 16:24:56.188430,2023-12-07 16:24:56.765593,0 days 00:00:00.577163,0.6,0.0,8.0,20,roulette wheel,COMPLETE
2876,2876,36.8,2023-12-07 16:24:56.765832,2023-12-07 16:24:57.331455,0 days 00:00:00.565623,0.95,0.5,6.0,50,roulette wheel,COMPLETE
2877,2877,38.4,2023-12-07 16:24:57.331721,2023-12-07 16:24:57.959554,0 days 00:00:00.627833,0.5,0.5,6.0,10,roulette wheel,COMPLETE
2878,2878,37.6,2023-12-07 16:24:57.959803,2023-12-07 16:24:58.600778,0 days 00:00:00.640975,0.8,0.5,6.0,100,weighted choice,COMPLETE
2879,2879,40.4,2023-12-07 16:24:58.601026,2023-12-07 16:24:58.959420,0 days 00:00:00.358394,0.95,0.01,8.0,50,roulette wheel,COMPLETE
2880,2880,41.2,2023-12-07 16:24:58.959652,2023-12-07 16:24:59.265634,0 days 00:00:00.305982,0.6,0.0,8.0,150,roulette wheel,COMPLETE
2881,2881,38.8,2023-12-07 16:24:59.265883,2023-12-07 16:24:59.616253,0 days 00:00:00.350370,0.95,0.01,8.0,250,roulette wheel,COMPLETE
2882,2882,38.0,2023-12-07 16:24:59.616497,2023-12-07 16:25:00.144321,0 days 00:00:00.527824,0.5,0.33,6.0,20,roulette wheel,COMPLETE
2883,2883,37.6,2023-12-07 16:25:00.144558,2023-12-07 16:25:00.733613,0 days 00:00:00.589055,0.6,0.5,6.0,100,random selection,COMPLETE
2884,2884,40.4,2023-12-07 16:25:00.733867,2023-12-07 16:25:01.094515,0 days 00:00:00.360648,0.95,0.01,8.0,100,roulette wheel,COMPLETE
2885,2885,37.2,2023-12-07 16:25:01.094746,2023-12-07 16:25:01.617402,0 days 00:00:00.522656,0.5,0.33,6.0,50,roulette wheel,COMPLETE
2886,2886,37.2,2023-12-07 16:25:01.617644,2023-12-07 16:25:02.001912,0 days 00:00:00.384268,0.8,0.1,8.0,250,random selection,COMPLETE
2887,2887,38.0,2023-12-07 16:25:02.002166,2023-12-07 16:25:02.564509,0 days 00:00:00.562343,0.8,0.5,6.0,300,roulette wheel,COMPLETE
2888,2888,39.2,2023-12-07 16:25:02.564758,2023-12-07 16:25:02.907556,0 days 00:00:00.342798,0.95,0.01,6.0,150,roulette wheel,COMPLETE
2889,2889,37.6,2023-12-07 16:25:02.907794,2023-12-07 16:25:03.576864,0 days 00:00:00.669070,0.5,0.5,8.0,10,weighted choice,COMPLETE
2890,2890,35.2,2023-12-07 16:25:03.577111,2023-12-07 16:25:03.916652,0 days 00:00:00.339541,0.95,0.0,8.0,50,random selection,COMPLETE
2891,2891,37.2,2023-12-07 16:25:03.916905,2023-12-07 16:25:04.516559,0 days 00:00:00.599654,0.6,0.5,6.0,10,roulette wheel,COMPLETE
2892,2892,37.6,2023-12-07 16:25:04.516797,2023-12-07 16:25:05.021705,0 days 00:00:00.504908,0.8,0.33,8.0,250,random selection,COMPLETE
2893,2893,40.8,2023-12-07 16:25:05.021955,2023-12-07 16:25:05.460049,0 days 00:00:00.438094,0.5,0.01,8.0,100,roulette wheel,COMPLETE
2894,2894,36.8,2023-12-07 16:25:05.460310,2023-12-07 16:25:06.174795,0 days 00:00:00.714485,0.95,0.5,8.0,300,weighted choice,COMPLETE
2895,2895,40.4,2023-12-07 16:25:06.175026,2023-12-07 16:25:06.401813,0 days 00:00:00.226787,0.95,0.0,6.0,300,roulette wheel,COMPLETE
2896,2896,37.6,2023-12-07 16:25:06.402055,2023-12-07 16:25:06.988057,0 days 00:00:00.586002,0.8,0.5,8.0,10,random selection,COMPLETE
2897,2897,42.8,2023-12-07 16:25:06.988318,2023-12-07 16:25:07.637217,0 days 00:00:00.648899,0.5,0.0,6.0,100,weighted choice,COMPLETE
2898,2898,38.8,2023-12-07 16:25:07.637466,2023-12-07 16:25:08.158887,0 days 00:00:00.521421,0.5,0.33,8.0,250,random selection,COMPLETE
2899,2899,38.8,2023-12-07 16:25:08.159155,2023-12-07 16:25:08.763422,0 days 00:00:00.604267,0.8,0.5,6.0,10,weighted choice,COMPLETE
2900,2900,37.6,2023-12-07 16:25:08.763697,2023-12-07 16:25:09.290239,0 days 00:00:00.526542,0.5,0.33,6.0,100,roulette wheel,COMPLETE
2901,2901,39.2,2023-12-07 16:25:09.290492,2023-12-07 16:25:09.806386,0 days 00:00:00.515894,0.95,0.01,8.0,300,weighted choice,COMPLETE
2902,2902,39.2,2023-12-07 16:25:09.806644,2023-12-07 16:25:10.244031,0 days 00:00:00.437387,0.95,0.01,8.0,100,weighted choice,COMPLETE
2903,2903,37.2,2023-12-07 16:25:10.244315,2023-12-07 16:25:10.893426,0 days 00:00:00.649111,0.6,0.5,8.0,20,weighted choice,COMPLETE
2904,2904,38.0,2023-12-07 16:25:10.893664,2023-12-07 16:25:11.303080,0 days 00:00:00.409416,0.8,0.1,6.0,10,weighted choice,COMPLETE
2905,2905,39.2,2023-12-07 16:25:11.303327,2023-12-07 16:25:11.775662,0 days 00:00:00.472335,0.8,0.01,8.0,150,weighted choice,COMPLETE
2906,2906,38.4,2023-12-07 16:25:11.775910,2023-12-07 16:25:12.166467,0 days 00:00:00.390557,0.8,0.1,8.0,200,random selection,COMPLETE
2907,2907,41.6,2023-12-07 16:25:12.166733,2023-12-07 16:25:12.677204,0 days 00:00:00.510471,0.5,0.01,8.0,50,weighted choice,COMPLETE
2908,2908,37.6,2023-12-07 16:25:12.677453,2023-12-07 16:25:13.219125,0 days 00:00:00.541672,0.5,0.1,8.0,250,weighted choice,COMPLETE
2909,2909,38.4,2023-12-07 16:25:13.219371,2023-12-07 16:25:13.794806,0 days 00:00:00.575435,0.8,0.5,6.0,300,random selection,COMPLETE
2910,2910,38.0,2023-12-07 16:25:13.795044,2023-12-07 16:25:14.203610,0 days 00:00:00.408566,0.5,0.01,6.0,300,random selection,COMPLETE
2911,2911,37.2,2023-12-07 16:25:14.203889,2023-12-07 16:25:14.690488,0 days 00:00:00.486599,0.95,0.33,6.0,10,roulette wheel,COMPLETE
2912,2912,39.2,2023-12-07 16:25:14.690759,2023-12-07 16:25:15.105211,0 days 00:00:00.414452,0.6,0.01,8.0,100,roulette wheel,COMPLETE
2913,2913,37.6,2023-12-07 16:25:15.105487,2023-12-07 16:25:15.712782,0 days 00:00:00.607295,0.6,0.5,8.0,10,random selection,COMPLETE
2914,2914,40.8,2023-12-07 16:25:15.713020,2023-12-07 16:25:16.220024,0 days 00:00:00.507004,0.6,0.0,8.0,250,weighted choice,COMPLETE
2915,2915,39.6,2023-12-07 16:25:16.220283,2023-12-07 16:25:16.809120,0 days 00:00:00.588837,0.5,0.01,8.0,200,weighted choice,COMPLETE
2916,2916,38.0,2023-12-07 16:25:16.809374,2023-12-07 16:25:17.314833,0 days 00:00:00.505459,0.5,0.1,8.0,150,weighted choice,COMPLETE
2917,2917,37.6,2023-12-07 16:25:17.315073,2023-12-07 16:25:17.941340,0 days 00:00:00.626267,0.5,0.5,8.0,250,roulette wheel,COMPLETE
2918,2918,37.6,2023-12-07 16:25:17.941595,2023-12-07 16:25:18.321543,0 days 00:00:00.379948,0.8,0.1,6.0,250,roulette wheel,COMPLETE
2919,2919,38.4,2023-12-07 16:25:18.321795,2023-12-07 16:25:18.860344,0 days 00:00:00.538549,0.95,0.1,8.0,250,weighted choice,COMPLETE
2920,2920,37.2,2023-12-07 16:25:18.860579,2023-12-07 16:25:19.160666,0 days 00:00:00.300087,0.5,0.0,6.0,250,random selection,COMPLETE
2921,2921,36.8,2023-12-07 16:25:19.160908,2023-12-07 16:25:19.649244,0 days 00:00:00.488336,0.95,0.33,6.0,150,roulette wheel,COMPLETE
2922,2922,41.2,2023-12-07 16:25:19.649495,2023-12-07 16:25:20.030686,0 days 00:00:00.381191,0.8,0.01,8.0,100,roulette wheel,COMPLETE
2923,2923,37.6,2023-12-07 16:25:20.030934,2023-12-07 16:25:20.432198,0 days 00:00:00.401264,0.5,0.01,6.0,300,random selection,COMPLETE
2924,2924,37.6,2023-12-07 16:25:20.432471,2023-12-07 16:25:20.934454,0 days 00:00:00.501983,0.6,0.33,6.0,300,random selection,COMPLETE
2925,2925,37.2,2023-12-07 16:25:20.934705,2023-12-07 16:25:21.506297,0 days 00:00:00.571592,0.95,0.5,6.0,150,random selection,COMPLETE
2926,2926,41.6,2023-12-07 16:25:21.506569,2023-12-07 16:25:21.999054,0 days 00:00:00.492485,0.8,0.0,8.0,20,roulette wheel,COMPLETE
2927,2927,38.0,2023-12-07 16:25:21.999307,2023-12-07 16:25:22.509930,0 days 00:00:00.510623,0.95,0.33,8.0,100,roulette wheel,COMPLETE
2928,2928,37.6,2023-12-07 16:25:22.510176,2023-12-07 16:25:23.043582,0 days 00:00:00.533406,0.95,0.33,8.0,20,weighted choice,COMPLETE
2929,2929,37.2,2023-12-07 16:25:23.043840,2023-12-07 16:25:23.541007,0 days 00:00:00.497167,0.95,0.33,6.0,150,roulette wheel,COMPLETE
2930,2930,38.0,2023-12-07 16:25:23.541253,2023-12-07 16:25:23.920850,0 days 00:00:00.379597,0.8,0.1,6.0,300,roulette wheel,COMPLETE
2931,2931,39.2,2023-12-07 16:25:23.921091,2023-12-07 16:25:24.347888,0 days 00:00:00.426797,0.5,0.01,8.0,200,roulette wheel,COMPLETE
2932,2932,37.6,2023-12-07 16:25:24.348149,2023-12-07 16:25:24.687585,0 days 00:00:00.339436,0.95,0.01,6.0,50,random selection,COMPLETE
2933,2933,37.2,2023-12-07 16:25:24.687827,2023-12-07 16:25:25.290865,0 days 00:00:00.603038,0.6,0.5,8.0,250,roulette wheel,COMPLETE
2934,2934,37.2,2023-12-07 16:25:25.291133,2023-12-07 16:25:25.681290,0 days 00:00:00.390157,0.5,0.1,6.0,20,random selection,COMPLETE
2935,2935,38.4,2023-12-07 16:25:25.681549,2023-12-07 16:25:26.263497,0 days 00:00:00.581948,0.95,0.5,8.0,300,roulette wheel,COMPLETE
2936,2936,37.6,2023-12-07 16:25:26.263759,2023-12-07 16:25:26.784722,0 days 00:00:00.520963,0.5,0.33,6.0,100,roulette wheel,COMPLETE
2937,2937,37.6,2023-12-07 16:25:26.784975,2023-12-07 16:25:27.227106,0 days 00:00:00.442131,0.5,0.1,8.0,10,weighted choice,COMPLETE
2938,2938,36.4,2023-12-07 16:25:27.227373,2023-12-07 16:25:27.576518,0 days 00:00:00.349145,0.8,0.01,6.0,200,random selection,COMPLETE
2939,2939,37.2,2023-12-07 16:25:27.576761,2023-12-07 16:25:28.089228,0 days 00:00:00.512467,0.6,0.33,6.0,200,roulette wheel,COMPLETE
2940,2940,38.0,2023-12-07 16:25:28.089484,2023-12-07 16:25:28.673474,0 days 00:00:00.583990,0.8,0.5,8.0,50,random selection,COMPLETE
2941,2941,37.6,2023-12-07 16:25:28.673737,2023-12-07 16:25:29.059099,0 days 00:00:00.385362,0.8,0.1,8.0,100,roulette wheel,COMPLETE
2942,2942,38.4,2023-12-07 16:25:29.059374,2023-12-07 16:25:29.446149,0 days 00:00:00.386775,0.95,0.1,6.0,250,roulette wheel,COMPLETE
2943,2943,42.4,2023-12-07 16:25:29.446406,2023-12-07 16:25:29.834461,0 days 00:00:00.388055,0.6,0.0,8.0,100,roulette wheel,COMPLETE
2944,2944,38.4,2023-12-07 16:25:29.834716,2023-12-07 16:25:30.341534,0 days 00:00:00.506818,0.6,0.33,8.0,100,random selection,COMPLETE
2945,2945,38.0,2023-12-07 16:25:30.341786,2023-12-07 16:25:30.969184,0 days 00:00:00.627398,0.5,0.5,6.0,50,roulette wheel,COMPLETE
2946,2946,37.2,2023-12-07 16:25:30.969446,2023-12-07 16:25:31.457199,0 days 00:00:00.487753,0.8,0.33,6.0,50,roulette wheel,COMPLETE
2947,2947,38.4,2023-12-07 16:25:31.457462,2023-12-07 16:25:31.816122,0 days 00:00:00.358660,0.95,0.01,8.0,250,roulette wheel,COMPLETE
2948,2948,38.0,2023-12-07 16:25:31.816367,2023-12-07 16:25:32.401751,0 days 00:00:00.585384,0.95,0.33,6.0,150,weighted choice,COMPLETE
2949,2949,37.6,2023-12-07 16:25:32.402002,2023-12-07 16:25:32.805640,0 days 00:00:00.403638,0.6,0.01,8.0,100,random selection,COMPLETE
2950,2950,38.0,2023-12-07 16:25:32.805902,2023-12-07 16:25:33.411925,0 days 00:00:00.606023,0.6,0.5,8.0,100,roulette wheel,COMPLETE
2951,2951,36.4,2023-12-07 16:25:33.412176,2023-12-07 16:25:33.992103,0 days 00:00:00.579927,0.8,0.5,8.0,150,roulette wheel,COMPLETE
2952,2952,40.4,2023-12-07 16:25:33.992349,2023-12-07 16:25:34.404924,0 days 00:00:00.412575,0.6,0.01,6.0,20,roulette wheel,COMPLETE
2953,2953,37.6,2023-12-07 16:25:34.405174,2023-12-07 16:25:34.887980,0 days 00:00:00.482806,0.95,0.33,6.0,300,random selection,COMPLETE
2954,2954,42.0,2023-12-07 16:25:34.888251,2023-12-07 16:25:35.290183,0 days 00:00:00.401932,0.8,0.0,6.0,50,roulette wheel,COMPLETE
2955,2955,41.2,2023-12-07 16:25:35.290434,2023-12-07 16:25:35.690932,0 days 00:00:00.400498,0.95,0.01,6.0,20,weighted choice,COMPLETE
2956,2956,37.6,2023-12-07 16:25:35.691177,2023-12-07 16:25:36.163653,0 days 00:00:00.472476,0.8,0.1,6.0,150,weighted choice,COMPLETE
2957,2957,38.4,2023-12-07 16:25:36.163925,2023-12-07 16:25:36.763538,0 days 00:00:00.599613,0.8,0.5,8.0,150,roulette wheel,COMPLETE
2958,2958,37.6,2023-12-07 16:25:36.763784,2023-12-07 16:25:37.139019,0 days 00:00:00.375235,0.95,0.1,6.0,150,roulette wheel,COMPLETE
2959,2959,38.8,2023-12-07 16:25:37.139293,2023-12-07 16:25:37.592012,0 days 00:00:00.452719,0.6,0.01,8.0,10,roulette wheel,COMPLETE
2960,2960,37.6,2023-12-07 16:25:37.592260,2023-12-07 16:25:38.107799,0 days 00:00:00.515539,0.8,0.33,8.0,20,roulette wheel,COMPLETE
2961,2961,38.4,2023-12-07 16:25:38.108046,2023-12-07 16:25:38.617731,0 days 00:00:00.509685,0.6,0.33,8.0,300,random selection,COMPLETE
2962,2962,36.8,2023-12-07 16:25:38.617996,2023-12-07 16:25:39.116866,0 days 00:00:00.498870,0.6,0.33,6.0,20,roulette wheel,COMPLETE
2963,2963,37.6,2023-12-07 16:25:39.117109,2023-12-07 16:25:39.703931,0 days 00:00:00.586822,0.95,0.5,6.0,10,roulette wheel,COMPLETE
2964,2964,38.0,2023-12-07 16:25:39.704189,2023-12-07 16:25:40.102827,0 days 00:00:00.398638,0.6,0.1,8.0,150,roulette wheel,COMPLETE
2965,2965,36.4,2023-12-07 16:25:40.103085,2023-12-07 16:25:40.891414,0 days 00:00:00.788329,0.5,0.5,8.0,250,weighted choice,COMPLETE
2966,2966,42.0,2023-12-07 16:25:40.891677,2023-12-07 16:25:41.223809,0 days 00:00:00.332132,0.5,0.0,8.0,200,roulette wheel,COMPLETE
2967,2967,38.4,2023-12-07 16:25:41.224066,2023-12-07 16:25:41.625852,0 days 00:00:00.401786,0.5,0.1,6.0,150,roulette wheel,COMPLETE
2968,2968,37.6,2023-12-07 16:25:41.626117,2023-12-07 16:25:42.231065,0 days 00:00:00.604948,0.6,0.5,8.0,200,random selection,COMPLETE
2969,2969,37.2,2023-12-07 16:25:42.231329,2023-12-07 16:25:42.812015,0 days 00:00:00.580686,0.5,0.33,6.0,50,weighted choice,COMPLETE
2970,2970,38.0,2023-12-07 16:25:42.812300,2023-12-07 16:25:43.351167,0 days 00:00:00.538867,0.8,0.33,6.0,50,weighted choice,COMPLETE
2971,2971,38.0,2023-12-07 16:25:43.351414,2023-12-07 16:25:43.877703,0 days 00:00:00.526289,0.6,0.33,8.0,200,roulette wheel,COMPLETE
2972,2972,37.2,2023-12-07 16:25:43.877962,2023-12-07 16:25:44.205460,0 days 00:00:00.327498,0.5,0.0,8.0,150,random selection,COMPLETE
2973,2973,37.6,2023-12-07 16:25:44.205721,2023-12-07 16:25:44.829324,0 days 00:00:00.623603,0.5,0.5,6.0,20,roulette wheel,COMPLETE
2974,2974,38.8,2023-12-07 16:25:44.829595,2023-12-07 16:25:45.516860,0 days 00:00:00.687265,0.5,0.33,6.0,300,weighted choice,COMPLETE
2975,2975,39.2,2023-12-07 16:25:45.517127,2023-12-07 16:25:45.945884,0 days 00:00:00.428757,0.5,0.01,8.0,200,roulette wheel,COMPLETE
2976,2976,38.4,2023-12-07 16:25:45.946138,2023-12-07 16:25:46.689360,0 days 00:00:00.743222,0.95,0.5,8.0,250,weighted choice,COMPLETE
2977,2977,37.6,2023-12-07 16:25:46.689607,2023-12-07 16:25:47.230428,0 days 00:00:00.540821,0.5,0.33,8.0,10,roulette wheel,COMPLETE
2978,2978,39.6,2023-12-07 16:25:47.230670,2023-12-07 16:25:47.645053,0 days 00:00:00.414383,0.5,0.01,6.0,300,roulette wheel,COMPLETE
2979,2979,38.0,2023-12-07 16:25:47.645307,2023-12-07 16:25:48.000249,0 days 00:00:00.354942,0.95,0.01,8.0,250,random selection,COMPLETE
2980,2980,40.8,2023-12-07 16:25:48.000503,2023-12-07 16:25:48.238702,0 days 00:00:00.238199,0.8,0.0,6.0,200,roulette wheel,COMPLETE
