,number,value,datetime_start,datetime_complete,duration,params_C,params_M,params_N,params_P,params_S,state
1504,1504,38.0,2023-12-06 17:02:33.482670,2023-12-06 17:02:34.199233,0 days 00:00:00.716563,0.5,0.5,1.0,150,weighted choice,COMPLETE
1505,1505,40.8,2023-12-06 17:02:34.199465,2023-12-06 17:02:34.725653,0 days 00:00:00.526188,0.6,0.01,4.0,200,weighted choice,COMPLETE
1506,1506,37.6,2023-12-06 17:02:34.725876,2023-12-06 17:02:35.114868,0 days 00:00:00.388992,0.5,0.1,4.0,150,roulette wheel,COMPLETE
1507,1507,37.2,2023-12-06 17:02:35.115101,2023-12-06 17:02:35.426006,0 days 00:00:00.310905,0.95,0.01,4.0,200,random selection,COMPLETE
1508,1508,37.6,2023-12-06 17:02:35.426230,2023-12-06 17:03:32.369219,0 days 00:00:56.942989,0.95,0.33,0.0,200,roulette wheel,COMPLETE
1509,1509,37.6,2023-12-06 17:03:32.369443,2023-12-06 17:04:17.737331,0 days 00:00:45.367888,0.95,0.1,0.0,200,roulette wheel,COMPLETE
1510,1510,36.8,2023-12-06 17:04:17.737549,2023-12-06 17:05:07.605164,0 days 00:00:49.867615,0.6,0.33,0.0,200,random selection,COMPLETE
1511,1511,36.8,2023-12-06 17:05:07.605396,2023-12-06 17:05:07.839830,0 days 00:00:00.234434,0.6,0.0,1.0,150,random selection,COMPLETE
1512,1512,38.4,2023-12-06 17:05:07.840045,2023-12-06 17:05:08.395959,0 days 00:00:00.555914,0.8,0.5,2.0,150,roulette wheel,COMPLETE
1513,1513,37.2,2023-12-06 17:05:08.396165,2023-12-06 17:06:34.048321,0 days 00:01:25.652156,0.5,0.0,0.0,200,random selection,COMPLETE
1514,1514,42.4,2023-12-06 17:06:34.048534,2023-12-06 17:06:34.365932,0 days 00:00:00.317398,0.8,0.0,1.0,150,weighted choice,COMPLETE
1515,1515,36.4,2023-12-06 17:06:34.366144,2023-12-06 17:06:34.603674,0 days 00:00:00.237530,0.6,0.0,1.0,150,random selection,COMPLETE
1516,1516,37.6,2023-12-06 17:06:34.603872,2023-12-06 17:06:35.227239,0 days 00:00:00.623367,0.5,0.33,1.0,150,weighted choice,COMPLETE
1517,1517,36.8,2023-12-06 17:06:35.227449,2023-12-06 17:06:35.733478,0 days 00:00:00.506029,0.5,0.33,2.0,200,random selection,COMPLETE
1518,1518,36.8,2023-12-06 17:06:35.733677,2023-12-06 17:07:42.086507,0 days 00:01:06.352830,0.0,0.5,,200,roulette wheel,COMPLETE
1519,1519,37.2,2023-12-06 17:07:42.086701,2023-12-06 17:07:42.823873,0 days 00:00:00.737172,0.5,0.5,1.0,200,weighted choice,COMPLETE
1520,1520,44.8,2023-12-06 17:07:42.824078,2023-12-06 17:07:43.240390,0 days 00:00:00.416312,0.6,0.0,4.0,150,weighted choice,COMPLETE
1521,1521,39.6,2023-12-06 17:07:43.240605,2023-12-06 17:07:43.759411,0 days 00:00:00.518806,0.6,0.01,4.0,200,weighted choice,COMPLETE
1522,1522,38.0,2023-12-06 17:07:43.759616,2023-12-06 17:08:23.846431,0 days 00:00:40.086815,0.0,0.1,,150,weighted choice,COMPLETE
1523,1523,37.2,2023-12-06 17:08:23.846645,2023-12-06 17:08:24.326754,0 days 00:00:00.480109,0.8,0.33,4.0,200,random selection,COMPLETE
1524,1524,38.4,2023-12-06 17:08:24.326954,2023-12-06 17:09:23.364802,0 days 00:00:59.037848,0.6,0.5,0.0,200,random selection,COMPLETE
1525,1525,37.2,2023-12-06 17:09:23.365021,2023-12-06 17:09:52.182764,0 days 00:00:28.817743,0.0,0.1,,150,random selection,COMPLETE
1526,1526,38.4,2023-12-06 17:09:52.182980,2023-12-06 17:09:52.766596,0 days 00:00:00.583616,0.6,0.5,2.0,150,random selection,COMPLETE
1527,1527,40.8,2023-12-06 17:09:52.766809,2023-12-06 17:09:52.953063,0 days 00:00:00.186254,0.95,0.0,2.0,200,roulette wheel,COMPLETE
1528,1528,37.2,2023-12-06 17:09:52.953261,2023-12-06 17:09:53.439282,0 days 00:00:00.486021,0.6,0.33,2.0,150,random selection,COMPLETE
1529,1529,40.4,2023-12-06 17:09:53.439499,2023-12-06 17:09:53.838814,0 days 00:00:00.399315,0.5,0.01,2.0,150,roulette wheel,COMPLETE
1530,1530,37.2,2023-12-06 17:09:53.839010,2023-12-06 17:10:37.290871,0 days 00:00:43.451861,0.95,0.1,0.0,200,roulette wheel,COMPLETE
1531,1531,36.8,2023-12-06 17:10:37.291756,2023-12-06 17:10:37.649613,0 days 00:00:00.357857,0.95,0.1,2.0,200,random selection,COMPLETE
1532,1532,36.8,2023-12-06 17:10:37.650092,2023-12-06 17:10:38.246784,0 days 00:00:00.596692,0.6,0.5,1.0,150,random selection,COMPLETE
1533,1533,43.2,2023-12-06 17:10:38.246989,2023-12-06 17:10:38.441467,0 days 00:00:00.194478,0.8,0.0,1.0,150,roulette wheel,COMPLETE
1534,1534,38.0,2023-12-06 17:10:38.441683,2023-12-06 17:12:00.521453,0 days 00:01:22.079770,0.5,0.5,0.0,200,weighted choice,COMPLETE
1535,1535,38.0,2023-12-06 17:12:00.522217,2023-12-06 17:12:34.757874,0 days 00:00:34.235657,0.8,0.01,0.0,200,roulette wheel,COMPLETE
1536,1536,36.8,2023-12-06 17:12:34.758181,2023-12-06 17:12:35.399717,0 days 00:00:00.641536,0.6,0.5,2.0,200,roulette wheel,COMPLETE
1537,1537,38.4,2023-12-06 17:12:35.399945,2023-12-06 17:12:35.814534,0 days 00:00:00.414589,0.6,0.1,1.0,150,roulette wheel,COMPLETE
1538,1538,38.0,2023-12-06 17:12:35.814741,2023-12-06 17:12:36.324123,0 days 00:00:00.509382,0.8,0.33,2.0,200,roulette wheel,COMPLETE
1539,1539,38.0,2023-12-06 17:12:36.324343,2023-12-06 17:13:12.545702,0 days 00:00:36.221359,0.6,0.1,0.0,150,roulette wheel,COMPLETE
1540,1540,37.6,2023-12-06 17:13:12.546544,2023-12-06 17:13:13.189244,0 days 00:00:00.642700,0.5,0.33,1.0,200,weighted choice,COMPLETE
1541,1541,37.6,2023-12-06 17:13:13.189454,2023-12-06 17:13:13.808545,0 days 00:00:00.619091,0.5,0.5,1.0,150,roulette wheel,COMPLETE
1542,1542,37.6,2023-12-06 17:13:13.808755,2023-12-06 17:13:14.326919,0 days 00:00:00.518164,0.6,0.33,4.0,150,roulette wheel,COMPLETE
1543,1543,38.0,2023-12-06 17:13:14.327122,2023-12-06 17:13:14.899460,0 days 00:00:00.572338,0.95,0.5,1.0,150,roulette wheel,COMPLETE
1544,1544,44.4,2023-12-06 17:13:14.899701,2023-12-06 17:13:15.445244,0 days 00:00:00.545543,0.5,0.0,1.0,200,weighted choice,COMPLETE
1545,1545,37.2,2023-12-06 17:13:15.445500,2023-12-06 17:13:56.831619,0 days 00:00:41.386119,0.8,0.1,0.0,200,roulette wheel,COMPLETE
1546,1546,38.4,2023-12-06 17:13:56.831897,2023-12-06 17:16:00.788281,0 days 00:02:03.956384,0.5,0.0,0.0,150,weighted choice,COMPLETE
1547,1547,37.6,2023-12-06 17:16:00.788505,2023-12-06 17:16:01.393367,0 days 00:00:00.604862,0.5,0.33,2.0,150,weighted choice,COMPLETE
1548,1548,37.2,2023-12-06 17:16:01.393593,2023-12-06 17:16:01.984210,0 days 00:00:00.590617,0.6,0.5,4.0,150,roulette wheel,COMPLETE
1549,1549,38.8,2023-12-06 17:16:01.984437,2023-12-06 17:16:02.710801,0 days 00:00:00.726364,0.5,0.5,4.0,150,weighted choice,COMPLETE
1550,1550,37.2,2023-12-06 17:16:02.711049,2023-12-06 17:16:03.268506,0 days 00:00:00.557457,0.8,0.5,2.0,150,roulette wheel,COMPLETE
1551,1551,38.0,2023-12-06 17:16:03.268738,2023-12-06 17:16:51.474577,0 days 00:00:48.205839,0.0,0.5,,150,random selection,COMPLETE
1552,1552,38.0,2023-12-06 17:16:51.475015,2023-12-06 17:16:52.039971,0 days 00:00:00.564956,0.95,0.5,4.0,200,roulette wheel,COMPLETE
1553,1553,37.2,2023-12-06 17:16:52.040198,2023-12-06 17:17:37.291345,0 days 00:00:45.251147,0.95,0.1,0.0,150,weighted choice,COMPLETE
1554,1554,38.4,2023-12-06 17:17:37.291814,2023-12-06 17:18:03.785927,0 days 00:00:26.494113,0.0,0.01,,150,roulette wheel,COMPLETE
1555,1555,38.0,2023-12-06 17:18:03.786145,2023-12-06 17:18:47.723096,0 days 00:00:43.936951,0.8,0.33,0.0,150,random selection,COMPLETE
1556,1556,36.8,2023-12-06 17:18:47.723611,2023-12-06 17:19:14.546564,0 days 00:00:26.822953,0.0,0.01,,150,roulette wheel,COMPLETE
1557,1557,37.6,2023-12-06 17:19:14.546781,2023-12-06 17:19:48.068050,0 days 00:00:33.521269,0.6,0.1,0.0,200,random selection,COMPLETE
1558,1558,38.4,2023-12-06 17:19:48.068577,2023-12-06 17:20:16.750130,0 days 00:00:28.681553,0.5,0.01,0.0,150,roulette wheel,COMPLETE
1559,1559,38.0,2023-12-06 17:20:16.750623,2023-12-06 17:20:17.126558,0 days 00:00:00.375935,0.95,0.1,2.0,150,roulette wheel,COMPLETE
1560,1560,38.0,2023-12-06 17:20:17.126836,2023-12-06 17:20:17.519172,0 days 00:00:00.392336,0.5,0.1,1.0,150,roulette wheel,COMPLETE
1561,1561,39.2,2023-12-06 17:20:17.519380,2023-12-06 17:20:18.093271,0 days 00:00:00.573891,0.6,0.5,1.0,200,roulette wheel,COMPLETE
1562,1562,37.6,2023-12-06 17:20:18.093487,2023-12-06 17:22:45.541330,0 days 00:02:27.447843,0.95,0.0,0.0,200,weighted choice,COMPLETE
1563,1563,36.8,2023-12-06 17:22:45.541743,2023-12-06 17:22:45.994315,0 days 00:00:00.452572,0.8,0.33,1.0,200,roulette wheel,COMPLETE
1564,1564,37.6,2023-12-06 17:22:45.994552,2023-12-06 17:22:46.466370,0 days 00:00:00.471818,0.8,0.33,4.0,200,roulette wheel,COMPLETE
1565,1565,38.4,2023-12-06 17:22:46.466583,2023-12-06 17:23:30.873668,0 days 00:00:44.407085,0.5,0.33,0.0,150,roulette wheel,COMPLETE
1566,1566,37.2,2023-12-06 17:23:30.873878,2023-12-06 17:24:23.307524,0 days 00:00:52.433646,0.0,0.33,,200,roulette wheel,COMPLETE
1567,1567,38.0,2023-12-06 17:24:23.307774,2023-12-06 17:24:56.805964,0 days 00:00:33.498190,0.0,0.1,,200,roulette wheel,COMPLETE
1568,1568,36.4,2023-12-06 17:24:56.806177,2023-12-06 17:25:52.911253,0 days 00:00:56.105076,0.95,0.33,0.0,200,roulette wheel,COMPLETE
1569,1569,37.6,2023-12-06 17:25:52.911540,2023-12-06 17:26:40.167289,0 days 00:00:47.255749,0.6,0.33,0.0,150,roulette wheel,COMPLETE
1570,1570,40.4,2023-12-06 17:26:40.167494,2023-12-06 17:26:40.475170,0 days 00:00:00.307676,0.8,0.01,1.0,200,roulette wheel,COMPLETE
1571,1571,37.6,2023-12-06 17:26:40.475385,2023-12-06 17:27:10.200768,0 days 00:00:29.725383,0.6,0.01,0.0,150,roulette wheel,COMPLETE
1572,1572,37.6,2023-12-06 17:27:10.200994,2023-12-06 17:27:10.740249,0 days 00:00:00.539255,0.8,0.5,2.0,150,random selection,COMPLETE
1573,1573,40.8,2023-12-06 17:27:10.740464,2023-12-06 17:27:10.957190,0 days 00:00:00.216726,0.8,0.0,4.0,200,roulette wheel,COMPLETE
1574,1574,37.2,2023-12-06 17:27:10.957425,2023-12-06 17:27:11.410356,0 days 00:00:00.452931,0.95,0.33,1.0,200,roulette wheel,COMPLETE
1575,1575,39.2,2023-12-06 17:27:11.410588,2023-12-06 17:27:11.739694,0 days 00:00:00.329106,0.8,0.01,4.0,200,roulette wheel,COMPLETE
1576,1576,38.0,2023-12-06 17:27:11.739919,2023-12-06 17:27:12.274704,0 days 00:00:00.534785,0.8,0.5,2.0,200,roulette wheel,COMPLETE
1577,1577,41.6,2023-12-06 17:27:12.274920,2023-12-06 17:27:12.767312,0 days 00:00:00.492392,0.6,0.01,1.0,200,weighted choice,COMPLETE
1578,1578,36.4,2023-12-06 17:27:12.767546,2023-12-06 17:27:52.828483,0 days 00:00:40.060937,0.6,0.01,0.0,150,weighted choice,COMPLETE
1579,1579,37.2,2023-12-06 17:27:52.828711,2023-12-06 17:28:58.016453,0 days 00:01:05.187742,0.0,0.33,,200,weighted choice,COMPLETE
1580,1580,44.0,2023-12-06 17:28:58.016867,2023-12-06 17:28:58.735746,0 days 00:00:00.718879,0.5,0.0,1.0,150,weighted choice,COMPLETE
1581,1581,42.4,2023-12-06 17:28:58.735973,2023-12-06 17:28:59.018347,0 days 00:00:00.282374,0.5,0.0,4.0,200,roulette wheel,COMPLETE
1582,1582,39.2,2023-12-06 17:28:59.018568,2023-12-06 17:29:41.465604,0 days 00:00:42.447036,0.8,0.1,0.0,200,roulette wheel,COMPLETE
1583,1583,38.4,2023-12-06 17:29:41.465847,2023-12-06 17:30:38.073105,0 days 00:00:56.607258,0.8,0.5,0.0,150,roulette wheel,COMPLETE
1584,1584,37.2,2023-12-06 17:30:38.073328,2023-12-06 17:31:21.663638,0 days 00:00:43.590310,0.0,0.33,,150,roulette wheel,COMPLETE
1585,1585,39.6,2023-12-06 17:31:21.663846,2023-12-06 17:31:22.023964,0 days 00:00:00.360118,0.6,0.01,2.0,200,roulette wheel,COMPLETE
1586,1586,38.0,2023-12-06 17:31:22.024172,2023-12-06 17:32:06.996993,0 days 00:00:44.972821,0.6,0.1,0.0,150,weighted choice,COMPLETE
1587,1587,36.4,2023-12-06 17:32:06.997225,2023-12-06 17:32:07.229629,0 days 00:00:00.232404,0.6,0.0,2.0,150,random selection,COMPLETE
1588,1588,38.0,2023-12-06 17:32:07.229850,2023-12-06 17:32:07.590658,0 days 00:00:00.360808,0.6,0.1,2.0,150,roulette wheel,COMPLETE
1589,1589,37.2,2023-12-06 17:32:07.590885,2023-12-06 17:33:02.810435,0 days 00:00:55.219550,0.8,0.5,0.0,200,random selection,COMPLETE
1590,1590,37.2,2023-12-06 17:33:02.810674,2023-12-06 17:33:03.165869,0 days 00:00:00.355195,0.95,0.1,2.0,200,roulette wheel,COMPLETE
1591,1591,37.6,2023-12-06 17:33:03.166079,2023-12-06 17:35:15.647404,0 days 00:02:12.481325,0.6,0.0,0.0,200,weighted choice,COMPLETE
1592,1592,39.2,2023-12-06 17:35:15.648228,2023-12-06 17:36:32.445276,0 days 00:01:16.797048,0.0,0.5,,200,weighted choice,COMPLETE
1593,1593,37.2,2023-12-06 17:36:32.445503,2023-12-06 17:37:05.362200,0 days 00:00:32.916697,0.5,0.1,0.0,150,roulette wheel,COMPLETE
1594,1594,38.0,2023-12-06 17:37:05.362417,2023-12-06 17:37:05.743343,0 days 00:00:00.380926,0.5,0.1,1.0,150,roulette wheel,COMPLETE
1595,1595,37.6,2023-12-06 17:37:05.743567,2023-12-06 17:37:49.862857,0 days 00:00:44.119290,0.5,0.33,0.0,150,random selection,COMPLETE
1596,1596,38.4,2023-12-06 17:37:49.863306,2023-12-06 17:37:50.555683,0 days 00:00:00.692377,0.6,0.5,1.0,200,weighted choice,COMPLETE
1597,1597,38.8,2023-12-06 17:37:50.555931,2023-12-06 17:37:51.021880,0 days 00:00:00.465949,0.6,0.1,4.0,150,weighted choice,COMPLETE
1598,1598,38.0,2023-12-06 17:37:51.022107,2023-12-06 17:37:51.580637,0 days 00:00:00.558530,0.8,0.33,1.0,200,weighted choice,COMPLETE
1599,1599,38.0,2023-12-06 17:37:51.580890,2023-12-06 17:37:52.034545,0 days 00:00:00.453655,0.95,0.1,2.0,200,weighted choice,COMPLETE
1600,1600,38.8,2023-12-06 17:37:52.034774,2023-12-06 17:38:53.125751,0 days 00:01:01.090977,0.6,0.5,0.0,200,random selection,COMPLETE
1601,1601,37.2,2023-12-06 17:38:53.126127,2023-12-06 17:39:22.863337,0 days 00:00:29.737210,0.0,0.1,,150,roulette wheel,COMPLETE
1602,1602,38.0,2023-12-06 17:39:22.863560,2023-12-06 17:40:06.200143,0 days 00:00:43.336583,0.5,0.1,0.0,150,weighted choice,COMPLETE
1603,1603,42.8,2023-12-06 17:40:06.200379,2023-12-06 17:40:06.386917,0 days 00:00:00.186538,0.8,0.0,1.0,200,roulette wheel,COMPLETE
1604,1604,37.6,2023-12-06 17:40:06.387141,2023-12-06 17:41:14.351827,0 days 00:01:07.964686,0.6,0.33,0.0,200,weighted choice,COMPLETE
1605,1605,38.0,2023-12-06 17:41:14.352068,2023-12-06 17:41:14.690256,0 days 00:00:00.338188,0.8,0.01,4.0,200,random selection,COMPLETE
1606,1606,37.2,2023-12-06 17:41:14.690476,2023-12-06 17:41:15.291045,0 days 00:00:00.600569,0.5,0.5,1.0,200,random selection,COMPLETE
1607,1607,40.0,2023-12-06 17:41:15.291274,2023-12-06 17:41:15.813028,0 days 00:00:00.521754,0.6,0.01,4.0,200,weighted choice,COMPLETE
1608,1608,36.8,2023-12-06 17:41:15.813248,2023-12-06 17:41:43.068796,0 days 00:00:27.255548,0.0,0.01,,150,roulette wheel,COMPLETE
1609,1609,38.0,2023-12-06 17:41:43.069019,2023-12-06 17:41:43.614306,0 days 00:00:00.545287,0.95,0.5,2.0,150,roulette wheel,COMPLETE
1610,1610,38.0,2023-12-06 17:41:43.614525,2023-12-06 17:41:44.112275,0 days 00:00:00.497750,0.6,0.33,2.0,200,roulette wheel,COMPLETE
1611,1611,36.8,2023-12-06 17:41:44.112482,2023-12-06 17:41:44.354478,0 days 00:00:00.241996,0.6,0.0,2.0,150,random selection,COMPLETE
1612,1612,38.0,2023-12-06 17:41:44.354689,2023-12-06 17:43:01.000634,0 days 00:01:16.645945,0.0,0.0,,150,random selection,COMPLETE
1613,1613,38.0,2023-12-06 17:43:01.001458,2023-12-06 17:43:57.579823,0 days 00:00:56.578365,0.6,0.5,0.0,200,random selection,COMPLETE
1614,1614,40.8,2023-12-06 17:43:57.580082,2023-12-06 17:43:57.895303,0 days 00:00:00.315221,0.95,0.01,4.0,200,roulette wheel,COMPLETE
1615,1615,43.2,2023-12-06 17:43:57.895522,2023-12-06 17:43:58.324302,0 days 00:00:00.428780,0.6,0.0,1.0,200,weighted choice,COMPLETE
1616,1616,38.0,2023-12-06 17:43:58.324514,2023-12-06 17:44:51.713777,0 days 00:00:53.389263,0.0,0.5,,150,roulette wheel,COMPLETE
1617,1617,37.6,2023-12-06 17:44:51.713997,2023-12-06 17:47:00.878370,0 days 00:02:09.164373,0.0,0.0,,150,weighted choice,COMPLETE
1618,1618,37.2,2023-12-06 17:47:00.878587,2023-12-06 17:47:59.283730,0 days 00:00:58.405143,0.95,0.33,0.0,150,weighted choice,COMPLETE
1619,1619,38.4,2023-12-06 17:47:59.283939,2023-12-06 17:47:59.826700,0 days 00:00:00.542761,0.8,0.5,1.0,150,roulette wheel,COMPLETE
1620,1620,42.8,2023-12-06 17:47:59.826920,2023-12-06 17:47:59.996105,0 days 00:00:00.169185,0.95,0.0,1.0,150,roulette wheel,COMPLETE
1621,1621,37.2,2023-12-06 17:47:59.996319,2023-12-06 17:48:00.573007,0 days 00:00:00.576688,0.6,0.5,1.0,200,roulette wheel,COMPLETE
1622,1622,36.8,2023-12-06 17:48:00.573245,2023-12-06 17:48:01.263142,0 days 00:00:00.689897,0.6,0.5,4.0,200,weighted choice,COMPLETE
1623,1623,38.0,2023-12-06 17:48:01.263368,2023-12-06 17:49:12.438118,0 days 00:01:11.174750,0.5,0.33,0.0,200,weighted choice,COMPLETE
1624,1624,37.2,2023-12-06 17:49:12.438348,2023-12-06 17:50:06.635415,0 days 00:00:54.197067,0.6,0.33,0.0,200,roulette wheel,COMPLETE
1625,1625,41.2,2023-12-06 17:50:06.635639,2023-12-06 17:50:06.831503,0 days 00:00:00.195864,0.95,0.0,4.0,150,roulette wheel,COMPLETE
1626,1626,36.8,2023-12-06 17:50:06.831718,2023-12-06 17:50:40.444685,0 days 00:00:33.612967,0.95,0.1,0.0,150,random selection,COMPLETE
1627,1627,37.6,2023-12-06 17:50:40.444914,2023-12-06 17:52:15.864040,0 days 00:01:35.419126,0.6,0.0,0.0,200,roulette wheel,COMPLETE
1628,1628,37.6,2023-12-06 17:52:15.864275,2023-12-06 17:52:16.233901,0 days 00:00:00.369626,0.5,0.1,2.0,200,random selection,COMPLETE
1629,1629,37.6,2023-12-06 17:52:16.234115,2023-12-06 17:52:16.598031,0 days 00:00:00.363916,0.6,0.01,4.0,200,random selection,COMPLETE
1630,1630,38.4,2023-12-06 17:52:16.598251,2023-12-06 17:52:57.964128,0 days 00:00:41.365877,0.0,0.33,,150,random selection,COMPLETE
1631,1631,37.2,2023-12-06 17:52:57.964432,2023-12-06 17:54:01.022428,0 days 00:01:03.057996,0.0,0.5,,200,roulette wheel,COMPLETE
1632,1632,38.8,2023-12-06 17:54:01.022646,2023-12-06 17:54:01.439686,0 days 00:00:00.417040,0.95,0.01,4.0,200,weighted choice,COMPLETE
1633,1633,42.4,2023-12-06 17:54:01.439902,2023-12-06 17:54:01.604341,0 days 00:00:00.164439,0.95,0.0,1.0,200,roulette wheel,COMPLETE
1634,1634,37.6,2023-12-06 17:54:01.604552,2023-12-06 17:54:02.260031,0 days 00:00:00.655479,0.95,0.5,2.0,200,weighted choice,COMPLETE
1635,1635,37.2,2023-12-06 17:54:02.260313,2023-12-06 17:55:39.939870,0 days 00:01:37.679557,0.8,0.0,0.0,200,roulette wheel,COMPLETE
1636,1636,38.8,2023-12-06 17:55:39.940109,2023-12-06 17:55:40.498360,0 days 00:00:00.558251,0.8,0.5,4.0,150,roulette wheel,COMPLETE
1637,1637,37.6,2023-12-06 17:55:40.498577,2023-12-06 17:56:38.662031,0 days 00:00:58.163454,0.95,0.1,0.0,200,weighted choice,COMPLETE
1638,1638,37.6,2023-12-06 17:56:38.662264,2023-12-06 17:56:39.299427,0 days 00:00:00.637163,0.95,0.5,2.0,150,random selection,COMPLETE
1639,1639,41.6,2023-12-06 17:56:39.299653,2023-12-06 17:56:39.572918,0 days 00:00:00.273265,0.95,0.0,1.0,150,weighted choice,COMPLETE
1640,1640,37.6,2023-12-06 17:56:39.573154,2023-12-06 17:56:39.775455,0 days 00:00:00.202301,0.8,0.0,2.0,200,random selection,COMPLETE
1641,1641,38.0,2023-12-06 17:56:39.775702,2023-12-06 17:59:14.064187,0 days 00:02:34.288485,0.5,0.0,0.0,200,weighted choice,COMPLETE
1642,1642,37.6,2023-12-06 17:59:14.064659,2023-12-06 17:59:14.527881,0 days 00:00:00.463222,0.8,0.33,2.0,200,random selection,COMPLETE
1643,1643,37.2,2023-12-06 17:59:14.528122,2023-12-06 17:59:15.149644,0 days 00:00:00.621522,0.5,0.33,4.0,150,weighted choice,COMPLETE
1644,1644,37.6,2023-12-06 17:59:15.149864,2023-12-06 18:00:06.340219,0 days 00:00:51.190355,0.6,0.01,0.0,200,weighted choice,COMPLETE
1645,1645,37.6,2023-12-06 18:00:06.340535,2023-12-06 18:00:06.809795,0 days 00:00:00.469260,0.8,0.33,1.0,150,roulette wheel,COMPLETE
1646,1646,38.4,2023-12-06 18:00:06.810020,2023-12-06 18:01:14.363678,0 days 00:01:07.553658,0.0,0.33,,200,weighted choice,COMPLETE
1647,1647,36.8,2023-12-06 18:01:14.363923,2023-12-06 18:02:48.293933,0 days 00:01:33.930010,0.8,0.0,0.0,200,roulette wheel,COMPLETE
1648,1648,36.8,2023-12-06 18:02:48.294240,2023-12-06 18:04:00.768212,0 days 00:01:12.473972,0.95,0.33,0.0,200,weighted choice,COMPLETE
1649,1649,36.8,2023-12-06 18:04:00.768444,2023-12-06 18:05:19.470792,0 days 00:01:18.702348,0.5,0.0,0.0,150,roulette wheel,COMPLETE
1650,1650,38.4,2023-12-06 18:05:19.471026,2023-12-06 18:05:19.848043,0 days 00:00:00.377017,0.6,0.1,4.0,200,roulette wheel,COMPLETE
1651,1651,36.8,2023-12-06 18:05:19.848262,2023-12-06 18:06:10.022259,0 days 00:00:50.173997,0.6,0.01,0.0,200,weighted choice,COMPLETE
1652,1652,37.6,2023-12-06 18:06:10.022602,2023-12-06 18:07:00.434141,0 days 00:00:50.411539,0.0,0.33,,200,roulette wheel,COMPLETE
1653,1653,40.0,2023-12-06 18:07:00.434355,2023-12-06 18:07:00.745395,0 days 00:00:00.311040,0.95,0.01,4.0,200,roulette wheel,COMPLETE
1654,1654,37.2,2023-12-06 18:07:00.745632,2023-12-06 18:08:40.566071,0 days 00:01:39.820439,0.6,0.5,0.0,200,roulette wheel,COMPLETE
1655,1655,37.2,2023-12-06 18:08:40.566302,2023-12-06 18:08:41.170739,0 days 00:00:00.604437,0.5,0.5,4.0,200,roulette wheel,COMPLETE
1656,1656,38.0,2023-12-06 18:08:41.170960,2023-12-06 18:08:41.718647,0 days 00:00:00.547687,0.95,0.5,4.0,150,roulette wheel,COMPLETE
1657,1657,36.8,2023-12-06 18:08:41.718876,2023-12-06 18:08:42.054133,0 days 00:00:00.335257,0.8,0.1,1.0,150,roulette wheel,COMPLETE
1658,1658,37.2,2023-12-06 18:08:42.054366,2023-12-06 18:20:08.303684,0 days 00:11:26.249318,0.95,0.5,0.0,200,roulette wheel,COMPLETE
1659,1659,38.8,2023-12-06 18:20:08.303968,2023-12-06 18:30:13.767770,0 days 00:10:05.463802,0.8,0.1,1.0,200,roulette wheel,COMPLETE
1660,1660,42.0,2023-12-06 18:30:13.767990,2023-12-06 18:30:14.267343,0 days 00:00:00.499353,0.5,0.0,4.0,200,weighted choice,COMPLETE
1661,1661,37.2,2023-12-06 18:30:14.267572,2023-12-06 18:30:14.748133,0 days 00:00:00.480561,0.8,0.33,1.0,150,roulette wheel,COMPLETE
1662,1662,38.0,2023-12-06 18:30:14.748360,2023-12-06 18:31:23.611219,0 days 00:01:08.862859,0.6,0.33,0.0,200,weighted choice,COMPLETE
1663,1663,37.2,2023-12-06 18:31:23.611549,2023-12-06 18:31:23.969450,0 days 00:00:00.357901,0.8,0.1,4.0,150,random selection,COMPLETE
1664,1664,37.2,2023-12-06 18:31:23.969675,2023-12-06 19:06:31.068887,0 days 00:35:07.099212,0.0,0.0,,200,roulette wheel,COMPLETE
1665,1665,36.4,2023-12-06 19:06:31.069098,2023-12-06 19:06:31.394263,0 days 00:00:00.325165,0.8,0.01,4.0,200,random selection,COMPLETE
1666,1666,42.4,2023-12-06 19:06:31.394487,2023-12-06 19:06:31.890660,0 days 00:00:00.496173,0.5,0.0,4.0,200,weighted choice,COMPLETE
1667,1667,37.2,2023-12-06 19:06:31.890881,2023-12-06 19:12:12.574013,0 days 00:05:40.683132,0.6,0.01,0.0,200,roulette wheel,COMPLETE
