,number,value,datetime_start,datetime_complete,duration,params_C,params_M,params_N,params_P,params_S,state
3309,3309,37.6,2023-12-07 16:28:22.700304,2023-12-07 16:28:23.385466,0 days 00:00:00.685162,0.6,0.5,8.0,100,weighted choice,COMPLETE
3310,3310,37.2,2023-12-07 16:28:23.385801,2023-12-07 16:28:23.966003,0 days 00:00:00.580202,0.6,0.5,6.0,300,random selection,COMPLETE
3311,3311,39.2,2023-12-07 16:28:23.966294,2023-12-07 16:28:24.491586,0 days 00:00:00.525292,0.5,0.33,6.0,20,roulette wheel,COMPLETE
3312,3312,36.8,2023-12-07 16:28:24.491881,2023-12-07 16:28:24.990553,0 days 00:00:00.498672,0.6,0.33,6.0,20,random selection,COMPLETE
3313,3313,36.8,2023-12-07 16:28:24.990862,2023-12-07 16:28:25.778683,0 days 00:00:00.787821,0.5,0.5,6.0,300,weighted choice,COMPLETE
3314,3314,38.0,2023-12-07 16:28:25.778993,2023-12-07 16:28:26.127394,0 days 00:00:00.348401,0.95,0.01,6.0,20,random selection,COMPLETE
3315,3315,36.8,2023-12-07 16:28:26.127697,2023-12-07 16:28:26.345737,0 days 00:00:00.218040,0.95,0.0,6.0,100,random selection,COMPLETE
3316,3316,36.8,2023-12-07 16:28:26.346041,2023-12-07 16:28:26.874967,0 days 00:00:00.528926,0.5,0.33,8.0,100,roulette wheel,COMPLETE
3317,3317,37.6,2023-12-07 16:28:26.875276,2023-12-07 16:28:27.659718,0 days 00:00:00.784442,0.5,0.5,6.0,300,weighted choice,COMPLETE
3318,3318,43.6,2023-12-07 16:28:27.660018,2023-12-07 16:28:28.257250,0 days 00:00:00.597232,0.5,0.0,8.0,100,weighted choice,COMPLETE
3319,3319,38.0,2023-12-07 16:28:28.257549,2023-12-07 16:28:28.843752,0 days 00:00:00.586203,0.8,0.5,8.0,10,roulette wheel,COMPLETE
3320,3320,38.8,2023-12-07 16:28:28.844050,2023-12-07 16:28:29.210402,0 days 00:00:00.366352,0.8,0.01,8.0,300,roulette wheel,COMPLETE
3321,3321,40.0,2023-12-07 16:28:29.210702,2023-12-07 16:28:29.713426,0 days 00:00:00.502724,0.6,0.01,6.0,150,weighted choice,COMPLETE
3322,3322,37.2,2023-12-07 16:28:29.713741,2023-12-07 16:28:29.988296,0 days 00:00:00.274555,0.6,0.0,6.0,200,random selection,COMPLETE
3323,3323,37.6,2023-12-07 16:28:29.988593,2023-12-07 16:28:30.578317,0 days 00:00:00.589724,0.8,0.5,8.0,20,roulette wheel,COMPLETE
3324,3324,38.0,2023-12-07 16:28:30.578616,2023-12-07 16:28:31.064320,0 days 00:00:00.485704,0.95,0.33,6.0,100,roulette wheel,COMPLETE
3325,3325,40.4,2023-12-07 16:28:31.064617,2023-12-07 16:28:31.565395,0 days 00:00:00.500778,0.5,0.01,8.0,20,weighted choice,COMPLETE
3326,3326,41.6,2023-12-07 16:28:31.565693,2023-12-07 16:28:32.098601,0 days 00:00:00.532908,0.95,0.0,8.0,20,weighted choice,COMPLETE
3327,3327,40.0,2023-12-07 16:28:32.098917,2023-12-07 16:28:32.401474,0 days 00:00:00.302557,0.6,0.0,8.0,300,roulette wheel,COMPLETE
3328,3328,37.6,2023-12-07 16:28:32.401778,2023-12-07 16:28:32.908667,0 days 00:00:00.506889,0.95,0.33,8.0,10,roulette wheel,COMPLETE
3329,3329,37.2,2023-12-07 16:28:32.908961,2023-12-07 16:28:33.460180,0 days 00:00:00.551219,0.95,0.5,6.0,300,random selection,COMPLETE
3330,3330,36.8,2023-12-07 16:28:33.460485,2023-12-07 16:28:33.803308,0 days 00:00:00.342823,0.95,0.0,8.0,50,random selection,COMPLETE
3331,3331,40.8,2023-12-07 16:28:33.803632,2023-12-07 16:28:34.236839,0 days 00:00:00.433207,0.5,0.01,8.0,100,roulette wheel,COMPLETE
3332,3332,37.6,2023-12-07 16:28:34.237146,2023-12-07 16:28:34.632348,0 days 00:00:00.395202,0.5,0.1,8.0,100,roulette wheel,COMPLETE
3333,3333,38.0,2023-12-07 16:28:34.632643,2023-12-07 16:28:35.031110,0 days 00:00:00.398467,0.5,0.1,6.0,200,roulette wheel,COMPLETE
3334,3334,38.0,2023-12-07 16:28:35.031419,2023-12-07 16:28:35.517412,0 days 00:00:00.485993,0.8,0.33,6.0,150,random selection,COMPLETE
3335,3335,40.0,2023-12-07 16:28:35.517738,2023-12-07 16:28:36.050563,0 days 00:00:00.532825,0.6,0.01,8.0,150,weighted choice,COMPLETE
3336,3336,37.2,2023-12-07 16:28:36.050860,2023-12-07 16:28:36.775061,0 days 00:00:00.724201,0.5,0.5,8.0,150,weighted choice,COMPLETE
3337,3337,37.6,2023-12-07 16:28:36.775365,2023-12-07 16:28:37.321901,0 days 00:00:00.546536,0.6,0.1,6.0,300,weighted choice,COMPLETE
3338,3338,40.4,2023-12-07 16:28:37.322206,2023-12-07 16:28:37.852950,0 days 00:00:00.530744,0.5,0.01,8.0,10,weighted choice,COMPLETE
3339,3339,37.6,2023-12-07 16:28:37.853263,2023-12-07 16:28:38.252288,0 days 00:00:00.399025,0.5,0.1,8.0,10,roulette wheel,COMPLETE
3340,3340,36.8,2023-12-07 16:28:38.252590,2023-12-07 16:28:38.897550,0 days 00:00:00.644960,0.95,0.33,8.0,250,weighted choice,COMPLETE
3341,3341,37.6,2023-12-07 16:28:38.897860,2023-12-07 16:28:39.508989,0 days 00:00:00.611129,0.6,0.5,8.0,10,roulette wheel,COMPLETE
3342,3342,37.2,2023-12-07 16:28:39.509291,2023-12-07 16:28:39.980449,0 days 00:00:00.471158,0.8,0.33,6.0,300,random selection,COMPLETE
3343,3343,38.0,2023-12-07 16:28:39.980761,2023-12-07 16:28:40.577779,0 days 00:00:00.597018,0.6,0.5,8.0,100,roulette wheel,COMPLETE
3344,3344,38.0,2023-12-07 16:28:40.578095,2023-12-07 16:28:40.965615,0 days 00:00:00.387520,0.95,0.1,8.0,100,roulette wheel,COMPLETE
3345,3345,38.0,2023-12-07 16:28:40.965938,2023-12-07 16:28:41.364716,0 days 00:00:00.398778,0.5,0.1,6.0,250,roulette wheel,COMPLETE
3346,3346,41.6,2023-12-07 16:28:41.365078,2023-12-07 16:28:41.717861,0 days 00:00:00.352783,0.8,0.0,6.0,150,weighted choice,COMPLETE
3347,3347,38.0,2023-12-07 16:28:41.718174,2023-12-07 16:28:41.938387,0 days 00:00:00.220213,0.95,0.0,6.0,300,random selection,COMPLETE
3348,3348,38.0,2023-12-07 16:28:41.938705,2023-12-07 16:28:42.565759,0 days 00:00:00.627054,0.95,0.33,6.0,300,weighted choice,COMPLETE
3349,3349,37.2,2023-12-07 16:28:42.566073,2023-12-07 16:28:42.941277,0 days 00:00:00.375204,0.8,0.1,8.0,20,roulette wheel,COMPLETE
3350,3350,38.4,2023-12-07 16:28:42.941600,2023-12-07 16:28:43.335974,0 days 00:00:00.394374,0.5,0.1,6.0,200,roulette wheel,COMPLETE
3351,3351,36.4,2023-12-07 16:28:43.336288,2023-12-07 16:28:43.687326,0 days 00:00:00.351038,0.8,0.01,6.0,200,random selection,COMPLETE
3352,3352,36.8,2023-12-07 16:28:43.687637,2023-12-07 16:28:44.320353,0 days 00:00:00.632716,0.6,0.33,6.0,250,weighted choice,COMPLETE
3353,3353,38.0,2023-12-07 16:28:44.320661,2023-12-07 16:28:44.818742,0 days 00:00:00.498081,0.8,0.33,8.0,20,random selection,COMPLETE
3354,3354,38.8,2023-12-07 16:28:44.819057,2023-12-07 16:28:45.188795,0 days 00:00:00.369738,0.8,0.1,6.0,100,roulette wheel,COMPLETE
3355,3355,36.4,2023-12-07 16:28:45.189120,2023-12-07 16:28:45.594490,0 days 00:00:00.405370,0.6,0.01,8.0,100,random selection,COMPLETE
3356,3356,37.2,2023-12-07 16:28:45.594799,2023-12-07 16:28:46.000673,0 days 00:00:00.405874,0.5,0.01,6.0,300,random selection,COMPLETE
3357,3357,36.8,2023-12-07 16:28:46.000987,2023-12-07 16:28:46.587737,0 days 00:00:00.586750,0.95,0.5,8.0,10,random selection,COMPLETE
3358,3358,37.6,2023-12-07 16:28:46.588065,2023-12-07 16:28:47.216250,0 days 00:00:00.628185,0.5,0.5,8.0,50,random selection,COMPLETE
3359,3359,40.0,2023-12-07 16:28:47.216561,2023-12-07 16:28:47.626511,0 days 00:00:00.409950,0.8,0.01,6.0,10,roulette wheel,COMPLETE
