,number,value,datetime_start,datetime_complete,duration,params_C,params_M,params_N,params_P,params_S,state
0,0,38.4,2023-12-06 11:12:41.191792,2023-12-06 11:12:41.681838,0 days 00:00:00.490046,0.95,0.33,4.0,50,roulette wheel,COMPLETE
1,1,36.8,2023-12-06 11:12:41.682248,2023-12-06 11:12:51.461832,0 days 00:00:09.779584,0.6,0.5,0.0,20,roulette wheel,COMPLETE
2,2,37.2,2023-12-06 11:12:51.462035,2023-12-06 11:12:51.954535,0 days 00:00:00.492500,0.6,0.33,1.0,10,random selection,COMPLETE
3,3,37.6,2023-12-06 11:12:51.954719,2023-12-06 11:13:31.835399,0 days 00:00:39.880680,0.0,0.5,,100,roulette wheel,COMPLETE
4,4,37.2,2023-12-06 11:13:31.835650,2023-12-06 11:13:59.658765,0 days 00:00:27.823115,0.8,0.01,0.0,100,weighted choice,COMPLETE
5,5,40.4,2023-12-06 11:13:59.659013,2023-12-06 11:14:00.038853,0 days 00:00:00.379840,0.6,0.01,2.0,50,roulette wheel,COMPLETE
6,6,36.8,2023-12-06 11:14:00.039037,2023-12-06 11:14:00.583704,0 days 00:00:00.544667,0.8,0.5,4.0,50,roulette wheel,COMPLETE
7,7,38.0,2023-12-06 11:14:00.583900,2023-12-06 11:14:01.120820,0 days 00:00:00.536920,0.95,0.5,2.0,10,random selection,COMPLETE
8,8,37.6,2023-12-06 11:14:01.121000,2023-12-06 11:14:08.486231,0 days 00:00:07.365231,0.0,0.33,,20,roulette wheel,COMPLETE
9,9,37.2,2023-12-06 11:14:08.486406,2023-12-06 11:14:08.877545,0 days 00:00:00.391139,0.8,0.01,4.0,10,random selection,COMPLETE
10,10,37.2,2023-12-06 11:14:08.877728,2023-12-06 11:14:09.216631,0 days 00:00:00.338903,0.8,0.1,2.0,10,random selection,COMPLETE
11,11,38.8,2023-12-06 11:14:09.216802,2023-12-06 11:14:09.737030,0 days 00:00:00.520228,0.5,0.01,4.0,10,weighted choice,COMPLETE
12,12,37.6,2023-12-06 11:14:09.737210,2023-12-06 11:14:10.216440,0 days 00:00:00.479230,0.95,0.33,1.0,10,weighted choice,COMPLETE
13,13,37.6,2023-12-06 11:14:10.216620,2023-12-06 11:14:10.902691,0 days 00:00:00.686071,0.5,0.5,2.0,100,weighted choice,COMPLETE
14,14,37.6,2023-12-06 11:14:10.902873,2023-12-06 11:14:33.477903,0 days 00:00:22.575030,0.5,0.5,0.0,50,roulette wheel,COMPLETE
15,15,36.8,2023-12-06 11:14:33.478083,2023-12-06 11:14:47.956279,0 days 00:00:14.478196,0.6,0.0,0.0,20,roulette wheel,COMPLETE
16,16,38.0,2023-12-06 11:14:47.956446,2023-12-06 11:14:48.317966,0 days 00:00:00.361520,0.5,0.1,1.0,20,roulette wheel,COMPLETE
17,17,37.6,2023-12-06 11:14:48.318154,2023-12-06 11:15:22.845182,0 days 00:00:34.527028,0.5,0.33,0.0,100,roulette wheel,COMPLETE
18,18,37.2,2023-12-06 11:15:22.845375,2023-12-06 11:15:27.397882,0 days 00:00:04.552507,0.0,0.5,,10,random selection,COMPLETE
19,19,42.8,2023-12-06 11:15:27.398061,2023-12-06 11:15:27.667036,0 days 00:00:00.268975,0.95,0.0,1.0,100,weighted choice,COMPLETE
20,20,38.0,2023-12-06 11:15:27.667224,2023-12-06 11:16:07.931475,0 days 00:00:40.264251,0.6,0.33,0.0,100,weighted choice,COMPLETE
21,21,36.8,2023-12-06 11:16:07.931740,2023-12-06 11:16:12.237375,0 days 00:00:04.305635,0.0,0.01,,20,roulette wheel,COMPLETE
22,22,38.0,2023-12-06 11:16:12.237560,2023-12-06 11:16:36.058392,0 days 00:00:23.820832,0.95,0.5,0.0,50,roulette wheel,COMPLETE
23,23,35.6,2023-12-06 11:16:36.058607,2023-12-06 11:16:36.389786,0 days 00:00:00.331179,0.8,0.0,2.0,50,random selection,COMPLETE
24,24,37.2,2023-12-06 11:16:36.389972,2023-12-06 11:16:36.723442,0 days 00:00:00.333470,0.8,0.1,2.0,50,roulette wheel,COMPLETE
25,25,38.0,2023-12-06 11:16:36.723690,2023-12-06 11:16:43.972404,0 days 00:00:07.248714,0.5,0.0,0.0,10,roulette wheel,COMPLETE
26,26,37.2,2023-12-06 11:16:43.972577,2023-12-06 11:17:11.326245,0 days 00:00:27.353668,0.0,0.0,,50,random selection,COMPLETE
27,27,37.2,2023-12-06 11:17:11.326420,2023-12-06 11:17:16.489631,0 days 00:00:05.163211,0.0,0.1,,20,roulette wheel,COMPLETE
28,28,38.0,2023-12-06 11:17:16.489806,2023-12-06 11:17:17.100330,0 days 00:00:00.610524,0.5,0.5,4.0,50,roulette wheel,COMPLETE
29,29,37.6,2023-12-06 11:17:17.100519,2023-12-06 11:17:44.709390,0 days 00:00:27.608871,0.0,0.1,,100,weighted choice,COMPLETE
30,30,36.8,2023-12-06 11:17:44.709622,2023-12-06 11:17:47.666418,0 days 00:00:02.956796,0.0,0.1,,10,weighted choice,COMPLETE
31,31,36.8,2023-12-06 11:17:47.666615,2023-12-06 11:17:48.167805,0 days 00:00:00.501190,0.6,0.33,1.0,20,roulette wheel,COMPLETE
32,32,37.6,2023-12-06 11:17:48.167989,2023-12-06 11:17:51.335888,0 days 00:00:03.167899,0.95,0.01,0.0,10,weighted choice,COMPLETE
33,33,38.0,2023-12-06 11:17:51.336065,2023-12-06 11:17:51.703374,0 days 00:00:00.367309,0.6,0.1,4.0,10,roulette wheel,COMPLETE
34,34,38.4,2023-12-06 11:17:51.703547,2023-12-06 11:18:10.717179,0 days 00:00:19.013632,0.5,0.33,0.0,50,roulette wheel,COMPLETE
35,35,37.6,2023-12-06 11:18:10.717403,2023-12-06 11:18:11.257554,0 days 00:00:00.540151,0.6,0.33,4.0,50,weighted choice,COMPLETE
36,36,36.8,2023-12-06 11:18:11.257738,2023-12-06 11:18:11.501547,0 days 00:00:00.243809,0.6,0.0,2.0,100,random selection,COMPLETE
37,37,40.0,2023-12-06 11:18:11.501746,2023-12-06 11:18:11.883339,0 days 00:00:00.381593,0.95,0.01,4.0,10,roulette wheel,COMPLETE
38,38,41.6,2023-12-06 11:18:11.883523,2023-12-06 11:18:12.205983,0 days 00:00:00.322460,0.8,0.01,2.0,100,roulette wheel,COMPLETE
39,39,36.4,2023-12-06 11:18:12.206167,2023-12-06 11:18:14.492762,0 days 00:00:02.286595,0.0,0.01,,10,roulette wheel,COMPLETE
40,40,37.6,2023-12-06 11:18:14.492944,2023-12-06 11:18:15.033332,0 days 00:00:00.540388,0.95,0.5,2.0,50,roulette wheel,COMPLETE
41,41,36.8,2023-12-06 11:18:15.033510,2023-12-06 11:18:27.634812,0 days 00:00:12.601302,0.8,0.01,0.0,50,roulette wheel,COMPLETE
42,42,43.2,2023-12-06 11:18:27.634984,2023-12-06 11:18:28.047252,0 days 00:00:00.412268,0.6,0.0,4.0,100,weighted choice,COMPLETE
43,43,43.2,2023-12-06 11:18:28.047440,2023-12-06 11:18:28.241603,0 days 00:00:00.194163,0.95,0.0,4.0,100,roulette wheel,COMPLETE
44,44,40.8,2023-12-06 11:18:28.241776,2023-12-06 11:18:28.975779,0 days 00:00:00.734003,0.5,0.0,4.0,20,weighted choice,COMPLETE
45,45,37.6,2023-12-06 11:18:28.975961,2023-12-06 11:18:29.448671,0 days 00:00:00.472710,0.6,0.33,1.0,10,random selection,COMPLETE
46,46,38.4,2023-12-06 11:18:29.448851,2023-12-06 11:18:29.888134,0 days 00:00:00.439283,0.5,0.1,4.0,50,weighted choice,COMPLETE
47,47,41.2,2023-12-06 11:18:29.888315,2023-12-06 11:18:30.328492,0 days 00:00:00.440177,0.95,0.0,2.0,20,roulette wheel,COMPLETE
48,48,38.0,2023-12-06 11:18:30.328663,2023-12-06 11:18:30.662874,0 days 00:00:00.334211,0.95,0.1,1.0,50,roulette wheel,COMPLETE
49,49,37.6,2023-12-06 11:18:30.663054,2023-12-06 11:18:31.199395,0 days 00:00:00.536341,0.8,0.5,1.0,50,random selection,COMPLETE
50,50,40.0,2023-12-06 11:18:31.199574,2023-12-06 11:18:31.615622,0 days 00:00:00.416048,0.8,0.01,2.0,10,roulette wheel,COMPLETE
51,51,37.2,2023-12-06 11:18:31.615809,2023-12-06 11:18:32.159747,0 days 00:00:00.543938,0.95,0.5,2.0,10,roulette wheel,COMPLETE
52,52,37.2,2023-12-06 11:18:32.159922,2023-12-06 11:18:55.583455,0 days 00:00:23.423533,0.8,0.5,0.0,50,random selection,COMPLETE
53,53,38.0,2023-12-06 11:18:55.583641,2023-12-06 11:19:26.542785,0 days 00:00:30.959144,0.6,0.1,0.0,100,weighted choice,COMPLETE
54,54,37.2,2023-12-06 11:19:26.543014,2023-12-06 11:19:54.176039,0 days 00:00:27.633025,0.95,0.1,0.0,100,roulette wheel,COMPLETE
55,55,37.6,2023-12-06 11:19:54.176223,2023-12-06 11:20:22.221103,0 days 00:00:28.044880,0.0,0.0,,50,roulette wheel,COMPLETE
56,56,40.4,2023-12-06 11:20:22.221285,2023-12-06 11:20:22.702531,0 days 00:00:00.481246,0.95,0.0,4.0,20,weighted choice,COMPLETE
57,57,38.0,2023-12-06 11:20:22.702724,2023-12-06 11:20:23.085166,0 days 00:00:00.382442,0.95,0.1,2.0,50,weighted choice,COMPLETE
58,58,42.0,2023-12-06 11:20:23.085343,2023-12-06 11:20:23.559684,0 days 00:00:00.474341,0.5,0.01,2.0,50,weighted choice,COMPLETE
59,59,37.6,2023-12-06 11:20:23.559857,2023-12-06 11:20:24.047158,0 days 00:00:00.487301,0.6,0.33,4.0,20,random selection,COMPLETE
60,60,37.2,2023-12-06 11:20:24.047334,2023-12-06 11:20:24.504631,0 days 00:00:00.457297,0.8,0.33,1.0,20,roulette wheel,COMPLETE
61,61,38.0,2023-12-06 11:20:24.504813,2023-12-06 11:20:38.577569,0 days 00:00:14.072756,0.0,0.0,,20,weighted choice,COMPLETE
62,62,43.6,2023-12-06 11:20:38.577735,2023-12-06 11:20:38.867097,0 days 00:00:00.289362,0.6,0.0,4.0,100,roulette wheel,COMPLETE
63,63,36.8,2023-12-06 11:20:38.867281,2023-12-06 11:20:39.312712,0 days 00:00:00.445431,0.8,0.0,4.0,20,random selection,COMPLETE
64,64,37.6,2023-12-06 11:20:39.312909,2023-12-06 11:20:39.659779,0 days 00:00:00.346870,0.95,0.1,2.0,20,roulette wheel,COMPLETE
65,65,43.2,2023-12-06 11:20:39.659958,2023-12-06 11:20:40.131193,0 days 00:00:00.471235,0.8,0.0,1.0,50,roulette wheel,COMPLETE
66,66,37.6,2023-12-06 11:20:40.131380,2023-12-06 11:20:40.608184,0 days 00:00:00.476804,0.6,0.33,2.0,50,random selection,COMPLETE
67,67,41.6,2023-12-06 11:20:40.608369,2023-12-06 11:20:41.057409,0 days 00:00:00.449040,0.6,0.01,4.0,50,weighted choice,COMPLETE
68,68,36.4,2023-12-06 11:20:41.057593,2023-12-06 11:20:41.509517,0 days 00:00:00.451924,0.8,0.33,1.0,20,roulette wheel,COMPLETE
69,69,36.8,2023-12-06 11:20:41.509713,2023-12-06 11:21:07.333365,0 days 00:00:25.823652,0.0,0.01,,100,weighted choice,COMPLETE
70,70,38.0,2023-12-06 11:21:07.333595,2023-12-06 11:21:07.823418,0 days 00:00:00.489823,0.6,0.33,4.0,100,roulette wheel,COMPLETE
71,71,37.2,2023-12-06 11:21:07.823595,2023-12-06 11:21:11.900710,0 days 00:00:04.077115,0.0,0.33,,10,weighted choice,COMPLETE
72,72,36.4,2023-12-06 11:21:11.900880,2023-12-06 11:21:12.293276,0 days 00:00:00.392396,0.95,0.01,2.0,10,random selection,COMPLETE
73,73,35.2,2023-12-06 11:21:12.293486,2023-12-06 11:21:12.682236,0 days 00:00:00.388750,0.95,0.01,2.0,10,random selection,COMPLETE
74,74,40.0,2023-12-06 11:21:12.682431,2023-12-06 11:21:13.048094,0 days 00:00:00.365663,0.8,0.01,1.0,20,roulette wheel,COMPLETE
75,75,37.6,2023-12-06 11:21:13.048282,2023-12-06 11:21:27.653003,0 days 00:00:14.604721,0.8,0.1,0.0,50,roulette wheel,COMPLETE
76,76,43.2,2023-12-06 11:21:27.653180,2023-12-06 11:21:27.971362,0 days 00:00:00.318182,0.6,0.0,4.0,100,roulette wheel,COMPLETE
77,77,38.8,2023-12-06 11:21:27.971541,2023-12-06 11:21:33.967862,0 days 00:00:05.996321,0.6,0.1,0.0,20,roulette wheel,COMPLETE
78,78,37.2,2023-12-06 11:21:33.968039,2023-12-06 11:21:38.973395,0 days 00:00:05.005356,0.0,0.01,,20,weighted choice,COMPLETE
79,79,37.2,2023-12-06 11:21:38.973575,2023-12-06 11:21:44.817853,0 days 00:00:05.844278,0.5,0.1,0.0,20,random selection,COMPLETE
80,80,38.0,2023-12-06 11:21:44.818036,2023-12-06 11:21:56.838757,0 days 00:00:12.020721,0.0,0.1,,50,random selection,COMPLETE
81,81,37.6,2023-12-06 11:21:56.838923,2023-12-06 11:21:57.296251,0 days 00:00:00.457328,0.95,0.33,1.0,100,roulette wheel,COMPLETE
82,82,39.2,2023-12-06 11:21:57.296429,2023-12-06 11:21:57.710819,0 days 00:00:00.414390,0.8,0.01,2.0,10,roulette wheel,COMPLETE
83,83,38.0,2023-12-06 11:21:57.710997,2023-12-06 11:22:26.957046,0 days 00:00:29.246049,0.8,0.01,0.0,100,weighted choice,COMPLETE
84,84,37.6,2023-12-06 11:22:26.957237,2023-12-06 11:22:38.901361,0 days 00:00:11.944124,0.0,0.1,,50,random selection,COMPLETE
85,85,39.2,2023-12-06 11:22:38.901547,2023-12-06 11:22:39.413778,0 days 00:00:00.512231,0.95,0.33,2.0,50,weighted choice,COMPLETE
86,86,37.2,2023-12-06 11:22:39.413961,2023-12-06 11:23:02.108226,0 days 00:00:22.694265,0.0,0.1,,100,roulette wheel,COMPLETE
87,87,37.2,2023-12-06 11:23:02.108400,2023-12-06 11:23:04.710569,0 days 00:00:02.602169,0.5,0.01,0.0,10,roulette wheel,COMPLETE
88,88,38.0,2023-12-06 11:23:04.710765,2023-12-06 11:23:05.357430,0 days 00:00:00.646665,0.5,0.5,1.0,50,weighted choice,COMPLETE
89,89,37.6,2023-12-06 11:23:05.357620,2023-12-06 11:23:19.642837,0 days 00:00:14.285217,0.6,0.1,0.0,50,roulette wheel,COMPLETE
90,90,38.4,2023-12-06 11:23:19.643014,2023-12-06 11:23:20.181059,0 days 00:00:00.538045,0.8,0.5,1.0,50,roulette wheel,COMPLETE
91,91,37.6,2023-12-06 11:23:20.181248,2023-12-06 11:23:20.534101,0 days 00:00:00.352853,0.6,0.1,2.0,100,random selection,COMPLETE
92,92,37.6,2023-12-06 11:23:20.534305,2023-12-06 11:23:24.983489,0 days 00:00:04.449184,0.5,0.33,0.0,10,weighted choice,COMPLETE
93,93,39.6,2023-12-06 11:23:24.983684,2023-12-06 11:23:25.470593,0 days 00:00:00.486909,0.5,0.01,1.0,10,roulette wheel,COMPLETE
94,94,37.6,2023-12-06 11:23:25.470770,2023-12-06 11:23:25.899211,0 days 00:00:00.428441,0.6,0.1,2.0,100,weighted choice,COMPLETE
95,95,37.6,2023-12-06 11:23:25.899405,2023-12-06 11:23:26.439176,0 days 00:00:00.539771,0.5,0.33,2.0,20,weighted choice,COMPLETE
96,96,37.6,2023-12-06 11:23:26.439366,2023-12-06 11:23:26.910771,0 days 00:00:00.471405,0.95,0.33,4.0,50,roulette wheel,COMPLETE
97,97,44.4,2023-12-06 11:23:26.910974,2023-12-06 11:23:27.647077,0 days 00:00:00.736103,0.6,0.0,2.0,50,weighted choice,COMPLETE
98,98,37.2,2023-12-06 11:23:27.647263,2023-12-06 11:23:28.026422,0 days 00:00:00.379159,0.5,0.1,4.0,100,roulette wheel,COMPLETE
99,99,38.8,2023-12-06 11:23:28.026613,2023-12-06 11:23:28.382168,0 days 00:00:00.355555,0.6,0.1,2.0,100,roulette wheel,COMPLETE
100,100,36.4,2023-12-06 11:23:28.382361,2023-12-06 11:23:28.827219,0 days 00:00:00.444858,0.95,0.33,1.0,50,random selection,COMPLETE
101,101,37.2,2023-12-06 11:23:28.827431,2023-12-06 11:23:52.569750,0 days 00:00:23.742319,0.0,0.5,,50,weighted choice,COMPLETE
102,102,36.8,2023-12-06 11:23:52.569996,2023-12-06 11:24:14.077575,0 days 00:00:21.507579,0.6,0.33,0.0,50,weighted choice,COMPLETE
103,103,37.6,2023-12-06 11:24:14.077763,2023-12-06 11:24:17.901476,0 days 00:00:03.823713,0.0,0.33,,10,roulette wheel,COMPLETE
104,104,37.2,2023-12-06 11:24:17.901656,2023-12-06 11:24:39.247234,0 days 00:00:21.345578,0.6,0.01,0.0,100,roulette wheel,COMPLETE
105,105,42.8,2023-12-06 11:24:39.247422,2023-12-06 11:24:39.907552,0 days 00:00:00.660130,0.6,0.0,4.0,20,weighted choice,COMPLETE
106,106,37.2,2023-12-06 11:24:39.907733,2023-12-06 11:25:21.550865,0 days 00:00:41.643132,0.8,0.5,0.0,100,random selection,COMPLETE
107,107,38.0,2023-12-06 11:25:21.551065,2023-12-06 11:25:38.653660,0 days 00:00:17.102595,0.95,0.1,0.0,50,weighted choice,COMPLETE
108,108,42.0,2023-12-06 11:25:38.653873,2023-12-06 11:25:39.039736,0 days 00:00:00.385863,0.6,0.01,4.0,50,roulette wheel,COMPLETE
109,109,38.0,2023-12-06 11:25:39.039917,2023-12-06 11:25:51.151079,0 days 00:00:12.111162,0.0,0.1,,50,random selection,COMPLETE
110,110,37.2,2023-12-06 11:25:51.151270,2023-12-06 11:25:57.581403,0 days 00:00:06.430133,0.95,0.1,0.0,20,roulette wheel,COMPLETE
111,111,37.6,2023-12-06 11:25:57.581584,2023-12-06 11:25:58.153950,0 days 00:00:00.572366,0.6,0.33,2.0,100,weighted choice,COMPLETE
112,112,38.4,2023-12-06 11:25:58.154137,2023-12-06 11:25:58.544182,0 days 00:00:00.390045,0.8,0.1,4.0,10,weighted choice,COMPLETE
113,113,36.8,2023-12-06 11:25:58.544375,2023-12-06 11:25:59.157974,0 days 00:00:00.613599,0.5,0.5,4.0,20,random selection,COMPLETE
114,114,36.8,2023-12-06 11:25:59.158186,2023-12-06 11:25:59.756597,0 days 00:00:00.598411,0.95,0.5,4.0,50,weighted choice,COMPLETE
115,115,37.2,2023-12-06 11:25:59.756788,2023-12-06 11:26:24.779846,0 days 00:00:25.023058,0.5,0.5,0.0,50,weighted choice,COMPLETE
116,116,38.8,2023-12-06 11:26:24.780063,2023-12-06 11:26:25.313813,0 days 00:00:00.533750,0.95,0.0,4.0,10,weighted choice,COMPLETE
117,117,37.6,2023-12-06 11:26:25.314009,2023-12-06 11:26:28.403312,0 days 00:00:03.089303,0.6,0.1,0.0,10,roulette wheel,COMPLETE
118,118,37.6,2023-12-06 11:26:28.403506,2023-12-06 11:26:28.765728,0 days 00:00:00.362222,0.8,0.1,4.0,20,roulette wheel,COMPLETE
119,119,38.4,2023-12-06 11:26:28.765909,2023-12-06 11:26:42.876225,0 days 00:00:14.110316,0.0,0.0,,20,weighted choice,COMPLETE
120,120,37.2,2023-12-06 11:26:42.876399,2023-12-06 11:27:10.727824,0 days 00:00:27.851425,0.95,0.1,0.0,100,roulette wheel,COMPLETE
121,121,37.2,2023-12-06 11:27:10.728024,2023-12-06 11:27:11.213496,0 days 00:00:00.485472,0.6,0.33,1.0,10,roulette wheel,COMPLETE
122,122,37.2,2023-12-06 11:27:11.213688,2023-12-06 11:27:34.754137,0 days 00:00:23.540449,0.0,0.5,,50,weighted choice,COMPLETE
123,123,37.6,2023-12-06 11:27:34.754350,2023-12-06 11:27:42.766013,0 days 00:00:08.011663,0.0,0.33,,20,weighted choice,COMPLETE
124,124,36.8,2023-12-06 11:27:42.766207,2023-12-06 11:27:43.383052,0 days 00:00:00.616845,0.5,0.0,2.0,20,random selection,COMPLETE
125,125,37.6,2023-12-06 11:27:43.383297,2023-12-06 11:27:47.692021,0 days 00:00:04.308724,0.0,0.01,,20,random selection,COMPLETE
126,126,38.0,2023-12-06 11:27:47.692212,2023-12-06 11:27:48.286243,0 days 00:00:00.594031,0.5,0.33,4.0,100,weighted choice,COMPLETE
127,127,39.6,2023-12-06 11:27:48.286466,2023-12-06 11:27:48.807372,0 days 00:00:00.520906,0.5,0.01,4.0,10,weighted choice,COMPLETE
128,128,38.0,2023-12-06 11:27:48.807571,2023-12-06 11:27:49.162115,0 days 00:00:00.354544,0.6,0.1,1.0,100,roulette wheel,COMPLETE
129,129,41.6,2023-12-06 11:27:49.162314,2023-12-06 11:27:49.650219,0 days 00:00:00.487905,0.95,0.0,1.0,20,roulette wheel,COMPLETE
130,130,38.0,2023-12-06 11:27:49.650411,2023-12-06 11:27:50.255462,0 days 00:00:00.605051,0.5,0.5,2.0,100,roulette wheel,COMPLETE
131,131,36.8,2023-12-06 11:27:50.255657,2023-12-06 11:27:50.819392,0 days 00:00:00.563735,0.95,0.5,4.0,50,roulette wheel,COMPLETE
132,132,37.2,2023-12-06 11:27:50.819575,2023-12-06 11:27:51.322303,0 days 00:00:00.502728,0.5,0.33,1.0,50,random selection,COMPLETE
133,133,36.4,2023-12-06 11:27:51.322510,2023-12-06 11:28:24.750075,0 days 00:00:33.427565,0.6,0.33,0.0,100,random selection,COMPLETE
134,134,34.4,2023-12-06 11:28:24.750297,2023-12-06 11:28:25.047880,0 days 00:00:00.297583,0.95,0.0,2.0,50,random selection,COMPLETE
135,135,38.0,2023-12-06 11:28:25.048077,2023-12-06 11:28:47.582110,0 days 00:00:22.534033,0.0,0.1,,100,roulette wheel,COMPLETE
136,136,36.8,2023-12-06 11:28:47.582306,2023-12-06 11:28:48.013721,0 days 00:00:00.431415,0.5,0.01,1.0,20,random selection,COMPLETE
137,137,42.8,2023-12-06 11:28:48.013914,2023-12-06 11:28:48.290289,0 days 00:00:00.276375,0.95,0.0,1.0,100,weighted choice,COMPLETE
138,138,37.2,2023-12-06 11:28:48.290496,2023-12-06 11:29:16.011052,0 days 00:00:27.720556,0.0,0.1,,100,weighted choice,COMPLETE
139,139,38.4,2023-12-06 11:29:16.011262,2023-12-06 11:29:44.209343,0 days 00:00:28.198081,0.0,0.0,,50,roulette wheel,COMPLETE
140,140,43.2,2023-12-06 11:29:44.209533,2023-12-06 11:29:44.671889,0 days 00:00:00.462356,0.8,0.0,1.0,50,roulette wheel,COMPLETE
141,141,43.2,2023-12-06 11:29:44.672080,2023-12-06 11:29:44.859618,0 days 00:00:00.187538,0.95,0.0,2.0,100,roulette wheel,COMPLETE
142,142,38.4,2023-12-06 11:29:44.859841,2023-12-06 11:29:45.193090,0 days 00:00:00.333249,0.95,0.1,1.0,100,roulette wheel,COMPLETE
143,143,36.4,2023-12-06 11:29:45.193308,2023-12-06 11:29:45.708461,0 days 00:00:00.515153,0.5,0.33,4.0,10,roulette wheel,COMPLETE
144,144,43.6,2023-12-06 11:29:45.708660,2023-12-06 11:29:46.066119,0 days 00:00:00.357459,0.5,0.0,4.0,100,roulette wheel,COMPLETE
145,145,35.6,2023-12-06 11:29:46.066313,2023-12-06 11:29:46.381638,0 days 00:00:00.315325,0.95,0.0,2.0,50,random selection,COMPLETE
146,146,37.2,2023-12-06 11:29:46.381849,2023-12-06 11:29:46.974508,0 days 00:00:00.592659,0.5,0.5,1.0,50,roulette wheel,COMPLETE
147,147,36.8,2023-12-06 11:29:46.974707,2023-12-06 11:29:57.692826,0 days 00:00:10.718119,0.8,0.5,0.0,20,weighted choice,COMPLETE
148,148,36.8,2023-12-06 11:29:57.693019,2023-12-06 11:29:58.156447,0 days 00:00:00.463428,0.95,0.33,2.0,100,random selection,COMPLETE
149,149,38.8,2023-12-06 11:29:58.156629,2023-12-06 11:30:26.258263,0 days 00:00:28.101634,0.0,0.1,,100,weighted choice,COMPLETE
150,150,37.6,2023-12-06 11:30:26.258447,2023-12-06 11:30:43.710539,0 days 00:00:17.452092,0.0,0.33,,50,roulette wheel,COMPLETE
151,151,37.6,2023-12-06 11:30:43.710737,2023-12-06 11:30:44.199726,0 days 00:00:00.488989,0.6,0.33,4.0,20,random selection,COMPLETE
152,152,40.0,2023-12-06 11:30:44.199922,2023-12-06 11:30:44.562028,0 days 00:00:00.362106,0.8,0.01,4.0,20,roulette wheel,COMPLETE
153,153,43.6,2023-12-06 11:30:44.562230,2023-12-06 11:30:45.474268,0 days 00:00:00.912038,0.5,0.0,1.0,100,weighted choice,COMPLETE
154,154,37.6,2023-12-06 11:30:45.474466,2023-12-06 11:30:45.828083,0 days 00:00:00.353617,0.6,0.1,1.0,10,roulette wheel,COMPLETE
155,155,37.6,2023-12-06 11:30:45.828282,2023-12-06 11:30:50.198479,0 days 00:00:04.370197,0.0,0.01,,20,random selection,COMPLETE
156,156,40.8,2023-12-06 11:30:50.198668,2023-12-06 11:30:50.565444,0 days 00:00:00.366776,0.95,0.01,1.0,50,weighted choice,COMPLETE
157,157,38.0,2023-12-06 11:30:50.565638,2023-12-06 11:31:11.745827,0 days 00:00:21.180189,0.0,0.5,,50,roulette wheel,COMPLETE
158,158,37.2,2023-12-06 11:31:11.746028,2023-12-06 11:31:12.288005,0 days 00:00:00.541977,0.8,0.5,1.0,50,roulette wheel,COMPLETE
159,159,37.6,2023-12-06 11:31:12.288200,2023-12-06 11:31:31.841387,0 days 00:00:19.553187,0.0,0.01,,100,roulette wheel,COMPLETE
160,160,37.2,2023-12-06 11:31:31.841586,2023-12-06 11:31:32.271934,0 days 00:00:00.430348,0.5,0.01,2.0,20,random selection,COMPLETE
161,161,38.0,2023-12-06 11:31:32.272130,2023-12-06 11:31:39.344087,0 days 00:00:07.071957,0.0,0.0,,10,weighted choice,COMPLETE
162,162,37.6,2023-12-06 11:31:39.344275,2023-12-06 11:31:39.967671,0 days 00:00:00.623396,0.5,0.5,4.0,50,roulette wheel,COMPLETE
163,163,38.0,2023-12-06 11:31:39.967858,2023-12-06 11:31:40.471173,0 days 00:00:00.503315,0.5,0.33,2.0,100,roulette wheel,COMPLETE
164,164,38.0,2023-12-06 11:31:40.471362,2023-12-06 11:31:40.861139,0 days 00:00:00.389777,0.95,0.1,4.0,10,weighted choice,COMPLETE
165,165,37.6,2023-12-06 11:31:40.861336,2023-12-06 11:31:48.351619,0 days 00:00:07.490283,0.0,0.33,,20,roulette wheel,COMPLETE
166,166,38.8,2023-12-06 11:31:48.351814,2023-12-06 11:31:48.904659,0 days 00:00:00.552845,0.8,0.5,1.0,20,roulette wheel,COMPLETE
167,167,38.4,2023-12-06 11:31:48.904852,2023-12-06 11:31:49.256431,0 days 00:00:00.351579,0.6,0.1,1.0,50,roulette wheel,COMPLETE
168,168,36.8,2023-12-06 11:31:49.256634,2023-12-06 11:32:12.125606,0 days 00:00:22.868972,0.6,0.5,0.0,50,random selection,COMPLETE
