,number,value,datetime_start,datetime_complete,duration,params_C,params_M,params_N,params_P,params_S,state
337,337,37.2,2023-12-06 13:09:56.967110,2023-12-06 13:10:02.092550,0 days 00:00:05.125440,0.6,0.01,0.0,20,roulette wheel,COMPLETE
338,338,37.2,2023-12-06 13:10:02.092760,2023-12-06 13:10:07.074281,0 days 00:00:04.981521,0.5,0.5,0.0,10,random selection,COMPLETE
339,339,40.8,2023-12-06 13:10:07.074518,2023-12-06 13:10:07.511989,0 days 00:00:00.437471,0.5,0.01,4.0,100,roulette wheel,COMPLETE
340,340,37.2,2023-12-06 13:10:07.512201,2023-12-06 13:10:08.137631,0 days 00:00:00.625430,0.6,0.5,2.0,20,weighted choice,COMPLETE
341,341,38.0,2023-12-06 13:10:08.137869,2023-12-06 13:10:08.735593,0 days 00:00:00.597724,0.6,0.5,2.0,10,roulette wheel,COMPLETE
342,342,38.0,2023-12-06 13:10:08.735806,2023-12-06 13:10:19.277924,0 days 00:00:10.542118,0.6,0.5,0.0,20,weighted choice,COMPLETE
343,343,38.8,2023-12-06 13:10:19.278154,2023-12-06 13:10:19.616225,0 days 00:00:00.338071,0.95,0.1,1.0,20,roulette wheel,COMPLETE
344,344,37.2,2023-12-06 13:10:19.616426,2023-12-06 13:10:19.942832,0 days 00:00:00.326406,0.95,0.01,4.0,50,random selection,COMPLETE
345,345,37.2,2023-12-06 13:10:19.943054,2023-12-06 13:10:39.674206,0 days 00:00:19.731152,0.0,0.33,,50,weighted choice,COMPLETE
346,346,43.2,2023-12-06 13:10:39.674414,2023-12-06 13:10:40.078516,0 days 00:00:00.404102,0.8,0.01,1.0,100,weighted choice,COMPLETE
347,347,37.6,2023-12-06 13:10:40.078731,2023-12-06 13:11:17.309734,0 days 00:00:37.231003,0.95,0.0,0.0,50,random selection,COMPLETE
348,348,36.8,2023-12-06 13:11:17.310035,2023-12-06 13:11:19.561185,0 days 00:00:02.251150,0.0,0.01,,10,roulette wheel,COMPLETE
349,349,37.6,2023-12-06 13:11:19.561394,2023-12-06 13:11:22.451526,0 days 00:00:02.890132,0.5,0.01,0.0,10,weighted choice,COMPLETE
350,350,36.4,2023-12-06 13:11:22.451733,2023-12-06 13:11:22.725234,0 days 00:00:00.273501,0.95,0.0,4.0,50,random selection,COMPLETE
351,351,41.6,2023-12-06 13:11:22.725492,2023-12-06 13:11:23.190684,0 days 00:00:00.465192,0.6,0.01,4.0,100,weighted choice,COMPLETE
352,352,35.6,2023-12-06 13:11:23.190908,2023-12-06 13:11:23.722570,0 days 00:00:00.531662,0.8,0.0,1.0,20,random selection,COMPLETE
353,353,37.2,2023-12-06 13:11:23.722803,2023-12-06 13:11:31.172435,0 days 00:00:07.449632,0.0,0.33,,20,roulette wheel,COMPLETE
354,354,40.8,2023-12-06 13:11:31.172652,2023-12-06 13:11:31.893551,0 days 00:00:00.720899,0.5,0.0,1.0,20,roulette wheel,COMPLETE
355,355,37.6,2023-12-06 13:11:31.893773,2023-12-06 13:11:32.484652,0 days 00:00:00.590879,0.6,0.5,4.0,50,roulette wheel,COMPLETE
356,356,38.0,2023-12-06 13:11:32.484879,2023-12-06 13:11:37.628463,0 days 00:00:05.143584,0.6,0.01,0.0,20,roulette wheel,COMPLETE
357,357,45.2,2023-12-06 13:11:37.628675,2023-12-06 13:11:38.242023,0 days 00:00:00.613348,0.5,0.0,1.0,100,roulette wheel,COMPLETE
358,358,38.0,2023-12-06 13:11:38.242240,2023-12-06 13:11:38.887165,0 days 00:00:00.644925,0.5,0.5,2.0,10,weighted choice,COMPLETE
359,359,37.2,2023-12-06 13:11:38.887397,2023-12-06 13:11:48.902056,0 days 00:00:10.014659,0.0,0.01,,50,random selection,COMPLETE
360,360,38.8,2023-12-06 13:11:48.902279,2023-12-06 13:11:49.425371,0 days 00:00:00.523092,0.5,0.33,2.0,20,roulette wheel,COMPLETE
361,361,37.2,2023-12-06 13:11:49.425570,2023-12-06 13:11:54.468766,0 days 00:00:05.043196,0.5,0.5,0.0,10,roulette wheel,COMPLETE
362,362,41.6,2023-12-06 13:11:54.468988,2023-12-06 13:11:54.984569,0 days 00:00:00.515581,0.5,0.01,4.0,100,weighted choice,COMPLETE
363,363,38.0,2023-12-06 13:11:54.984808,2023-12-06 13:11:59.125363,0 days 00:00:04.140555,0.0,0.33,,10,weighted choice,COMPLETE
364,364,38.4,2023-12-06 13:11:59.125566,2023-12-06 13:11:59.600004,0 days 00:00:00.474438,0.95,0.33,4.0,20,roulette wheel,COMPLETE
365,365,37.2,2023-12-06 13:11:59.600231,2023-12-06 13:12:00.138170,0 days 00:00:00.537939,0.95,0.5,1.0,100,roulette wheel,COMPLETE
366,366,38.4,2023-12-06 13:12:00.138389,2023-12-06 13:12:19.784852,0 days 00:00:19.646463,0.0,0.33,,50,weighted choice,COMPLETE
367,367,36.8,2023-12-06 13:12:19.785078,2023-12-06 13:12:31.610741,0 days 00:00:11.825663,0.5,0.01,0.0,50,roulette wheel,COMPLETE
368,368,40.0,2023-12-06 13:12:31.610951,2023-12-06 13:12:32.016017,0 days 00:00:00.405066,0.95,0.01,2.0,10,roulette wheel,COMPLETE
369,369,38.0,2023-12-06 13:12:32.016241,2023-12-06 13:12:32.573655,0 days 00:00:00.557414,0.8,0.5,4.0,20,random selection,COMPLETE
370,370,36.8,2023-12-06 13:12:32.573884,2023-12-06 13:12:33.086205,0 days 00:00:00.512321,0.5,0.33,2.0,10,roulette wheel,COMPLETE
371,371,35.6,2023-12-06 13:12:33.086428,2023-12-06 13:12:33.388554,0 days 00:00:00.302126,0.95,0.0,2.0,50,random selection,COMPLETE
372,372,36.8,2023-12-06 13:12:33.388764,2023-12-06 13:13:01.749523,0 days 00:00:28.360759,0.0,0.0,,50,roulette wheel,COMPLETE
373,373,37.6,2023-12-06 13:13:01.749734,2023-12-06 13:13:06.958990,0 days 00:00:05.209256,0.0,0.1,,20,roulette wheel,COMPLETE
374,374,37.2,2023-12-06 13:13:06.959208,2023-12-06 13:13:07.510644,0 days 00:00:00.551436,0.95,0.5,4.0,50,random selection,COMPLETE
375,375,36.4,2023-12-06 13:13:07.510861,2023-12-06 13:13:09.796522,0 days 00:00:02.285661,0.0,0.01,,10,roulette wheel,COMPLETE
376,376,38.0,2023-12-06 13:13:09.796725,2023-12-06 13:13:10.322852,0 days 00:00:00.526127,0.5,0.33,2.0,10,roulette wheel,COMPLETE
377,377,37.2,2023-12-06 13:13:10.323075,2023-12-06 13:13:10.791071,0 days 00:00:00.467996,0.95,0.33,2.0,50,roulette wheel,COMPLETE
378,378,38.0,2023-12-06 13:13:10.791294,2023-12-06 13:13:11.239002,0 days 00:00:00.447708,0.95,0.33,1.0,100,roulette wheel,COMPLETE
379,379,36.8,2023-12-06 13:13:11.239209,2023-12-06 13:13:13.504435,0 days 00:00:02.265226,0.0,0.01,,10,random selection,COMPLETE
380,380,38.4,2023-12-06 13:13:13.504657,2023-12-06 13:13:17.357126,0 days 00:00:03.852469,0.0,0.33,,10,random selection,COMPLETE
381,381,36.8,2023-12-06 13:13:17.357336,2023-12-06 13:13:53.684489,0 days 00:00:36.327153,0.8,0.0,0.0,50,roulette wheel,COMPLETE
382,382,38.4,2023-12-06 13:13:53.684728,2023-12-06 13:13:54.227598,0 days 00:00:00.542870,0.95,0.5,1.0,10,roulette wheel,COMPLETE
383,383,37.2,2023-12-06 13:13:54.227832,2023-12-06 13:14:01.650193,0 days 00:00:07.422361,0.0,0.33,,20,random selection,COMPLETE
384,384,38.0,2023-12-06 13:14:01.650403,2023-12-06 13:14:09.122575,0 days 00:00:07.472172,0.0,0.33,,20,roulette wheel,COMPLETE
385,385,43.2,2023-12-06 13:14:09.122844,2023-12-06 13:14:09.516155,0 days 00:00:00.393311,0.95,0.0,1.0,50,roulette wheel,COMPLETE
386,386,38.0,2023-12-06 13:14:09.516395,2023-12-06 13:14:10.070408,0 days 00:00:00.554013,0.8,0.5,2.0,50,random selection,COMPLETE
387,387,39.6,2023-12-06 13:14:10.070704,2023-12-06 13:14:10.553460,0 days 00:00:00.482756,0.5,0.01,4.0,10,roulette wheel,COMPLETE
388,388,38.0,2023-12-06 13:14:10.553662,2023-12-06 13:14:11.185810,0 days 00:00:00.632148,0.5,0.5,4.0,10,roulette wheel,COMPLETE
389,389,36.4,2023-12-06 13:14:11.186034,2023-12-06 13:14:11.798421,0 days 00:00:00.612387,0.5,0.0,4.0,10,random selection,COMPLETE
390,390,39.2,2023-12-06 13:14:11.798649,2023-12-06 13:14:12.241652,0 days 00:00:00.443003,0.5,0.01,2.0,20,roulette wheel,COMPLETE
391,391,38.0,2023-12-06 13:14:12.241857,2023-12-06 13:14:12.606384,0 days 00:00:00.364527,0.8,0.1,4.0,10,roulette wheel,COMPLETE
392,392,38.4,2023-12-06 13:14:12.606616,2023-12-06 13:14:32.446364,0 days 00:00:19.839748,0.0,0.33,,50,weighted choice,COMPLETE
393,393,37.2,2023-12-06 13:14:32.446607,2023-12-06 13:14:33.061677,0 days 00:00:00.615070,0.5,0.5,2.0,50,roulette wheel,COMPLETE
394,394,37.2,2023-12-06 13:14:33.061899,2023-12-06 13:14:33.602483,0 days 00:00:00.540584,0.6,0.0,1.0,50,random selection,COMPLETE
395,395,38.4,2023-12-06 13:14:33.602691,2023-12-06 13:14:39.003392,0 days 00:00:05.400701,0.5,0.5,0.0,10,weighted choice,COMPLETE
396,396,36.4,2023-12-06 13:14:39.003609,2023-12-06 13:15:00.870933,0 days 00:00:21.867324,0.0,0.5,,50,roulette wheel,COMPLETE
397,397,38.4,2023-12-06 13:15:00.871182,2023-12-06 13:15:15.154202,0 days 00:00:14.283020,0.6,0.01,0.0,50,weighted choice,COMPLETE
398,398,36.8,2023-12-06 13:15:15.154416,2023-12-06 13:15:15.711247,0 days 00:00:00.556831,0.8,0.5,2.0,50,roulette wheel,COMPLETE
399,399,38.0,2023-12-06 13:15:15.711460,2023-12-06 13:15:52.921260,0 days 00:00:37.209800,0.0,0.0,,50,weighted choice,COMPLETE
400,400,38.0,2023-12-06 13:15:52.921479,2023-12-06 13:16:03.432092,0 days 00:00:10.510613,0.5,0.5,0.0,20,weighted choice,COMPLETE
401,401,37.6,2023-12-06 13:16:03.432327,2023-12-06 13:16:10.926525,0 days 00:00:07.494198,0.0,0.33,,20,roulette wheel,COMPLETE
402,402,38.0,2023-12-06 13:16:10.926742,2023-12-06 13:16:28.523220,0 days 00:00:17.596478,0.0,0.33,,50,roulette wheel,COMPLETE
403,403,36.8,2023-12-06 13:16:28.523437,2023-12-06 13:16:28.934776,0 days 00:00:00.411339,0.5,0.01,4.0,50,random selection,COMPLETE
404,404,41.2,2023-12-06 13:16:28.934991,2023-12-06 13:16:29.338731,0 days 00:00:00.403740,0.8,0.01,2.0,50,weighted choice,COMPLETE
405,405,37.6,2023-12-06 13:16:29.338958,2023-12-06 13:16:29.739816,0 days 00:00:00.400858,0.8,0.1,4.0,10,weighted choice,COMPLETE
406,406,36.8,2023-12-06 13:16:29.740044,2023-12-06 13:16:30.268646,0 days 00:00:00.528602,0.5,0.33,4.0,10,roulette wheel,COMPLETE
407,407,37.6,2023-12-06 13:16:30.268935,2023-12-06 13:16:32.873944,0 days 00:00:02.605009,0.5,0.01,0.0,10,random selection,COMPLETE
408,408,40.8,2023-12-06 13:16:32.874166,2023-12-06 13:16:33.428835,0 days 00:00:00.554669,0.95,0.0,2.0,20,weighted choice,COMPLETE
409,409,38.4,2023-12-06 13:16:33.429038,2023-12-06 13:16:34.022441,0 days 00:00:00.593403,0.6,0.5,2.0,10,random selection,COMPLETE
410,410,37.6,2023-12-06 13:16:34.022654,2023-12-06 13:16:34.405944,0 days 00:00:00.383290,0.6,0.01,4.0,50,random selection,COMPLETE
411,411,38.0,2023-12-06 13:16:34.406179,2023-12-06 13:16:39.076616,0 days 00:00:04.670437,0.8,0.33,0.0,10,weighted choice,COMPLETE
412,412,36.8,2023-12-06 13:16:39.076840,2023-12-06 13:16:39.378162,0 days 00:00:00.301322,0.95,0.01,1.0,100,random selection,COMPLETE
413,413,38.0,2023-12-06 13:16:39.378379,2023-12-06 13:16:39.924097,0 days 00:00:00.545718,0.8,0.5,1.0,20,random selection,COMPLETE
414,414,38.4,2023-12-06 13:16:39.924341,2023-12-06 13:16:40.309488,0 days 00:00:00.385147,0.6,0.1,1.0,20,weighted choice,COMPLETE
415,415,36.4,2023-12-06 13:16:40.309723,2023-12-06 13:17:08.895113,0 days 00:00:28.585390,0.0,0.0,,50,roulette wheel,COMPLETE
416,416,36.8,2023-12-06 13:17:08.895367,2023-12-06 13:17:16.851573,0 days 00:00:07.956206,0.8,0.0,0.0,10,random selection,COMPLETE
417,417,38.0,2023-12-06 13:17:16.851788,2023-12-06 13:17:17.328791,0 days 00:00:00.477003,0.95,0.33,4.0,50,roulette wheel,COMPLETE
418,418,38.0,2023-12-06 13:17:17.329019,2023-12-06 13:17:17.839382,0 days 00:00:00.510363,0.5,0.33,4.0,100,roulette wheel,COMPLETE
419,419,38.0,2023-12-06 13:17:17.839614,2023-12-06 13:17:30.095626,0 days 00:00:12.256012,0.0,0.1,,50,roulette wheel,COMPLETE
420,420,37.6,2023-12-06 13:17:30.095841,2023-12-06 13:17:30.600051,0 days 00:00:00.504210,0.5,0.33,1.0,50,random selection,COMPLETE
421,421,38.0,2023-12-06 13:17:30.600284,2023-12-06 13:17:59.015703,0 days 00:00:28.415419,0.0,0.0,,50,roulette wheel,COMPLETE
422,422,43.6,2023-12-06 13:17:59.015917,2023-12-06 13:17:59.462716,0 days 00:00:00.446799,0.8,0.0,1.0,100,weighted choice,COMPLETE
423,423,38.4,2023-12-06 13:17:59.462945,2023-12-06 13:18:00.020811,0 days 00:00:00.557866,0.5,0.33,4.0,10,weighted choice,COMPLETE
424,424,38.0,2023-12-06 13:18:00.021036,2023-12-06 13:18:00.378636,0 days 00:00:00.357600,0.6,0.1,1.0,20,roulette wheel,COMPLETE
425,425,38.4,2023-12-06 13:18:00.378857,2023-12-06 13:18:00.843526,0 days 00:00:00.464669,0.8,0.33,2.0,100,roulette wheel,COMPLETE
426,426,38.0,2023-12-06 13:18:00.843756,2023-12-06 13:18:06.877896,0 days 00:00:06.034140,0.5,0.1,0.0,20,roulette wheel,COMPLETE
427,427,36.8,2023-12-06 13:18:06.878117,2023-12-06 13:18:07.382823,0 days 00:00:00.504706,0.6,0.33,4.0,10,roulette wheel,COMPLETE
428,428,37.2,2023-12-06 13:18:07.383053,2023-12-06 13:19:00.560632,0 days 00:00:53.177579,0.0,0.0,,100,random selection,COMPLETE
429,429,37.6,2023-12-06 13:19:00.560848,2023-12-06 13:19:01.012837,0 days 00:00:00.451989,0.95,0.33,2.0,50,random selection,COMPLETE
430,430,37.6,2023-12-06 13:19:01.013081,2023-12-06 13:19:01.187030,0 days 00:00:00.173949,0.95,0.0,2.0,100,random selection,COMPLETE
431,431,37.6,2023-12-06 13:19:01.187251,2023-12-06 13:19:06.147978,0 days 00:00:04.960727,0.0,0.01,,20,weighted choice,COMPLETE
432,432,37.2,2023-12-06 13:19:06.148403,2023-12-06 13:19:18.365463,0 days 00:00:12.217060,0.0,0.1,,50,roulette wheel,COMPLETE
433,433,37.2,2023-12-06 13:19:18.365694,2023-12-06 13:19:30.212549,0 days 00:00:11.846855,0.0,0.0,,20,roulette wheel,COMPLETE
434,434,37.2,2023-12-06 13:19:30.212748,2023-12-06 13:20:06.605899,0 days 00:00:36.393151,0.6,0.33,0.0,100,roulette wheel,COMPLETE
435,435,37.2,2023-12-06 13:20:06.606143,2023-12-06 13:20:07.003589,0 days 00:00:00.397446,0.6,0.1,1.0,10,weighted choice,COMPLETE
436,436,37.6,2023-12-06 13:20:07.003830,2023-12-06 13:20:21.469667,0 days 00:00:14.465837,0.0,0.1,,50,weighted choice,COMPLETE
437,437,38.0,2023-12-06 13:20:21.469885,2023-12-06 13:20:21.810249,0 days 00:00:00.340364,0.95,0.1,2.0,20,random selection,COMPLETE
438,438,40.4,2023-12-06 13:20:21.810471,2023-12-06 13:20:22.175500,0 days 00:00:00.365029,0.8,0.01,1.0,20,roulette wheel,COMPLETE
439,439,38.0,2023-12-06 13:20:22.175730,2023-12-06 13:20:22.551852,0 days 00:00:00.376122,0.8,0.1,2.0,10,weighted choice,COMPLETE
440,440,36.8,2023-12-06 13:20:22.552087,2023-12-06 13:20:23.173788,0 days 00:00:00.621701,0.6,0.5,1.0,50,weighted choice,COMPLETE
441,441,38.0,2023-12-06 13:20:23.174025,2023-12-06 13:20:32.285573,0 days 00:00:09.111548,0.0,0.5,,20,roulette wheel,COMPLETE
442,442,40.8,2023-12-06 13:20:32.285870,2023-12-06 13:20:32.766572,0 days 00:00:00.480702,0.5,0.01,1.0,50,weighted choice,COMPLETE
443,443,37.2,2023-12-06 13:20:32.766808,2023-12-06 13:20:33.239349,0 days 00:00:00.472541,0.95,0.33,4.0,10,random selection,COMPLETE
444,444,41.6,2023-12-06 13:20:33.239568,2023-12-06 13:20:33.574216,0 days 00:00:00.334648,0.8,0.01,2.0,50,roulette wheel,COMPLETE
445,445,36.8,2023-12-06 13:20:33.574429,2023-12-06 13:20:34.256874,0 days 00:00:00.682445,0.5,0.0,1.0,20,random selection,COMPLETE
446,446,37.6,2023-12-06 13:20:34.257112,2023-12-06 13:20:34.636611,0 days 00:00:00.379499,0.5,0.1,4.0,10,random selection,COMPLETE
447,447,37.2,2023-12-06 13:20:34.636841,2023-12-06 13:20:52.908750,0 days 00:00:18.271909,0.0,0.01,,100,random selection,COMPLETE
448,448,35.6,2023-12-06 13:20:52.908965,2023-12-06 13:20:53.108827,0 days 00:00:00.199862,0.8,0.0,1.0,100,random selection,COMPLETE
449,449,37.6,2023-12-06 13:20:53.109058,2023-12-06 13:21:31.337080,0 days 00:00:38.228022,0.0,0.33,,100,weighted choice,COMPLETE
450,450,38.0,2023-12-06 13:21:31.337294,2023-12-06 13:21:39.966161,0 days 00:00:08.628867,0.95,0.33,0.0,20,roulette wheel,COMPLETE
451,451,39.2,2023-12-06 13:21:39.966443,2023-12-06 13:21:40.706145,0 days 00:00:00.739702,0.5,0.0,4.0,10,weighted choice,COMPLETE
452,452,37.2,2023-12-06 13:21:40.706382,2023-12-06 13:21:45.347790,0 days 00:00:04.641408,0.0,0.5,,10,roulette wheel,COMPLETE
453,453,38.0,2023-12-06 13:21:45.348005,2023-12-06 13:21:45.777970,0 days 00:00:00.429965,0.5,0.1,2.0,50,weighted choice,COMPLETE
454,454,37.2,2023-12-06 13:21:45.778192,2023-12-06 13:21:50.416530,0 days 00:00:04.638338,0.0,0.5,,10,random selection,COMPLETE
455,455,40.8,2023-12-06 13:21:50.416740,2023-12-06 13:21:50.828811,0 days 00:00:00.412071,0.6,0.01,2.0,20,roulette wheel,COMPLETE
456,456,38.0,2023-12-06 13:21:50.829028,2023-12-06 13:21:53.399827,0 days 00:00:02.570799,0.0,0.01,,10,weighted choice,COMPLETE
457,457,38.0,2023-12-06 13:21:53.400042,2023-12-06 13:21:53.766596,0 days 00:00:00.366554,0.8,0.1,4.0,10,roulette wheel,COMPLETE
458,458,37.2,2023-12-06 13:21:53.766816,2023-12-06 13:21:54.105513,0 days 00:00:00.338697,0.8,0.1,2.0,20,roulette wheel,COMPLETE
459,459,37.6,2023-12-06 13:21:54.105747,2023-12-06 13:22:47.472436,0 days 00:00:53.366689,0.0,0.0,,100,random selection,COMPLETE
460,460,37.6,2023-12-06 13:22:47.472685,2023-12-06 13:22:47.810582,0 days 00:00:00.337897,0.95,0.1,2.0,20,random selection,COMPLETE
461,461,36.0,2023-12-06 13:22:47.810819,2023-12-06 13:22:48.381099,0 days 00:00:00.570280,0.6,0.0,2.0,20,random selection,COMPLETE
462,462,41.6,2023-12-06 13:22:48.381335,2023-12-06 13:22:48.869444,0 days 00:00:00.488109,0.95,0.0,1.0,20,roulette wheel,COMPLETE
463,463,38.0,2023-12-06 13:22:48.869679,2023-12-06 13:22:55.953627,0 days 00:00:07.083948,0.0,0.0,,10,weighted choice,COMPLETE
464,464,36.4,2023-12-06 13:22:55.953844,2023-12-06 13:22:56.434112,0 days 00:00:00.480268,0.8,0.0,4.0,10,random selection,COMPLETE
465,465,37.2,2023-12-06 13:22:56.434334,2023-12-06 13:22:56.895202,0 days 00:00:00.460868,0.8,0.33,2.0,10,roulette wheel,COMPLETE
466,466,37.2,2023-12-06 13:22:56.895431,2023-12-06 13:22:57.485602,0 days 00:00:00.590171,0.5,0.5,1.0,50,roulette wheel,COMPLETE
467,467,36.4,2023-12-06 13:22:57.485831,2023-12-06 13:22:57.936793,0 days 00:00:00.450962,0.8,0.33,1.0,20,random selection,COMPLETE
468,468,37.2,2023-12-06 13:22:57.937027,2023-12-06 13:22:58.277207,0 days 00:00:00.340180,0.95,0.1,2.0,10,roulette wheel,COMPLETE
469,469,36.8,2023-12-06 13:22:58.277427,2023-12-06 13:23:14.567471,0 days 00:00:16.290044,0.95,0.0,0.0,20,roulette wheel,COMPLETE
470,470,38.0,2023-12-06 13:23:14.567708,2023-12-06 13:23:24.875515,0 days 00:00:10.307807,0.0,0.01,,50,roulette wheel,COMPLETE
471,471,38.4,2023-12-06 13:23:24.875733,2023-12-06 13:23:28.978184,0 days 00:00:04.102451,0.0,0.33,,10,weighted choice,COMPLETE
472,472,37.6,2023-12-06 13:23:28.978400,2023-12-06 13:23:29.359285,0 days 00:00:00.380885,0.5,0.1,4.0,100,random selection,COMPLETE
473,473,37.6,2023-12-06 13:23:29.359533,2023-12-06 13:23:32.052314,0 days 00:00:02.692781,0.0,0.1,,10,roulette wheel,COMPLETE
474,474,38.4,2023-12-06 13:23:32.052530,2023-12-06 13:23:32.573717,0 days 00:00:00.521187,0.8,0.33,4.0,10,weighted choice,COMPLETE
475,475,36.4,2023-12-06 13:23:32.573939,2023-12-06 13:23:46.620953,0 days 00:00:14.047014,0.0,0.0,,20,weighted choice,COMPLETE
476,476,41.2,2023-12-06 13:23:46.621187,2023-12-06 13:23:47.268613,0 days 00:00:00.647426,0.5,0.0,2.0,20,roulette wheel,COMPLETE
477,477,37.6,2023-12-06 13:23:47.268843,2023-12-06 13:23:47.758000,0 days 00:00:00.489157,0.6,0.33,2.0,10,roulette wheel,COMPLETE
478,478,37.6,2023-12-06 13:23:47.758237,2023-12-06 13:24:14.052784,0 days 00:00:26.294547,0.95,0.5,0.0,50,weighted choice,COMPLETE
479,479,37.6,2023-12-06 13:24:14.053030,2023-12-06 13:24:14.509670,0 days 00:00:00.456640,0.95,0.33,2.0,100,random selection,COMPLETE
480,480,40.8,2023-12-06 13:24:14.509901,2023-12-06 13:24:15.009617,0 days 00:00:00.499716,0.8,0.0,4.0,10,roulette wheel,COMPLETE
481,481,37.2,2023-12-06 13:24:15.009838,2023-12-06 13:24:15.593621,0 days 00:00:00.583783,0.5,0.5,2.0,50,random selection,COMPLETE
482,482,38.4,2023-12-06 13:24:15.593859,2023-12-06 13:24:16.162202,0 days 00:00:00.568343,0.95,0.5,2.0,20,weighted choice,COMPLETE
483,483,37.6,2023-12-06 13:24:16.162429,2023-12-06 13:24:16.714343,0 days 00:00:00.551914,0.8,0.5,4.0,100,random selection,COMPLETE
484,484,37.2,2023-12-06 13:24:16.714571,2023-12-06 13:24:17.039736,0 days 00:00:00.325165,0.95,0.1,1.0,20,random selection,COMPLETE
485,485,40.8,2023-12-06 13:24:17.039968,2023-12-06 13:24:17.499754,0 days 00:00:00.459786,0.6,0.01,2.0,20,weighted choice,COMPLETE
486,486,37.2,2023-12-06 13:24:17.499990,2023-12-06 13:24:18.092965,0 days 00:00:00.592975,0.5,0.5,2.0,20,roulette wheel,COMPLETE
487,487,38.4,2023-12-06 13:24:18.093186,2023-12-06 13:24:18.571867,0 days 00:00:00.478681,0.8,0.33,4.0,50,roulette wheel,COMPLETE
488,488,38.0,2023-12-06 13:24:18.572077,2023-12-06 13:24:57.114117,0 days 00:00:38.542040,0.0,0.5,,100,roulette wheel,COMPLETE
489,489,37.6,2023-12-06 13:24:57.114351,2023-12-06 13:25:00.035433,0 days 00:00:02.921082,0.6,0.01,0.0,10,weighted choice,COMPLETE
490,490,41.2,2023-12-06 13:25:00.035659,2023-12-06 13:25:00.409094,0 days 00:00:00.373435,0.95,0.01,4.0,50,weighted choice,COMPLETE
491,491,37.6,2023-12-06 13:25:00.409328,2023-12-06 13:25:09.487966,0 days 00:00:09.078638,0.0,0.5,,20,roulette wheel,COMPLETE
492,492,36.0,2023-12-06 13:25:09.488174,2023-12-06 13:25:10.026445,0 days 00:00:00.538271,0.8,0.0,2.0,10,random selection,COMPLETE
493,493,37.2,2023-12-06 13:25:10.026668,2023-12-06 13:25:10.628439,0 days 00:00:00.601771,0.6,0.5,4.0,20,roulette wheel,COMPLETE
494,494,37.2,2023-12-06 13:25:10.628673,2023-12-06 13:25:32.210538,0 days 00:00:21.581865,0.0,0.5,,50,roulette wheel,COMPLETE
495,495,38.0,2023-12-06 13:25:32.210908,2023-12-06 13:25:32.604852,0 days 00:00:00.393944,0.6,0.1,1.0,10,weighted choice,COMPLETE
496,496,40.4,2023-12-06 13:25:32.605077,2023-12-06 13:25:33.103294,0 days 00:00:00.498217,0.8,0.0,4.0,10,roulette wheel,COMPLETE
497,497,37.6,2023-12-06 13:25:33.103514,2023-12-06 13:25:33.671317,0 days 00:00:00.567803,0.6,0.5,2.0,20,random selection,COMPLETE
498,498,36.4,2023-12-06 13:25:33.671559,2023-12-06 13:25:34.262237,0 days 00:00:00.590678,0.5,0.5,1.0,50,random selection,COMPLETE
499,499,43.2,2023-12-06 13:25:34.262497,2023-12-06 13:25:34.645987,0 days 00:00:00.383490,0.95,0.0,1.0,50,roulette wheel,COMPLETE
500,500,39.2,2023-12-06 13:25:34.646233,2023-12-06 13:25:35.139349,0 days 00:00:00.493116,0.95,0.0,2.0,10,roulette wheel,COMPLETE
501,501,41.2,2023-12-06 13:25:35.139576,2023-12-06 13:25:35.850709,0 days 00:00:00.711133,0.5,0.0,1.0,20,roulette wheel,COMPLETE
502,502,37.2,2023-12-06 13:25:35.850929,2023-12-06 13:25:36.413171,0 days 00:00:00.562242,0.95,0.5,1.0,10,weighted choice,COMPLETE
503,503,36.4,2023-12-06 13:25:36.413436,2023-12-06 13:25:42.599110,0 days 00:00:06.185674,0.8,0.1,0.0,20,random selection,COMPLETE
504,504,36.4,2023-12-06 13:25:42.599343,2023-12-06 13:25:45.155223,0 days 00:00:02.555880,0.0,0.01,,10,weighted choice,COMPLETE
