,number,value,datetime_start,datetime_complete,duration,params_C,params_M,params_N,params_P,params_S,state
1996,1996,38.0,2023-12-07 12:43:35.847950,2023-12-07 12:44:04.473901,0 days 00:00:28.625951,0.0,0.1,,300,random selection,COMPLETE
1997,1997,40.8,2023-12-07 12:44:04.474132,2023-12-07 12:44:04.654819,0 days 00:00:00.180687,0.8,0.0,1.0,300,roulette wheel,COMPLETE
1998,1998,37.2,2023-12-07 12:44:04.655015,2023-12-07 12:44:04.987819,0 days 00:00:00.332804,0.8,0.1,1.0,300,roulette wheel,COMPLETE
1999,1999,38.4,2023-12-07 12:44:04.988032,2023-12-07 12:44:05.347541,0 days 00:00:00.359509,0.5,0.1,2.0,300,roulette wheel,COMPLETE
2000,2000,42.8,2023-12-07 12:44:05.347729,2023-12-07 12:44:05.541618,0 days 00:00:00.193889,0.8,0.0,2.0,250,roulette wheel,COMPLETE
2001,2001,42.8,2023-12-07 12:44:05.541836,2023-12-07 12:44:05.801628,0 days 00:00:00.259792,0.5,0.0,1.0,250,roulette wheel,COMPLETE
2002,2002,38.4,2023-12-07 12:44:05.801829,2023-12-07 12:44:06.135065,0 days 00:00:00.333236,0.95,0.1,1.0,250,random selection,COMPLETE
2003,2003,36.4,2023-12-07 12:44:06.135271,2023-12-07 12:44:06.690979,0 days 00:00:00.555708,0.8,0.5,2.0,250,roulette wheel,COMPLETE
2004,2004,37.6,2023-12-07 12:44:06.691191,2023-12-07 12:44:40.569470,0 days 00:00:33.878279,0.8,0.01,0.0,300,roulette wheel,COMPLETE
2005,2005,41.6,2023-12-07 12:44:40.569737,2023-12-07 12:44:40.855417,0 days 00:00:00.285680,0.5,0.0,4.0,300,roulette wheel,COMPLETE
2006,2006,40.8,2023-12-07 12:44:40.855611,2023-12-07 12:44:41.392799,0 days 00:00:00.537188,0.6,0.01,2.0,300,weighted choice,COMPLETE
2007,2007,36.4,2023-12-07 12:44:41.393027,2023-12-07 12:44:41.658597,0 days 00:00:00.265570,0.5,0.0,1.0,250,random selection,COMPLETE
2008,2008,39.2,2023-12-07 12:44:41.658797,2023-12-07 12:44:42.020584,0 days 00:00:00.361787,0.5,0.01,1.0,250,roulette wheel,COMPLETE
2009,2009,40.4,2023-12-07 12:44:42.020782,2023-12-07 12:44:42.228348,0 days 00:00:00.207566,0.8,0.0,4.0,300,roulette wheel,COMPLETE
2010,2010,37.2,2023-12-07 12:44:42.228545,2023-12-07 12:44:42.697478,0 days 00:00:00.468933,0.95,0.33,4.0,300,random selection,COMPLETE
2011,2011,36.8,2023-12-07 12:44:42.697681,2023-12-07 12:44:42.996948,0 days 00:00:00.299267,0.8,0.01,1.0,250,random selection,COMPLETE
2012,2012,37.6,2023-12-07 12:44:42.997165,2023-12-07 12:46:49.715288,0 days 00:02:06.718123,0.0,0.0,,250,roulette wheel,COMPLETE
2013,2013,38.0,2023-12-07 12:46:49.715592,2023-12-07 12:48:35.104460,0 days 00:01:45.388868,0.5,0.0,0.0,300,roulette wheel,COMPLETE
2014,2014,37.6,2023-12-07 12:48:35.104674,2023-12-07 12:49:41.800628,0 days 00:01:06.695954,0.5,0.5,0.0,300,roulette wheel,COMPLETE
2015,2015,39.6,2023-12-07 12:49:41.800895,2023-12-07 12:49:42.115106,0 days 00:00:00.314211,0.95,0.01,4.0,300,roulette wheel,COMPLETE
2016,2016,40.0,2023-12-07 12:49:42.115305,2023-12-07 12:49:42.433571,0 days 00:00:00.318266,0.8,0.01,2.0,250,roulette wheel,COMPLETE
2017,2017,37.6,2023-12-07 12:49:42.433770,2023-12-07 12:49:42.756615,0 days 00:00:00.322845,0.95,0.1,1.0,300,random selection,COMPLETE
2018,2018,37.2,2023-12-07 12:49:42.756828,2023-12-07 12:50:14.471163,0 days 00:00:31.714335,0.0,0.1,,250,random selection,COMPLETE
2019,2019,42.4,2023-12-07 12:50:14.471490,2023-12-07 12:50:14.929663,0 days 00:00:00.458173,0.6,0.0,4.0,250,weighted choice,COMPLETE
2020,2020,39.6,2023-12-07 12:50:14.929875,2023-12-07 12:50:15.212016,0 days 00:00:00.282141,0.95,0.01,1.0,250,roulette wheel,COMPLETE
2021,2021,36.4,2023-12-07 12:50:15.212210,2023-12-07 12:50:15.717339,0 days 00:00:00.505129,0.5,0.33,4.0,300,random selection,COMPLETE
2022,2022,38.0,2023-12-07 12:50:15.717548,2023-12-07 12:50:16.059195,0 days 00:00:00.341647,0.95,0.1,2.0,300,roulette wheel,COMPLETE
2023,2023,38.0,2023-12-07 12:50:16.059393,2023-12-07 12:50:16.585815,0 days 00:00:00.526422,0.5,0.1,1.0,300,weighted choice,COMPLETE
2024,2024,37.6,2023-12-07 12:50:16.586019,2023-12-07 12:51:05.080186,0 days 00:00:48.494167,0.0,0.5,,300,random selection,COMPLETE
2025,2025,38.4,2023-12-07 12:51:05.080489,2023-12-07 12:51:05.410353,0 days 00:00:00.329864,0.95,0.1,1.0,300,roulette wheel,COMPLETE
2026,2026,41.2,2023-12-07 12:51:05.410571,2023-12-07 12:51:05.570908,0 days 00:00:00.160337,0.95,0.0,1.0,300,roulette wheel,COMPLETE
2027,2027,40.4,2023-12-07 12:51:05.571102,2023-12-07 12:51:05.918747,0 days 00:00:00.347645,0.6,0.01,2.0,250,roulette wheel,COMPLETE
2028,2028,37.6,2023-12-07 12:51:05.918935,2023-12-07 12:51:06.541389,0 days 00:00:00.622454,0.6,0.33,4.0,250,weighted choice,COMPLETE
2029,2029,41.6,2023-12-07 12:51:06.541589,2023-12-07 12:51:06.715595,0 days 00:00:00.174006,0.95,0.0,2.0,250,roulette wheel,COMPLETE
2030,2030,40.8,2023-12-07 12:51:06.715779,2023-12-07 12:51:06.925910,0 days 00:00:00.210131,0.8,0.0,4.0,300,roulette wheel,COMPLETE
2031,2031,40.4,2023-12-07 12:51:06.926099,2023-12-07 12:51:07.237255,0 days 00:00:00.311156,0.95,0.01,4.0,300,roulette wheel,COMPLETE
2032,2032,41.2,2023-12-07 12:51:07.237441,2023-12-07 12:51:07.486954,0 days 00:00:00.249513,0.6,0.0,4.0,250,roulette wheel,COMPLETE
2033,2033,36.8,2023-12-07 12:51:07.487142,2023-12-07 12:51:08.052989,0 days 00:00:00.565847,0.6,0.5,1.0,250,roulette wheel,COMPLETE
2034,2034,38.8,2023-12-07 12:51:08.053200,2023-12-07 12:51:08.619471,0 days 00:00:00.566271,0.8,0.5,4.0,250,roulette wheel,COMPLETE
2035,2035,36.4,2023-12-07 12:51:08.619673,2023-12-07 12:51:08.850311,0 days 00:00:00.230638,0.6,0.0,2.0,250,random selection,COMPLETE
2036,2036,36.8,2023-12-07 12:51:08.850502,2023-12-07 12:52:02.727004,0 days 00:00:53.876502,0.0,0.33,,300,roulette wheel,COMPLETE
2037,2037,37.2,2023-12-07 12:52:02.727205,2023-12-07 12:52:02.997128,0 days 00:00:00.269923,0.6,0.0,2.0,300,random selection,COMPLETE
2038,2038,37.6,2023-12-07 12:52:02.997349,2023-12-07 12:52:03.488776,0 days 00:00:00.491427,0.8,0.33,1.0,250,roulette wheel,COMPLETE
2039,2039,38.0,2023-12-07 12:52:03.488976,2023-12-07 12:53:07.797745,0 days 00:01:04.308769,0.0,0.5,,250,roulette wheel,COMPLETE
2040,2040,37.2,2023-12-07 12:53:07.797976,2023-12-07 12:53:08.255054,0 days 00:00:00.457078,0.8,0.33,1.0,250,roulette wheel,COMPLETE
2041,2041,40.4,2023-12-07 12:53:08.255257,2023-12-07 12:53:08.772735,0 days 00:00:00.517478,0.6,0.01,2.0,250,weighted choice,COMPLETE
2042,2042,40.4,2023-12-07 12:53:08.772937,2023-12-07 12:53:09.121732,0 days 00:00:00.348795,0.6,0.01,2.0,250,roulette wheel,COMPLETE
2043,2043,38.0,2023-12-07 12:53:09.121938,2023-12-07 12:53:09.492497,0 days 00:00:00.370559,0.5,0.1,2.0,300,roulette wheel,COMPLETE
2044,2044,36.8,2023-12-07 12:53:09.492703,2023-12-07 12:55:08.014667,0 days 00:01:58.521964,0.0,0.0,,250,random selection,COMPLETE
2045,2045,37.2,2023-12-07 12:55:08.014922,2023-12-07 12:55:53.713401,0 days 00:00:45.698479,0.95,0.1,0.0,300,roulette wheel,COMPLETE
2046,2046,38.4,2023-12-07 12:55:53.713610,2023-12-07 12:55:54.216579,0 days 00:00:00.502969,0.5,0.1,2.0,250,weighted choice,COMPLETE
2047,2047,36.8,2023-12-07 12:55:54.216783,2023-12-07 12:57:42.534543,0 days 00:01:48.317760,0.5,0.0,0.0,250,roulette wheel,COMPLETE
2048,2048,36.8,2023-12-07 12:57:42.534742,2023-12-07 12:57:42.914376,0 days 00:00:00.379634,0.5,0.1,4.0,250,random selection,COMPLETE
2049,2049,38.4,2023-12-07 12:57:42.914568,2023-12-07 12:57:43.606417,0 days 00:00:00.691849,0.6,0.5,1.0,250,weighted choice,COMPLETE
2050,2050,39.6,2023-12-07 12:57:43.606625,2023-12-07 12:57:43.919268,0 days 00:00:00.312643,0.8,0.01,2.0,250,roulette wheel,COMPLETE
2051,2051,40.0,2023-12-07 12:57:43.919491,2023-12-07 12:57:44.217294,0 days 00:00:00.297803,0.8,0.01,1.0,250,roulette wheel,COMPLETE
2052,2052,37.6,2023-12-07 12:57:44.217491,2023-12-07 12:57:44.588890,0 days 00:00:00.371399,0.5,0.1,4.0,250,roulette wheel,COMPLETE
2053,2053,38.0,2023-12-07 12:57:44.589084,2023-12-07 13:00:01.647485,0 days 00:02:17.058401,0.0,0.0,,300,random selection,COMPLETE
2054,2054,38.4,2023-12-07 13:00:01.647875,2023-12-07 13:00:49.977405,0 days 00:00:48.329530,0.0,0.5,,250,random selection,COMPLETE
2055,2055,37.2,2023-12-07 13:00:49.977665,2023-12-07 13:01:45.193195,0 days 00:00:55.215530,0.0,0.33,,300,roulette wheel,COMPLETE
2056,2056,37.6,2023-12-07 13:01:45.193391,2023-12-07 13:02:23.262670,0 days 00:00:38.069279,0.5,0.01,0.0,250,roulette wheel,COMPLETE
2057,2057,38.0,2023-12-07 13:02:23.262889,2023-12-07 13:03:10.407507,0 days 00:00:47.144618,0.6,0.1,0.0,300,roulette wheel,COMPLETE
2058,2058,40.0,2023-12-07 13:03:10.407715,2023-12-07 13:03:10.842567,0 days 00:00:00.434852,0.95,0.01,2.0,300,weighted choice,COMPLETE
2059,2059,37.6,2023-12-07 13:03:10.842782,2023-12-07 13:03:11.319708,0 days 00:00:00.476926,0.6,0.1,1.0,250,weighted choice,COMPLETE
2060,2060,37.6,2023-12-07 13:03:11.319904,2023-12-07 13:03:11.807024,0 days 00:00:00.487120,0.6,0.33,1.0,300,roulette wheel,COMPLETE
2061,2061,38.4,2023-12-07 13:03:11.807250,2023-12-07 13:05:39.923950,0 days 00:02:28.116700,0.0,0.0,,300,roulette wheel,COMPLETE
2062,2062,37.2,2023-12-07 13:05:39.924148,2023-12-07 13:05:40.479205,0 days 00:00:00.555057,0.6,0.5,1.0,250,random selection,COMPLETE
2063,2063,38.0,2023-12-07 13:05:40.479413,2023-12-07 13:05:40.652435,0 days 00:00:00.173022,0.8,0.0,1.0,300,random selection,COMPLETE
2064,2064,37.6,2023-12-07 13:05:40.652641,2023-12-07 13:06:46.661609,0 days 00:01:06.008968,0.95,0.1,0.0,300,weighted choice,COMPLETE
2065,2065,40.0,2023-12-07 13:06:46.661811,2023-12-07 13:06:47.187105,0 days 00:00:00.525294,0.6,0.01,2.0,250,weighted choice,COMPLETE
2066,2066,38.0,2023-12-07 13:06:47.187305,2023-12-07 13:11:45.503468,0 days 00:04:58.316163,0.0,0.0,,300,weighted choice,COMPLETE
2067,2067,38.4,2023-12-07 13:11:45.503669,2023-12-07 13:11:45.990810,0 days 00:00:00.487141,0.95,0.1,2.0,300,weighted choice,COMPLETE
2068,2068,38.0,2023-12-07 13:11:45.991025,2023-12-07 13:12:19.193527,0 days 00:00:33.202502,0.5,0.1,0.0,300,random selection,COMPLETE
2069,2069,37.2,2023-12-07 13:12:19.193771,2023-12-07 13:13:27.178049,0 days 00:01:07.984278,0.0,0.01,,300,weighted choice,COMPLETE
2070,2070,37.2,2023-12-07 13:13:27.178247,2023-12-07 13:14:31.927149,0 days 00:01:04.748902,0.0,0.5,,250,roulette wheel,COMPLETE
2071,2071,37.6,2023-12-07 13:14:31.927349,2023-12-07 13:14:32.733497,0 days 00:00:00.806148,0.5,0.5,4.0,300,weighted choice,COMPLETE
2072,2072,37.6,2023-12-07 13:14:32.733695,2023-12-07 13:14:33.325041,0 days 00:00:00.591346,0.95,0.5,4.0,250,roulette wheel,COMPLETE
2073,2073,41.6,2023-12-07 13:14:33.325263,2023-12-07 13:14:33.505291,0 days 00:00:00.180028,0.95,0.0,2.0,250,roulette wheel,COMPLETE
2074,2074,38.0,2023-12-07 13:14:33.505508,2023-12-07 13:14:34.199693,0 days 00:00:00.694185,0.8,0.5,2.0,300,weighted choice,COMPLETE
2075,2075,42.8,2023-12-07 13:14:34.199891,2023-12-07 13:14:34.465133,0 days 00:00:00.265242,0.5,0.0,2.0,300,roulette wheel,COMPLETE
2076,2076,37.2,2023-12-07 13:14:34.465342,2023-12-07 13:15:14.768081,0 days 00:00:40.302739,0.95,0.01,0.0,300,roulette wheel,COMPLETE
2077,2077,38.8,2023-12-07 13:15:14.768291,2023-12-07 13:15:15.144566,0 days 00:00:00.376275,0.5,0.1,1.0,300,roulette wheel,COMPLETE
2078,2078,38.0,2023-12-07 13:15:15.144777,2023-12-07 13:15:15.755838,0 days 00:00:00.611061,0.5,0.5,1.0,250,roulette wheel,COMPLETE
2079,2079,38.4,2023-12-07 13:15:15.756047,2023-12-07 13:15:16.244872,0 days 00:00:00.488825,0.95,0.1,2.0,250,weighted choice,COMPLETE
2080,2080,38.0,2023-12-07 13:15:16.245076,2023-12-07 13:15:16.598603,0 days 00:00:00.353527,0.8,0.1,2.0,300,roulette wheel,COMPLETE
2081,2081,37.2,2023-12-07 13:15:16.598802,2023-12-07 13:15:17.102622,0 days 00:00:00.503820,0.5,0.33,2.0,250,random selection,COMPLETE
2082,2082,37.2,2023-12-07 13:15:17.102838,2023-12-07 13:15:17.364787,0 days 00:00:00.261949,0.5,0.0,2.0,300,random selection,COMPLETE
2083,2083,36.8,2023-12-07 13:15:17.364999,2023-12-07 13:15:17.557023,0 days 00:00:00.192024,0.8,0.0,2.0,250,random selection,COMPLETE
2084,2084,37.6,2023-12-07 13:15:17.557235,2023-12-07 13:15:18.067820,0 days 00:00:00.510585,0.6,0.33,4.0,250,roulette wheel,COMPLETE
2085,2085,38.0,2023-12-07 13:15:18.068042,2023-12-07 13:16:52.560810,0 days 00:01:34.492768,0.8,0.5,0.0,250,weighted choice,COMPLETE
2086,2086,37.6,2023-12-07 13:16:52.561021,2023-12-07 13:19:22.907221,0 days 00:02:30.346200,0.0,0.0,,300,roulette wheel,COMPLETE
2087,2087,41.2,2023-12-07 13:19:22.907433,2023-12-07 13:19:23.101904,0 days 00:00:00.194471,0.8,0.0,2.0,300,roulette wheel,COMPLETE
2088,2088,40.4,2023-12-07 13:19:23.102095,2023-12-07 13:19:23.442834,0 days 00:00:00.340739,0.6,0.01,1.0,300,roulette wheel,COMPLETE
2089,2089,37.2,2023-12-07 13:19:23.443040,2023-12-07 13:20:43.986255,0 days 00:01:20.543215,0.8,0.0,0.0,250,random selection,COMPLETE
2090,2090,37.6,2023-12-07 13:20:43.986464,2023-12-07 13:20:44.352071,0 days 00:00:00.365607,0.8,0.1,4.0,250,random selection,COMPLETE
2091,2091,38.8,2023-12-07 13:20:44.352281,2023-12-07 13:20:44.968030,0 days 00:00:00.615749,0.5,0.5,2.0,250,roulette wheel,COMPLETE
2092,2092,38.0,2023-12-07 13:20:44.968252,2023-12-07 13:21:41.601776,0 days 00:00:56.633524,0.0,0.1,,250,weighted choice,COMPLETE
2093,2093,37.2,2023-12-07 13:21:41.602052,2023-12-07 13:21:42.188279,0 days 00:00:00.586227,0.6,0.5,4.0,300,random selection,COMPLETE
2094,2094,37.6,2023-12-07 13:21:42.188506,2023-12-07 13:23:14.273095,0 days 00:01:32.084589,0.95,0.5,0.0,300,weighted choice,COMPLETE
2095,2095,37.6,2023-12-07 13:23:14.273315,2023-12-07 13:23:49.630271,0 days 00:00:35.356956,0.0,0.1,,250,roulette wheel,COMPLETE
2096,2096,40.8,2023-12-07 13:23:49.630491,2023-12-07 13:23:49.970375,0 days 00:00:00.339884,0.6,0.01,1.0,250,roulette wheel,COMPLETE
2097,2097,40.4,2023-12-07 13:23:49.970571,2023-12-07 13:23:50.358789,0 days 00:00:00.388218,0.5,0.01,4.0,250,roulette wheel,COMPLETE
2098,2098,38.0,2023-12-07 13:23:50.358995,2023-12-07 13:24:44.541004,0 days 00:00:54.182009,0.0,0.1,,300,weighted choice,COMPLETE
2099,2099,38.4,2023-12-07 13:24:44.541324,2023-12-07 13:24:45.035769,0 days 00:00:00.494445,0.6,0.33,2.0,300,roulette wheel,COMPLETE
2100,2100,38.4,2023-12-07 13:24:45.035985,2023-12-07 13:24:45.393668,0 days 00:00:00.357683,0.5,0.1,1.0,300,roulette wheel,COMPLETE
2101,2101,38.8,2023-12-07 13:24:45.393863,2023-12-07 13:24:45.992509,0 days 00:00:00.598646,0.5,0.01,4.0,300,weighted choice,COMPLETE
2102,2102,38.0,2023-12-07 13:24:45.992727,2023-12-07 13:24:46.720913,0 days 00:00:00.728186,0.6,0.5,4.0,300,weighted choice,COMPLETE
2103,2103,38.0,2023-12-07 13:24:46.721121,2023-12-07 13:24:47.078605,0 days 00:00:00.357484,0.5,0.1,1.0,300,random selection,COMPLETE
2104,2104,37.2,2023-12-07 13:24:47.078808,2023-12-07 13:27:29.619275,0 days 00:02:42.540467,0.95,0.0,0.0,250,weighted choice,COMPLETE
2105,2105,38.4,2023-12-07 13:27:29.619602,2023-12-07 13:27:30.156449,0 days 00:00:00.536847,0.8,0.5,1.0,300,roulette wheel,COMPLETE
2106,2106,38.4,2023-12-07 13:27:30.156660,2023-12-07 13:28:06.341849,0 days 00:00:36.185189,0.8,0.01,0.0,300,roulette wheel,COMPLETE
2107,2107,38.0,2023-12-07 13:28:06.342119,2023-12-07 13:28:06.595617,0 days 00:00:00.253498,0.5,0.0,2.0,300,random selection,COMPLETE
2108,2108,39.6,2023-12-07 13:28:06.595850,2023-12-07 13:29:18.744830,0 days 00:01:12.148980,0.0,0.5,,300,roulette wheel,COMPLETE
2109,2109,38.0,2023-12-07 13:29:18.745111,2023-12-07 13:29:19.460441,0 days 00:00:00.715330,0.8,0.5,4.0,300,weighted choice,COMPLETE
2110,2110,36.8,2023-12-07 13:29:19.460665,2023-12-07 13:29:20.067349,0 days 00:00:00.606684,0.5,0.5,4.0,250,roulette wheel,COMPLETE
2111,2111,36.8,2023-12-07 13:29:20.067558,2023-12-07 13:29:20.656442,0 days 00:00:00.588884,0.8,0.33,1.0,300,weighted choice,COMPLETE
2112,2112,37.6,2023-12-07 13:29:20.656657,2023-12-07 13:29:21.196774,0 days 00:00:00.540117,0.8,0.5,2.0,300,random selection,COMPLETE
2113,2113,38.0,2023-12-07 13:29:21.196982,2023-12-07 13:31:06.774371,0 days 00:01:45.577389,0.8,0.0,0.0,300,roulette wheel,COMPLETE
2114,2114,37.2,2023-12-07 13:31:06.774585,2023-12-07 13:31:07.275111,0 days 00:00:00.500526,0.6,0.33,2.0,250,roulette wheel,COMPLETE
2115,2115,37.6,2023-12-07 13:31:07.275318,2023-12-07 13:31:07.788110,0 days 00:00:00.512792,0.5,0.33,2.0,250,roulette wheel,COMPLETE
2116,2116,37.6,2023-12-07 13:31:07.788319,2023-12-07 13:31:54.913989,0 days 00:00:47.125670,0.0,0.33,,250,random selection,COMPLETE
2117,2117,37.2,2023-12-07 13:31:54.914245,2023-12-07 13:31:55.381198,0 days 00:00:00.466953,0.8,0.33,4.0,300,roulette wheel,COMPLETE
2118,2118,40.0,2023-12-07 13:31:55.381411,2023-12-07 13:31:55.573859,0 days 00:00:00.192448,0.95,0.0,4.0,250,roulette wheel,COMPLETE
2119,2119,38.0,2023-12-07 13:31:55.574059,2023-12-07 13:31:55.943159,0 days 00:00:00.369100,0.95,0.1,4.0,250,roulette wheel,COMPLETE
2120,2120,36.8,2023-12-07 13:31:55.943355,2023-12-07 13:31:56.522133,0 days 00:00:00.578778,0.6,0.5,4.0,250,roulette wheel,COMPLETE
2121,2121,37.6,2023-12-07 13:31:56.522343,2023-12-07 13:31:57.222989,0 days 00:00:00.700646,0.95,0.5,4.0,300,weighted choice,COMPLETE
2122,2122,37.2,2023-12-07 13:31:57.223218,2023-12-07 13:32:24.377849,0 days 00:00:27.154631,0.0,0.1,,250,random selection,COMPLETE
2123,2123,37.2,2023-12-07 13:32:24.378060,2023-12-07 13:33:36.749358,0 days 00:01:12.371298,0.0,0.33,,250,weighted choice,COMPLETE
2124,2124,36.4,2023-12-07 13:33:36.749566,2023-12-07 13:34:28.176127,0 days 00:00:51.426561,0.5,0.0,0.0,250,random selection,COMPLETE
2125,2125,38.4,2023-12-07 13:34:28.176340,2023-12-07 13:34:28.514879,0 days 00:00:00.338539,0.8,0.1,2.0,300,roulette wheel,COMPLETE
2126,2126,37.2,2023-12-07 13:34:28.515095,2023-12-07 13:35:05.629705,0 days 00:00:37.114610,0.0,0.1,,250,roulette wheel,COMPLETE
2127,2127,38.4,2023-12-07 13:35:05.629917,2023-12-07 13:38:35.176927,0 days 00:03:29.547010,0.5,0.0,0.0,300,weighted choice,COMPLETE
2128,2128,36.4,2023-12-07 13:38:35.177144,2023-12-07 13:39:21.342042,0 days 00:00:46.164898,0.8,0.33,0.0,300,random selection,COMPLETE
2129,2129,38.0,2023-12-07 13:39:21.342254,2023-12-07 13:39:21.712593,0 days 00:00:00.370339,0.95,0.1,4.0,250,roulette wheel,COMPLETE
2130,2130,37.6,2023-12-07 13:39:21.712809,2023-12-07 13:39:22.224867,0 days 00:00:00.512058,0.6,0.1,1.0,300,weighted choice,COMPLETE
2131,2131,37.6,2023-12-07 13:39:22.225077,2023-12-07 13:39:22.726874,0 days 00:00:00.501797,0.6,0.33,4.0,300,roulette wheel,COMPLETE
2132,2132,38.0,2023-12-07 13:39:22.727075,2023-12-07 13:39:23.077325,0 days 00:00:00.350250,0.95,0.1,2.0,250,roulette wheel,COMPLETE
2133,2133,37.6,2023-12-07 13:39:23.077535,2023-12-07 13:39:23.580754,0 days 00:00:00.503219,0.5,0.33,1.0,250,random selection,COMPLETE
2134,2134,38.0,2023-12-07 13:39:23.580975,2023-12-07 13:39:24.140683,0 days 00:00:00.559708,0.8,0.5,1.0,300,roulette wheel,COMPLETE
2135,2135,38.0,2023-12-07 13:39:24.140891,2023-12-07 13:40:05.887082,0 days 00:00:41.746191,0.5,0.33,0.0,300,random selection,COMPLETE
2136,2136,38.0,2023-12-07 13:40:05.887315,2023-12-07 13:41:04.654376,0 days 00:00:58.767061,0.95,0.33,0.0,250,roulette wheel,COMPLETE
2137,2137,37.6,2023-12-07 13:41:04.654598,2023-12-07 13:41:05.230573,0 days 00:00:00.575975,0.95,0.5,4.0,250,random selection,COMPLETE
2138,2138,37.6,2023-12-07 13:41:05.230799,2023-12-07 13:41:05.773831,0 days 00:00:00.543032,0.95,0.5,2.0,300,random selection,COMPLETE
2139,2139,37.6,2023-12-07 13:41:05.774040,2023-12-07 13:41:06.245309,0 days 00:00:00.471269,0.95,0.1,2.0,250,weighted choice,COMPLETE
2140,2140,40.0,2023-12-07 13:41:06.245516,2023-12-07 13:41:06.426254,0 days 00:00:00.180738,0.95,0.0,2.0,300,roulette wheel,COMPLETE
2141,2141,37.6,2023-12-07 13:41:06.426462,2023-12-07 13:43:33.938332,0 days 00:02:27.511870,0.0,0.0,,300,roulette wheel,COMPLETE
2142,2142,38.0,2023-12-07 13:43:33.938540,2023-12-07 13:43:34.500947,0 days 00:00:00.562407,0.8,0.5,4.0,250,roulette wheel,COMPLETE
2143,2143,38.4,2023-12-07 13:43:34.501147,2023-12-07 13:43:34.740927,0 days 00:00:00.239780,0.5,0.0,1.0,300,random selection,COMPLETE
2144,2144,38.4,2023-12-07 13:43:34.741132,2023-12-07 13:43:35.073089,0 days 00:00:00.331957,0.8,0.1,1.0,300,roulette wheel,COMPLETE
2145,2145,36.8,2023-12-07 13:43:35.073305,2023-12-07 13:43:35.438244,0 days 00:00:00.364939,0.5,0.1,2.0,250,random selection,COMPLETE
2146,2146,38.0,2023-12-07 13:43:35.438469,2023-12-07 13:43:36.040638,0 days 00:00:00.602169,0.5,0.5,1.0,250,random selection,COMPLETE
2147,2147,41.2,2023-12-07 13:43:36.040862,2023-12-07 13:43:36.334210,0 days 00:00:00.293348,0.95,0.01,2.0,250,roulette wheel,COMPLETE
2148,2148,37.6,2023-12-07 13:43:36.334409,2023-12-07 13:43:36.855537,0 days 00:00:00.521128,0.5,0.1,4.0,250,weighted choice,COMPLETE
2149,2149,37.2,2023-12-07 13:43:36.855741,2023-12-07 13:43:37.329084,0 days 00:00:00.473343,0.95,0.33,4.0,300,roulette wheel,COMPLETE
2150,2150,37.6,2023-12-07 13:43:37.329301,2023-12-07 13:44:34.979514,0 days 00:00:57.650213,0.5,0.01,0.0,250,weighted choice,COMPLETE
2151,2151,38.8,2023-12-07 13:44:34.979880,2023-12-07 13:46:18.497138,0 days 00:01:43.517258,0.5,0.0,0.0,250,roulette wheel,COMPLETE
2152,2152,37.6,2023-12-07 13:46:18.497511,2023-12-07 13:46:18.985750,0 days 00:00:00.488239,0.6,0.33,4.0,300,random selection,COMPLETE
2153,2153,38.4,2023-12-07 13:46:18.985984,2023-12-07 13:46:19.334642,0 days 00:00:00.348658,0.6,0.1,2.0,300,roulette wheel,COMPLETE
2154,2154,38.4,2023-12-07 13:46:19.334860,2023-12-07 13:46:19.704179,0 days 00:00:00.369319,0.95,0.1,4.0,250,roulette wheel,COMPLETE
2155,2155,36.8,2023-12-07 13:46:19.704404,2023-12-07 13:47:25.155670,0 days 00:01:05.451266,0.0,0.01,,300,weighted choice,COMPLETE
2156,2156,37.6,2023-12-07 13:47:25.155889,2023-12-07 13:48:33.878379,0 days 00:01:08.722490,0.95,0.33,0.0,300,roulette wheel,COMPLETE
2157,2157,38.0,2023-12-07 13:48:33.878586,2023-12-07 13:49:12.821812,0 days 00:00:38.943226,0.0,0.1,,250,roulette wheel,COMPLETE
2158,2158,37.6,2023-12-07 13:49:12.822037,2023-12-07 13:49:13.407611,0 days 00:00:00.585574,0.6,0.5,2.0,300,roulette wheel,COMPLETE
2159,2159,37.2,2023-12-07 13:49:13.407833,2023-12-07 13:51:22.337798,0 days 00:02:08.929965,0.0,0.0,,250,roulette wheel,COMPLETE
2160,2160,37.6,2023-12-07 13:51:22.338010,2023-12-07 13:53:50.968544,0 days 00:02:28.630534,0.0,0.0,,300,roulette wheel,COMPLETE
