,number,value,datetime_start,datetime_complete,duration,params_C,params_M,params_N,params_P,params_S,state
2161,2161,42.0,2023-12-07 13:53:50.968747,2023-12-07 13:53:51.495136,0 days 00:00:00.526389,0.5,0.0,4.0,250,weighted choice,COMPLETE
2162,2162,36.8,2023-12-07 13:53:51.495352,2023-12-07 13:53:52.194074,0 days 00:00:00.698722,0.95,0.5,4.0,250,weighted choice,COMPLETE
2163,2163,37.2,2023-12-07 13:53:52.194328,2023-12-07 13:54:48.199362,0 days 00:00:56.005034,0.0,0.5,,250,random selection,COMPLETE
2164,2164,40.8,2023-12-07 13:54:48.199757,2023-12-07 13:54:48.485224,0 days 00:00:00.285467,0.95,0.01,1.0,250,roulette wheel,COMPLETE
2165,2165,36.4,2023-12-07 13:54:48.485437,2023-12-07 13:55:48.980797,0 days 00:01:00.495360,0.6,0.33,0.0,250,roulette wheel,COMPLETE
2166,2166,37.6,2023-12-07 13:55:48.981012,2023-12-07 13:56:32.654733,0 days 00:00:43.673721,0.8,0.1,0.0,250,roulette wheel,COMPLETE
2167,2167,36.8,2023-12-07 13:56:32.655002,2023-12-07 13:58:49.404407,0 days 00:02:16.749405,0.0,0.0,,300,random selection,COMPLETE
2168,2168,38.0,2023-12-07 13:58:49.404627,2023-12-07 13:58:50.097646,0 days 00:00:00.693019,0.8,0.5,2.0,250,weighted choice,COMPLETE
2169,2169,37.2,2023-12-07 13:58:50.097862,2023-12-07 13:58:50.659069,0 days 00:00:00.561207,0.8,0.5,4.0,300,random selection,COMPLETE
2170,2170,37.2,2023-12-07 13:58:50.659286,2023-12-07 13:58:50.982352,0 days 00:00:00.323066,0.8,0.1,1.0,300,random selection,COMPLETE
2171,2171,37.6,2023-12-07 13:58:50.982578,2023-12-07 13:58:51.563862,0 days 00:00:00.581284,0.6,0.5,2.0,300,roulette wheel,COMPLETE
2172,2172,38.0,2023-12-07 13:58:51.564078,2023-12-07 14:01:59.890201,0 days 00:03:08.326123,0.95,0.0,0.0,300,weighted choice,COMPLETE
2173,2173,38.4,2023-12-07 14:01:59.890420,2023-12-07 14:02:00.433786,0 days 00:00:00.543366,0.5,0.1,2.0,300,weighted choice,COMPLETE
2174,2174,37.6,2023-12-07 14:02:00.434016,2023-12-07 14:02:00.742021,0 days 00:00:00.308005,0.95,0.01,4.0,300,random selection,COMPLETE
2175,2175,36.8,2023-12-07 14:02:00.742246,2023-12-07 14:03:19.909117,0 days 00:01:19.166871,0.8,0.0,0.0,250,random selection,COMPLETE
2176,2176,37.2,2023-12-07 14:03:19.909355,2023-12-07 14:05:52.030783,0 days 00:02:32.121428,0.6,0.0,0.0,250,weighted choice,COMPLETE
2177,2177,38.0,2023-12-07 14:05:52.031014,2023-12-07 14:06:58.598783,0 days 00:01:06.567769,0.0,0.5,,250,roulette wheel,COMPLETE
2178,2178,37.6,2023-12-07 14:06:58.598991,2023-12-07 14:06:59.135881,0 days 00:00:00.536890,0.5,0.1,2.0,300,weighted choice,COMPLETE
2179,2179,37.6,2023-12-07 14:06:59.136097,2023-12-07 14:06:59.711667,0 days 00:00:00.575570,0.6,0.5,2.0,250,roulette wheel,COMPLETE
2180,2180,37.6,2023-12-07 14:06:59.711880,2023-12-07 14:08:14.100331,0 days 00:01:14.388451,0.0,0.33,,250,weighted choice,COMPLETE
2181,2181,44.4,2023-12-07 14:08:14.100551,2023-12-07 14:08:14.364524,0 days 00:00:00.263973,0.5,0.0,2.0,250,roulette wheel,COMPLETE
2182,2182,37.2,2023-12-07 14:08:14.364728,2023-12-07 14:09:57.835680,0 days 00:01:43.470952,0.6,0.5,0.0,300,weighted choice,COMPLETE
2183,2183,37.6,2023-12-07 14:09:57.835905,2023-12-07 14:09:58.343141,0 days 00:00:00.507236,0.5,0.33,4.0,250,roulette wheel,COMPLETE
2184,2184,37.6,2023-12-07 14:09:58.343365,2023-12-07 14:11:02.256976,0 days 00:01:03.913611,0.0,0.5,,250,roulette wheel,COMPLETE
2185,2185,39.6,2023-12-07 14:11:02.257196,2023-12-07 14:11:02.622595,0 days 00:00:00.365399,0.6,0.01,4.0,300,roulette wheel,COMPLETE
2186,2186,40.0,2023-12-07 14:11:02.622823,2023-12-07 14:11:02.940527,0 days 00:00:00.317704,0.95,0.0,1.0,300,weighted choice,COMPLETE
2187,2187,38.0,2023-12-07 14:11:02.940767,2023-12-07 14:11:03.272105,0 days 00:00:00.331338,0.8,0.1,1.0,300,roulette wheel,COMPLETE
2188,2188,38.4,2023-12-07 14:11:03.272327,2023-12-07 14:12:12.126528,0 days 00:01:08.854201,0.95,0.5,0.0,250,roulette wheel,COMPLETE
2189,2189,38.4,2023-12-07 14:12:12.126756,2023-12-07 14:12:12.624293,0 days 00:00:00.497537,0.95,0.1,4.0,300,weighted choice,COMPLETE
2190,2190,38.0,2023-12-07 14:12:12.624503,2023-12-07 14:14:45.558458,0 days 00:02:32.933955,0.8,0.0,0.0,300,weighted choice,COMPLETE
2191,2191,37.6,2023-12-07 14:14:45.558681,2023-12-07 14:15:30.812075,0 days 00:00:45.253394,0.0,0.33,,300,random selection,COMPLETE
2192,2192,38.4,2023-12-07 14:15:30.812470,2023-12-07 14:16:37.455388,0 days 00:01:06.642918,0.0,0.01,,300,weighted choice,COMPLETE
2193,2193,38.0,2023-12-07 14:16:37.455734,2023-12-07 14:16:37.944119,0 days 00:00:00.488385,0.6,0.33,4.0,250,random selection,COMPLETE
2194,2194,37.2,2023-12-07 14:16:37.944345,2023-12-07 14:16:38.276428,0 days 00:00:00.332083,0.8,0.1,1.0,300,random selection,COMPLETE
2195,2195,37.6,2023-12-07 14:16:38.276665,2023-12-07 14:16:38.831110,0 days 00:00:00.554445,0.95,0.5,4.0,300,random selection,COMPLETE
2196,2196,38.0,2023-12-07 14:16:38.831330,2023-12-07 14:18:37.717717,0 days 00:01:58.886387,0.0,0.0,,250,random selection,COMPLETE
2197,2197,37.6,2023-12-07 14:18:37.717948,2023-12-07 14:18:38.193483,0 days 00:00:00.475535,0.6,0.33,1.0,250,roulette wheel,COMPLETE
2198,2198,41.6,2023-12-07 14:18:38.193706,2023-12-07 14:18:38.358146,0 days 00:00:00.164440,0.95,0.0,1.0,250,roulette wheel,COMPLETE
2199,2199,38.0,2023-12-07 14:18:38.358389,2023-12-07 14:19:43.146589,0 days 00:01:04.788200,0.5,0.33,0.0,300,roulette wheel,COMPLETE
2200,2200,37.2,2023-12-07 14:19:43.146813,2023-12-07 14:19:43.829843,0 days 00:00:00.683030,0.8,0.5,2.0,300,weighted choice,COMPLETE
2201,2201,41.2,2023-12-07 14:19:43.830058,2023-12-07 14:19:44.311515,0 days 00:00:00.481457,0.6,0.0,4.0,300,weighted choice,COMPLETE
2202,2202,36.8,2023-12-07 14:19:44.311733,2023-12-07 14:20:24.831306,0 days 00:00:40.519573,0.95,0.01,0.0,250,roulette wheel,COMPLETE
2203,2203,38.8,2023-12-07 14:20:24.831538,2023-12-07 14:20:25.311767,0 days 00:00:00.480229,0.6,0.1,1.0,250,weighted choice,COMPLETE
2204,2204,37.6,2023-12-07 14:20:25.312003,2023-12-07 14:20:25.852778,0 days 00:00:00.540775,0.95,0.5,2.0,300,roulette wheel,COMPLETE
2205,2205,37.6,2023-12-07 14:20:25.853001,2023-12-07 14:20:26.189239,0 days 00:00:00.336238,0.8,0.1,1.0,300,roulette wheel,COMPLETE
2206,2206,38.0,2023-12-07 14:20:26.189447,2023-12-07 14:20:26.662914,0 days 00:00:00.473467,0.95,0.33,2.0,250,roulette wheel,COMPLETE
2207,2207,37.6,2023-12-07 14:20:26.663132,2023-12-07 14:20:27.428409,0 days 00:00:00.765277,0.5,0.5,1.0,300,weighted choice,COMPLETE
2208,2208,38.0,2023-12-07 14:20:27.428637,2023-12-07 14:20:55.602046,0 days 00:00:28.173409,0.5,0.01,0.0,250,random selection,COMPLETE
2209,2209,37.6,2023-12-07 14:20:55.602284,2023-12-07 14:24:22.001819,0 days 00:03:26.399535,0.8,0.0,0.0,300,weighted choice,COMPLETE
2210,2210,37.2,2023-12-07 14:24:22.002519,2023-12-07 14:25:01.672421,0 days 00:00:39.669902,0.6,0.01,0.0,300,roulette wheel,COMPLETE
2211,2211,38.4,2023-12-07 14:25:01.672654,2023-12-07 14:26:26.037119,0 days 00:01:24.364465,0.6,0.5,0.0,250,weighted choice,COMPLETE
2212,2212,37.6,2023-12-07 14:26:26.037365,2023-12-07 14:26:26.625759,0 days 00:00:00.588394,0.95,0.33,1.0,300,weighted choice,COMPLETE
2213,2213,37.6,2023-12-07 14:26:26.625999,2023-12-07 14:26:27.095729,0 days 00:00:00.469730,0.95,0.1,1.0,300,weighted choice,COMPLETE
2214,2214,38.4,2023-12-07 14:26:27.095937,2023-12-07 14:26:27.432455,0 days 00:00:00.336518,0.95,0.1,2.0,300,roulette wheel,COMPLETE
2215,2215,37.6,2023-12-07 14:26:27.432680,2023-12-07 14:27:44.114242,0 days 00:01:16.681562,0.5,0.5,0.0,300,roulette wheel,COMPLETE
2216,2216,38.0,2023-12-07 14:27:44.114467,2023-12-07 14:27:44.800897,0 days 00:00:00.686430,0.8,0.5,2.0,300,weighted choice,COMPLETE
2217,2217,38.0,2023-12-07 14:27:44.801120,2023-12-07 14:27:45.305351,0 days 00:00:00.504231,0.5,0.33,2.0,300,roulette wheel,COMPLETE
2218,2218,40.0,2023-12-07 14:27:45.305569,2023-12-07 14:27:45.695798,0 days 00:00:00.390229,0.5,0.01,4.0,300,roulette wheel,COMPLETE
2219,2219,37.2,2023-12-07 14:27:45.696015,2023-12-07 14:28:26.785241,0 days 00:00:41.089226,0.0,0.01,,300,roulette wheel,COMPLETE
2220,2220,37.2,2023-12-07 14:28:26.785479,2023-12-07 14:29:37.447989,0 days 00:01:10.662510,0.0,0.5,,250,roulette wheel,COMPLETE
2221,2221,37.2,2023-12-07 14:29:37.448212,2023-12-07 14:30:07.135794,0 days 00:00:29.687582,0.0,0.01,,300,random selection,COMPLETE
2222,2222,38.0,2023-12-07 14:30:07.136012,2023-12-07 14:30:07.587213,0 days 00:00:00.451201,0.8,0.33,1.0,300,roulette wheel,COMPLETE
2223,2223,37.6,2023-12-07 14:30:07.587454,2023-12-07 14:30:08.091401,0 days 00:00:00.503947,0.5,0.33,1.0,250,roulette wheel,COMPLETE
2224,2224,37.6,2023-12-07 14:30:08.091638,2023-12-07 14:30:08.566397,0 days 00:00:00.474759,0.95,0.33,2.0,250,roulette wheel,COMPLETE
2225,2225,36.8,2023-12-07 14:30:08.566629,2023-12-07 14:30:09.022403,0 days 00:00:00.455774,0.8,0.33,2.0,300,random selection,COMPLETE
2226,2226,37.2,2023-12-07 14:30:09.022632,2023-12-07 14:30:45.574747,0 days 00:00:36.552115,0.0,0.01,,250,roulette wheel,COMPLETE
2227,2227,38.0,2023-12-07 14:30:45.575048,2023-12-07 14:31:42.833564,0 days 00:00:57.258516,0.95,0.5,0.0,300,random selection,COMPLETE
2228,2228,37.2,2023-12-07 14:31:42.833995,2023-12-07 14:32:13.638569,0 days 00:00:30.804574,0.6,0.01,0.0,250,random selection,COMPLETE
2229,2229,38.0,2023-12-07 14:32:13.638804,2023-12-07 14:33:59.215738,0 days 00:01:45.576934,0.6,0.0,0.0,250,roulette wheel,COMPLETE
2230,2230,37.6,2023-12-07 14:33:59.216191,2023-12-07 14:35:23.163660,0 days 00:01:23.947469,0.95,0.33,0.0,300,weighted choice,COMPLETE
2231,2231,38.0,2023-12-07 14:35:23.163915,2023-12-07 14:35:23.746041,0 days 00:00:00.582126,0.6,0.5,4.0,250,roulette wheel,COMPLETE
2232,2232,37.2,2023-12-07 14:35:23.746245,2023-12-07 14:35:24.319230,0 days 00:00:00.572985,0.6,0.5,2.0,250,roulette wheel,COMPLETE
2233,2233,37.2,2023-12-07 14:35:24.319444,2023-12-07 14:36:05.793602,0 days 00:00:41.474158,0.6,0.1,0.0,250,roulette wheel,COMPLETE
2234,2234,41.6,2023-12-07 14:36:05.793834,2023-12-07 14:36:06.362300,0 days 00:00:00.568466,0.5,0.01,1.0,250,weighted choice,COMPLETE
2235,2235,37.6,2023-12-07 14:36:06.362539,2023-12-07 14:36:06.710934,0 days 00:00:00.348395,0.6,0.01,1.0,250,random selection,COMPLETE
2236,2236,37.6,2023-12-07 14:36:06.711164,2023-12-07 14:36:07.077553,0 days 00:00:00.366389,0.6,0.01,4.0,300,random selection,COMPLETE
2237,2237,37.2,2023-12-07 14:36:07.077764,2023-12-07 14:37:41.009355,0 days 00:01:33.931591,0.0,0.5,,300,weighted choice,COMPLETE
2238,2238,39.2,2023-12-07 14:37:41.009602,2023-12-07 14:37:41.509279,0 days 00:00:00.499677,0.5,0.33,2.0,250,roulette wheel,COMPLETE
2239,2239,37.6,2023-12-07 14:37:41.509496,2023-12-07 14:37:41.980415,0 days 00:00:00.470919,0.95,0.33,4.0,300,random selection,COMPLETE
2240,2240,37.2,2023-12-07 14:37:41.980656,2023-12-07 14:37:42.617555,0 days 00:00:00.636899,0.6,0.33,4.0,250,weighted choice,COMPLETE
2241,2241,37.2,2023-12-07 14:37:42.617790,2023-12-07 14:38:29.431133,0 days 00:00:46.813343,0.8,0.1,0.0,250,roulette wheel,COMPLETE
2242,2242,38.4,2023-12-07 14:38:29.431357,2023-12-07 14:39:55.047289,0 days 00:01:25.615932,0.8,0.33,0.0,300,weighted choice,COMPLETE
2243,2243,37.6,2023-12-07 14:39:55.047536,2023-12-07 14:41:01.314784,0 days 00:01:06.267248,0.6,0.1,0.0,300,weighted choice,COMPLETE
2244,2244,36.8,2023-12-07 14:41:01.315447,2023-12-07 14:42:36.095462,0 days 00:01:34.780015,0.95,0.5,0.0,250,weighted choice,COMPLETE
2245,2245,38.0,2023-12-07 14:42:36.095888,2023-12-07 14:42:36.670548,0 days 00:00:00.574660,0.6,0.5,2.0,250,roulette wheel,COMPLETE
2246,2246,37.6,2023-12-07 14:42:36.670768,2023-12-07 14:43:43.149465,0 days 00:01:06.478697,0.0,0.5,,300,roulette wheel,COMPLETE
2247,2247,37.6,2023-12-07 14:43:43.149743,2023-12-07 14:44:47.251250,0 days 00:01:04.101507,0.0,0.01,,300,weighted choice,COMPLETE
2248,2248,37.2,2023-12-07 14:44:47.251480,2023-12-07 14:45:28.283439,0 days 00:00:41.031959,0.5,0.1,0.0,300,roulette wheel,COMPLETE
2249,2249,37.2,2023-12-07 14:45:28.283751,2023-12-07 14:45:58.927074,0 days 00:00:30.643323,0.0,0.1,,300,random selection,COMPLETE
2250,2250,38.8,2023-12-07 14:45:58.927503,2023-12-07 14:45:59.303809,0 days 00:00:00.376306,0.6,0.1,2.0,300,roulette wheel,COMPLETE
2251,2251,38.4,2023-12-07 14:45:59.304030,2023-12-07 14:46:35.544671,0 days 00:00:36.240641,0.0,0.01,,250,roulette wheel,COMPLETE
2252,2252,40.8,2023-12-07 14:46:35.544977,2023-12-07 14:46:35.728456,0 days 00:00:00.183479,0.8,0.0,1.0,250,roulette wheel,COMPLETE
2253,2253,37.6,2023-12-07 14:46:35.728689,2023-12-07 14:47:51.721333,0 days 00:01:15.992644,0.6,0.5,0.0,250,roulette wheel,COMPLETE
2254,2254,36.0,2023-12-07 14:47:51.721553,2023-12-07 14:48:46.416950,0 days 00:00:54.695397,0.0,0.5,,300,random selection,COMPLETE
2255,2255,37.2,2023-12-07 14:48:46.417252,2023-12-07 14:49:27.805747,0 days 00:00:41.388495,0.6,0.33,0.0,300,random selection,COMPLETE
2256,2256,38.0,2023-12-07 14:49:27.805962,2023-12-07 14:50:07.705199,0 days 00:00:39.899237,0.0,0.01,,300,roulette wheel,COMPLETE
2257,2257,37.6,2023-12-07 14:50:07.705507,2023-12-07 14:50:08.217854,0 days 00:00:00.512347,0.5,0.33,4.0,250,roulette wheel,COMPLETE
2258,2258,38.0,2023-12-07 14:50:08.218080,2023-12-07 14:50:47.505121,0 days 00:00:39.287041,0.0,0.33,,300,random selection,COMPLETE
2259,2259,37.2,2023-12-07 14:50:47.505435,2023-12-07 14:50:48.081935,0 days 00:00:00.576500,0.95,0.5,4.0,250,random selection,COMPLETE
2260,2260,38.4,2023-12-07 14:50:48.082168,2023-12-07 14:50:48.551983,0 days 00:00:00.469815,0.95,0.1,1.0,250,weighted choice,COMPLETE
2261,2261,40.4,2023-12-07 14:50:48.552208,2023-12-07 14:50:48.759332,0 days 00:00:00.207124,0.8,0.0,4.0,250,roulette wheel,COMPLETE
2262,2262,40.4,2023-12-07 14:50:48.759533,2023-12-07 14:50:49.111607,0 days 00:00:00.352074,0.6,0.01,2.0,250,roulette wheel,COMPLETE
2263,2263,38.0,2023-12-07 14:50:49.111829,2023-12-07 14:50:49.575624,0 days 00:00:00.463795,0.8,0.33,2.0,250,roulette wheel,COMPLETE
2264,2264,37.6,2023-12-07 14:50:49.575845,2023-12-07 14:50:50.162917,0 days 00:00:00.587072,0.6,0.5,4.0,300,random selection,COMPLETE
2265,2265,38.0,2023-12-07 14:50:50.163176,2023-12-07 14:50:50.781645,0 days 00:00:00.618469,0.8,0.33,2.0,300,weighted choice,COMPLETE
2266,2266,37.6,2023-12-07 14:50:50.781872,2023-12-07 14:50:51.388980,0 days 00:00:00.607108,0.6,0.33,1.0,250,weighted choice,COMPLETE
2267,2267,37.6,2023-12-07 14:50:51.389243,2023-12-07 14:53:00.255457,0 days 00:02:08.866214,0.0,0.0,,250,roulette wheel,COMPLETE
2268,2268,41.2,2023-12-07 14:53:00.255697,2023-12-07 14:53:00.711535,0 days 00:00:00.455838,0.6,0.0,4.0,250,weighted choice,COMPLETE
2269,2269,37.6,2023-12-07 14:53:00.711772,2023-12-07 14:53:00.893429,0 days 00:00:00.181657,0.8,0.0,1.0,250,random selection,COMPLETE
2270,2270,37.6,2023-12-07 14:53:00.893656,2023-12-07 14:53:38.171570,0 days 00:00:37.277914,0.0,0.1,,250,roulette wheel,COMPLETE
2271,2271,38.4,2023-12-07 14:53:38.171826,2023-12-07 14:53:38.638898,0 days 00:00:00.467072,0.8,0.33,4.0,300,roulette wheel,COMPLETE
2272,2272,37.6,2023-12-07 14:53:38.639117,2023-12-07 14:53:39.085192,0 days 00:00:00.446075,0.95,0.33,1.0,300,roulette wheel,COMPLETE
2273,2273,38.0,2023-12-07 14:53:39.085435,2023-12-07 14:53:39.671803,0 days 00:00:00.586368,0.5,0.5,1.0,250,random selection,COMPLETE
2274,2274,38.0,2023-12-07 14:53:39.672034,2023-12-07 14:53:40.139979,0 days 00:00:00.467945,0.8,0.1,2.0,250,weighted choice,COMPLETE
2275,2275,37.6,2023-12-07 14:53:40.140207,2023-12-07 14:53:40.610432,0 days 00:00:00.470225,0.6,0.33,1.0,250,random selection,COMPLETE
2276,2276,39.6,2023-12-07 14:53:40.610659,2023-12-07 14:53:40.980086,0 days 00:00:00.369427,0.6,0.01,4.0,300,roulette wheel,COMPLETE
2277,2277,38.0,2023-12-07 14:53:40.980318,2023-12-07 14:54:44.787062,0 days 00:01:03.806744,0.8,0.1,0.0,250,weighted choice,COMPLETE
2278,2278,37.2,2023-12-07 14:54:44.787294,2023-12-07 14:54:45.147284,0 days 00:00:00.359990,0.95,0.1,4.0,300,random selection,COMPLETE
2279,2279,38.0,2023-12-07 14:54:45.147515,2023-12-07 14:54:45.496633,0 days 00:00:00.349118,0.6,0.01,2.0,250,random selection,COMPLETE
2280,2280,38.0,2023-12-07 14:54:45.496866,2023-12-07 14:57:03.282950,0 days 00:02:17.786084,0.0,0.0,,300,random selection,COMPLETE
2281,2281,37.6,2023-12-07 14:57:03.283188,2023-12-07 15:02:00.951473,0 days 00:04:57.668285,0.0,0.0,,300,weighted choice,COMPLETE
2282,2282,37.6,2023-12-07 15:02:00.951876,2023-12-07 15:05:57.646064,0 days 00:03:56.694188,0.0,0.0,,250,weighted choice,COMPLETE
2283,2283,38.0,2023-12-07 15:05:57.646471,2023-12-07 15:05:58.318817,0 days 00:00:00.672346,0.95,0.5,1.0,250,weighted choice,COMPLETE
2284,2284,37.6,2023-12-07 15:05:58.319042,2023-12-07 15:05:59.057957,0 days 00:00:00.738915,0.5,0.5,4.0,250,weighted choice,COMPLETE
2285,2285,38.4,2023-12-07 15:05:59.058188,2023-12-07 15:07:49.436273,0 days 00:01:50.378085,0.95,0.0,0.0,250,roulette wheel,COMPLETE
2286,2286,37.2,2023-12-07 15:07:49.436557,2023-12-07 15:12:47.608185,0 days 00:04:58.171628,0.0,0.0,,300,weighted choice,COMPLETE
2287,2287,38.0,2023-12-07 15:12:47.608406,2023-12-07 15:14:08.363325,0 days 00:01:20.754919,0.5,0.33,0.0,250,weighted choice,COMPLETE
2288,2288,38.0,2023-12-07 15:14:08.363547,2023-12-07 15:15:23.913220,0 days 00:01:15.549673,0.5,0.33,0.0,250,weighted choice,COMPLETE
2289,2289,37.2,2023-12-07 15:15:23.913549,2023-12-07 15:15:24.414934,0 days 00:00:00.501385,0.95,0.33,4.0,250,roulette wheel,COMPLETE
2290,2290,43.2,2023-12-07 15:15:24.415186,2023-12-07 15:15:24.942055,0 days 00:00:00.526869,0.5,0.0,2.0,250,weighted choice,COMPLETE
2291,2291,38.0,2023-12-07 15:15:24.942269,2023-12-07 15:15:25.170579,0 days 00:00:00.228310,0.6,0.0,2.0,300,random selection,COMPLETE
2292,2292,37.6,2023-12-07 15:15:25.170819,2023-12-07 15:16:00.047707,0 days 00:00:34.876888,0.0,0.33,,300,random selection,COMPLETE
2293,2293,37.2,2023-12-07 15:16:00.048134,2023-12-07 15:16:00.717900,0 days 00:00:00.669766,0.95,0.5,1.0,250,weighted choice,COMPLETE
2294,2294,36.4,2023-12-07 15:16:00.718121,2023-12-07 15:16:35.078138,0 days 00:00:34.360017,0.95,0.1,0.0,250,random selection,COMPLETE
2295,2295,36.8,2023-12-07 15:16:35.078373,2023-12-07 15:19:03.540505,0 days 00:02:28.462132,0.0,0.0,,300,roulette wheel,COMPLETE
2296,2296,38.4,2023-12-07 15:19:03.540722,2023-12-07 15:19:37.249079,0 days 00:00:33.708357,0.0,0.1,,250,random selection,COMPLETE
2297,2297,38.0,2023-12-07 15:19:37.249460,2023-12-07 15:20:54.334293,0 days 00:01:17.084833,0.95,0.5,0.0,250,roulette wheel,COMPLETE
2298,2298,38.0,2023-12-07 15:20:54.334532,2023-12-07 15:20:54.839205,0 days 00:00:00.504673,0.5,0.33,1.0,250,roulette wheel,COMPLETE
2299,2299,37.2,2023-12-07 15:20:54.839437,2023-12-07 15:21:36.316251,0 days 00:00:41.476814,0.0,0.1,,300,roulette wheel,COMPLETE
2300,2300,37.2,2023-12-07 15:21:36.316757,2023-12-07 15:22:21.518074,0 days 00:00:45.201317,0.95,0.33,0.0,300,random selection,COMPLETE
2301,2301,39.2,2023-12-07 15:22:21.518399,2023-12-07 15:22:21.897858,0 days 00:00:00.379459,0.5,0.01,2.0,300,roulette wheel,COMPLETE
2302,2302,38.0,2023-12-07 15:22:21.898088,2023-12-07 15:24:51.579435,0 days 00:02:29.681347,0.0,0.0,,300,roulette wheel,COMPLETE
2303,2303,37.6,2023-12-07 15:24:51.579667,2023-12-07 15:24:52.263395,0 days 00:00:00.683728,0.95,0.5,1.0,250,weighted choice,COMPLETE
2304,2304,37.6,2023-12-07 15:24:52.263642,2023-12-07 15:28:10.196317,0 days 00:03:17.932675,0.8,0.0,0.0,300,weighted choice,COMPLETE
2305,2305,38.8,2023-12-07 15:28:10.197156,2023-12-07 15:28:10.675941,0 days 00:00:00.478785,0.95,0.33,4.0,300,roulette wheel,COMPLETE
2306,2306,38.4,2023-12-07 15:28:10.676179,2023-12-07 15:28:11.153570,0 days 00:00:00.477391,0.95,0.1,1.0,250,weighted choice,COMPLETE
2307,2307,38.0,2023-12-07 15:28:11.154029,2023-12-07 15:29:28.808624,0 days 00:01:17.654595,0.5,0.33,0.0,250,weighted choice,COMPLETE
2308,2308,38.0,2023-12-07 15:29:28.808931,2023-12-07 15:29:29.187587,0 days 00:00:00.378656,0.5,0.1,1.0,250,roulette wheel,COMPLETE
2309,2309,37.2,2023-12-07 15:29:29.187831,2023-12-07 15:30:22.691409,0 days 00:00:53.503578,0.0,0.33,,250,roulette wheel,COMPLETE
2310,2310,37.2,2023-12-07 15:30:22.691641,2023-12-07 15:30:23.342276,0 days 00:00:00.650635,0.6,0.33,4.0,300,weighted choice,COMPLETE
2311,2311,37.6,2023-12-07 15:30:23.342510,2023-12-07 15:30:24.098389,0 days 00:00:00.755879,0.5,0.5,4.0,250,weighted choice,COMPLETE
2312,2312,37.2,2023-12-07 15:30:24.098627,2023-12-07 15:30:24.654674,0 days 00:00:00.556047,0.8,0.5,2.0,300,random selection,COMPLETE
2313,2313,38.0,2023-12-07 15:30:24.654916,2023-12-07 15:31:23.949218,0 days 00:00:59.294302,0.0,0.1,,250,weighted choice,COMPLETE
2314,2314,37.6,2023-12-07 15:31:23.949528,2023-12-07 15:32:31.323493,0 days 00:01:07.373965,0.0,0.01,,300,weighted choice,COMPLETE
2315,2315,37.2,2023-12-07 15:32:31.323741,2023-12-07 15:33:21.828147,0 days 00:00:50.504406,0.6,0.33,0.0,250,random selection,COMPLETE
2316,2316,37.6,2023-12-07 15:33:21.828477,2023-12-07 15:34:02.287914,0 days 00:00:40.459437,0.95,0.01,0.0,300,roulette wheel,COMPLETE
2317,2317,38.0,2023-12-07 15:34:02.288362,2023-12-07 15:34:02.787312,0 days 00:00:00.498950,0.95,0.1,4.0,300,weighted choice,COMPLETE
2318,2318,37.6,2023-12-07 15:34:02.787547,2023-12-07 15:34:03.032009,0 days 00:00:00.244462,0.6,0.0,4.0,250,random selection,COMPLETE
2319,2319,38.4,2023-12-07 15:34:03.032252,2023-12-07 15:35:01.290291,0 days 00:00:58.258039,0.0,0.33,,250,roulette wheel,COMPLETE
2320,2320,42.8,2023-12-07 15:35:01.290534,2023-12-07 15:35:01.547971,0 days 00:00:00.257437,0.6,0.0,4.0,250,roulette wheel,COMPLETE
2321,2321,37.2,2023-12-07 15:35:01.548196,2023-12-07 15:35:45.924733,0 days 00:00:44.376537,0.5,0.1,0.0,300,roulette wheel,COMPLETE
2322,2322,38.0,2023-12-07 15:35:45.924984,2023-12-07 15:36:20.654183,0 days 00:00:34.729199,0.0,0.1,,250,roulette wheel,COMPLETE
2323,2323,38.4,2023-12-07 15:36:20.654427,2023-12-07 15:36:21.186856,0 days 00:00:00.532429,0.5,0.1,1.0,300,weighted choice,COMPLETE
2324,2324,37.6,2023-12-07 15:36:21.187108,2023-12-07 15:37:05.977128,0 days 00:00:44.790020,0.8,0.33,0.0,300,random selection,COMPLETE
