,number,value,datetime_start,datetime_complete,duration,params_C,params_M,params_N,params_P,params_S,state
1832,1832,37.6,2023-12-07 11:25:56.543727,2023-12-07 11:26:54.874032,0 days 00:00:58.330305,0.95,0.33,0.0,300,roulette wheel,COMPLETE
1833,1833,37.6,2023-12-07 11:26:54.874273,2023-12-07 11:29:56.822714,0 days 00:03:01.948441,0.8,0.0,0.0,300,weighted choice,COMPLETE
1834,1834,37.2,2023-12-07 11:29:56.822957,2023-12-07 11:29:57.014618,0 days 00:00:00.191661,0.95,0.0,4.0,300,random selection,COMPLETE
1835,1835,36.4,2023-12-07 11:29:57.014795,2023-12-07 11:30:32.327073,0 days 00:00:35.312278,0.6,0.01,0.0,250,roulette wheel,COMPLETE
1836,1836,38.8,2023-12-07 11:30:32.327353,2023-12-07 11:30:32.625083,0 days 00:00:00.297730,0.8,0.01,1.0,300,roulette wheel,COMPLETE
1837,1837,37.6,2023-12-07 11:30:32.625257,2023-12-07 11:31:43.902995,0 days 00:01:11.277738,0.95,0.1,0.0,300,weighted choice,COMPLETE
1838,1838,38.4,2023-12-07 11:31:43.903175,2023-12-07 11:31:44.499025,0 days 00:00:00.595850,0.95,0.33,4.0,300,weighted choice,COMPLETE
1839,1839,37.2,2023-12-07 11:31:44.499192,2023-12-07 11:32:53.140258,0 days 00:01:08.641066,0.0,0.5,,300,roulette wheel,COMPLETE
1840,1840,37.6,2023-12-07 11:32:53.140486,2023-12-07 11:34:26.508641,0 days 00:01:33.368155,0.0,0.5,,300,weighted choice,COMPLETE
1841,1841,41.2,2023-12-07 11:34:26.508828,2023-12-07 11:34:26.896460,0 days 00:00:00.387632,0.8,0.0,4.0,300,weighted choice,COMPLETE
1842,1842,36.8,2023-12-07 11:34:26.896629,2023-12-07 11:34:27.355587,0 days 00:00:00.458958,0.8,0.33,2.0,300,roulette wheel,COMPLETE
1843,1843,39.2,2023-12-07 11:34:27.355768,2023-12-07 11:35:16.743637,0 days 00:00:49.387869,0.0,0.5,,300,random selection,COMPLETE
1844,1844,37.6,2023-12-07 11:35:16.743963,2023-12-07 11:36:20.545367,0 days 00:01:03.801404,0.8,0.01,0.0,300,weighted choice,COMPLETE
1845,1845,37.6,2023-12-07 11:36:20.545544,2023-12-07 11:36:21.090831,0 days 00:00:00.545287,0.95,0.5,4.0,300,roulette wheel,COMPLETE
1846,1846,37.2,2023-12-07 11:36:21.090996,2023-12-07 11:37:06.404168,0 days 00:00:45.313172,0.8,0.1,0.0,250,roulette wheel,COMPLETE
1847,1847,37.6,2023-12-07 11:37:06.404400,2023-12-07 11:38:15.647332,0 days 00:01:09.242932,0.6,0.5,0.0,250,roulette wheel,COMPLETE
1848,1848,43.2,2023-12-07 11:38:15.647526,2023-12-07 11:38:15.908306,0 days 00:00:00.260780,0.5,0.0,1.0,250,roulette wheel,COMPLETE
1849,1849,36.8,2023-12-07 11:38:15.908479,2023-12-07 11:38:38.507251,0 days 00:00:22.598772,0.0,0.01,,300,random selection,COMPLETE
1850,1850,38.0,2023-12-07 11:38:38.507436,2023-12-07 11:38:38.981239,0 days 00:00:00.473803,0.6,0.33,1.0,250,roulette wheel,COMPLETE
1851,1851,40.4,2023-12-07 11:38:38.981408,2023-12-07 11:38:39.343737,0 days 00:00:00.362329,0.5,0.01,1.0,250,roulette wheel,COMPLETE
1852,1852,37.6,2023-12-07 11:38:39.343908,2023-12-07 11:38:39.813975,0 days 00:00:00.470067,0.6,0.33,2.0,250,roulette wheel,COMPLETE
1853,1853,36.8,2023-12-07 11:38:39.814175,2023-12-07 11:39:41.041265,0 days 00:01:01.227090,0.6,0.5,0.0,300,random selection,COMPLETE
1854,1854,37.6,2023-12-07 11:39:41.041499,2023-12-07 11:40:36.848369,0 days 00:00:55.806870,0.0,0.33,,300,roulette wheel,COMPLETE
1855,1855,39.2,2023-12-07 11:40:36.848548,2023-12-07 11:40:37.341991,0 days 00:00:00.493443,0.8,0.01,4.0,300,weighted choice,COMPLETE
1856,1856,37.6,2023-12-07 11:40:37.342173,2023-12-07 11:41:03.852607,0 days 00:00:26.510434,0.5,0.01,0.0,300,random selection,COMPLETE
1857,1857,37.2,2023-12-07 11:41:03.852802,2023-12-07 11:41:52.027595,0 days 00:00:48.174793,0.95,0.1,0.0,300,roulette wheel,COMPLETE
1858,1858,38.0,2023-12-07 11:41:52.027777,2023-12-07 11:41:52.644312,0 days 00:00:00.616535,0.8,0.33,2.0,250,weighted choice,COMPLETE
1859,1859,41.2,2023-12-07 11:41:52.644492,2023-12-07 11:41:53.024545,0 days 00:00:00.380053,0.5,0.01,1.0,250,roulette wheel,COMPLETE
1860,1860,36.8,2023-12-07 11:41:53.024738,2023-12-07 11:42:29.703485,0 days 00:00:36.678747,0.0,0.1,,250,roulette wheel,COMPLETE
1861,1861,38.0,2023-12-07 11:42:29.703667,2023-12-07 11:42:30.246125,0 days 00:00:00.542458,0.95,0.5,1.0,250,roulette wheel,COMPLETE
1862,1862,41.2,2023-12-07 11:42:30.246310,2023-12-07 11:42:30.492364,0 days 00:00:00.246054,0.6,0.0,4.0,300,roulette wheel,COMPLETE
1863,1863,40.4,2023-12-07 11:42:30.492546,2023-12-07 11:42:30.691651,0 days 00:00:00.199105,0.95,0.0,4.0,250,roulette wheel,COMPLETE
1864,1864,37.2,2023-12-07 11:42:30.691820,2023-12-07 11:42:31.023986,0 days 00:00:00.332166,0.8,0.1,2.0,300,random selection,COMPLETE
1865,1865,40.0,2023-12-07 11:42:31.024167,2023-12-07 11:42:31.377546,0 days 00:00:00.353379,0.6,0.01,2.0,250,roulette wheel,COMPLETE
1866,1866,37.6,2023-12-07 11:42:31.377734,2023-12-07 11:42:31.572074,0 days 00:00:00.194340,0.8,0.0,2.0,250,random selection,COMPLETE
1867,1867,37.2,2023-12-07 11:42:31.572250,2023-12-07 11:43:45.980257,0 days 00:01:14.408007,0.5,0.33,0.0,250,weighted choice,COMPLETE
1868,1868,37.2,2023-12-07 11:43:45.980603,2023-12-07 11:46:22.626144,0 days 00:02:36.645541,0.6,0.0,0.0,300,weighted choice,COMPLETE
1869,1869,37.6,2023-12-07 11:46:22.626328,2023-12-07 11:46:59.720472,0 days 00:00:37.094144,0.0,0.1,,250,roulette wheel,COMPLETE
1870,1870,38.0,2023-12-07 11:46:59.720652,2023-12-07 11:47:00.190764,0 days 00:00:00.470112,0.6,0.33,1.0,300,random selection,COMPLETE
1871,1871,37.6,2023-12-07 11:47:00.191056,2023-12-07 11:47:00.577285,0 days 00:00:00.386229,0.5,0.1,4.0,300,random selection,COMPLETE
1872,1872,37.2,2023-12-07 11:47:00.577480,2023-12-07 11:47:01.117964,0 days 00:00:00.540484,0.8,0.5,1.0,250,roulette wheel,COMPLETE
1873,1873,41.6,2023-12-07 11:47:01.118136,2023-12-07 11:47:01.505761,0 days 00:00:00.387625,0.5,0.01,2.0,250,roulette wheel,COMPLETE
1874,1874,38.0,2023-12-07 11:47:01.505935,2023-12-07 11:47:02.119414,0 days 00:00:00.613479,0.8,0.33,4.0,300,weighted choice,COMPLETE
1875,1875,39.6,2023-12-07 11:47:02.119599,2023-12-07 11:47:02.663448,0 days 00:00:00.543849,0.6,0.01,4.0,300,weighted choice,COMPLETE
1876,1876,36.8,2023-12-07 11:47:02.663638,2023-12-07 11:48:32.528284,0 days 00:01:29.864646,0.0,0.5,,250,weighted choice,COMPLETE
1877,1877,37.6,2023-12-07 11:48:32.528601,2023-12-07 11:48:33.084389,0 days 00:00:00.555788,0.95,0.5,4.0,300,roulette wheel,COMPLETE
1878,1878,37.6,2023-12-07 11:48:33.084561,2023-12-07 11:49:14.085589,0 days 00:00:41.001028,0.0,0.1,,250,roulette wheel,COMPLETE
1879,1879,38.4,2023-12-07 11:49:14.085777,2023-12-07 11:50:14.429313,0 days 00:01:00.343536,0.6,0.01,0.0,250,weighted choice,COMPLETE
1880,1880,37.2,2023-12-07 11:50:14.429510,2023-12-07 11:50:14.908441,0 days 00:00:00.478931,0.8,0.33,4.0,250,roulette wheel,COMPLETE
1881,1881,37.6,2023-12-07 11:50:14.908625,2023-12-07 11:51:19.206690,0 days 00:01:04.298065,0.6,0.33,0.0,250,roulette wheel,COMPLETE
1882,1882,39.6,2023-12-07 11:51:19.206862,2023-12-07 11:51:19.402797,0 days 00:00:00.195935,0.95,0.0,4.0,300,roulette wheel,COMPLETE
1883,1883,37.6,2023-12-07 11:51:19.402973,2023-12-07 11:52:46.646676,0 days 00:01:27.243703,0.5,0.5,0.0,250,weighted choice,COMPLETE
1884,1884,38.0,2023-12-07 11:52:46.646863,2023-12-07 11:52:47.140022,0 days 00:00:00.493159,0.5,0.33,1.0,250,roulette wheel,COMPLETE
1885,1885,40.4,2023-12-07 11:52:47.140210,2023-12-07 11:52:47.428830,0 days 00:00:00.288620,0.95,0.01,2.0,300,roulette wheel,COMPLETE
1886,1886,37.6,2023-12-07 11:52:47.429015,2023-12-07 11:52:48.172505,0 days 00:00:00.743490,0.6,0.5,2.0,300,weighted choice,COMPLETE
1887,1887,37.2,2023-12-07 11:52:48.172680,2023-12-07 11:52:48.740424,0 days 00:00:00.567744,0.6,0.5,1.0,250,roulette wheel,COMPLETE
1888,1888,37.2,2023-12-07 11:52:48.740601,2023-12-07 11:52:48.969863,0 days 00:00:00.229262,0.6,0.0,2.0,300,random selection,COMPLETE
1889,1889,38.4,2023-12-07 11:52:48.970049,2023-12-07 11:52:49.541880,0 days 00:00:00.571831,0.95,0.5,4.0,250,roulette wheel,COMPLETE
1890,1890,39.6,2023-12-07 11:52:49.542075,2023-12-07 11:52:49.854093,0 days 00:00:00.312018,0.95,0.01,4.0,250,roulette wheel,COMPLETE
1891,1891,37.2,2023-12-07 11:52:49.854306,2023-12-07 11:52:50.467098,0 days 00:00:00.612792,0.6,0.33,1.0,250,weighted choice,COMPLETE
1892,1892,37.2,2023-12-07 11:52:50.467297,2023-12-07 11:52:50.644348,0 days 00:00:00.177051,0.8,0.0,1.0,300,random selection,COMPLETE
1893,1893,37.6,2023-12-07 11:52:50.644536,2023-12-07 11:52:51.176802,0 days 00:00:00.532266,0.95,0.5,1.0,300,random selection,COMPLETE
1894,1894,37.6,2023-12-07 11:52:51.176984,2023-12-07 11:54:00.889834,0 days 00:01:09.712850,0.5,0.5,0.0,300,roulette wheel,COMPLETE
1895,1895,40.4,2023-12-07 11:54:00.890165,2023-12-07 11:54:01.168957,0 days 00:00:00.278792,0.95,0.01,1.0,300,roulette wheel,COMPLETE
1896,1896,37.6,2023-12-07 11:54:01.169138,2023-12-07 11:54:38.250747,0 days 00:00:37.081609,0.5,0.1,0.0,250,random selection,COMPLETE
1897,1897,37.2,2023-12-07 11:54:38.251074,2023-12-07 11:55:36.742460,0 days 00:00:58.491386,0.6,0.33,0.0,250,roulette wheel,COMPLETE
1898,1898,37.2,2023-12-07 11:55:36.742687,2023-12-07 11:55:37.211657,0 days 00:00:00.468970,0.8,0.33,4.0,250,roulette wheel,COMPLETE
1899,1899,38.4,2023-12-07 11:55:37.211838,2023-12-07 11:55:37.669079,0 days 00:00:00.457241,0.95,0.1,1.0,250,weighted choice,COMPLETE
1900,1900,41.6,2023-12-07 11:55:37.669277,2023-12-07 11:55:37.899329,0 days 00:00:00.230052,0.6,0.0,2.0,250,roulette wheel,COMPLETE
1901,1901,38.8,2023-12-07 11:55:37.899513,2023-12-07 11:55:38.494181,0 days 00:00:00.594668,0.8,0.33,4.0,250,weighted choice,COMPLETE
1902,1902,37.6,2023-12-07 11:55:38.494365,2023-12-07 11:55:39.080700,0 days 00:00:00.586335,0.5,0.5,2.0,300,roulette wheel,COMPLETE
1903,1903,37.6,2023-12-07 11:55:39.080874,2023-12-07 11:56:22.711847,0 days 00:00:43.630973,0.0,0.33,,300,random selection,COMPLETE
1904,1904,38.0,2023-12-07 11:56:22.712190,2023-12-07 11:56:23.315334,0 days 00:00:00.603144,0.5,0.5,4.0,300,roulette wheel,COMPLETE
1905,1905,37.2,2023-12-07 11:56:23.315514,2023-12-07 11:56:23.804612,0 days 00:00:00.489098,0.95,0.1,4.0,300,weighted choice,COMPLETE
1906,1906,37.2,2023-12-07 11:56:23.804794,2023-12-07 11:56:24.171963,0 days 00:00:00.367169,0.5,0.01,2.0,250,random selection,COMPLETE
1907,1907,37.6,2023-12-07 11:56:24.172151,2023-12-07 11:56:24.625294,0 days 00:00:00.453143,0.8,0.33,2.0,300,roulette wheel,COMPLETE
1908,1908,38.0,2023-12-07 11:56:24.625481,2023-12-07 11:57:17.855212,0 days 00:00:53.229731,0.0,0.5,,250,random selection,COMPLETE
1909,1909,37.2,2023-12-07 11:57:17.855490,2023-12-07 11:58:12.469597,0 days 00:00:54.614107,0.0,0.33,,250,roulette wheel,COMPLETE
1910,1910,37.6,2023-12-07 11:58:12.469781,2023-12-07 12:00:06.765571,0 days 00:01:54.295790,0.0,0.0,,250,random selection,COMPLETE
1911,1911,37.6,2023-12-07 12:00:06.765756,2023-12-07 12:00:07.119915,0 days 00:00:00.354159,0.5,0.1,1.0,300,roulette wheel,COMPLETE
1912,1912,37.2,2023-12-07 12:00:07.120098,2023-12-07 12:00:59.542360,0 days 00:00:52.422262,0.0,0.33,,300,roulette wheel,COMPLETE
1913,1913,37.6,2023-12-07 12:00:59.542533,2023-12-07 12:01:00.002195,0 days 00:00:00.459662,0.8,0.33,4.0,300,roulette wheel,COMPLETE
1914,1914,37.6,2023-12-07 12:01:00.002370,2023-12-07 12:02:11.032474,0 days 00:01:11.030104,0.0,0.5,,250,roulette wheel,COMPLETE
1915,1915,37.6,2023-12-07 12:02:11.032641,2023-12-07 12:02:11.538113,0 days 00:00:00.505472,0.5,0.33,2.0,250,roulette wheel,COMPLETE
1916,1916,38.0,2023-12-07 12:02:11.538285,2023-12-07 12:03:24.074104,0 days 00:01:12.535819,0.0,0.33,,250,weighted choice,COMPLETE
1917,1917,36.8,2023-12-07 12:03:24.074358,2023-12-07 12:03:24.251347,0 days 00:00:00.176989,0.95,0.0,2.0,250,random selection,COMPLETE
1918,1918,37.6,2023-12-07 12:03:24.251556,2023-12-07 12:03:24.757854,0 days 00:00:00.506298,0.5,0.33,2.0,250,random selection,COMPLETE
1919,1919,36.8,2023-12-07 12:03:24.758059,2023-12-07 12:04:04.250266,0 days 00:00:39.492207,0.0,0.1,,300,roulette wheel,COMPLETE
1920,1920,38.0,2023-12-07 12:04:04.250451,2023-12-07 12:04:55.767536,0 days 00:00:51.517085,0.0,0.33,,300,roulette wheel,COMPLETE
1921,1921,41.6,2023-12-07 12:04:55.767726,2023-12-07 12:04:56.125208,0 days 00:00:00.357482,0.8,0.0,2.0,250,weighted choice,COMPLETE
1922,1922,37.6,2023-12-07 12:04:56.125404,2023-12-07 12:06:10.855325,0 days 00:01:14.729921,0.8,0.0,0.0,250,random selection,COMPLETE
1923,1923,37.6,2023-12-07 12:06:10.855695,2023-12-07 12:11:13.534057,0 days 00:05:02.678362,0.0,0.0,,300,weighted choice,COMPLETE
1924,1924,38.4,2023-12-07 12:11:13.534336,2023-12-07 12:11:13.871364,0 days 00:00:00.337028,0.8,0.1,1.0,300,roulette wheel,COMPLETE
1925,1925,40.8,2023-12-07 12:11:13.871551,2023-12-07 12:11:14.201489,0 days 00:00:00.329938,0.8,0.01,4.0,300,roulette wheel,COMPLETE
1926,1926,37.6,2023-12-07 12:11:14.201680,2023-12-07 12:11:14.685688,0 days 00:00:00.484008,0.6,0.33,2.0,250,roulette wheel,COMPLETE
1927,1927,41.2,2023-12-07 12:11:14.685877,2023-12-07 12:11:14.876814,0 days 00:00:00.190937,0.8,0.0,2.0,250,roulette wheel,COMPLETE
1928,1928,39.6,2023-12-07 12:11:14.877001,2023-12-07 12:11:15.410171,0 days 00:00:00.533170,0.6,0.01,1.0,300,weighted choice,COMPLETE
1929,1929,37.2,2023-12-07 12:11:15.410364,2023-12-07 12:11:15.963180,0 days 00:00:00.552816,0.95,0.5,4.0,300,random selection,COMPLETE
1930,1930,37.2,2023-12-07 12:11:15.963367,2023-12-07 12:11:16.180826,0 days 00:00:00.217459,0.6,0.0,1.0,250,random selection,COMPLETE
1931,1931,36.8,2023-12-07 12:11:16.181010,2023-12-07 12:11:16.538514,0 days 00:00:00.357504,0.6,0.01,4.0,300,random selection,COMPLETE
1932,1932,36.8,2023-12-07 12:11:16.538712,2023-12-07 12:11:17.145238,0 days 00:00:00.606526,0.5,0.5,2.0,300,roulette wheel,COMPLETE
1933,1933,38.8,2023-12-07 12:11:17.145420,2023-12-07 12:11:17.610364,0 days 00:00:00.464944,0.8,0.33,4.0,300,random selection,COMPLETE
1934,1934,40.8,2023-12-07 12:11:17.610539,2023-12-07 12:11:17.818928,0 days 00:00:00.208389,0.8,0.0,4.0,300,roulette wheel,COMPLETE
1935,1935,37.2,2023-12-07 12:11:17.819113,2023-12-07 12:11:43.449943,0 days 00:00:25.630830,0.0,0.1,,250,random selection,COMPLETE
1936,1936,40.4,2023-12-07 12:11:43.450225,2023-12-07 12:11:43.773502,0 days 00:00:00.323277,0.8,0.01,4.0,250,roulette wheel,COMPLETE
1937,1937,38.4,2023-12-07 12:11:43.773690,2023-12-07 12:11:44.267844,0 days 00:00:00.494154,0.95,0.1,4.0,250,weighted choice,COMPLETE
1938,1938,37.2,2023-12-07 12:11:44.268064,2023-12-07 12:11:44.539951,0 days 00:00:00.271887,0.95,0.01,1.0,300,random selection,COMPLETE
1939,1939,38.0,2023-12-07 12:11:44.540137,2023-12-07 12:12:37.562149,0 days 00:00:53.022012,0.0,0.33,,300,roulette wheel,COMPLETE
1940,1940,38.0,2023-12-07 12:12:37.562440,2023-12-07 12:13:17.014284,0 days 00:00:39.451844,0.0,0.1,,250,roulette wheel,COMPLETE
1941,1941,38.0,2023-12-07 12:13:17.014462,2023-12-07 12:13:17.359325,0 days 00:00:00.344863,0.6,0.1,1.0,250,roulette wheel,COMPLETE
1942,1942,42.0,2023-12-07 12:13:17.359514,2023-12-07 12:13:17.587774,0 days 00:00:00.228260,0.6,0.0,2.0,250,roulette wheel,COMPLETE
1943,1943,36.8,2023-12-07 12:13:17.587956,2023-12-07 12:13:17.760437,0 days 00:00:00.172481,0.8,0.0,1.0,300,random selection,COMPLETE
1944,1944,37.2,2023-12-07 12:13:17.760622,2023-12-07 12:13:55.519765,0 days 00:00:37.759143,0.8,0.01,0.0,250,roulette wheel,COMPLETE
1945,1945,37.6,2023-12-07 12:13:55.520015,2023-12-07 12:15:11.383458,0 days 00:01:15.863443,0.0,0.33,,300,weighted choice,COMPLETE
1946,1946,37.2,2023-12-07 12:15:11.383645,2023-12-07 12:16:30.584673,0 days 00:01:19.201028,0.8,0.0,0.0,250,random selection,COMPLETE
1947,1947,37.2,2023-12-07 12:16:30.584872,2023-12-07 12:16:30.933856,0 days 00:00:00.348984,0.6,0.01,4.0,250,random selection,COMPLETE
1948,1948,37.6,2023-12-07 12:16:30.934051,2023-12-07 12:17:44.914343,0 days 00:01:13.980292,0.95,0.5,0.0,300,roulette wheel,COMPLETE
1949,1949,41.2,2023-12-07 12:17:44.914567,2023-12-07 12:17:45.381450,0 days 00:00:00.466883,0.6,0.0,1.0,300,weighted choice,COMPLETE
1950,1950,38.0,2023-12-07 12:17:45.381646,2023-12-07 12:18:16.914302,0 days 00:00:31.532656,0.5,0.01,0.0,300,random selection,COMPLETE
1951,1951,37.2,2023-12-07 12:18:16.914493,2023-12-07 12:18:17.501350,0 days 00:00:00.586857,0.6,0.5,4.0,250,roulette wheel,COMPLETE
1952,1952,38.0,2023-12-07 12:18:17.501541,2023-12-07 12:18:17.991038,0 days 00:00:00.489497,0.95,0.1,4.0,250,weighted choice,COMPLETE
1953,1953,37.2,2023-12-07 12:18:17.991241,2023-12-07 12:18:18.343670,0 days 00:00:00.352429,0.5,0.1,1.0,250,random selection,COMPLETE
1954,1954,40.8,2023-12-07 12:18:18.343869,2023-12-07 12:18:18.699077,0 days 00:00:00.355208,0.6,0.01,2.0,250,roulette wheel,COMPLETE
1955,1955,37.6,2023-12-07 12:18:18.699268,2023-12-07 12:18:54.341888,0 days 00:00:35.642620,0.8,0.1,0.0,300,random selection,COMPLETE
1956,1956,37.6,2023-12-07 12:18:54.342171,2023-12-07 12:18:54.718633,0 days 00:00:00.376462,0.5,0.1,1.0,300,roulette wheel,COMPLETE
1957,1957,37.2,2023-12-07 12:18:54.718828,2023-12-07 12:19:41.391383,0 days 00:00:46.672555,0.0,0.5,,300,random selection,COMPLETE
1958,1958,36.8,2023-12-07 12:19:41.391653,2023-12-07 12:20:47.059674,0 days 00:01:05.668021,0.0,0.01,,300,weighted choice,COMPLETE
1959,1959,38.4,2023-12-07 12:20:47.059994,2023-12-07 12:20:47.558053,0 days 00:00:00.498059,0.8,0.1,4.0,300,weighted choice,COMPLETE
1960,1960,38.4,2023-12-07 12:20:47.558252,2023-12-07 12:20:48.042615,0 days 00:00:00.484363,0.95,0.1,4.0,250,weighted choice,COMPLETE
1961,1961,38.0,2023-12-07 12:20:48.042800,2023-12-07 12:20:48.505915,0 days 00:00:00.463115,0.8,0.33,2.0,300,roulette wheel,COMPLETE
1962,1962,38.4,2023-12-07 12:20:48.506116,2023-12-07 12:20:48.883938,0 days 00:00:00.377822,0.6,0.1,4.0,300,roulette wheel,COMPLETE
1963,1963,36.8,2023-12-07 12:20:48.884129,2023-12-07 12:23:16.592815,0 days 00:02:27.708686,0.0,0.0,,300,roulette wheel,COMPLETE
1964,1964,41.2,2023-12-07 12:23:16.592999,2023-12-07 12:23:16.779877,0 days 00:00:00.186878,0.8,0.0,2.0,300,roulette wheel,COMPLETE
1965,1965,42.8,2023-12-07 12:23:16.780041,2023-12-07 12:23:17.311826,0 days 00:00:00.531785,0.5,0.0,2.0,250,weighted choice,COMPLETE
1966,1966,39.6,2023-12-07 12:23:17.312032,2023-12-07 12:23:17.749699,0 days 00:00:00.437667,0.95,0.01,2.0,300,weighted choice,COMPLETE
1967,1967,37.2,2023-12-07 12:23:17.749912,2023-12-07 12:23:18.095352,0 days 00:00:00.345440,0.6,0.1,1.0,300,random selection,COMPLETE
1968,1968,37.6,2023-12-07 12:23:18.095548,2023-12-07 12:23:18.639900,0 days 00:00:00.544352,0.8,0.5,1.0,250,roulette wheel,COMPLETE
1969,1969,37.2,2023-12-07 12:23:18.640087,2023-12-07 12:23:19.184886,0 days 00:00:00.544799,0.8,0.5,2.0,250,roulette wheel,COMPLETE
1970,1970,37.2,2023-12-07 12:23:19.185078,2023-12-07 12:24:13.558690,0 days 00:00:54.373612,0.0,0.33,,250,roulette wheel,COMPLETE
1971,1971,37.6,2023-12-07 12:24:13.558876,2023-12-07 12:25:40.725299,0 days 00:01:27.166423,0.6,0.5,0.0,250,weighted choice,COMPLETE
1972,1972,37.6,2023-12-07 12:25:40.725566,2023-12-07 12:26:48.348454,0 days 00:01:07.622888,0.0,0.5,,300,roulette wheel,COMPLETE
1973,1973,39.6,2023-12-07 12:26:48.348636,2023-12-07 12:26:48.685641,0 days 00:00:00.337005,0.95,0.0,2.0,300,weighted choice,COMPLETE
1974,1974,38.4,2023-12-07 12:26:48.685834,2023-12-07 12:26:49.032678,0 days 00:00:00.346844,0.8,0.1,2.0,250,roulette wheel,COMPLETE
1975,1975,37.2,2023-12-07 12:26:49.032932,2023-12-07 12:27:48.270311,0 days 00:00:59.237379,0.6,0.01,0.0,300,weighted choice,COMPLETE
1976,1976,38.0,2023-12-07 12:27:48.270576,2023-12-07 12:28:50.454856,0 days 00:01:02.184280,0.0,0.1,,300,weighted choice,COMPLETE
1977,1977,36.8,2023-12-07 12:28:50.455116,2023-12-07 12:28:50.790239,0 days 00:00:00.335123,0.95,0.1,1.0,250,random selection,COMPLETE
1978,1978,37.6,2023-12-07 12:28:50.790435,2023-12-07 12:28:51.464109,0 days 00:00:00.673674,0.95,0.5,1.0,250,weighted choice,COMPLETE
1979,1979,41.2,2023-12-07 12:28:51.464318,2023-12-07 12:28:51.829137,0 days 00:00:00.364819,0.5,0.01,1.0,250,roulette wheel,COMPLETE
1980,1980,39.6,2023-12-07 12:28:51.829322,2023-12-07 12:28:52.167464,0 days 00:00:00.338142,0.6,0.01,1.0,300,roulette wheel,COMPLETE
1981,1981,38.0,2023-12-07 12:28:52.167660,2023-12-07 12:31:55.047574,0 days 00:03:02.879914,0.8,0.0,0.0,300,weighted choice,COMPLETE
1982,1982,37.6,2023-12-07 12:31:55.047792,2023-12-07 12:31:55.616391,0 days 00:00:00.568599,0.95,0.5,4.0,250,random selection,COMPLETE
1983,1983,37.2,2023-12-07 12:31:55.616601,2023-12-07 12:31:55.873968,0 days 00:00:00.257367,0.5,0.0,2.0,300,random selection,COMPLETE
1984,1984,41.6,2023-12-07 12:31:55.874163,2023-12-07 12:31:56.104797,0 days 00:00:00.230634,0.6,0.0,2.0,250,roulette wheel,COMPLETE
1985,1985,42.0,2023-12-07 12:31:56.104987,2023-12-07 12:31:56.584378,0 days 00:00:00.479391,0.6,0.0,4.0,300,weighted choice,COMPLETE
1986,1986,37.6,2023-12-07 12:31:56.584572,2023-12-07 12:32:43.436969,0 days 00:00:46.852397,0.95,0.1,0.0,250,roulette wheel,COMPLETE
1987,1987,37.2,2023-12-07 12:32:43.437160,2023-12-07 12:32:43.934413,0 days 00:00:00.497253,0.6,0.33,4.0,250,roulette wheel,COMPLETE
1988,1988,38.0,2023-12-07 12:32:43.934608,2023-12-07 12:34:50.046125,0 days 00:02:06.111517,0.0,0.0,,250,roulette wheel,COMPLETE
1989,1989,37.6,2023-12-07 12:34:50.046372,2023-12-07 12:37:33.525560,0 days 00:02:43.479188,0.95,0.0,0.0,250,weighted choice,COMPLETE
1990,1990,37.2,2023-12-07 12:37:33.525884,2023-12-07 12:37:33.978054,0 days 00:00:00.452170,0.95,0.33,1.0,250,random selection,COMPLETE
1991,1991,36.8,2023-12-07 12:37:33.978257,2023-12-07 12:39:39.587563,0 days 00:02:05.609306,0.0,0.0,,250,roulette wheel,COMPLETE
1992,1992,36.4,2023-12-07 12:39:39.587753,2023-12-07 12:39:40.047984,0 days 00:00:00.460231,0.95,0.33,4.0,300,random selection,COMPLETE
1993,1993,37.2,2023-12-07 12:39:40.048176,2023-12-07 12:43:35.139947,0 days 00:03:55.091771,0.0,0.0,,250,weighted choice,COMPLETE
1994,1994,40.0,2023-12-07 12:43:35.140317,2023-12-07 12:43:35.514194,0 days 00:00:00.373877,0.5,0.01,2.0,250,roulette wheel,COMPLETE
1995,1995,37.6,2023-12-07 12:43:35.514407,2023-12-07 12:43:35.847738,0 days 00:00:00.333331,0.95,0.1,2.0,300,random selection,COMPLETE
