,number,value,datetime_start,datetime_complete,duration,params_C,params_M,params_N,params_P,params_S,state
1339,1339,36.0,2023-12-06 15:58:15.436750,2023-12-06 15:58:15.783328,0 days 00:00:00.346578,0.6,0.01,1.0,200,random selection,COMPLETE
1340,1340,42.4,2023-12-06 15:58:15.783515,2023-12-06 15:58:15.947424,0 days 00:00:00.163909,0.95,0.0,1.0,150,roulette wheel,COMPLETE
1341,1341,37.2,2023-12-06 15:58:15.947603,2023-12-06 15:59:53.544044,0 days 00:01:37.596441,0.95,0.0,0.0,200,roulette wheel,COMPLETE
1342,1342,36.0,2023-12-06 15:59:53.544240,2023-12-06 15:59:53.910694,0 days 00:00:00.366454,0.5,0.1,2.0,150,random selection,COMPLETE
1343,1343,40.4,2023-12-06 15:59:53.910879,2023-12-06 15:59:54.261906,0 days 00:00:00.351027,0.6,0.01,1.0,150,roulette wheel,COMPLETE
1344,1344,42.8,2023-12-06 15:59:54.262089,2023-12-06 15:59:54.658630,0 days 00:00:00.396541,0.6,0.0,4.0,150,weighted choice,COMPLETE
1345,1345,37.2,2023-12-06 15:59:54.658816,2023-12-06 16:00:24.859022,0 days 00:00:30.200206,0.0,0.1,,150,roulette wheel,COMPLETE
1346,1346,36.8,2023-12-06 16:00:24.859222,2023-12-06 16:00:25.081929,0 days 00:00:00.222707,0.6,0.0,1.0,200,random selection,COMPLETE
1347,1347,37.6,2023-12-06 16:00:25.082129,2023-12-06 16:01:07.695255,0 days 00:00:42.613126,0.0,0.33,,150,roulette wheel,COMPLETE
1348,1348,37.2,2023-12-06 16:01:07.695448,2023-12-06 16:01:08.249519,0 days 00:00:00.554071,0.95,0.33,2.0,150,weighted choice,COMPLETE
1349,1349,37.6,2023-12-06 16:01:08.249705,2023-12-06 16:02:00.606298,0 days 00:00:52.356593,0.0,0.33,,200,roulette wheel,COMPLETE
1350,1350,37.6,2023-12-06 16:02:00.606481,2023-12-06 16:02:00.951185,0 days 00:00:00.344704,0.95,0.1,2.0,150,roulette wheel,COMPLETE
1351,1351,41.2,2023-12-06 16:02:00.951374,2023-12-06 16:02:01.338250,0 days 00:00:00.386876,0.5,0.01,2.0,150,roulette wheel,COMPLETE
1352,1352,36.8,2023-12-06 16:02:01.338438,2023-12-06 16:02:36.306357,0 days 00:00:34.967919,0.0,0.1,,200,roulette wheel,COMPLETE
1353,1353,40.8,2023-12-06 16:02:36.306553,2023-12-06 16:02:36.697780,0 days 00:00:00.391227,0.5,0.01,2.0,150,roulette wheel,COMPLETE
1354,1354,37.6,2023-12-06 16:02:36.697969,2023-12-06 16:02:37.193842,0 days 00:00:00.495873,0.5,0.33,1.0,150,random selection,COMPLETE
1355,1355,40.8,2023-12-06 16:02:37.194048,2023-12-06 16:02:37.595360,0 days 00:00:00.401312,0.5,0.01,4.0,200,roulette wheel,COMPLETE
1356,1356,38.0,2023-12-06 16:02:37.595540,2023-12-06 16:03:10.636235,0 days 00:00:33.040695,0.0,0.01,,200,roulette wheel,COMPLETE
1357,1357,37.6,2023-12-06 16:03:10.636433,2023-12-06 16:03:11.239642,0 days 00:00:00.603209,0.5,0.5,4.0,200,roulette wheel,COMPLETE
1358,1358,37.2,2023-12-06 16:03:11.239836,2023-12-06 16:03:11.568357,0 days 00:00:00.328521,0.8,0.01,4.0,150,random selection,COMPLETE
1359,1359,39.2,2023-12-06 16:03:11.568553,2023-12-06 16:03:39.031566,0 days 00:00:27.463013,0.5,0.01,0.0,200,random selection,COMPLETE
1360,1360,38.0,2023-12-06 16:03:39.031877,2023-12-06 16:03:39.225370,0 days 00:00:00.193493,0.8,0.0,2.0,200,random selection,COMPLETE
1361,1361,36.8,2023-12-06 16:03:39.225549,2023-12-06 16:05:48.576296,0 days 00:02:09.350747,0.0,0.0,,150,weighted choice,COMPLETE
1362,1362,37.6,2023-12-06 16:05:48.576490,2023-12-06 16:05:49.025969,0 days 00:00:00.449479,0.6,0.1,2.0,150,weighted choice,COMPLETE
1363,1363,37.6,2023-12-06 16:05:49.026161,2023-12-06 16:05:49.642349,0 days 00:00:00.616188,0.5,0.33,2.0,200,weighted choice,COMPLETE
1364,1364,37.2,2023-12-06 16:05:49.642543,2023-12-06 16:06:12.641861,0 days 00:00:22.999318,0.0,0.01,,150,random selection,COMPLETE
1365,1365,39.6,2023-12-06 16:06:12.642063,2023-12-06 16:06:12.970538,0 days 00:00:00.328475,0.8,0.01,4.0,200,roulette wheel,COMPLETE
1366,1366,36.8,2023-12-06 16:06:12.970735,2023-12-06 16:06:13.179139,0 days 00:00:00.208404,0.8,0.0,4.0,200,random selection,COMPLETE
1367,1367,40.8,2023-12-06 16:06:13.179329,2023-12-06 16:06:13.525670,0 days 00:00:00.346341,0.6,0.01,1.0,200,roulette wheel,COMPLETE
1368,1368,37.6,2023-12-06 16:06:13.525864,2023-12-06 16:06:45.375929,0 days 00:00:31.850065,0.95,0.01,0.0,150,roulette wheel,COMPLETE
1369,1369,39.6,2023-12-06 16:06:45.376153,2023-12-06 16:06:45.748805,0 days 00:00:00.372652,0.6,0.01,4.0,150,roulette wheel,COMPLETE
1370,1370,42.8,2023-12-06 16:06:45.749006,2023-12-06 16:06:46.065314,0 days 00:00:00.316308,0.8,0.0,2.0,150,weighted choice,COMPLETE
1371,1371,42.8,2023-12-06 16:06:46.065507,2023-12-06 16:06:46.267676,0 days 00:00:00.202169,0.8,0.0,2.0,150,roulette wheel,COMPLETE
1372,1372,37.6,2023-12-06 16:06:46.267879,2023-12-06 16:06:46.817385,0 days 00:00:00.549506,0.95,0.5,4.0,150,roulette wheel,COMPLETE
1373,1373,44.8,2023-12-06 16:06:46.817573,2023-12-06 16:06:47.093561,0 days 00:00:00.275988,0.5,0.0,2.0,200,roulette wheel,COMPLETE
1374,1374,37.6,2023-12-06 16:06:47.093753,2023-12-06 16:06:47.688251,0 days 00:00:00.594498,0.5,0.5,1.0,150,roulette wheel,COMPLETE
1375,1375,37.6,2023-12-06 16:06:47.688450,2023-12-06 16:08:07.071288,0 days 00:01:19.382838,0.8,0.0,0.0,150,random selection,COMPLETE
1376,1376,37.2,2023-12-06 16:08:07.071511,2023-12-06 16:08:36.639141,0 days 00:00:29.567630,0.95,0.01,0.0,150,random selection,COMPLETE
1377,1377,36.8,2023-12-06 16:08:36.639327,2023-12-06 16:09:01.683242,0 days 00:00:25.043915,0.0,0.01,,150,random selection,COMPLETE
1378,1378,37.2,2023-12-06 16:09:01.683442,2023-12-06 16:12:04.477349,0 days 00:03:02.793907,0.0,0.0,,200,weighted choice,COMPLETE
1379,1379,37.2,2023-12-06 16:12:04.477540,2023-12-06 16:13:52.654792,0 days 00:01:48.177252,0.95,0.0,0.0,200,roulette wheel,COMPLETE
1380,1380,38.0,2023-12-06 16:13:52.654985,2023-12-06 16:14:41.660153,0 days 00:00:49.005168,0.0,0.1,,200,weighted choice,COMPLETE
1381,1381,37.6,2023-12-06 16:14:41.660412,2023-12-06 16:15:09.457397,0 days 00:00:27.796985,0.0,0.01,,200,random selection,COMPLETE
1382,1382,41.2,2023-12-06 16:15:09.457596,2023-12-06 16:15:09.759984,0 days 00:00:00.302388,0.95,0.01,2.0,150,roulette wheel,COMPLETE
1383,1383,40.8,2023-12-06 16:15:09.760190,2023-12-06 16:15:10.130012,0 days 00:00:00.369822,0.6,0.01,2.0,150,roulette wheel,COMPLETE
1384,1384,37.2,2023-12-06 16:15:10.130200,2023-12-06 16:15:37.213839,0 days 00:00:27.083639,0.0,0.01,,150,roulette wheel,COMPLETE
1385,1385,38.4,2023-12-06 16:15:37.214040,2023-12-06 16:16:33.671215,0 days 00:00:56.457175,0.5,0.5,0.0,150,roulette wheel,COMPLETE
1386,1386,37.6,2023-12-06 16:16:33.671411,2023-12-06 16:16:34.036088,0 days 00:00:00.364677,0.5,0.1,1.0,150,random selection,COMPLETE
1387,1387,37.6,2023-12-06 16:16:34.036277,2023-12-06 16:17:13.790830,0 days 00:00:39.754553,0.5,0.1,0.0,200,roulette wheel,COMPLETE
1388,1388,37.2,2023-12-06 16:17:13.791040,2023-12-06 16:18:11.242748,0 days 00:00:57.451708,0.6,0.5,0.0,150,roulette wheel,COMPLETE
1389,1389,38.0,2023-12-06 16:18:11.242942,2023-12-06 16:18:11.697805,0 days 00:00:00.454863,0.8,0.33,1.0,200,roulette wheel,COMPLETE
1390,1390,37.2,2023-12-06 16:18:11.698001,2023-12-06 16:18:11.907106,0 days 00:00:00.209105,0.8,0.0,4.0,150,random selection,COMPLETE
1391,1391,37.6,2023-12-06 16:18:11.907300,2023-12-06 16:18:12.278659,0 days 00:00:00.371359,0.6,0.1,4.0,200,roulette wheel,COMPLETE
1392,1392,40.8,2023-12-06 16:18:12.278858,2023-12-06 16:18:12.593743,0 days 00:00:00.314885,0.8,0.01,2.0,150,roulette wheel,COMPLETE
1393,1393,37.2,2023-12-06 16:18:12.593934,2023-12-06 16:18:12.947456,0 days 00:00:00.353522,0.6,0.01,2.0,200,random selection,COMPLETE
1394,1394,37.6,2023-12-06 16:18:12.947661,2023-12-06 16:18:13.425435,0 days 00:00:00.477774,0.6,0.33,2.0,150,roulette wheel,COMPLETE
1395,1395,37.2,2023-12-06 16:18:13.425635,2023-12-06 16:18:13.895707,0 days 00:00:00.470072,0.95,0.33,2.0,200,roulette wheel,COMPLETE
1396,1396,37.6,2023-12-06 16:18:13.895907,2023-12-06 16:18:14.389179,0 days 00:00:00.493272,0.5,0.33,2.0,150,roulette wheel,COMPLETE
1397,1397,37.2,2023-12-06 16:18:14.389384,2023-12-06 16:18:42.829359,0 days 00:00:28.439975,0.0,0.01,,200,random selection,COMPLETE
1398,1398,43.2,2023-12-06 16:18:42.829555,2023-12-06 16:18:42.998288,0 days 00:00:00.168733,0.95,0.0,1.0,150,roulette wheel,COMPLETE
1399,1399,36.8,2023-12-06 16:18:42.998478,2023-12-06 16:19:43.603600,0 days 00:01:00.605122,0.0,0.5,,200,roulette wheel,COMPLETE
1400,1400,38.4,2023-12-06 16:19:43.603790,2023-12-06 16:20:45.478178,0 days 00:01:01.874388,0.0,0.5,,150,weighted choice,COMPLETE
1401,1401,38.4,2023-12-06 16:20:45.478381,2023-12-06 16:21:15.711730,0 days 00:00:30.233349,0.0,0.1,,150,roulette wheel,COMPLETE
1402,1402,37.2,2023-12-06 16:21:15.711991,2023-12-06 16:21:16.073914,0 days 00:00:00.361923,0.6,0.1,2.0,200,random selection,COMPLETE
1403,1403,38.4,2023-12-06 16:21:16.074123,2023-12-06 16:21:16.645136,0 days 00:00:00.571013,0.6,0.5,1.0,150,roulette wheel,COMPLETE
1404,1404,36.8,2023-12-06 16:21:16.645327,2023-12-06 16:22:37.836220,0 days 00:01:21.190893,0.5,0.5,0.0,200,weighted choice,COMPLETE
1405,1405,37.2,2023-12-06 16:22:37.836508,2023-12-06 16:22:38.507714,0 days 00:00:00.671206,0.8,0.5,4.0,200,weighted choice,COMPLETE
1406,1406,37.6,2023-12-06 16:22:38.507925,2023-12-06 16:23:05.967224,0 days 00:00:27.459299,0.0,0.01,,150,roulette wheel,COMPLETE
1407,1407,37.2,2023-12-06 16:23:05.967441,2023-12-06 16:23:42.082944,0 days 00:00:36.115503,0.8,0.01,0.0,200,roulette wheel,COMPLETE
1408,1408,38.0,2023-12-06 16:23:42.083270,2023-12-06 16:25:02.918806,0 days 00:01:20.835536,0.0,0.0,,150,roulette wheel,COMPLETE
1409,1409,36.4,2023-12-06 16:25:02.919009,2023-12-06 16:25:03.517131,0 days 00:00:00.598122,0.5,0.5,2.0,150,roulette wheel,COMPLETE
1410,1410,37.6,2023-12-06 16:25:03.517326,2023-12-06 16:25:34.857615,0 days 00:00:31.340289,0.8,0.01,0.0,150,roulette wheel,COMPLETE
1411,1411,36.8,2023-12-06 16:25:34.857813,2023-12-06 16:25:35.387976,0 days 00:00:00.530163,0.95,0.5,1.0,150,roulette wheel,COMPLETE
1412,1412,36.8,2023-12-06 16:25:35.388178,2023-12-06 16:25:35.851066,0 days 00:00:00.462888,0.8,0.33,2.0,150,roulette wheel,COMPLETE
1413,1413,38.0,2023-12-06 16:25:35.851265,2023-12-06 16:26:17.931856,0 days 00:00:42.080591,0.0,0.33,,150,roulette wheel,COMPLETE
1414,1414,36.4,2023-12-06 16:26:17.932052,2023-12-06 16:26:18.159175,0 days 00:00:00.227123,0.6,0.0,1.0,150,random selection,COMPLETE
1415,1415,40.4,2023-12-06 16:26:18.159371,2023-12-06 16:26:18.546109,0 days 00:00:00.386738,0.5,0.01,2.0,150,roulette wheel,COMPLETE
1416,1416,37.6,2023-12-06 16:26:18.546300,2023-12-06 16:29:19.259194,0 days 00:03:00.712894,0.0,0.0,,200,weighted choice,COMPLETE
1417,1417,40.0,2023-12-06 16:29:19.259552,2023-12-06 16:29:19.586615,0 days 00:00:00.327063,0.8,0.01,4.0,200,roulette wheel,COMPLETE
1418,1418,43.2,2023-12-06 16:29:19.586815,2023-12-06 16:29:19.838005,0 days 00:00:00.251190,0.6,0.0,4.0,200,roulette wheel,COMPLETE
1419,1419,36.8,2023-12-06 16:29:19.838193,2023-12-06 16:29:20.183069,0 days 00:00:00.344876,0.95,0.1,2.0,200,random selection,COMPLETE
1420,1420,36.4,2023-12-06 16:29:20.183270,2023-12-06 16:29:20.386007,0 days 00:00:00.202737,0.8,0.0,2.0,150,random selection,COMPLETE
1421,1421,38.0,2023-12-06 16:29:20.386213,2023-12-06 16:29:20.867545,0 days 00:00:00.481332,0.5,0.1,2.0,150,weighted choice,COMPLETE
1422,1422,38.0,2023-12-06 16:29:20.867771,2023-12-06 16:29:21.348148,0 days 00:00:00.480377,0.8,0.33,4.0,200,random selection,COMPLETE
1423,1423,42.0,2023-12-06 16:29:21.348354,2023-12-06 16:29:21.547224,0 days 00:00:00.198870,0.8,0.0,2.0,150,roulette wheel,COMPLETE
1424,1424,36.8,2023-12-06 16:29:21.547419,2023-12-06 16:29:22.107380,0 days 00:00:00.559961,0.6,0.5,1.0,200,random selection,COMPLETE
1425,1425,38.0,2023-12-06 16:29:22.107589,2023-12-06 16:30:14.827299,0 days 00:00:52.719710,0.5,0.5,0.0,200,random selection,COMPLETE
1426,1426,38.4,2023-12-06 16:30:14.827565,2023-12-06 16:31:18.325684,0 days 00:01:03.498119,0.0,0.5,,150,weighted choice,COMPLETE
1427,1427,39.6,2023-12-06 16:31:18.325908,2023-12-06 16:31:18.661773,0 days 00:00:00.335865,0.8,0.01,4.0,200,roulette wheel,COMPLETE
1428,1428,37.6,2023-12-06 16:31:18.661961,2023-12-06 16:31:45.706925,0 days 00:00:27.044964,0.0,0.01,,150,roulette wheel,COMPLETE
1429,1429,37.6,2023-12-06 16:31:45.707253,2023-12-06 16:31:46.086342,0 days 00:00:00.379089,0.5,0.1,2.0,150,roulette wheel,COMPLETE
1430,1430,38.0,2023-12-06 16:31:46.086538,2023-12-06 16:32:18.323847,0 days 00:00:32.237309,0.8,0.01,0.0,200,random selection,COMPLETE
1431,1431,39.6,2023-12-06 16:32:18.324065,2023-12-06 16:32:18.686619,0 days 00:00:00.362554,0.95,0.1,4.0,150,roulette wheel,COMPLETE
1432,1432,38.0,2023-12-06 16:32:18.686830,2023-12-06 16:34:01.886509,0 days 00:01:43.199679,0.8,0.0,0.0,200,roulette wheel,COMPLETE
1433,1433,37.2,2023-12-06 16:34:01.886704,2023-12-06 16:34:42.686200,0 days 00:00:40.799496,0.8,0.01,0.0,150,weighted choice,COMPLETE
1434,1434,37.6,2023-12-06 16:34:42.686429,2023-12-06 16:35:24.822465,0 days 00:00:42.136036,0.0,0.33,,150,roulette wheel,COMPLETE
1435,1435,40.8,2023-12-06 16:35:24.822674,2023-12-06 16:35:25.109205,0 days 00:00:00.286531,0.95,0.01,1.0,200,roulette wheel,COMPLETE
1436,1436,37.6,2023-12-06 16:35:25.109430,2023-12-06 16:35:25.651054,0 days 00:00:00.541624,0.95,0.5,2.0,200,random selection,COMPLETE
1437,1437,37.6,2023-12-06 16:35:25.651249,2023-12-06 16:35:26.237670,0 days 00:00:00.586421,0.6,0.5,4.0,200,roulette wheel,COMPLETE
1438,1438,38.0,2023-12-06 16:35:26.237867,2023-12-06 16:35:26.604912,0 days 00:00:00.367045,0.5,0.1,1.0,150,roulette wheel,COMPLETE
1439,1439,40.4,2023-12-06 16:35:26.605121,2023-12-06 16:35:26.992892,0 days 00:00:00.387771,0.95,0.01,2.0,150,weighted choice,COMPLETE
1440,1440,37.2,2023-12-06 16:35:26.993100,2023-12-06 16:36:08.090479,0 days 00:00:41.097379,0.95,0.01,0.0,150,weighted choice,COMPLETE
1441,1441,37.6,2023-12-06 16:36:08.090860,2023-12-06 16:36:08.324978,0 days 00:00:00.234118,0.6,0.0,2.0,200,random selection,COMPLETE
1442,1442,37.2,2023-12-06 16:36:08.325177,2023-12-06 16:37:28.523374,0 days 00:01:20.198197,0.0,0.0,,150,roulette wheel,COMPLETE
1443,1443,38.0,2023-12-06 16:37:28.523568,2023-12-06 16:37:28.981537,0 days 00:00:00.457969,0.95,0.33,1.0,200,roulette wheel,COMPLETE
1444,1444,37.2,2023-12-06 16:37:28.981740,2023-12-06 16:40:31.259497,0 days 00:03:02.277757,0.0,0.0,,200,weighted choice,COMPLETE
1445,1445,40.8,2023-12-06 16:40:31.259850,2023-12-06 16:40:31.643288,0 days 00:00:00.383438,0.95,0.01,1.0,150,weighted choice,COMPLETE
1446,1446,37.6,2023-12-06 16:40:31.643494,2023-12-06 16:41:07.568656,0 days 00:00:35.925162,0.6,0.01,0.0,200,roulette wheel,COMPLETE
1447,1447,38.0,2023-12-06 16:41:07.568978,2023-12-06 16:41:53.656101,0 days 00:00:46.087123,0.8,0.33,0.0,150,random selection,COMPLETE
1448,1448,37.6,2023-12-06 16:41:53.656374,2023-12-06 16:41:54.299829,0 days 00:00:00.643455,0.95,0.5,4.0,150,weighted choice,COMPLETE
1449,1449,38.0,2023-12-06 16:41:54.300045,2023-12-06 16:42:20.680583,0 days 00:00:26.380538,0.5,0.01,0.0,150,random selection,COMPLETE
1450,1450,37.2,2023-12-06 16:42:20.680949,2023-12-06 16:42:21.019046,0 days 00:00:00.338097,0.95,0.1,1.0,150,roulette wheel,COMPLETE
1451,1451,37.2,2023-12-06 16:42:21.019236,2023-12-06 16:42:21.551061,0 days 00:00:00.531825,0.8,0.5,1.0,200,roulette wheel,COMPLETE
1452,1452,40.0,2023-12-06 16:42:21.551253,2023-12-06 16:42:21.910463,0 days 00:00:00.359210,0.6,0.01,2.0,200,roulette wheel,COMPLETE
1453,1453,36.4,2023-12-06 16:42:21.910671,2023-12-06 16:42:22.552962,0 days 00:00:00.642291,0.8,0.5,1.0,200,weighted choice,COMPLETE
1454,1454,40.8,2023-12-06 16:42:22.553164,2023-12-06 16:42:22.858052,0 days 00:00:00.304888,0.8,0.01,1.0,150,roulette wheel,COMPLETE
1455,1455,37.2,2023-12-06 16:42:22.858252,2023-12-06 16:42:59.280933,0 days 00:00:36.422681,0.8,0.1,0.0,150,roulette wheel,COMPLETE
1456,1456,38.0,2023-12-06 16:42:59.281211,2023-12-06 16:43:35.885163,0 days 00:00:36.603952,0.8,0.1,0.0,200,random selection,COMPLETE
1457,1457,36.8,2023-12-06 16:43:35.885374,2023-12-06 16:44:42.658292,0 days 00:01:06.772918,0.6,0.5,0.0,150,weighted choice,COMPLETE
1458,1458,37.6,2023-12-06 16:44:42.658523,2023-12-06 16:45:17.488384,0 days 00:00:34.829861,0.95,0.1,0.0,150,random selection,COMPLETE
1459,1459,37.6,2023-12-06 16:45:17.488670,2023-12-06 16:45:17.948366,0 days 00:00:00.459696,0.8,0.33,1.0,150,roulette wheel,COMPLETE
1460,1460,37.2,2023-12-06 16:45:17.948581,2023-12-06 16:46:25.821625,0 days 00:01:07.873044,0.6,0.5,0.0,200,roulette wheel,COMPLETE
1461,1461,39.6,2023-12-06 16:46:25.821846,2023-12-06 16:46:26.156126,0 days 00:00:00.334280,0.8,0.01,4.0,200,roulette wheel,COMPLETE
1462,1462,37.2,2023-12-06 16:46:26.156337,2023-12-06 16:46:55.216364,0 days 00:00:29.060027,0.6,0.01,0.0,150,roulette wheel,COMPLETE
1463,1463,37.2,2023-12-06 16:46:55.216575,2023-12-06 16:47:26.234622,0 days 00:00:31.018047,0.95,0.01,0.0,150,roulette wheel,COMPLETE
1464,1464,38.0,2023-12-06 16:47:26.234971,2023-12-06 16:47:26.605641,0 days 00:00:00.370670,0.95,0.1,4.0,200,roulette wheel,COMPLETE
1465,1465,36.4,2023-12-06 16:47:26.605847,2023-12-06 16:47:27.218376,0 days 00:00:00.612529,0.5,0.5,4.0,200,roulette wheel,COMPLETE
1466,1466,43.2,2023-12-06 16:47:27.218590,2023-12-06 16:47:27.438455,0 days 00:00:00.219865,0.8,0.0,4.0,150,roulette wheel,COMPLETE
1467,1467,40.4,2023-12-06 16:47:27.438655,2023-12-06 16:47:27.735363,0 days 00:00:00.296708,0.95,0.01,2.0,200,roulette wheel,COMPLETE
1468,1468,40.8,2023-12-06 16:47:27.735562,2023-12-06 16:47:28.020523,0 days 00:00:00.284961,0.95,0.01,1.0,200,roulette wheel,COMPLETE
1469,1469,37.6,2023-12-06 16:47:28.020798,2023-12-06 16:47:28.575504,0 days 00:00:00.554706,0.8,0.5,2.0,200,roulette wheel,COMPLETE
1470,1470,43.6,2023-12-06 16:47:28.575705,2023-12-06 16:47:28.822880,0 days 00:00:00.247175,0.6,0.0,2.0,150,roulette wheel,COMPLETE
1471,1471,37.6,2023-12-06 16:47:28.823093,2023-12-06 16:48:09.404842,0 days 00:00:40.581749,0.6,0.1,0.0,200,roulette wheel,COMPLETE
1472,1472,42.8,2023-12-06 16:48:09.405055,2023-12-06 16:48:09.659948,0 days 00:00:00.254893,0.6,0.0,4.0,200,roulette wheel,COMPLETE
1473,1473,40.4,2023-12-06 16:48:09.660156,2023-12-06 16:48:10.026710,0 days 00:00:00.366554,0.6,0.01,4.0,200,roulette wheel,COMPLETE
1474,1474,37.6,2023-12-06 16:48:10.026906,2023-12-06 16:48:10.565762,0 days 00:00:00.538856,0.8,0.5,1.0,150,roulette wheel,COMPLETE
1475,1475,37.6,2023-12-06 16:48:10.565975,2023-12-06 16:48:44.855590,0 days 00:00:34.289615,0.6,0.1,0.0,150,roulette wheel,COMPLETE
1476,1476,40.8,2023-12-06 16:48:44.855875,2023-12-06 16:48:45.376385,0 days 00:00:00.520510,0.6,0.01,2.0,200,weighted choice,COMPLETE
1477,1477,38.4,2023-12-06 16:48:45.376590,2023-12-06 16:50:13.090406,0 days 00:01:27.713816,0.95,0.0,0.0,150,roulette wheel,COMPLETE
1478,1478,37.2,2023-12-06 16:50:13.090610,2023-12-06 16:50:13.681066,0 days 00:00:00.590456,0.5,0.5,2.0,200,roulette wheel,COMPLETE
1479,1479,36.8,2023-12-06 16:50:13.681274,2023-12-06 16:51:11.008286,0 days 00:00:57.327012,0.5,0.5,0.0,200,random selection,COMPLETE
1480,1480,40.8,2023-12-06 16:51:11.008665,2023-12-06 16:51:11.298058,0 days 00:00:00.289393,0.95,0.0,1.0,200,weighted choice,COMPLETE
1481,1481,37.2,2023-12-06 16:51:11.298262,2023-12-06 16:51:11.665406,0 days 00:00:00.367144,0.6,0.1,4.0,200,roulette wheel,COMPLETE
1482,1482,37.2,2023-12-06 16:51:11.665600,2023-12-06 16:52:13.663411,0 days 00:01:01.997811,0.0,0.5,,200,roulette wheel,COMPLETE
1483,1483,38.0,2023-12-06 16:52:13.663613,2023-12-06 16:52:14.040100,0 days 00:00:00.376487,0.6,0.1,4.0,200,roulette wheel,COMPLETE
1484,1484,37.6,2023-12-06 16:52:14.040301,2023-12-06 16:52:14.757147,0 days 00:00:00.716846,0.5,0.5,4.0,200,weighted choice,COMPLETE
1485,1485,36.8,2023-12-06 16:52:14.757367,2023-12-06 16:52:15.020354,0 days 00:00:00.262987,0.5,0.0,2.0,150,random selection,COMPLETE
1486,1486,38.4,2023-12-06 16:52:15.020554,2023-12-06 16:53:15.676955,0 days 00:01:00.656401,0.5,0.5,0.0,200,random selection,COMPLETE
1487,1487,37.6,2023-12-06 16:53:15.677236,2023-12-06 16:54:05.965174,0 days 00:00:50.287938,0.0,0.5,,200,random selection,COMPLETE
1488,1488,38.8,2023-12-06 16:54:05.965437,2023-12-06 16:54:06.335008,0 days 00:00:00.369571,0.5,0.1,2.0,150,roulette wheel,COMPLETE
1489,1489,37.6,2023-12-06 16:54:06.335227,2023-12-06 16:54:34.684008,0 days 00:00:28.348781,0.0,0.1,,150,random selection,COMPLETE
1490,1490,37.6,2023-12-06 16:54:34.684351,2023-12-06 16:54:35.152265,0 days 00:00:00.467914,0.8,0.33,2.0,200,roulette wheel,COMPLETE
1491,1491,38.0,2023-12-06 16:54:35.152470,2023-12-06 16:54:35.532226,0 days 00:00:00.379756,0.5,0.1,2.0,200,roulette wheel,COMPLETE
1492,1492,37.2,2023-12-06 16:54:35.532427,2023-12-06 16:54:35.863837,0 days 00:00:00.331410,0.8,0.1,1.0,200,random selection,COMPLETE
1493,1493,38.0,2023-12-06 16:54:35.864048,2023-12-06 16:54:36.283728,0 days 00:00:00.419680,0.95,0.1,1.0,150,weighted choice,COMPLETE
1494,1494,38.4,2023-12-06 16:54:36.283950,2023-12-06 16:55:10.639020,0 days 00:00:34.355070,0.6,0.1,0.0,200,random selection,COMPLETE
1495,1495,36.4,2023-12-06 16:55:10.639419,2023-12-06 16:56:20.868705,0 days 00:01:10.229286,0.8,0.5,0.0,150,weighted choice,COMPLETE
1496,1496,37.2,2023-12-06 16:56:20.868941,2023-12-06 16:56:52.199682,0 days 00:00:31.330741,0.0,0.1,,150,roulette wheel,COMPLETE
1497,1497,37.6,2023-12-06 16:56:52.199880,2023-12-06 16:57:21.933540,0 days 00:00:29.733660,0.0,0.1,,150,roulette wheel,COMPLETE
1498,1498,38.0,2023-12-06 16:57:21.933749,2023-12-06 16:57:22.501749,0 days 00:00:00.568000,0.95,0.5,2.0,200,roulette wheel,COMPLETE
1499,1499,37.6,2023-12-06 16:57:22.501951,2023-12-06 16:58:20.814201,0 days 00:00:58.312250,0.6,0.5,0.0,150,roulette wheel,COMPLETE
1500,1500,38.0,2023-12-06 16:58:20.814498,2023-12-06 17:01:27.563082,0 days 00:03:06.748584,0.0,0.0,,200,weighted choice,COMPLETE
1501,1501,37.6,2023-12-06 17:01:27.563760,2023-12-06 17:01:27.930739,0 days 00:00:00.366979,0.6,0.1,1.0,150,roulette wheel,COMPLETE
1502,1502,37.2,2023-12-06 17:01:27.931002,2023-12-06 17:02:33.034695,0 days 00:01:05.103693,0.0,0.33,,200,weighted choice,COMPLETE
1503,1503,40.0,2023-12-06 17:02:33.034906,2023-12-06 17:02:33.482472,0 days 00:00:00.447566,0.8,0.01,1.0,200,weighted choice,COMPLETE
