,number,value,datetime_start,datetime_complete,duration,params_C,params_M,params_N,params_P,params_S,state
1009,1009,36.4,2023-12-06 14:32:16.060768,2023-12-06 14:32:21.891467,0 days 00:00:05.830699,0.0,0.1,,20,weighted choice,COMPLETE
1010,1010,39.6,2023-12-06 14:32:21.891738,2023-12-06 14:32:22.303370,0 days 00:00:00.411632,0.95,0.01,4.0,10,weighted choice,COMPLETE
1011,1011,42.0,2023-12-06 14:32:22.303680,2023-12-06 14:32:22.639338,0 days 00:00:00.335658,0.8,0.01,1.0,50,roulette wheel,COMPLETE
1012,1012,38.0,2023-12-06 14:32:22.639625,2023-12-06 14:32:24.912877,0 days 00:00:02.273252,0.0,0.01,,10,roulette wheel,COMPLETE
1013,1013,37.2,2023-12-06 14:32:24.913159,2023-12-06 14:32:28.771508,0 days 00:00:03.858349,0.0,0.33,,10,roulette wheel,COMPLETE
1014,1014,36.8,2023-12-06 14:32:28.771795,2023-12-06 14:32:33.825600,0 days 00:00:05.053805,0.6,0.5,0.0,10,roulette wheel,COMPLETE
1015,1015,37.6,2023-12-06 14:32:33.825881,2023-12-06 14:32:34.415017,0 days 00:00:00.589136,0.95,0.5,2.0,10,weighted choice,COMPLETE
1016,1016,39.2,2023-12-06 14:32:34.415294,2023-12-06 14:32:35.031937,0 days 00:00:00.616643,0.5,0.0,4.0,10,roulette wheel,COMPLETE
1017,1017,38.4,2023-12-06 14:32:35.032216,2023-12-06 14:32:47.006081,0 days 00:00:11.973865,0.0,0.1,,50,random selection,COMPLETE
1018,1018,38.0,2023-12-06 14:32:47.006347,2023-12-06 14:32:47.469132,0 days 00:00:00.462785,0.8,0.33,1.0,100,roulette wheel,COMPLETE
1019,1019,42.0,2023-12-06 14:32:47.469419,2023-12-06 14:32:47.812699,0 days 00:00:00.343280,0.95,0.01,4.0,20,roulette wheel,COMPLETE
1020,1020,38.0,2023-12-06 14:32:47.812975,2023-12-06 14:33:02.378433,0 days 00:00:14.565458,0.6,0.0,0.0,20,roulette wheel,COMPLETE
1021,1021,38.8,2023-12-06 14:33:02.378729,2023-12-06 14:33:09.847340,0 days 00:00:07.468611,0.0,0.33,,20,roulette wheel,COMPLETE
1022,1022,38.0,2023-12-06 14:33:09.847619,2023-12-06 14:33:10.426826,0 days 00:00:00.579207,0.8,0.5,1.0,20,weighted choice,COMPLETE
1023,1023,38.0,2023-12-06 14:33:10.427117,2023-12-06 14:33:10.883890,0 days 00:00:00.456773,0.8,0.33,1.0,50,random selection,COMPLETE
1024,1024,37.6,2023-12-06 14:33:10.884181,2023-12-06 14:33:18.020572,0 days 00:00:07.136391,0.0,0.0,,10,weighted choice,COMPLETE
1025,1025,37.2,2023-12-06 14:33:18.020837,2023-12-06 14:33:18.456776,0 days 00:00:00.435939,0.5,0.01,2.0,20,random selection,COMPLETE
1026,1026,38.0,2023-12-06 14:33:18.457059,2023-12-06 14:33:21.684273,0 days 00:00:03.227214,0.8,0.1,0.0,10,roulette wheel,COMPLETE
1027,1027,37.6,2023-12-06 14:33:21.684564,2023-12-06 14:33:22.244309,0 days 00:00:00.559745,0.8,0.5,4.0,100,roulette wheel,COMPLETE
1028,1028,42.0,2023-12-06 14:33:22.244605,2023-12-06 14:33:22.617189,0 days 00:00:00.372584,0.6,0.01,4.0,100,roulette wheel,COMPLETE
1029,1029,37.6,2023-12-06 14:33:22.617461,2023-12-06 14:33:23.088817,0 days 00:00:00.471356,0.8,0.33,4.0,50,roulette wheel,COMPLETE
1030,1030,37.2,2023-12-06 14:33:23.089108,2023-12-06 14:33:45.258665,0 days 00:00:22.169557,0.8,0.33,0.0,50,weighted choice,COMPLETE
1031,1031,37.6,2023-12-06 14:33:45.259004,2023-12-06 14:33:45.866640,0 days 00:00:00.607636,0.5,0.5,2.0,50,roulette wheel,COMPLETE
1032,1032,36.4,2023-12-06 14:33:45.866907,2023-12-06 14:33:57.426924,0 days 00:00:11.560017,0.0,0.0,,20,random selection,COMPLETE
1033,1033,37.6,2023-12-06 14:33:57.427245,2023-12-06 14:34:15.037934,0 days 00:00:17.610689,0.0,0.33,,50,roulette wheel,COMPLETE
1034,1034,37.2,2023-12-06 14:34:15.038215,2023-12-06 14:34:23.530428,0 days 00:00:08.492213,0.8,0.33,0.0,20,roulette wheel,COMPLETE
1035,1035,37.6,2023-12-06 14:34:23.530715,2023-12-06 14:35:10.250675,0 days 00:00:46.719960,0.95,0.0,0.0,50,weighted choice,COMPLETE
1036,1036,36.8,2023-12-06 14:35:10.250976,2023-12-06 14:35:17.685132,0 days 00:00:07.434156,0.0,0.33,,20,roulette wheel,COMPLETE
1037,1037,37.2,2023-12-06 14:35:17.685412,2023-12-06 14:35:18.295805,0 days 00:00:00.610393,0.5,0.5,2.0,10,roulette wheel,COMPLETE
1038,1038,40.4,2023-12-06 14:35:18.296087,2023-12-06 14:35:18.657234,0 days 00:00:00.361147,0.95,0.01,2.0,50,weighted choice,COMPLETE
1039,1039,37.2,2023-12-06 14:35:18.657582,2023-12-06 14:35:19.133523,0 days 00:00:00.475941,0.95,0.33,4.0,10,roulette wheel,COMPLETE
1040,1040,40.4,2023-12-06 14:35:19.133820,2023-12-06 14:35:19.678230,0 days 00:00:00.544410,0.6,0.0,4.0,20,roulette wheel,COMPLETE
1041,1041,37.2,2023-12-06 14:35:19.678497,2023-12-06 14:35:20.178518,0 days 00:00:00.500021,0.5,0.33,4.0,100,random selection,COMPLETE
1042,1042,40.0,2023-12-06 14:35:20.178805,2023-12-06 14:35:20.642730,0 days 00:00:00.463925,0.6,0.01,1.0,10,roulette wheel,COMPLETE
1043,1043,37.6,2023-12-06 14:35:20.643010,2023-12-06 14:35:42.017397,0 days 00:00:21.374387,0.0,0.5,,50,roulette wheel,COMPLETE
1044,1044,38.0,2023-12-06 14:35:42.017702,2023-12-06 14:35:42.683381,0 days 00:00:00.665679,0.5,0.5,4.0,50,weighted choice,COMPLETE
1045,1045,37.2,2023-12-06 14:35:42.683665,2023-12-06 14:36:02.421271,0 days 00:00:19.737606,0.8,0.33,0.0,50,random selection,COMPLETE
1046,1046,37.2,2023-12-06 14:36:02.421570,2023-12-06 14:36:06.649775,0 days 00:00:04.228205,0.6,0.33,0.0,10,roulette wheel,COMPLETE
1047,1047,37.2,2023-12-06 14:36:06.650090,2023-12-06 14:36:18.419590,0 days 00:00:11.769500,0.0,0.0,,20,roulette wheel,COMPLETE
1048,1048,36.8,2023-12-06 14:36:18.419868,2023-12-06 14:36:18.604705,0 days 00:00:00.184837,0.95,0.0,2.0,100,random selection,COMPLETE
1049,1049,43.2,2023-12-06 14:36:18.605002,2023-12-06 14:36:18.944321,0 days 00:00:00.339319,0.8,0.01,1.0,50,roulette wheel,COMPLETE
1050,1050,38.4,2023-12-06 14:36:18.944620,2023-12-06 14:36:19.588719,0 days 00:00:00.644099,0.5,0.5,2.0,10,weighted choice,COMPLETE
1051,1051,36.8,2023-12-06 14:36:19.589028,2023-12-06 14:36:19.951945,0 days 00:00:00.362917,0.6,0.1,1.0,10,random selection,COMPLETE
1052,1052,37.2,2023-12-06 14:36:19.952221,2023-12-06 14:36:20.426975,0 days 00:00:00.474754,0.95,0.33,4.0,50,random selection,COMPLETE
1053,1053,37.2,2023-12-06 14:36:20.427266,2023-12-06 14:36:20.783609,0 days 00:00:00.356343,0.6,0.1,1.0,20,random selection,COMPLETE
1054,1054,39.2,2023-12-06 14:36:20.783918,2023-12-06 14:36:21.165792,0 days 00:00:00.381874,0.8,0.1,2.0,20,weighted choice,COMPLETE
1055,1055,42.8,2023-12-06 14:36:21.166059,2023-12-06 14:36:21.513654,0 days 00:00:00.347595,0.8,0.01,2.0,50,roulette wheel,COMPLETE
1056,1056,40.8,2023-12-06 14:36:21.513958,2023-12-06 14:36:21.844610,0 days 00:00:00.330652,0.95,0.01,4.0,100,roulette wheel,COMPLETE
1057,1057,37.2,2023-12-06 14:36:21.844899,2023-12-06 14:36:26.213535,0 days 00:00:04.368636,0.0,0.01,,20,random selection,COMPLETE
1058,1058,38.4,2023-12-06 14:36:26.213829,2023-12-06 14:36:26.629708,0 days 00:00:00.415879,0.95,0.1,1.0,100,weighted choice,COMPLETE
1059,1059,37.6,2023-12-06 14:36:26.630005,2023-12-06 14:36:27.090649,0 days 00:00:00.460644,0.8,0.33,2.0,100,roulette wheel,COMPLETE
1060,1060,36.8,2023-12-06 14:36:27.090951,2023-12-06 14:36:27.558270,0 days 00:00:00.467319,0.8,0.33,1.0,20,roulette wheel,COMPLETE
1061,1061,38.0,2023-12-06 14:36:27.558570,2023-12-06 14:37:10.823519,0 days 00:00:43.264949,0.6,0.5,0.0,100,roulette wheel,COMPLETE
1062,1062,38.8,2023-12-06 14:37:10.824011,2023-12-06 14:37:11.153931,0 days 00:00:00.329920,0.95,0.1,1.0,20,random selection,COMPLETE
1063,1063,40.4,2023-12-06 14:37:11.154233,2023-12-06 14:37:11.553673,0 days 00:00:00.399440,0.5,0.01,2.0,100,roulette wheel,COMPLETE
1064,1064,37.2,2023-12-06 14:37:11.553945,2023-12-06 14:37:12.004394,0 days 00:00:00.450449,0.95,0.33,1.0,10,random selection,COMPLETE
1065,1065,39.6,2023-12-06 14:37:12.004682,2023-12-06 14:37:12.420784,0 days 00:00:00.416102,0.8,0.01,1.0,10,roulette wheel,COMPLETE
1066,1066,40.8,2023-12-06 14:37:12.421064,2023-12-06 14:37:12.823370,0 days 00:00:00.402306,0.8,0.01,2.0,20,weighted choice,COMPLETE
1067,1067,39.2,2023-12-06 14:37:12.823658,2023-12-06 14:37:13.319181,0 days 00:00:00.495523,0.95,0.0,2.0,10,roulette wheel,COMPLETE
1068,1068,42.4,2023-12-06 14:37:13.319460,2023-12-06 14:37:13.708846,0 days 00:00:00.389386,0.95,0.01,4.0,100,weighted choice,COMPLETE
1069,1069,38.0,2023-12-06 14:37:13.709123,2023-12-06 14:37:35.501556,0 days 00:00:21.792433,0.0,0.5,,50,roulette wheel,COMPLETE
1070,1070,37.6,2023-12-06 14:37:35.501828,2023-12-06 14:37:41.501580,0 days 00:00:05.999752,0.0,0.0,,10,roulette wheel,COMPLETE
1071,1071,37.6,2023-12-06 14:37:41.501864,2023-12-06 14:37:41.885890,0 days 00:00:00.384026,0.6,0.1,4.0,20,roulette wheel,COMPLETE
1072,1072,37.6,2023-12-06 14:37:41.886182,2023-12-06 14:37:46.953895,0 days 00:00:05.067713,0.5,0.5,0.0,10,roulette wheel,COMPLETE
1073,1073,36.8,2023-12-06 14:37:46.954215,2023-12-06 14:38:09.349102,0 days 00:00:22.394887,0.0,0.1,,100,random selection,COMPLETE
1074,1074,37.6,2023-12-06 14:38:09.349391,2023-12-06 14:38:13.182887,0 days 00:00:03.833496,0.0,0.33,,10,random selection,COMPLETE
1075,1075,37.6,2023-12-06 14:38:13.183175,2023-12-06 14:38:13.597170,0 days 00:00:00.413995,0.8,0.1,4.0,50,weighted choice,COMPLETE
1076,1076,36.8,2023-12-06 14:38:13.597462,2023-12-06 14:38:13.945453,0 days 00:00:00.347991,0.8,0.1,1.0,100,random selection,COMPLETE
1077,1077,38.4,2023-12-06 14:38:13.945747,2023-12-06 14:38:21.116459,0 days 00:00:07.170712,0.0,0.0,,10,weighted choice,COMPLETE
1078,1078,42.4,2023-12-06 14:38:21.116725,2023-12-06 14:38:21.848654,0 days 00:00:00.731929,0.6,0.0,2.0,20,weighted choice,COMPLETE
1079,1079,38.0,2023-12-06 14:38:21.848959,2023-12-06 14:38:29.388347,0 days 00:00:07.539388,0.0,0.33,,20,roulette wheel,COMPLETE
1080,1080,38.0,2023-12-06 14:38:29.388641,2023-12-06 14:38:42.439817,0 days 00:00:13.051176,0.95,0.01,0.0,50,random selection,COMPLETE
1081,1081,37.2,2023-12-06 14:38:42.440106,2023-12-06 14:38:45.544007,0 days 00:00:03.103901,0.8,0.01,0.0,10,weighted choice,COMPLETE
1082,1082,38.0,2023-12-06 14:38:45.544294,2023-12-06 14:39:47.638373,0 days 00:01:02.094079,0.6,0.0,0.0,100,roulette wheel,COMPLETE
1083,1083,37.6,2023-12-06 14:39:47.638683,2023-12-06 14:40:19.744154,0 days 00:00:32.105471,0.0,0.33,,100,roulette wheel,COMPLETE
1084,1084,38.8,2023-12-06 14:40:19.744557,2023-12-06 14:40:20.293159,0 days 00:00:00.548602,0.8,0.5,1.0,10,roulette wheel,COMPLETE
1085,1085,38.0,2023-12-06 14:40:20.293446,2023-12-06 14:40:26.890057,0 days 00:00:06.596611,0.6,0.1,0.0,20,weighted choice,COMPLETE
1086,1086,38.0,2023-12-06 14:40:26.890347,2023-12-06 14:40:27.409123,0 days 00:00:00.518776,0.5,0.33,4.0,50,random selection,COMPLETE
1087,1087,37.2,2023-12-06 14:40:27.409432,2023-12-06 14:40:27.968745,0 days 00:00:00.559313,0.6,0.5,1.0,50,roulette wheel,COMPLETE
1088,1088,42.0,2023-12-06 14:40:27.969040,2023-12-06 14:40:28.607985,0 days 00:00:00.638945,0.8,0.0,2.0,20,weighted choice,COMPLETE
1089,1089,37.2,2023-12-06 14:40:28.608285,2023-12-06 14:40:28.987525,0 days 00:00:00.379240,0.5,0.1,1.0,10,roulette wheel,COMPLETE
1090,1090,38.4,2023-12-06 14:40:28.987805,2023-12-06 14:40:31.680122,0 days 00:00:02.692317,0.0,0.1,,10,random selection,COMPLETE
1091,1091,40.0,2023-12-06 14:40:31.680409,2023-12-06 14:40:32.165075,0 days 00:00:00.484666,0.8,0.01,2.0,10,weighted choice,COMPLETE
1092,1092,37.2,2023-12-06 14:40:32.165357,2023-12-06 14:40:32.541396,0 days 00:00:00.376039,0.5,0.1,2.0,50,roulette wheel,COMPLETE
1093,1093,43.2,2023-12-06 14:40:32.541694,2023-12-06 14:40:32.762181,0 days 00:00:00.220487,0.8,0.0,2.0,100,roulette wheel,COMPLETE
1094,1094,37.2,2023-12-06 14:40:32.762460,2023-12-06 14:40:33.306387,0 days 00:00:00.543927,0.95,0.5,1.0,50,roulette wheel,COMPLETE
1095,1095,36.0,2023-12-06 14:40:33.306680,2023-12-06 14:40:33.724224,0 days 00:00:00.417544,0.8,0.01,1.0,10,random selection,COMPLETE
1096,1096,39.6,2023-12-06 14:40:33.724498,2023-12-06 14:40:34.209984,0 days 00:00:00.485486,0.5,0.01,4.0,20,weighted choice,COMPLETE
1097,1097,37.2,2023-12-06 14:40:34.210273,2023-12-06 14:40:40.194415,0 days 00:00:05.984142,0.6,0.1,0.0,20,random selection,COMPLETE
1098,1098,37.2,2023-12-06 14:40:40.194718,2023-12-06 14:40:43.520007,0 days 00:00:03.325289,0.95,0.1,0.0,10,roulette wheel,COMPLETE
1099,1099,37.6,2023-12-06 14:40:43.520301,2023-12-06 14:40:47.891414,0 days 00:00:04.371113,0.0,0.01,,20,roulette wheel,COMPLETE
1100,1100,37.6,2023-12-06 14:40:47.891701,2023-12-06 14:40:50.590742,0 days 00:00:02.699041,0.0,0.1,,10,roulette wheel,COMPLETE
1101,1101,38.4,2023-12-06 14:40:50.591033,2023-12-06 14:41:31.758898,0 days 00:00:41.167865,0.5,0.5,0.0,100,roulette wheel,COMPLETE
1102,1102,38.4,2023-12-06 14:41:31.759216,2023-12-06 14:41:32.307925,0 days 00:00:00.548709,0.95,0.5,2.0,10,random selection,COMPLETE
1103,1103,43.6,2023-12-06 14:41:32.308197,2023-12-06 14:41:32.781521,0 days 00:00:00.473324,0.6,0.0,1.0,100,roulette wheel,COMPLETE
1104,1104,37.6,2023-12-06 14:41:32.781822,2023-12-06 14:41:43.670540,0 days 00:00:10.888718,0.95,0.5,0.0,20,weighted choice,COMPLETE
1105,1105,36.4,2023-12-06 14:41:43.670832,2023-12-06 14:41:44.164616,0 days 00:00:00.493784,0.8,0.0,2.0,20,random selection,COMPLETE
1106,1106,38.0,2023-12-06 14:41:44.164922,2023-12-06 14:41:44.703052,0 days 00:00:00.538130,0.95,0.5,2.0,50,random selection,COMPLETE
1107,1107,38.0,2023-12-06 14:41:44.703359,2023-12-06 14:41:45.117664,0 days 00:00:00.414305,0.5,0.1,4.0,10,weighted choice,COMPLETE
1108,1108,37.2,2023-12-06 14:41:45.117976,2023-12-06 14:41:45.721578,0 days 00:00:00.603602,0.5,0.5,2.0,20,roulette wheel,COMPLETE
1109,1109,37.6,2023-12-06 14:41:45.721873,2023-12-06 14:41:51.668089,0 days 00:00:05.946216,0.5,0.1,0.0,20,roulette wheel,COMPLETE
1110,1110,37.6,2023-12-06 14:41:51.668411,2023-12-06 14:42:54.750910,0 days 00:01:03.082499,0.8,0.0,0.0,100,random selection,COMPLETE
1111,1111,36.8,2023-12-06 14:42:54.751222,2023-12-06 14:42:55.107916,0 days 00:00:00.356694,0.8,0.1,4.0,20,random selection,COMPLETE
1112,1112,36.8,2023-12-06 14:42:55.108224,2023-12-06 14:43:15.071435,0 days 00:00:19.963211,0.8,0.33,0.0,50,roulette wheel,COMPLETE
1113,1113,38.0,2023-12-06 14:43:15.071747,2023-12-06 14:43:15.555322,0 days 00:00:00.483575,0.6,0.33,1.0,20,roulette wheel,COMPLETE
1114,1114,39.2,2023-12-06 14:43:15.555622,2023-12-06 14:43:16.069548,0 days 00:00:00.513926,0.8,0.0,4.0,10,roulette wheel,COMPLETE
1115,1115,37.2,2023-12-06 14:43:16.069851,2023-12-06 14:43:16.531833,0 days 00:00:00.461982,0.8,0.33,1.0,10,roulette wheel,COMPLETE
1116,1116,40.4,2023-12-06 14:43:16.532134,2023-12-06 14:43:16.918222,0 days 00:00:00.386088,0.95,0.01,1.0,20,weighted choice,COMPLETE
1117,1117,43.6,2023-12-06 14:43:16.918505,2023-12-06 14:43:17.725448,0 days 00:00:00.806943,0.5,0.0,2.0,100,weighted choice,COMPLETE
1118,1118,37.6,2023-12-06 14:43:17.725751,2023-12-06 14:43:18.122222,0 days 00:00:00.396471,0.95,0.01,2.0,10,random selection,COMPLETE
1119,1119,39.6,2023-12-06 14:43:18.122515,2023-12-06 14:43:18.528470,0 days 00:00:00.405955,0.95,0.01,1.0,10,roulette wheel,COMPLETE
1120,1120,38.4,2023-12-06 14:43:18.528788,2023-12-06 14:43:19.104674,0 days 00:00:00.575886,0.6,0.5,1.0,20,roulette wheel,COMPLETE
1121,1121,37.6,2023-12-06 14:43:19.104983,2023-12-06 14:43:19.707682,0 days 00:00:00.602699,0.5,0.5,1.0,50,roulette wheel,COMPLETE
1122,1122,38.8,2023-12-06 14:43:19.707977,2023-12-06 14:43:20.069590,0 days 00:00:00.361613,0.8,0.1,4.0,20,roulette wheel,COMPLETE
1123,1123,38.4,2023-12-06 14:43:20.069888,2023-12-06 14:43:20.427097,0 days 00:00:00.357209,0.8,0.1,4.0,10,roulette wheel,COMPLETE
1124,1124,36.8,2023-12-06 14:43:20.427383,2023-12-06 14:43:21.014180,0 days 00:00:00.586797,0.8,0.5,2.0,10,weighted choice,COMPLETE
1125,1125,36.8,2023-12-06 14:43:21.014522,2023-12-06 14:43:48.178787,0 days 00:00:27.164265,0.5,0.01,0.0,100,weighted choice,COMPLETE
1126,1126,38.0,2023-12-06 14:43:48.179106,2023-12-06 14:43:54.051714,0 days 00:00:05.872608,0.0,0.0,,10,random selection,COMPLETE
1127,1127,37.6,2023-12-06 14:43:54.052004,2023-12-06 14:43:56.311874,0 days 00:00:02.259870,0.0,0.01,,10,random selection,COMPLETE
1128,1128,39.2,2023-12-06 14:43:56.312176,2023-12-06 14:43:56.725855,0 days 00:00:00.413679,0.8,0.01,4.0,10,roulette wheel,COMPLETE
1129,1129,40.0,2023-12-06 14:43:56.726157,2023-12-06 14:43:57.102145,0 days 00:00:00.375988,0.6,0.01,1.0,50,roulette wheel,COMPLETE
1130,1130,35.2,2023-12-06 14:43:57.102450,2023-12-06 14:43:57.516747,0 days 00:00:00.414297,0.95,0.0,4.0,20,random selection,COMPLETE
1131,1131,37.2,2023-12-06 14:43:57.517048,2023-12-06 14:44:00.255264,0 days 00:00:02.738216,0.0,0.1,,10,roulette wheel,COMPLETE
1132,1132,37.2,2023-12-06 14:44:00.255557,2023-12-06 14:44:00.775757,0 days 00:00:00.520200,0.5,0.33,4.0,20,roulette wheel,COMPLETE
1133,1133,37.2,2023-12-06 14:44:00.776055,2023-12-06 14:44:20.244560,0 days 00:00:19.468505,0.0,0.01,,100,roulette wheel,COMPLETE
1134,1134,38.0,2023-12-06 14:44:20.244863,2023-12-06 14:44:26.230037,0 days 00:00:05.985174,0.0,0.0,,10,roulette wheel,COMPLETE
1135,1135,36.8,2023-12-06 14:44:26.230331,2023-12-06 14:44:33.680202,0 days 00:00:07.449871,0.0,0.33,,20,random selection,COMPLETE
1136,1136,38.4,2023-12-06 14:44:33.680499,2023-12-06 14:44:34.175375,0 days 00:00:00.494876,0.6,0.33,2.0,50,roulette wheel,COMPLETE
1137,1137,38.0,2023-12-06 14:44:34.175678,2023-12-06 14:44:34.781528,0 days 00:00:00.605850,0.5,0.5,2.0,10,random selection,COMPLETE
1138,1138,37.2,2023-12-06 14:44:34.781844,2023-12-06 14:44:49.597276,0 days 00:00:14.815432,0.8,0.01,0.0,50,weighted choice,COMPLETE
1139,1139,43.6,2023-12-06 14:44:49.597582,2023-12-06 14:44:50.012708,0 days 00:00:00.415126,0.6,0.0,1.0,100,roulette wheel,COMPLETE
1140,1140,38.8,2023-12-06 14:44:50.013029,2023-12-06 14:45:54.913902,0 days 00:01:04.900873,0.95,0.0,0.0,100,random selection,COMPLETE
1141,1141,38.4,2023-12-06 14:45:54.914211,2023-12-06 14:45:59.356325,0 days 00:00:04.442114,0.95,0.33,0.0,10,roulette wheel,COMPLETE
1142,1142,37.6,2023-12-06 14:45:59.356627,2023-12-06 14:45:59.863940,0 days 00:00:00.507313,0.5,0.33,1.0,10,random selection,COMPLETE
1143,1143,37.6,2023-12-06 14:45:59.864237,2023-12-06 14:46:33.637768,0 days 00:00:33.773531,0.6,0.33,0.0,100,random selection,COMPLETE
1144,1144,41.2,2023-12-06 14:46:33.638181,2023-12-06 14:46:34.020964,0 days 00:00:00.382783,0.6,0.01,2.0,50,roulette wheel,COMPLETE
1145,1145,37.2,2023-12-06 14:46:34.021268,2023-12-06 14:46:55.169702,0 days 00:00:21.148434,0.0,0.5,,50,random selection,COMPLETE
1146,1146,37.6,2023-12-06 14:46:55.170001,2023-12-06 14:47:12.556570,0 days 00:00:17.386569,0.0,0.33,,50,random selection,COMPLETE
1147,1147,38.0,2023-12-06 14:47:12.556874,2023-12-06 14:47:56.429404,0 days 00:00:43.872530,0.8,0.5,0.0,100,roulette wheel,COMPLETE
1148,1148,36.4,2023-12-06 14:47:56.429707,2023-12-06 14:48:15.439351,0 days 00:00:19.009644,0.0,0.01,,100,roulette wheel,COMPLETE
1149,1149,37.2,2023-12-06 14:48:15.439656,2023-12-06 14:48:32.499718,0 days 00:00:17.060062,0.0,0.33,,50,random selection,COMPLETE
1150,1150,38.0,2023-12-06 14:48:32.500010,2023-12-06 14:48:42.636068,0 days 00:00:10.136058,0.0,0.01,,50,random selection,COMPLETE
1151,1151,37.6,2023-12-06 14:48:42.636377,2023-12-06 14:49:00.090123,0 days 00:00:17.453746,0.0,0.33,,50,random selection,COMPLETE
1152,1152,38.0,2023-12-06 14:49:00.090754,2023-12-06 14:49:05.894452,0 days 00:00:05.803698,0.0,0.1,,20,weighted choice,COMPLETE
1153,1153,37.6,2023-12-06 14:49:05.894758,2023-12-06 14:49:06.244169,0 days 00:00:00.349411,0.95,0.1,2.0,10,random selection,COMPLETE
1154,1154,37.6,2023-12-06 14:49:06.244475,2023-12-06 14:49:06.691073,0 days 00:00:00.446598,0.95,0.33,1.0,50,roulette wheel,COMPLETE
1155,1155,37.2,2023-12-06 14:49:06.691373,2023-12-06 14:49:07.137563,0 days 00:00:00.446190,0.95,0.33,1.0,50,roulette wheel,COMPLETE
1156,1156,37.6,2023-12-06 14:49:07.137865,2023-12-06 14:49:07.469223,0 days 00:00:00.331358,0.8,0.1,1.0,20,random selection,COMPLETE
1157,1157,37.6,2023-12-06 14:49:07.469533,2023-12-06 14:49:07.845740,0 days 00:00:00.376207,0.5,0.1,2.0,10,random selection,COMPLETE
1158,1158,38.4,2023-12-06 14:49:07.846047,2023-12-06 14:49:08.386286,0 days 00:00:00.540239,0.95,0.5,2.0,100,roulette wheel,COMPLETE
1159,1159,40.8,2023-12-06 14:49:08.386599,2023-12-06 14:49:08.829564,0 days 00:00:00.442965,0.6,0.01,1.0,50,weighted choice,COMPLETE
1160,1160,37.6,2023-12-06 14:49:08.829863,2023-12-06 14:49:09.451519,0 days 00:00:00.621656,0.6,0.5,2.0,50,weighted choice,COMPLETE
1161,1161,38.4,2023-12-06 14:49:09.451822,2023-12-06 14:49:10.041867,0 days 00:00:00.590045,0.8,0.5,1.0,50,weighted choice,COMPLETE
1162,1162,38.4,2023-12-06 14:49:10.042261,2023-12-06 14:49:10.385681,0 days 00:00:00.343420,0.8,0.1,1.0,10,roulette wheel,COMPLETE
1163,1163,36.8,2023-12-06 14:49:10.385991,2023-12-06 14:49:34.146533,0 days 00:00:23.760542,0.8,0.5,0.0,50,roulette wheel,COMPLETE
1164,1164,38.0,2023-12-06 14:49:34.146845,2023-12-06 14:49:34.665802,0 days 00:00:00.518957,0.5,0.33,4.0,50,roulette wheel,COMPLETE
1165,1165,40.8,2023-12-06 14:49:34.666105,2023-12-06 14:49:34.971978,0 days 00:00:00.305873,0.95,0.01,2.0,100,roulette wheel,COMPLETE
1166,1166,37.2,2023-12-06 14:49:34.972276,2023-12-06 14:49:35.432852,0 days 00:00:00.460576,0.95,0.33,4.0,50,random selection,COMPLETE
1167,1167,37.6,2023-12-06 14:49:35.433205,2023-12-06 14:49:56.412069,0 days 00:00:20.978864,0.0,0.5,,50,random selection,COMPLETE
1168,1168,38.0,2023-12-06 14:49:56.412429,2023-12-06 14:49:57.082037,0 days 00:00:00.669608,0.5,0.5,1.0,100,weighted choice,COMPLETE
1169,1169,36.8,2023-12-06 14:49:57.082355,2023-12-06 14:49:57.592143,0 days 00:00:00.509788,0.5,0.33,1.0,20,roulette wheel,COMPLETE
1170,1170,37.6,2023-12-06 14:49:57.592443,2023-12-06 14:50:28.685250,0 days 00:00:31.092807,0.0,0.33,,100,random selection,COMPLETE
1171,1171,38.4,2023-12-06 14:50:28.685557,2023-12-06 14:50:29.043690,0 days 00:00:00.358133,0.95,0.1,4.0,20,roulette wheel,COMPLETE
1172,1172,37.6,2023-12-06 14:50:29.043978,2023-12-06 14:51:06.103226,0 days 00:00:37.059248,0.0,0.0,,50,weighted choice,COMPLETE
1173,1173,37.6,2023-12-06 14:51:06.103516,2023-12-06 14:51:14.802753,0 days 00:00:08.699237,0.95,0.33,0.0,20,roulette wheel,COMPLETE
