,number,value,datetime_start,datetime_complete,duration,params_C,params_M,params_N,params_P,params_S,state
1174,1174,38.0,2023-12-06 14:51:14.803065,2023-12-06 14:51:21.930055,0 days 00:00:07.126990,0.0,0.0,,10,weighted choice,COMPLETE
1175,1175,38.0,2023-12-06 14:51:21.930338,2023-12-06 14:51:26.574076,0 days 00:00:04.643738,0.0,0.5,,10,roulette wheel,COMPLETE
1176,1176,37.6,2023-12-06 14:51:26.574366,2023-12-06 14:51:31.574469,0 days 00:00:05.000103,0.0,0.01,,20,weighted choice,COMPLETE
1177,1177,37.2,2023-12-06 14:51:31.574787,2023-12-06 14:51:31.968616,0 days 00:00:00.393829,0.5,0.1,4.0,20,roulette wheel,COMPLETE
1178,1178,36.8,2023-12-06 14:51:31.968929,2023-12-06 14:51:32.330094,0 days 00:00:00.361165,0.6,0.1,4.0,20,random selection,COMPLETE
1179,1179,41.2,2023-12-06 14:51:32.330404,2023-12-06 14:51:32.727081,0 days 00:00:00.396677,0.5,0.01,1.0,100,roulette wheel,COMPLETE
1180,1180,37.2,2023-12-06 14:51:32.727370,2023-12-06 14:51:33.305793,0 days 00:00:00.578423,0.6,0.5,1.0,50,roulette wheel,COMPLETE
1181,1181,36.8,2023-12-06 14:51:33.306114,2023-12-06 14:51:33.884205,0 days 00:00:00.578091,0.95,0.5,2.0,20,weighted choice,COMPLETE
1182,1182,36.8,2023-12-06 14:51:33.884498,2023-12-06 14:51:34.340844,0 days 00:00:00.456346,0.95,0.33,1.0,10,roulette wheel,COMPLETE
1183,1183,38.8,2023-12-06 14:51:34.341144,2023-12-06 14:51:34.908732,0 days 00:00:00.567588,0.6,0.5,2.0,50,roulette wheel,COMPLETE
1184,1184,37.6,2023-12-06 14:51:34.909025,2023-12-06 14:51:56.992453,0 days 00:00:22.083428,0.5,0.01,0.0,100,roulette wheel,COMPLETE
1185,1185,37.2,2023-12-06 14:51:56.993093,2023-12-06 14:52:32.481447,0 days 00:00:35.488354,0.6,0.33,0.0,100,roulette wheel,COMPLETE
1186,1186,37.2,2023-12-06 14:52:32.481762,2023-12-06 14:52:35.043620,0 days 00:00:02.561858,0.5,0.01,0.0,10,random selection,COMPLETE
1187,1187,36.0,2023-12-06 14:52:35.043919,2023-12-06 14:53:14.331028,0 days 00:00:39.287109,0.5,0.33,0.0,100,weighted choice,COMPLETE
1188,1188,37.6,2023-12-06 14:53:14.331341,2023-12-06 14:53:14.802257,0 days 00:00:00.470916,0.95,0.33,4.0,10,roulette wheel,COMPLETE
1189,1189,40.0,2023-12-06 14:53:14.802564,2023-12-06 14:53:15.590230,0 days 00:00:00.787666,0.6,0.0,1.0,20,weighted choice,COMPLETE
1190,1190,38.4,2023-12-06 14:53:15.590532,2023-12-06 14:53:16.078663,0 days 00:00:00.488131,0.8,0.33,1.0,10,weighted choice,COMPLETE
1191,1191,38.4,2023-12-06 14:53:16.078983,2023-12-06 14:53:16.515761,0 days 00:00:00.436778,0.6,0.1,4.0,100,weighted choice,COMPLETE
1192,1192,38.0,2023-12-06 14:53:16.516048,2023-12-06 14:53:17.058987,0 days 00:00:00.542939,0.8,0.5,1.0,10,random selection,COMPLETE
1193,1193,37.6,2023-12-06 14:53:17.059291,2023-12-06 14:53:22.409336,0 days 00:00:05.350045,0.5,0.5,0.0,10,weighted choice,COMPLETE
1194,1194,38.8,2023-12-06 14:53:22.409633,2023-12-06 14:53:26.259034,0 days 00:00:03.849401,0.0,0.33,,10,roulette wheel,COMPLETE
1195,1195,37.6,2023-12-06 14:53:26.259336,2023-12-06 14:53:34.657453,0 days 00:00:08.398117,0.95,0.0,0.0,10,random selection,COMPLETE
1196,1196,38.4,2023-12-06 14:53:34.657761,2023-12-06 14:53:35.204046,0 days 00:00:00.546285,0.8,0.5,2.0,50,roulette wheel,COMPLETE
1197,1197,37.6,2023-12-06 14:53:35.204364,2023-12-06 14:53:35.859962,0 days 00:00:00.655598,0.5,0.5,2.0,50,weighted choice,COMPLETE
1198,1198,36.4,2023-12-06 14:53:35.860264,2023-12-06 14:53:36.365066,0 days 00:00:00.504802,0.95,0.33,4.0,10,weighted choice,COMPLETE
1199,1199,38.0,2023-12-06 14:53:36.365369,2023-12-06 14:53:36.736020,0 days 00:00:00.370651,0.5,0.1,2.0,100,roulette wheel,COMPLETE
1200,1200,37.2,2023-12-06 15:05:27.345445,2023-12-06 15:06:15.417167,0 days 00:00:48.071722,0.6,0.33,0.0,150,roulette wheel,COMPLETE
1201,1201,37.2,2023-12-06 15:06:15.417733,2023-12-06 15:06:50.539498,0 days 00:00:35.121765,0.6,0.1,0.0,200,random selection,COMPLETE
1202,1202,37.2,2023-12-06 15:06:50.539695,2023-12-06 15:07:43.412740,0 days 00:00:52.873045,0.0,0.5,,150,roulette wheel,COMPLETE
1203,1203,38.0,2023-12-06 15:07:43.412927,2023-12-06 15:07:43.904916,0 days 00:00:00.491989,0.6,0.33,2.0,150,random selection,COMPLETE
1204,1204,36.8,2023-12-06 15:07:43.905118,2023-12-06 15:07:44.150980,0 days 00:00:00.245862,0.6,0.0,2.0,200,random selection,COMPLETE
1205,1205,38.0,2023-12-06 15:07:44.151182,2023-12-06 15:07:44.611715,0 days 00:00:00.460533,0.6,0.1,1.0,150,weighted choice,COMPLETE
1206,1206,41.2,2023-12-06 15:07:44.611904,2023-12-06 15:07:44.937589,0 days 00:00:00.325685,0.8,0.01,2.0,150,roulette wheel,COMPLETE
1207,1207,38.8,2023-12-06 15:07:44.937831,2023-12-06 15:07:45.309299,0 days 00:00:00.371468,0.8,0.1,4.0,200,random selection,COMPLETE
1208,1208,36.8,2023-12-06 15:07:45.309487,2023-12-06 15:07:45.473547,0 days 00:00:00.164060,0.95,0.0,1.0,150,random selection,COMPLETE
1209,1209,38.4,2023-12-06 15:07:45.473752,2023-12-06 15:07:46.083350,0 days 00:00:00.609598,0.6,0.33,2.0,200,weighted choice,COMPLETE
1210,1210,37.6,2023-12-06 15:07:46.083528,2023-12-06 15:07:46.446156,0 days 00:00:00.362628,0.95,0.1,4.0,200,random selection,COMPLETE
1211,1211,40.8,2023-12-06 15:07:46.446329,2023-12-06 15:07:46.778043,0 days 00:00:00.331714,0.8,0.01,4.0,200,roulette wheel,COMPLETE
1212,1212,38.0,2023-12-06 15:07:46.778210,2023-12-06 15:07:47.503670,0 days 00:00:00.725460,0.5,0.5,1.0,200,weighted choice,COMPLETE
1213,1213,38.8,2023-12-06 15:07:47.503856,2023-12-06 15:09:03.646472,0 days 00:01:16.142616,0.0,0.0,,150,random selection,COMPLETE
1214,1214,36.8,2023-12-06 15:09:03.646645,2023-12-06 15:10:04.175771,0 days 00:01:00.529126,0.0,0.5,,200,roulette wheel,COMPLETE
1215,1215,37.2,2023-12-06 15:10:04.175943,2023-12-06 15:10:28.809047,0 days 00:00:24.633104,0.0,0.01,,150,random selection,COMPLETE
1216,1216,37.6,2023-12-06 15:10:28.809213,2023-12-06 15:11:01.821301,0 days 00:00:33.012088,0.0,0.01,,200,roulette wheel,COMPLETE
1217,1217,37.2,2023-12-06 15:11:01.821584,2023-12-06 15:11:02.391525,0 days 00:00:00.569941,0.6,0.5,1.0,200,random selection,COMPLETE
1218,1218,37.6,2023-12-06 15:11:02.391712,2023-12-06 15:11:35.892804,0 days 00:00:33.501092,0.5,0.01,0.0,200,roulette wheel,COMPLETE
1219,1219,38.0,2023-12-06 15:11:35.893015,2023-12-06 15:11:36.239130,0 days 00:00:00.346115,0.95,0.1,2.0,150,roulette wheel,COMPLETE
1220,1220,36.8,2023-12-06 15:11:36.239296,2023-12-06 15:12:18.036969,0 days 00:00:41.797673,0.6,0.1,0.0,200,roulette wheel,COMPLETE
1221,1221,37.2,2023-12-06 15:12:18.037261,2023-12-06 15:12:18.645788,0 days 00:00:00.608527,0.5,0.33,1.0,150,weighted choice,COMPLETE
1222,1222,37.6,2023-12-06 15:12:18.645960,2023-12-06 15:12:19.312918,0 days 00:00:00.666958,0.8,0.5,4.0,200,weighted choice,COMPLETE
1223,1223,37.6,2023-12-06 15:12:19.313092,2023-12-06 15:12:19.916810,0 days 00:00:00.603718,0.5,0.5,2.0,200,roulette wheel,COMPLETE
1224,1224,36.8,2023-12-06 15:12:19.916986,2023-12-06 15:12:20.386865,0 days 00:00:00.469879,0.6,0.33,1.0,200,roulette wheel,COMPLETE
1225,1225,37.2,2023-12-06 15:12:20.387044,2023-12-06 15:12:20.925277,0 days 00:00:00.538233,0.95,0.5,1.0,200,roulette wheel,COMPLETE
1226,1226,38.0,2023-12-06 15:12:20.925446,2023-12-06 15:12:21.520034,0 days 00:00:00.594588,0.5,0.5,4.0,150,random selection,COMPLETE
1227,1227,38.4,2023-12-06 15:12:21.520211,2023-12-06 15:12:22.033043,0 days 00:00:00.512832,0.5,0.33,4.0,200,roulette wheel,COMPLETE
1228,1228,37.6,2023-12-06 15:12:22.033213,2023-12-06 15:12:22.588536,0 days 00:00:00.555323,0.8,0.5,2.0,200,roulette wheel,COMPLETE
1229,1229,36.8,2023-12-06 15:12:22.588696,2023-12-06 15:12:23.075264,0 days 00:00:00.486568,0.6,0.33,1.0,150,random selection,COMPLETE
1230,1230,36.4,2023-12-06 15:12:23.075441,2023-12-06 15:13:52.051620,0 days 00:01:28.976179,0.95,0.0,0.0,150,roulette wheel,COMPLETE
1231,1231,40.8,2023-12-06 15:13:52.051934,2023-12-06 15:13:52.217921,0 days 00:00:00.165987,0.95,0.0,1.0,200,roulette wheel,COMPLETE
1232,1232,38.0,2023-12-06 15:13:52.218089,2023-12-06 15:13:52.783668,0 days 00:00:00.565579,0.6,0.5,2.0,200,random selection,COMPLETE
1233,1233,36.8,2023-12-06 15:13:52.783859,2023-12-06 15:13:53.492977,0 days 00:00:00.709118,0.5,0.5,2.0,200,weighted choice,COMPLETE
1234,1234,38.0,2023-12-06 15:13:53.493157,2023-12-06 15:15:30.495812,0 days 00:01:37.002655,0.0,0.0,,200,random selection,COMPLETE
1235,1235,37.2,2023-12-06 15:15:30.495994,2023-12-06 15:16:13.435689,0 days 00:00:42.939695,0.95,0.1,0.0,200,roulette wheel,COMPLETE
1236,1236,41.2,2023-12-06 15:16:13.436014,2023-12-06 15:16:13.864617,0 days 00:00:00.428603,0.8,0.01,2.0,150,weighted choice,COMPLETE
1237,1237,40.0,2023-12-06 15:16:13.864818,2023-12-06 15:16:14.072312,0 days 00:00:00.207494,0.8,0.0,4.0,200,roulette wheel,COMPLETE
1238,1238,38.0,2023-12-06 15:16:14.072485,2023-12-06 15:16:51.349559,0 days 00:00:37.277074,0.95,0.1,0.0,150,roulette wheel,COMPLETE
1239,1239,38.4,2023-12-06 15:16:51.349742,2023-12-06 15:18:35.070622,0 days 00:01:43.720880,0.0,0.0,,200,roulette wheel,COMPLETE
1240,1240,38.0,2023-12-06 15:18:35.070792,2023-12-06 15:18:35.555606,0 days 00:00:00.484814,0.5,0.1,1.0,200,weighted choice,COMPLETE
1241,1241,37.6,2023-12-06 15:18:35.555789,2023-12-06 15:18:35.921548,0 days 00:00:00.365759,0.6,0.1,4.0,200,random selection,COMPLETE
1242,1242,37.6,2023-12-06 15:18:35.921723,2023-12-06 15:19:18.222978,0 days 00:00:42.301255,0.0,0.33,,150,roulette wheel,COMPLETE
1243,1243,38.0,2023-12-06 15:19:18.223283,2023-12-06 15:20:38.363178,0 days 00:01:20.139895,0.0,0.0,,150,roulette wheel,COMPLETE
1244,1244,38.0,2023-12-06 15:20:38.363370,2023-12-06 15:21:33.746830,0 days 00:00:55.383460,0.6,0.5,0.0,200,random selection,COMPLETE
1245,1245,41.6,2023-12-06 15:21:33.747008,2023-12-06 15:21:34.216639,0 days 00:00:00.469631,0.6,0.01,1.0,150,weighted choice,COMPLETE
1246,1246,37.2,2023-12-06 15:21:34.216826,2023-12-06 15:21:34.585325,0 days 00:00:00.368499,0.6,0.1,4.0,150,roulette wheel,COMPLETE
1247,1247,40.4,2023-12-06 15:21:34.585504,2023-12-06 15:21:34.979805,0 days 00:00:00.394301,0.5,0.01,4.0,200,roulette wheel,COMPLETE
1248,1248,37.6,2023-12-06 15:21:34.979977,2023-12-06 15:22:45.465006,0 days 00:01:10.485029,0.95,0.5,0.0,150,weighted choice,COMPLETE
1249,1249,37.2,2023-12-06 15:22:45.465199,2023-12-06 15:22:45.915850,0 days 00:00:00.450651,0.8,0.33,1.0,200,roulette wheel,COMPLETE
1250,1250,38.0,2023-12-06 15:22:45.916034,2023-12-06 15:23:55.897814,0 days 00:01:09.981780,0.95,0.5,0.0,200,roulette wheel,COMPLETE
1251,1251,37.6,2023-12-06 15:23:55.898087,2023-12-06 15:23:56.271857,0 days 00:00:00.373770,0.5,0.1,1.0,150,roulette wheel,COMPLETE
1252,1252,37.2,2023-12-06 15:23:56.272036,2023-12-06 15:24:38.258474,0 days 00:00:41.986438,0.8,0.1,0.0,200,roulette wheel,COMPLETE
1253,1253,39.6,2023-12-06 15:24:38.258750,2023-12-06 15:24:38.670189,0 days 00:00:00.411439,0.95,0.01,2.0,200,weighted choice,COMPLETE
1254,1254,36.8,2023-12-06 15:24:38.670380,2023-12-06 15:26:43.596663,0 days 00:02:04.926283,0.5,0.0,0.0,150,weighted choice,COMPLETE
1255,1255,38.4,2023-12-06 15:26:43.596843,2023-12-06 15:26:44.138785,0 days 00:00:00.541942,0.8,0.5,1.0,200,roulette wheel,COMPLETE
1256,1256,37.2,2023-12-06 15:26:44.138975,2023-12-06 15:27:42.949974,0 days 00:00:58.810999,0.95,0.33,0.0,150,weighted choice,COMPLETE
1257,1257,37.6,2023-12-06 15:27:42.950168,2023-12-06 15:27:43.246597,0 days 00:00:00.296429,0.95,0.01,2.0,150,random selection,COMPLETE
1258,1258,37.2,2023-12-06 15:27:43.246776,2023-12-06 15:28:49.338127,0 days 00:01:06.091351,0.8,0.5,0.0,200,roulette wheel,COMPLETE
1259,1259,37.2,2023-12-06 15:28:49.338310,2023-12-06 15:30:28.167386,0 days 00:01:38.829076,0.0,0.0,,200,random selection,COMPLETE
1260,1260,36.8,2023-12-06 15:30:28.167600,2023-12-06 15:30:28.777720,0 days 00:00:00.610120,0.6,0.33,4.0,200,weighted choice,COMPLETE
1261,1261,44.4,2023-12-06 15:30:28.777902,2023-12-06 15:30:29.295141,0 days 00:00:00.517239,0.5,0.0,1.0,200,weighted choice,COMPLETE
1262,1262,38.8,2023-12-06 15:30:29.295326,2023-12-06 15:31:32.096162,0 days 00:01:02.800836,0.6,0.5,0.0,200,random selection,COMPLETE
1263,1263,40.4,2023-12-06 15:31:32.096362,2023-12-06 15:31:32.291092,0 days 00:00:00.194730,0.95,0.0,4.0,200,roulette wheel,COMPLETE
1264,1264,38.0,2023-12-06 15:31:32.291280,2023-12-06 15:31:32.717943,0 days 00:00:00.426663,0.95,0.1,2.0,150,weighted choice,COMPLETE
1265,1265,38.4,2023-12-06 15:31:32.718137,2023-12-06 15:32:48.127345,0 days 00:01:15.409208,0.0,0.5,,200,weighted choice,COMPLETE
1266,1266,37.2,2023-12-06 15:32:48.127658,2023-12-06 15:32:48.715577,0 days 00:00:00.587919,0.5,0.5,2.0,200,random selection,COMPLETE
1267,1267,37.6,2023-12-06 15:32:48.715766,2023-12-06 15:32:49.210471,0 days 00:00:00.494705,0.5,0.33,2.0,200,roulette wheel,COMPLETE
1268,1268,38.0,2023-12-06 15:32:49.210641,2023-12-06 15:32:49.696036,0 days 00:00:00.485395,0.5,0.33,1.0,200,roulette wheel,COMPLETE
1269,1269,37.6,2023-12-06 15:32:49.696223,2023-12-06 15:32:49.971872,0 days 00:00:00.275649,0.5,0.0,4.0,200,random selection,COMPLETE
1270,1270,37.2,2023-12-06 15:32:49.972050,2023-12-06 15:32:50.521033,0 days 00:00:00.548983,0.95,0.5,4.0,200,roulette wheel,COMPLETE
1271,1271,37.2,2023-12-06 15:32:50.521217,2023-12-06 15:32:50.975901,0 days 00:00:00.454684,0.8,0.33,2.0,200,roulette wheel,COMPLETE
1272,1272,37.6,2023-12-06 15:32:50.976093,2023-12-06 15:32:51.485260,0 days 00:00:00.509167,0.5,0.33,4.0,200,roulette wheel,COMPLETE
1273,1273,37.6,2023-12-06 15:32:51.485444,2023-12-06 15:33:28.069580,0 days 00:00:36.584136,0.95,0.1,0.0,150,roulette wheel,COMPLETE
1274,1274,38.0,2023-12-06 15:33:28.069770,2023-12-06 15:33:28.688155,0 days 00:00:00.618385,0.95,0.5,1.0,150,weighted choice,COMPLETE
1275,1275,41.2,2023-12-06 15:33:28.688350,2023-12-06 15:33:28.883470,0 days 00:00:00.195120,0.95,0.0,4.0,150,roulette wheel,COMPLETE
1276,1276,42.8,2023-12-06 15:33:28.883648,2023-12-06 15:33:29.316165,0 days 00:00:00.432517,0.6,0.0,2.0,200,weighted choice,COMPLETE
1277,1277,37.6,2023-12-06 15:33:29.316356,2023-12-06 15:33:29.506315,0 days 00:00:00.189959,0.95,0.0,4.0,200,random selection,COMPLETE
1278,1278,40.8,2023-12-06 15:33:29.506499,2023-12-06 15:33:29.836850,0 days 00:00:00.330351,0.8,0.01,4.0,150,roulette wheel,COMPLETE
1279,1279,37.2,2023-12-06 15:33:29.837044,2023-12-06 15:34:12.649313,0 days 00:00:42.812269,0.5,0.33,0.0,150,random selection,COMPLETE
1280,1280,38.0,2023-12-06 15:34:12.649555,2023-12-06 15:35:43.593333,0 days 00:01:30.943778,0.95,0.0,0.0,150,roulette wheel,COMPLETE
1281,1281,37.2,2023-12-06 15:35:43.593525,2023-12-06 15:36:16.340506,0 days 00:00:32.746981,0.0,0.01,,200,roulette wheel,COMPLETE
1282,1282,37.2,2023-12-06 15:36:16.340737,2023-12-06 15:36:46.171004,0 days 00:00:29.830267,0.0,0.1,,150,roulette wheel,COMPLETE
1283,1283,37.6,2023-12-06 15:36:46.171194,2023-12-06 15:36:46.757939,0 days 00:00:00.586745,0.6,0.5,4.0,200,random selection,COMPLETE
1284,1284,42.8,2023-12-06 15:36:46.758127,2023-12-06 15:36:47.047984,0 days 00:00:00.289857,0.5,0.0,4.0,150,roulette wheel,COMPLETE
1285,1285,37.6,2023-12-06 15:36:47.048180,2023-12-06 15:36:47.615239,0 days 00:00:00.567059,0.8,0.5,1.0,200,roulette wheel,COMPLETE
1286,1286,38.4,2023-12-06 15:36:47.615440,2023-12-06 15:36:48.075293,0 days 00:00:00.459853,0.8,0.33,1.0,200,random selection,COMPLETE
1287,1287,37.6,2023-12-06 15:36:48.075494,2023-12-06 15:37:46.468930,0 days 00:00:58.393436,0.8,0.5,0.0,150,roulette wheel,COMPLETE
1288,1288,38.0,2023-12-06 15:37:46.469113,2023-12-06 15:38:38.080437,0 days 00:00:51.611324,0.0,0.5,,150,roulette wheel,COMPLETE
1289,1289,37.2,2023-12-06 15:38:38.080614,2023-12-06 15:38:38.306762,0 days 00:00:00.226148,0.6,0.0,1.0,150,random selection,COMPLETE
1290,1290,38.0,2023-12-06 15:38:38.306943,2023-12-06 15:38:38.645350,0 days 00:00:00.338407,0.95,0.1,1.0,200,random selection,COMPLETE
1291,1291,38.0,2023-12-06 15:38:38.645535,2023-12-06 15:39:14.787091,0 days 00:00:36.141556,0.0,0.1,,200,roulette wheel,COMPLETE
1292,1292,37.6,2023-12-06 15:39:14.787310,2023-12-06 15:40:10.660854,0 days 00:00:55.873544,0.5,0.5,0.0,150,roulette wheel,COMPLETE
1293,1293,38.0,2023-12-06 15:40:10.661055,2023-12-06 15:40:48.274986,0 days 00:00:37.613931,0.8,0.1,0.0,200,random selection,COMPLETE
1294,1294,37.6,2023-12-06 15:40:48.275226,2023-12-06 15:41:29.873645,0 days 00:00:41.598419,0.8,0.1,0.0,200,roulette wheel,COMPLETE
1295,1295,37.6,2023-12-06 15:41:29.873885,2023-12-06 15:42:41.029301,0 days 00:01:11.155416,0.95,0.5,0.0,150,weighted choice,COMPLETE
1296,1296,42.4,2023-12-06 15:42:41.029503,2023-12-06 15:42:41.227601,0 days 00:00:00.198098,0.8,0.0,2.0,150,roulette wheel,COMPLETE
1297,1297,37.6,2023-12-06 15:42:41.227793,2023-12-06 15:42:41.775826,0 days 00:00:00.548033,0.95,0.5,4.0,150,roulette wheel,COMPLETE
1298,1298,37.6,2023-12-06 15:42:41.776013,2023-12-06 15:44:03.401162,0 days 00:01:21.625149,0.6,0.0,0.0,200,random selection,COMPLETE
1299,1299,38.0,2023-12-06 15:44:03.401359,2023-12-06 15:44:30.658030,0 days 00:00:27.256671,0.0,0.01,,150,roulette wheel,COMPLETE
1300,1300,37.6,2023-12-06 15:44:30.658208,2023-12-06 15:44:31.167329,0 days 00:00:00.509121,0.5,0.33,4.0,200,random selection,COMPLETE
1301,1301,36.8,2023-12-06 15:44:31.167521,2023-12-06 15:45:19.983561,0 days 00:00:48.816040,0.0,0.01,,200,weighted choice,COMPLETE
1302,1302,38.0,2023-12-06 15:45:19.983746,2023-12-06 15:45:20.465105,0 days 00:00:00.481359,0.6,0.33,1.0,150,roulette wheel,COMPLETE
1303,1303,38.4,2023-12-06 15:45:20.465292,2023-12-06 15:46:16.108590,0 days 00:00:55.643298,0.6,0.5,0.0,150,roulette wheel,COMPLETE
1304,1304,37.2,2023-12-06 15:46:16.108786,2023-12-06 15:47:10.722028,0 days 00:00:54.613242,0.0,0.33,,150,weighted choice,COMPLETE
1305,1305,37.6,2023-12-06 15:47:10.722221,2023-12-06 15:47:58.900523,0 days 00:00:48.178302,0.6,0.33,0.0,200,random selection,COMPLETE
1306,1306,38.4,2023-12-06 15:47:58.900716,2023-12-06 15:47:59.247330,0 days 00:00:00.346614,0.95,0.1,2.0,150,roulette wheel,COMPLETE
1307,1307,37.6,2023-12-06 15:47:59.247513,2023-12-06 15:48:26.133851,0 days 00:00:26.886338,0.0,0.01,,150,roulette wheel,COMPLETE
1308,1308,37.6,2023-12-06 15:48:26.134045,2023-12-06 15:51:29.655136,0 days 00:03:03.521091,0.0,0.0,,200,weighted choice,COMPLETE
1309,1309,38.0,2023-12-06 15:51:29.655332,2023-12-06 15:51:30.109476,0 days 00:00:00.454144,0.8,0.33,2.0,150,roulette wheel,COMPLETE
1310,1310,37.2,2023-12-06 15:51:30.109672,2023-12-06 15:52:13.228676,0 days 00:00:43.119004,0.0,0.33,,150,roulette wheel,COMPLETE
1311,1311,39.6,2023-12-06 15:52:13.228860,2023-12-06 15:52:13.713285,0 days 00:00:00.484425,0.6,0.01,1.0,150,weighted choice,COMPLETE
1312,1312,37.6,2023-12-06 15:52:13.713474,2023-12-06 15:52:14.075991,0 days 00:00:00.362517,0.8,0.1,4.0,150,random selection,COMPLETE
1313,1313,38.4,2023-12-06 15:52:14.076194,2023-12-06 15:52:45.632616,0 days 00:00:31.556422,0.0,0.01,,200,roulette wheel,COMPLETE
1314,1314,38.0,2023-12-06 15:52:45.632869,2023-12-06 15:52:46.299151,0 days 00:00:00.666282,0.6,0.5,2.0,150,weighted choice,COMPLETE
1315,1315,38.0,2023-12-06 15:52:46.299344,2023-12-06 15:52:46.798733,0 days 00:00:00.499389,0.5,0.1,2.0,200,weighted choice,COMPLETE
1316,1316,38.4,2023-12-06 15:52:46.798940,2023-12-06 15:52:47.428934,0 days 00:00:00.629994,0.95,0.5,2.0,150,weighted choice,COMPLETE
1317,1317,38.0,2023-12-06 15:52:47.429129,2023-12-06 15:52:47.776779,0 days 00:00:00.347650,0.6,0.1,1.0,150,roulette wheel,COMPLETE
1318,1318,42.0,2023-12-06 15:52:47.776961,2023-12-06 15:52:47.969513,0 days 00:00:00.192552,0.8,0.0,1.0,150,roulette wheel,COMPLETE
1319,1319,42.8,2023-12-06 15:52:47.969690,2023-12-06 15:52:48.215409,0 days 00:00:00.245719,0.6,0.0,1.0,150,roulette wheel,COMPLETE
1320,1320,40.4,2023-12-06 15:52:48.215599,2023-12-06 15:52:48.572329,0 days 00:00:00.356730,0.8,0.01,4.0,150,roulette wheel,COMPLETE
1321,1321,37.6,2023-12-06 15:52:48.572518,2023-12-06 15:53:31.259876,0 days 00:00:42.687358,0.0,0.33,,150,roulette wheel,COMPLETE
1322,1322,37.6,2023-12-06 15:53:31.260071,2023-12-06 15:54:00.683347,0 days 00:00:29.423276,0.6,0.01,0.0,150,roulette wheel,COMPLETE
1323,1323,38.4,2023-12-06 15:54:00.683555,2023-12-06 15:54:01.312118,0 days 00:00:00.628563,0.5,0.33,1.0,200,weighted choice,COMPLETE
1324,1324,37.2,2023-12-06 15:54:01.312312,2023-12-06 15:55:21.929678,0 days 00:01:20.617366,0.0,0.0,,150,roulette wheel,COMPLETE
1325,1325,40.8,2023-12-06 15:55:21.930042,2023-12-06 15:55:22.225799,0 days 00:00:00.295757,0.95,0.01,2.0,150,roulette wheel,COMPLETE
1326,1326,37.6,2023-12-06 15:55:22.225998,2023-12-06 15:56:01.830824,0 days 00:00:39.604826,0.8,0.1,0.0,200,roulette wheel,COMPLETE
1327,1327,37.6,2023-12-06 15:56:01.831033,2023-12-06 15:56:02.378742,0 days 00:00:00.547709,0.95,0.5,4.0,150,random selection,COMPLETE
1328,1328,38.0,2023-12-06 15:56:02.378933,2023-12-06 15:56:02.832664,0 days 00:00:00.453731,0.95,0.33,2.0,150,roulette wheel,COMPLETE
1329,1329,37.6,2023-12-06 15:56:02.832861,2023-12-06 15:56:03.282943,0 days 00:00:00.450082,0.95,0.33,2.0,150,roulette wheel,COMPLETE
1330,1330,36.8,2023-12-06 15:56:03.283121,2023-12-06 15:56:03.762698,0 days 00:00:00.479577,0.6,0.33,2.0,200,roulette wheel,COMPLETE
1331,1331,38.0,2023-12-06 15:56:03.762903,2023-12-06 15:56:04.110771,0 days 00:00:00.347868,0.6,0.1,1.0,200,roulette wheel,COMPLETE
1332,1332,37.6,2023-12-06 15:56:04.110950,2023-12-06 15:56:31.937360,0 days 00:00:27.826410,0.0,0.1,,150,random selection,COMPLETE
1333,1333,38.0,2023-12-06 15:56:31.937639,2023-12-06 15:56:32.410995,0 days 00:00:00.473356,0.6,0.33,1.0,150,random selection,COMPLETE
1334,1334,37.6,2023-12-06 15:56:32.411198,2023-12-06 15:58:14.408099,0 days 00:01:41.996901,0.0,0.0,,200,roulette wheel,COMPLETE
1335,1335,41.6,2023-12-06 15:58:14.408298,2023-12-06 15:58:14.692744,0 days 00:00:00.284446,0.95,0.0,1.0,200,weighted choice,COMPLETE
1336,1336,40.8,2023-12-06 15:58:14.692933,2023-12-06 15:58:14.991089,0 days 00:00:00.298156,0.95,0.01,2.0,150,roulette wheel,COMPLETE
1337,1337,44.8,2023-12-06 15:58:14.991275,2023-12-06 15:58:15.238109,0 days 00:00:00.246834,0.6,0.0,1.0,150,roulette wheel,COMPLETE
1338,1338,42.4,2023-12-06 15:58:15.238300,2023-12-06 15:58:15.436553,0 days 00:00:00.198253,0.8,0.0,2.0,150,roulette wheel,COMPLETE
