,number,value,datetime_start,datetime_complete,duration,params_C,params_M,params_N,params_P,params_S,state
1668,1668,37.2,2023-12-06 19:12:12.574244,2023-12-06 19:12:13.182916,0 days 00:00:00.608672,0.5,0.33,1.0,200,weighted choice,COMPLETE
1669,1669,37.6,2023-12-06 19:12:13.183144,2023-12-06 19:12:13.667981,0 days 00:00:00.484837,0.5,0.1,2.0,200,weighted choice,COMPLETE
1670,1670,37.2,2023-12-06 19:12:13.668216,2023-12-06 19:40:40.683847,0 days 00:28:27.015631,0.95,0.33,0.0,150,weighted choice,COMPLETE
1671,1671,38.4,2023-12-06 19:40:40.684068,2023-12-06 19:40:41.144395,0 days 00:00:00.460327,0.6,0.1,2.0,150,weighted choice,COMPLETE
1672,1672,39.2,2023-12-06 19:40:41.144641,2023-12-06 19:40:41.752883,0 days 00:00:00.608242,0.8,0.5,1.0,150,weighted choice,COMPLETE
1673,1673,38.4,2023-12-06 19:40:41.753098,2023-12-06 19:40:42.239242,0 days 00:00:00.486144,0.6,0.33,4.0,200,roulette wheel,COMPLETE
1674,1674,38.0,2023-12-06 19:40:42.239477,2023-12-06 20:00:54.358612,0 days 00:20:12.119135,0.95,0.5,0.0,200,random selection,COMPLETE
1675,1675,37.2,2023-12-06 20:00:54.358983,2023-12-06 20:00:54.903339,0 days 00:00:00.544356,0.8,0.5,4.0,150,random selection,COMPLETE
1676,1676,37.2,2023-12-06 20:00:54.903564,2023-12-06 20:00:55.253584,0 days 00:00:00.350020,0.8,0.1,4.0,150,random selection,COMPLETE
1677,1677,38.0,2023-12-06 20:00:55.253833,2023-12-06 20:59:27.618797,0 days 00:58:32.364964,0.0,0.0,,150,weighted choice,COMPLETE
1678,1678,38.4,2023-12-06 20:59:27.619025,2023-12-06 20:59:28.063070,0 days 00:00:00.444045,0.95,0.1,4.0,150,weighted choice,COMPLETE
1679,1679,38.4,2023-12-06 20:59:28.063308,2023-12-06 21:25:06.007003,0 days 00:25:37.943695,0.0,0.33,,150,roulette wheel,COMPLETE
1680,1680,42.8,2023-12-06 21:25:06.007219,2023-12-06 21:25:06.328714,0 days 00:00:00.321495,0.8,0.0,2.0,150,weighted choice,COMPLETE
1681,1681,40.8,2023-12-06 21:25:06.328943,2023-12-06 21:25:06.766791,0 days 00:00:00.437848,0.8,0.01,2.0,200,weighted choice,COMPLETE
1682,1682,41.2,2023-12-06 21:25:06.767053,2023-12-06 21:25:07.251585,0 days 00:00:00.484532,0.6,0.01,4.0,150,weighted choice,COMPLETE
1683,1683,38.0,2023-12-06 21:25:07.251806,2023-12-06 21:32:48.006513,0 days 00:07:40.754707,0.5,0.1,0.0,200,roulette wheel,COMPLETE
1684,1684,37.2,2023-12-06 21:32:48.006764,2023-12-06 22:10:54.160156,0 days 00:38:06.153392,0.0,0.0,,200,roulette wheel,COMPLETE
1685,1685,38.4,2023-12-06 22:10:54.160385,2023-12-06 22:11:19.779984,0 days 00:00:25.619599,0.6,0.1,4.0,200,roulette wheel,COMPLETE
1686,1686,40.0,2023-12-06 22:11:19.780207,2023-12-06 22:11:20.132133,0 days 00:00:00.351926,0.6,0.01,1.0,150,roulette wheel,COMPLETE
1687,1687,38.0,2023-12-06 22:11:20.132380,2023-12-06 22:11:20.613953,0 days 00:00:00.481573,0.5,0.1,2.0,200,weighted choice,COMPLETE
1688,1688,36.8,2023-12-06 22:11:20.614177,2023-12-06 22:11:21.069244,0 days 00:00:00.455067,0.95,0.33,4.0,150,random selection,COMPLETE
1689,1689,36.8,2023-12-06 22:11:21.069476,2023-12-06 22:24:32.112810,0 days 00:13:11.043334,0.0,0.5,,150,roulette wheel,COMPLETE
1690,1690,37.6,2023-12-06 22:24:32.113599,2023-12-06 22:25:12.749908,0 days 00:00:40.636309,0.0,0.33,,150,random selection,COMPLETE
1691,1691,40.4,2023-12-06 22:25:12.750151,2023-12-06 22:25:13.068688,0 days 00:00:00.318537,0.8,0.01,1.0,200,roulette wheel,COMPLETE
1692,1692,42.8,2023-12-06 22:25:13.068912,2023-12-06 22:25:13.273523,0 days 00:00:00.204611,0.8,0.0,2.0,200,roulette wheel,COMPLETE
1693,1693,40.4,2023-12-06 22:25:13.273751,2023-12-06 22:25:13.458255,0 days 00:00:00.184504,0.95,0.0,2.0,200,roulette wheel,COMPLETE
1694,1694,42.8,2023-12-06 22:25:13.458480,2023-12-06 22:25:13.898251,0 days 00:00:00.439771,0.6,0.0,2.0,200,weighted choice,COMPLETE
1695,1695,37.6,2023-12-06 22:25:13.898483,2023-12-06 22:25:14.481614,0 days 00:00:00.583131,0.6,0.5,1.0,150,roulette wheel,COMPLETE
1696,1696,39.6,2023-12-06 22:25:14.481837,2023-12-06 22:25:14.777253,0 days 00:00:00.295416,0.95,0.01,1.0,150,roulette wheel,COMPLETE
1697,1697,38.8,2023-12-06 22:25:14.777485,2023-12-06 22:25:15.142960,0 days 00:00:00.365475,0.8,0.1,4.0,200,roulette wheel,COMPLETE
1698,1698,38.0,2023-12-06 22:25:15.143179,2023-12-06 22:25:41.660736,0 days 00:00:26.517557,0.0,0.01,,150,roulette wheel,COMPLETE
1699,1699,38.0,2023-12-06 22:25:41.660969,2023-12-06 22:25:42.158243,0 days 00:00:00.497274,0.5,0.33,1.0,200,roulette wheel,COMPLETE
1700,1700,37.6,2023-12-06 22:25:42.158479,2023-12-06 22:25:42.748112,0 days 00:00:00.589633,0.5,0.5,2.0,150,random selection,COMPLETE
1701,1701,37.2,2023-12-06 22:25:42.748345,2023-12-06 22:26:22.128257,0 days 00:00:39.379912,0.0,0.1,,150,weighted choice,COMPLETE
1702,1702,43.6,2023-12-06 22:26:22.128523,2023-12-06 22:26:22.537370,0 days 00:00:00.408847,0.6,0.0,2.0,150,weighted choice,COMPLETE
1703,1703,37.2,2023-12-06 22:26:22.537595,2023-12-06 22:26:23.079880,0 days 00:00:00.542285,0.8,0.5,2.0,200,roulette wheel,COMPLETE
1704,1704,38.0,2023-12-06 22:26:23.080108,2023-12-06 22:26:23.657424,0 days 00:00:00.577316,0.6,0.5,4.0,200,roulette wheel,COMPLETE
1705,1705,38.4,2023-12-06 22:26:23.657649,2023-12-06 22:26:24.102579,0 days 00:00:00.444930,0.6,0.1,1.0,150,weighted choice,COMPLETE
1706,1706,37.2,2023-12-06 22:26:24.102815,2023-12-06 22:27:25.179832,0 days 00:01:01.077017,0.95,0.5,0.0,150,roulette wheel,COMPLETE
1707,1707,40.8,2023-12-06 22:27:25.180055,2023-12-06 22:27:25.689856,0 days 00:00:00.509801,0.6,0.01,2.0,200,weighted choice,COMPLETE
1708,1708,38.4,2023-12-06 22:27:25.690091,2023-12-06 22:28:13.512314,0 days 00:00:47.822223,0.0,0.5,,150,random selection,COMPLETE
1709,1709,36.0,2023-12-06 22:28:13.512681,2023-12-06 22:28:13.747377,0 days 00:00:00.234696,0.6,0.0,2.0,150,random selection,COMPLETE
1710,1710,43.2,2023-12-06 22:28:13.747614,2023-12-06 22:28:13.977698,0 days 00:00:00.230084,0.6,0.0,1.0,200,roulette wheel,COMPLETE
1711,1711,38.0,2023-12-06 22:28:13.977934,2023-12-06 22:28:45.478643,0 days 00:00:31.500709,0.6,0.1,0.0,150,random selection,COMPLETE
1712,1712,38.0,2023-12-06 22:28:45.478903,2023-12-06 22:28:45.973224,0 days 00:00:00.494321,0.6,0.33,4.0,200,roulette wheel,COMPLETE
1713,1713,37.2,2023-12-06 22:28:45.973445,2023-12-06 22:29:38.656029,0 days 00:00:52.682584,0.0,0.5,,150,roulette wheel,COMPLETE
1714,1714,37.2,2023-12-06 22:29:38.656265,2023-12-06 22:29:38.996535,0 days 00:00:00.340270,0.95,0.1,1.0,200,random selection,COMPLETE
1715,1715,38.8,2023-12-06 22:29:38.996781,2023-12-06 22:29:39.497122,0 days 00:00:00.500341,0.5,0.33,4.0,150,random selection,COMPLETE
1716,1716,41.6,2023-12-06 22:29:39.497370,2023-12-06 22:29:39.675622,0 days 00:00:00.178252,0.95,0.0,2.0,200,roulette wheel,COMPLETE
1717,1717,40.8,2023-12-06 22:29:39.675869,2023-12-06 22:29:39.965900,0 days 00:00:00.290031,0.95,0.01,2.0,200,roulette wheel,COMPLETE
1718,1718,36.8,2023-12-06 22:29:39.966135,2023-12-06 22:29:40.418732,0 days 00:00:00.452597,0.8,0.33,2.0,200,random selection,COMPLETE
1719,1719,38.4,2023-12-06 22:29:40.418967,2023-12-06 22:29:40.907379,0 days 00:00:00.488412,0.5,0.33,1.0,150,roulette wheel,COMPLETE
1720,1720,38.0,2023-12-06 22:29:40.907594,2023-12-06 22:29:41.280201,0 days 00:00:00.372607,0.5,0.1,4.0,150,roulette wheel,COMPLETE
1721,1721,37.2,2023-12-06 22:29:41.280427,2023-12-06 22:29:41.986835,0 days 00:00:00.706408,0.6,0.5,4.0,200,weighted choice,COMPLETE
1722,1722,40.4,2023-12-06 22:29:41.987081,2023-12-06 22:29:42.398893,0 days 00:00:00.411812,0.95,0.01,2.0,200,weighted choice,COMPLETE
1723,1723,36.4,2023-12-06 22:29:42.399125,2023-12-06 22:30:51.060904,0 days 00:01:08.661779,0.8,0.5,0.0,200,roulette wheel,COMPLETE
1724,1724,38.4,2023-12-06 22:30:51.061146,2023-12-06 22:30:51.680837,0 days 00:00:00.619691,0.5,0.33,4.0,150,weighted choice,COMPLETE
1725,1725,42.8,2023-12-06 22:30:51.681077,2023-12-06 22:30:51.960546,0 days 00:00:00.279469,0.95,0.01,1.0,150,roulette wheel,COMPLETE
1726,1726,36.8,2023-12-06 22:30:51.960773,2023-12-06 22:31:23.935027,0 days 00:00:31.974254,0.5,0.1,0.0,150,roulette wheel,COMPLETE
1727,1727,40.4,2023-12-06 22:31:23.935353,2023-12-06 22:31:24.289032,0 days 00:00:00.353679,0.8,0.0,4.0,200,weighted choice,COMPLETE
1728,1728,37.6,2023-12-06 22:31:24.289258,2023-12-06 22:31:24.612521,0 days 00:00:00.323263,0.8,0.01,4.0,200,random selection,COMPLETE
1729,1729,40.0,2023-12-06 22:31:24.612774,2023-12-06 22:31:25.009910,0 days 00:00:00.397136,0.5,0.01,4.0,150,roulette wheel,COMPLETE
1730,1730,37.6,2023-12-06 22:31:25.010131,2023-12-06 22:32:14.015439,0 days 00:00:49.005308,0.0,0.5,,150,random selection,COMPLETE
1731,1731,37.6,2023-12-06 22:32:14.015693,2023-12-06 22:33:50.793803,0 days 00:01:36.778110,0.0,0.0,,200,random selection,COMPLETE
1732,1732,38.4,2023-12-06 22:33:50.794029,2023-12-06 22:33:51.351254,0 days 00:00:00.557225,0.8,0.5,4.0,150,roulette wheel,COMPLETE
1733,1733,36.8,2023-12-06 22:33:51.351475,2023-12-06 22:33:51.932703,0 days 00:00:00.581228,0.5,0.5,2.0,200,random selection,COMPLETE
1734,1734,36.4,2023-12-06 22:33:51.932927,2023-12-06 22:33:52.209291,0 days 00:00:00.276364,0.5,0.0,2.0,150,random selection,COMPLETE
1735,1735,37.6,2023-12-06 22:33:52.209529,2023-12-06 22:33:52.521576,0 days 00:00:00.312047,0.95,0.01,4.0,200,random selection,COMPLETE
1736,1736,37.2,2023-12-06 22:33:52.521799,2023-12-06 22:35:13.363000,0 days 00:01:20.841201,0.6,0.0,0.0,200,random selection,COMPLETE
1737,1737,40.4,2023-12-06 22:35:13.363261,2023-12-06 22:35:13.912825,0 days 00:00:00.549564,0.5,0.01,2.0,200,weighted choice,COMPLETE
1738,1738,37.6,2023-12-06 22:35:13.913090,2023-12-06 22:36:07.679826,0 days 00:00:53.766736,0.0,0.5,,150,roulette wheel,COMPLETE
1739,1739,39.2,2023-12-06 22:36:07.680066,2023-12-06 22:36:07.994907,0 days 00:00:00.314841,0.95,0.01,4.0,200,roulette wheel,COMPLETE
1740,1740,37.6,2023-12-06 22:36:07.995141,2023-12-06 22:36:45.935314,0 days 00:00:37.940173,0.0,0.33,,150,random selection,COMPLETE
1741,1741,37.2,2023-12-06 22:36:45.935641,2023-12-06 22:36:46.661591,0 days 00:00:00.725950,0.5,0.5,2.0,150,weighted choice,COMPLETE
1742,1742,37.6,2023-12-06 22:36:46.661822,2023-12-06 22:36:47.275647,0 days 00:00:00.613825,0.5,0.5,2.0,150,roulette wheel,COMPLETE
1743,1743,40.8,2023-12-06 22:36:47.275887,2023-12-06 22:36:47.783987,0 days 00:00:00.508100,0.6,0.01,4.0,150,weighted choice,COMPLETE
1744,1744,38.4,2023-12-06 22:36:47.784269,2023-12-06 22:36:48.152401,0 days 00:00:00.368132,0.6,0.1,1.0,150,roulette wheel,COMPLETE
1745,1745,37.6,2023-12-06 22:36:48.152626,2023-12-06 22:38:11.440320,0 days 00:01:23.287694,0.95,0.5,0.0,200,weighted choice,COMPLETE
1746,1746,37.2,2023-12-06 22:38:11.440768,2023-12-06 22:38:42.206534,0 days 00:00:30.765766,0.0,0.1,,200,random selection,COMPLETE
1747,1747,37.6,2023-12-06 22:38:42.206857,2023-12-06 22:38:42.681495,0 days 00:00:00.474638,0.6,0.33,2.0,150,roulette wheel,COMPLETE
1748,1748,40.8,2023-12-06 22:38:42.681729,2023-12-06 22:38:43.071285,0 days 00:00:00.389556,0.5,0.01,1.0,150,roulette wheel,COMPLETE
1749,1749,37.2,2023-12-06 22:38:43.071519,2023-12-06 22:39:35.042591,0 days 00:00:51.971072,0.0,0.5,,150,roulette wheel,COMPLETE
1750,1750,36.8,2023-12-06 22:39:35.042826,2023-12-06 22:40:39.319222,0 days 00:01:04.276396,0.5,0.5,0.0,150,weighted choice,COMPLETE
1751,1751,38.0,2023-12-06 22:40:39.319484,2023-12-06 22:41:58.829387,0 days 00:01:19.509903,0.0,0.0,,150,roulette wheel,COMPLETE
1752,1752,37.2,2023-12-06 22:41:58.829632,2023-12-06 22:42:39.222309,0 days 00:00:40.392677,0.5,0.1,0.0,200,roulette wheel,COMPLETE
1753,1753,37.2,2023-12-06 22:42:39.222628,2023-12-06 22:43:21.072804,0 days 00:00:41.850176,0.0,0.33,,150,roulette wheel,COMPLETE
1754,1754,38.0,2023-12-06 22:43:21.073055,2023-12-06 22:43:21.551822,0 days 00:00:00.478767,0.95,0.1,4.0,200,weighted choice,COMPLETE
1755,1755,39.6,2023-12-06 22:43:21.552050,2023-12-06 22:43:21.862136,0 days 00:00:00.310086,0.95,0.01,4.0,200,roulette wheel,COMPLETE
1756,1756,37.2,2023-12-06 22:43:21.862374,2023-12-06 22:45:05.284561,0 days 00:01:43.422187,0.0,0.0,,200,roulette wheel,COMPLETE
1757,1757,37.2,2023-12-06 22:45:05.284798,2023-12-06 22:45:05.632968,0 days 00:00:00.348170,0.6,0.01,1.0,150,random selection,COMPLETE
1758,1758,38.0,2023-12-06 22:45:05.633210,2023-12-06 22:45:52.558073,0 days 00:00:46.924863,0.6,0.33,0.0,150,roulette wheel,COMPLETE
1759,1759,37.6,2023-12-06 22:45:52.558325,2023-12-06 22:46:40.430292,0 days 00:00:47.871967,0.0,0.33,,200,roulette wheel,COMPLETE
1760,1760,37.6,2023-12-06 22:46:40.430519,2023-12-06 22:47:15.198743,0 days 00:00:34.768224,0.6,0.1,0.0,150,roulette wheel,COMPLETE
1761,1761,40.4,2023-12-06 22:47:15.198996,2023-12-06 22:47:15.590569,0 days 00:00:00.391573,0.5,0.01,1.0,150,roulette wheel,COMPLETE
1762,1762,38.0,2023-12-06 22:47:15.590817,2023-12-06 22:47:16.268182,0 days 00:00:00.677365,0.6,0.5,2.0,200,weighted choice,COMPLETE
1763,1763,38.0,2023-12-06 22:47:16.268418,2023-12-06 22:48:29.327702,0 days 00:01:13.059284,0.0,0.5,,200,weighted choice,COMPLETE
1764,1764,38.0,2023-12-06 22:48:29.327947,2023-12-06 22:50:03.364164,0 days 00:01:34.036217,0.6,0.0,0.0,200,roulette wheel,COMPLETE
1765,1765,38.0,2023-12-06 22:50:03.364422,2023-12-06 22:50:03.911325,0 days 00:00:00.546903,0.8,0.5,2.0,150,roulette wheel,COMPLETE
1766,1766,37.2,2023-12-06 22:50:03.911586,2023-12-06 22:50:42.452853,0 days 00:00:38.541267,0.0,0.33,,150,random selection,COMPLETE
1767,1767,37.6,2023-12-06 22:50:42.453087,2023-12-06 22:50:43.047522,0 days 00:00:00.594435,0.5,0.33,2.0,150,weighted choice,COMPLETE
1768,1768,39.6,2023-12-06 22:50:43.047755,2023-12-06 22:50:43.447161,0 days 00:00:00.399406,0.5,0.01,4.0,200,roulette wheel,COMPLETE
1769,1769,37.6,2023-12-06 22:50:43.447399,2023-12-06 22:52:02.249343,0 days 00:01:18.801944,0.6,0.0,0.0,200,random selection,COMPLETE
1770,1770,37.6,2023-12-06 22:52:02.249606,2023-12-06 22:53:01.099643,0 days 00:00:58.850037,0.8,0.33,0.0,200,roulette wheel,COMPLETE
1771,1771,37.2,2023-12-06 22:53:01.099869,2023-12-06 22:53:01.471814,0 days 00:00:00.371945,0.5,0.1,1.0,200,roulette wheel,COMPLETE
1772,1772,37.6,2023-12-06 22:53:01.472047,2023-12-06 22:53:01.935682,0 days 00:00:00.463635,0.8,0.33,1.0,150,roulette wheel,COMPLETE
1773,1773,40.4,2023-12-06 22:53:01.935920,2023-12-06 22:53:02.473467,0 days 00:00:00.537547,0.5,0.01,4.0,150,weighted choice,COMPLETE
1774,1774,40.4,2023-12-06 22:53:02.473737,2023-12-06 22:53:02.912544,0 days 00:00:00.438807,0.8,0.01,4.0,150,weighted choice,COMPLETE
1775,1775,37.6,2023-12-06 22:53:02.912776,2023-12-06 22:54:12.406284,0 days 00:01:09.493508,0.8,0.5,0.0,150,weighted choice,COMPLETE
1776,1776,37.2,2023-12-06 22:54:12.406540,2023-12-06 22:54:39.771080,0 days 00:00:27.364540,0.0,0.01,,150,roulette wheel,COMPLETE
1777,1777,38.8,2023-12-06 22:54:39.771313,2023-12-06 22:54:40.172844,0 days 00:00:00.401531,0.5,0.01,4.0,200,roulette wheel,COMPLETE
1778,1778,37.6,2023-12-06 22:54:40.173093,2023-12-06 22:54:40.416360,0 days 00:00:00.243267,0.6,0.0,4.0,200,random selection,COMPLETE
1779,1779,38.0,2023-12-06 22:54:40.416593,2023-12-06 22:54:41.014843,0 days 00:00:00.598250,0.6,0.33,2.0,150,weighted choice,COMPLETE
1780,1780,42.4,2023-12-06 22:54:41.015076,2023-12-06 22:54:41.251780,0 days 00:00:00.236704,0.6,0.0,1.0,200,roulette wheel,COMPLETE
1781,1781,42.0,2023-12-06 22:54:41.252040,2023-12-06 22:54:41.455038,0 days 00:00:00.202998,0.8,0.0,2.0,200,roulette wheel,COMPLETE
1782,1782,37.6,2023-12-06 22:54:41.455301,2023-12-06 22:54:41.801780,0 days 00:00:00.346479,0.95,0.1,2.0,150,random selection,COMPLETE
1783,1783,37.6,2023-12-06 22:54:41.802023,2023-12-06 22:55:24.782782,0 days 00:00:42.980759,0.0,0.33,,150,roulette wheel,COMPLETE
1784,1784,37.2,2023-12-06 22:55:24.783015,2023-12-06 22:55:52.437412,0 days 00:00:27.654397,0.0,0.1,,150,random selection,COMPLETE
1785,1785,41.2,2023-12-06 22:55:52.437643,2023-12-06 22:55:52.737190,0 days 00:00:00.299547,0.95,0.01,2.0,200,roulette wheel,COMPLETE
1786,1786,38.0,2023-12-06 22:55:52.737428,2023-12-06 22:55:53.077344,0 days 00:00:00.339916,0.8,0.1,1.0,150,roulette wheel,COMPLETE
1787,1787,38.0,2023-12-06 22:55:53.077585,2023-12-06 22:55:53.371697,0 days 00:00:00.294112,0.95,0.01,2.0,150,random selection,COMPLETE
1788,1788,40.8,2023-12-06 22:55:53.371931,2023-12-06 22:55:53.707751,0 days 00:00:00.335820,0.8,0.01,4.0,150,roulette wheel,COMPLETE
1789,1789,37.2,2023-12-06 22:55:53.708005,2023-12-06 22:56:46.099003,0 days 00:00:52.390998,0.0,0.5,,150,roulette wheel,COMPLETE
1790,1790,38.4,2023-12-06 22:56:46.099255,2023-12-06 22:58:24.397001,0 days 00:01:38.297746,0.0,0.0,,200,random selection,COMPLETE
1791,1791,37.6,2023-12-06 22:58:24.397244,2023-12-06 22:58:24.743500,0 days 00:00:00.346256,0.6,0.01,1.0,200,random selection,COMPLETE
1792,1792,38.0,2023-12-06 22:58:24.743747,2023-12-06 22:58:25.198366,0 days 00:00:00.454619,0.8,0.33,1.0,200,roulette wheel,COMPLETE
1793,1793,38.0,2023-12-06 22:58:25.198613,2023-12-06 22:58:25.543883,0 days 00:00:00.345270,0.95,0.1,2.0,150,roulette wheel,COMPLETE
1794,1794,37.6,2023-12-06 22:58:25.544141,2023-12-06 22:58:26.263271,0 days 00:00:00.719130,0.5,0.5,1.0,200,weighted choice,COMPLETE
1795,1795,37.6,2023-12-06 22:58:26.263499,2023-12-06 22:59:46.207516,0 days 00:01:19.944017,0.5,0.0,0.0,150,roulette wheel,COMPLETE
1796,1796,37.2,2023-12-06 22:59:46.207781,2023-12-06 23:00:16.982815,0 days 00:00:30.775034,0.8,0.01,0.0,150,roulette wheel,COMPLETE
1797,1797,44.8,2023-12-06 23:00:16.983071,2023-12-06 23:00:17.490719,0 days 00:00:00.507648,0.5,0.0,2.0,200,weighted choice,COMPLETE
1798,1798,41.6,2023-12-06 23:00:17.490963,2023-12-06 23:00:17.688308,0 days 00:00:00.197345,0.95,0.0,4.0,150,roulette wheel,COMPLETE
1799,1799,37.2,2023-12-06 23:00:17.688552,2023-12-06 23:00:55.618520,0 days 00:00:37.929968,0.0,0.01,,150,weighted choice,COMPLETE
1800,1800,40.0,2023-12-07 11:12:28.217483,2023-12-07 11:12:28.596399,0 days 00:00:00.378916,0.5,0.01,1.0,250,roulette wheel,COMPLETE
1801,1801,37.6,2023-12-07 11:12:28.596829,2023-12-07 11:15:26.021912,0 days 00:02:57.425083,0.95,0.0,0.0,250,weighted choice,COMPLETE
1802,1802,37.6,2023-12-07 11:15:26.022213,2023-12-07 11:15:26.494174,0 days 00:00:00.471961,0.6,0.33,2.0,250,random selection,COMPLETE
1803,1803,38.0,2023-12-07 11:15:26.494372,2023-12-07 11:15:26.837695,0 days 00:00:00.343323,0.6,0.1,1.0,300,roulette wheel,COMPLETE
1804,1804,37.6,2023-12-07 11:15:26.837882,2023-12-07 11:15:27.311851,0 days 00:00:00.473969,0.8,0.33,4.0,250,roulette wheel,COMPLETE
1805,1805,36.4,2023-12-07 11:15:27.312033,2023-12-07 11:15:27.652468,0 days 00:00:00.340435,0.6,0.1,1.0,250,random selection,COMPLETE
1806,1806,37.2,2023-12-07 11:15:27.652716,2023-12-07 11:16:06.788540,0 days 00:00:39.135824,0.95,0.01,0.0,250,roulette wheel,COMPLETE
1807,1807,37.2,2023-12-07 11:16:06.788767,2023-12-07 11:17:08.605886,0 days 00:01:01.817119,0.5,0.1,0.0,250,weighted choice,COMPLETE
1808,1808,41.2,2023-12-07 11:17:08.606150,2023-12-07 11:17:08.917822,0 days 00:00:00.311672,0.8,0.01,2.0,250,roulette wheel,COMPLETE
1809,1809,38.4,2023-12-07 11:17:08.917991,2023-12-07 11:17:09.456744,0 days 00:00:00.538753,0.8,0.5,2.0,250,roulette wheel,COMPLETE
1810,1810,38.4,2023-12-07 11:17:09.456910,2023-12-07 11:18:49.768091,0 days 00:01:40.311181,0.95,0.0,0.0,300,roulette wheel,COMPLETE
1811,1811,38.0,2023-12-07 11:18:49.768264,2023-12-07 11:18:50.125481,0 days 00:00:00.357217,0.8,0.1,4.0,250,roulette wheel,COMPLETE
1812,1812,40.8,2023-12-07 11:18:50.125655,2023-12-07 11:18:50.433501,0 days 00:00:00.307846,0.8,0.01,2.0,300,roulette wheel,COMPLETE
1813,1813,37.2,2023-12-07 11:18:50.433663,2023-12-07 11:20:27.374620,0 days 00:01:36.940957,0.95,0.0,0.0,250,roulette wheel,COMPLETE
1814,1814,38.0,2023-12-07 11:20:27.374795,2023-12-07 11:21:26.175150,0 days 00:00:58.800355,0.0,0.33,,300,roulette wheel,COMPLETE
1815,1815,36.8,2023-12-07 11:21:26.175413,2023-12-07 11:21:26.717374,0 days 00:00:00.541961,0.95,0.5,4.0,300,random selection,COMPLETE
1816,1816,38.0,2023-12-07 11:21:26.717550,2023-12-07 11:22:25.648104,0 days 00:00:58.930554,0.6,0.33,0.0,250,roulette wheel,COMPLETE
1817,1817,36.8,2023-12-07 11:22:25.648320,2023-12-07 11:22:59.295629,0 days 00:00:33.647309,0.5,0.01,0.0,250,random selection,COMPLETE
1818,1818,40.8,2023-12-07 11:22:59.295878,2023-12-07 11:22:59.710649,0 days 00:00:00.414771,0.95,0.01,1.0,250,weighted choice,COMPLETE
1819,1819,36.4,2023-12-07 11:22:59.710825,2023-12-07 11:23:59.543026,0 days 00:00:59.832201,0.8,0.33,0.0,300,roulette wheel,COMPLETE
1820,1820,43.2,2023-12-07 11:23:59.543302,2023-12-07 11:23:59.805520,0 days 00:00:00.262218,0.5,0.0,1.0,250,roulette wheel,COMPLETE
1821,1821,38.4,2023-12-07 11:23:59.805685,2023-12-07 11:24:00.144002,0 days 00:00:00.338317,0.8,0.1,2.0,250,roulette wheel,COMPLETE
1822,1822,37.2,2023-12-07 11:24:00.144168,2023-12-07 11:24:58.618461,0 days 00:00:58.474293,0.8,0.01,0.0,250,weighted choice,COMPLETE
1823,1823,41.6,2023-12-07 11:24:58.618746,2023-12-07 11:24:58.806706,0 days 00:00:00.187960,0.8,0.0,1.0,300,roulette wheel,COMPLETE
1824,1824,38.4,2023-12-07 11:24:58.806866,2023-12-07 11:25:53.113027,0 days 00:00:54.306161,0.0,0.5,,250,random selection,COMPLETE
1825,1825,39.2,2023-12-07 11:25:53.113216,2023-12-07 11:25:53.533139,0 days 00:00:00.419923,0.95,0.01,1.0,300,weighted choice,COMPLETE
1826,1826,38.0,2023-12-07 11:25:53.533311,2023-12-07 11:25:54.069128,0 days 00:00:00.535817,0.8,0.5,2.0,250,random selection,COMPLETE
1827,1827,36.8,2023-12-07 11:25:54.069294,2023-12-07 11:25:54.658141,0 days 00:00:00.588847,0.5,0.5,2.0,300,roulette wheel,COMPLETE
1828,1828,38.4,2023-12-07 11:25:54.658302,2023-12-07 11:25:55.151207,0 days 00:00:00.492905,0.5,0.33,2.0,250,roulette wheel,COMPLETE
1829,1829,37.6,2023-12-07 11:25:55.151384,2023-12-07 11:25:55.613684,0 days 00:00:00.462300,0.95,0.33,2.0,250,roulette wheel,COMPLETE
1830,1830,41.2,2023-12-07 11:25:55.613874,2023-12-07 11:25:55.822769,0 days 00:00:00.208895,0.8,0.0,4.0,300,roulette wheel,COMPLETE
1831,1831,38.0,2023-12-07 11:25:55.822936,2023-12-07 11:25:56.543549,0 days 00:00:00.720613,0.6,0.5,1.0,300,weighted choice,COMPLETE
